chevrolet,1229942832594505728,2020-02-19 01:36:37,"b""@mmyaaaaa_ Hello. We're sorry to hear about this situation with your vehicle. Please send us a DM so we may best as\xe2\x80\xa6 https://t.co/hUHNMFbTpV"""
chevrolet,1229928747886764032,2020-02-19 00:40:39,"b'@Prakash16192999 Thanks for reaching out to us, Prakash.  So that we may best assist you, please DM us additional i\xe2\x80\xa6 https://t.co/jQkSSpyy3o'"
chevrolet,1229926135711989760,2020-02-19 00:30:16,b'@osmith1599 We truly regret to see these paint concerns.  Have you talked to a certified Chevy dealership about ser\xe2\x80\xa6 https://t.co/gMAib7wvmN'
chevrolet,1229919088471724032,2020-02-19 00:02:16,"b""@juragantraffic We'd be happy to connect you to a certified dealership for further diagnosis of your Trax. Just sen\xe2\x80\xa6 https://t.co/nG48n93VbF"""
chevrolet,1229911776973602816,2020-02-18 23:33:12,b'@jvignal Gracias por contactarnos. Nos disculpamos por escuchar sus frustraciones ya que este no es el tipo de expe\xe2\x80\xa6 https://t.co/tBbtM0Zyz7'
chevrolet,1229900864040517632,2020-02-18 22:49:51,"b""@aajdixon Hey, Anthony. We're sorry to hear of the ongoing frustration as we understand how dissatisfying this must\xe2\x80\xa6 https://t.co/Cnl0tOAwCO"""
chevrolet,1229900440935886848,2020-02-18 22:48:10,"b'@zinzi360 Thank you for reaching out, Lindsay. We apologize to hear of your frustrations regarding this situation.\xe2\x80\xa6 https://t.co/ynMraick3K'"
chevrolet,1229888391287689216,2020-02-18 22:00:17,"b""@NobleDwyerHomes We're truly sorry to hear this happen, and our team would like to investigate this further on your\xe2\x80\xa6 https://t.co/GfJQVpNMB1"""
chevrolet,1229883683017916417,2020-02-18 21:41:34,b'@6Ten_Penn We appreciate your feedback on the headlight design. Are you currently experiencing concerns with you he\xe2\x80\xa6 https://t.co/DmdSXeowVP'
chevrolet,1229883567552909312,2020-02-18 21:41:07,"b'@Pino_707 Thank you for reaching out, Kenny. We apologize to hear of your frustrations as this is not the type of e\xe2\x80\xa6 https://t.co/PXL2lSEQKk'"
chevrolet,1229850911855411200,2020-02-18 19:31:21,"b""@MaxRadniecki That's a great question. Please DM the last 8 digits of your VIN so we may provide the most accurate\xe2\x80\xa6 https://t.co/TzJhSfySQQ"""
chevrolet,1229848270844776449,2020-02-18 19:20:51,"b""@snaztastiik We're blushing. Could you please send us a DM?"""
chevrolet,1229839606033477632,2020-02-18 18:46:26,"b'@AlanRaphael15 We regret to hear this, Alan. Our team would like learn more about this and explore avenues of assis\xe2\x80\xa6 https://t.co/Fig76bwibL'"
chevrolet,1229837161647624192,2020-02-18 18:36:43,"b""@theleavelles We're sorry to hear this. Our team can investigate this further on your behalf to learn more about th\xe2\x80\xa6 https://t.co/RkNJOLgzfa"""
chevrolet,1229836079060045824,2020-02-18 18:32:25,"b'@Saurabh83131583 Hello, are you currently experiencing concerns with your vehicle? If so, please DM us your VIN, mi\xe2\x80\xa6 https://t.co/Y0vq1O0fdo'"
chevrolet,1229825664145997824,2020-02-18 17:51:02,"b""@PerezM361KS We're sorry to hear of the ongoing frustration, Perez. Please send us a DM with additional information\xe2\x80\xa6 https://t.co/KsnFms1w0o"""
chevrolet,1229822259272929281,2020-02-18 17:37:30,"b'@MrStephenA This is not the experience we strive for customers to have, Stephen. Please send us a DM with additiona\xe2\x80\xa6 https://t.co/TQ0JeV4btt'"
chevrolet,1229804005032787969,2020-02-18 16:24:58,"b""@blake_holbrook Mornng, Blake. We're sorry to hear of your dissatisfaction. When you have a moment, please send us\xe2\x80\xa6 https://t.co/QOENpnEGrj"""
chevrolet,1229786886119383040,2020-02-18 15:16:56,"b""@smithwhomlou Hello again, Mary. We've recently responded to your DM and recommend after reviewing it that you cont\xe2\x80\xa6 https://t.co/YoeDE7ESKq"""
chevrolet,1229772118109278210,2020-02-18 14:18:15,"b""@smithwhomlou Hey, Mary. We've recently followed up with you by DM. We hope you find a moment to review it."""
chevrolet,1229766178106568707,2020-02-18 13:54:39,"b'@13ro1Marsha We\xe2\x80\x99re happy your looking into purchasing a Silverado, Marsha. You may find prices and current deals at\xe2\x80\xa6 https://t.co/xJoWNwlUWY'"
chevrolet,1229765241648496640,2020-02-18 13:50:56,"b'@meginnn_ We understand how this can be frustrating, Megin. If you are still experiencing concerns with your MyChev\xe2\x80\xa6 https://t.co/PfpZHwKoSE'"
chevrolet,1229756369017819137,2020-02-18 13:15:40,"b""@megabyte407 You're welcome. We're sorry about the inconvenience, feel free to reach out if you need assistance in\xe2\x80\xa6 https://t.co/6Ni5WbBeMZ"""
chevrolet,1229755468207116288,2020-02-18 13:12:06,"b""@megabyte407 We're happy to help you reset your WiFi password. If you would like our assistance, please send us a D\xe2\x80\xa6 https://t.co/O0HTYpZuLi"""
chevrolet,1229747534899212288,2020-02-18 12:40:34,"b""@nothinIasts We're sorry to see you leave the Chevrolet family. If you need any assistance regarding your Spark, pl\xe2\x80\xa6 https://t.co/m3OgRfSBoj"""
chevrolet,1229738822021156864,2020-02-18 12:05:57,"b'@Shaud_we_trust Kindly review our response to your DM when you have a moment, Chad.'"
chevrolet,1229726455367487488,2020-02-18 11:16:48,"b'@Jellis1905 Kindly review our reply to your DM when you have a moment, Josh.'"
chevrolet,1229706023025274880,2020-02-18 09:55:37,"b'@spoomadden26 As your owning agent is most knowledgeable regarding your case, they are in the best position to assi\xe2\x80\xa6 https://t.co/VqedkH0ZBJ'"
chevrolet,1229674123476922370,2020-02-18 07:48:51,"b'@donnyp55 Should you wish to discuss your concerns further, Donny, please feel free to send our team a DM. https://t.co/uXlRBslaLT'"
chevrolet,1229673441537642496,2020-02-18 07:46:09,"b'@Brett531 Please send our team a DM, Brett, so that we have the chance to learn more about your Traverse and see ho\xe2\x80\xa6 https://t.co/nlx4t1HQMg'"
chevrolet,1229602724464848898,2020-02-18 03:05:09,"b""@Zigzag_72 We're happy to hear you're interested in joining the Chevy family and would be more than happy to help l\xe2\x80\xa6 https://t.co/3mxFJITjSF"""
chevrolet,1229596805026828289,2020-02-18 02:41:37,"b""@dlature Hi, Dale. Please send us a DM if you are still experiencing concerns with the app and we'd be happy to ass\xe2\x80\xa6 https://t.co/DKqtbK6ILu"""
chevrolet,1229591124706123777,2020-02-18 02:19:03,"b'@0ddfellow Thank you for bringing this to our attention, Justin. We apologize to hear of your frustrations as this\xe2\x80\xa6 https://t.co/FgmL3myjeG'"
chevrolet,1229543458659950593,2020-02-17 23:09:39,"b""@CoachBarrier Hey, Duke. We're sorry to hear this. When you have a moment, please tell us more about your situation\xe2\x80\xa6 https://t.co/9XtJOrvR4u"""
chevrolet,1229540331013599232,2020-02-17 22:57:13,"b""@fallonnnxo Hey, Fallon. We're sorry to hear these sentiments. If you are currently experiencing concerns with your\xe2\x80\xa6 https://t.co/lQUpozUxCo"""
chevrolet,1229539580983930880,2020-02-17 22:54:14,"b'@mesamuelson We recognize your position, Mark. Should you ever like our assistance in the future, we are only a DM away.'"
chevrolet,1229538524220686339,2020-02-17 22:50:02,"b'@Fly044 We understand your frustrations, Stephanie. Have you brought this to the attention of your dealership? We a\xe2\x80\xa6 https://t.co/7eoKUqCxpq'"
chevrolet,1229536627409637376,2020-02-17 22:42:30,"b""@Pwcleveland2 We're sorry to see this. If you're currently experiencing engine concerns, please DM us your VIN, mil\xe2\x80\xa6 https://t.co/bguH3NS8eV"""
chevrolet,1229530883809394688,2020-02-17 22:19:40,"b'@mesamuelson We certainly understand where you are coming from, Mark. For us to look into your concerns on our end,\xe2\x80\xa6 https://t.co/UxgMW10rZu'"
chevrolet,1229526757927051264,2020-02-17 22:03:17,"b'@lgriff4 We understand how frustrating this must be, Linda. For us to provide you support while you work with your\xe2\x80\xa6 https://t.co/BIqqMaEav5'"
chevrolet,1229524354750246913,2020-02-17 21:53:44,"b""@AirRocketGlider Hi, Keith. We're sorry to hear about this situation. Our team would be happy to look into this fur\xe2\x80\xa6 https://t.co/RRtpDfuwtS"""
chevrolet,1229518286729035776,2020-02-17 21:29:37,"b'@itsAnnastesia Our team regrets to hear these sentiments, Annastesia. Please know, we will be happy to take a close\xe2\x80\xa6 https://t.co/Cs3bUpVbYx'"
chevrolet,1229517334240362498,2020-02-17 21:25:50,"b'@_tyeishad Hi, Tyeisha. We apologize for the frustration caused. Please send us a DM with additional details so we\xe2\x80\xa6 https://t.co/XQVlGVw9lu'"
chevrolet,1229511598223478785,2020-02-17 21:03:02,"b'@nmkroc We regret to hear these sentiments, Nick. Please know, our team will be happy to take a closer look into yo\xe2\x80\xa6 https://t.co/BUChCyLQYD'"
chevrolet,1229476394096152579,2020-02-17 18:43:09,"b""@cptbuckybarnes Hello. We've responded to your DM and politely ask you to follow up with us there to address your concerns. Thank you."""
chevrolet,1229466608197758976,2020-02-17 18:04:16,"b'@alexxthealright Hello, Alex. We recently responded to your DM. At your earliest convenience, please respond to us there.'"
chevrolet,1229400288508837888,2020-02-17 13:40:44,"b'@jmart1978 Hey, Jason. If you have any questions or concerns, we are only a DM away. We hope to one day restore your trust in our brand.'"
chevrolet,1229354977543372801,2020-02-17 10:40:41,"b'@taylorjphotos If you have any current concerns our team can assist with at this time, Taylor, please do not hesita\xe2\x80\xa6 https://t.co/kjOlcED4JG'"
chevrolet,1229351884068020225,2020-02-17 10:28:24,"b'@thetraceyrenay Our team would like to learn more about your Malibu and see how we may be able to best assist, Trac\xe2\x80\xa6 https://t.co/cAJ1sF2Nr7'"
chevrolet,1229328466048217088,2020-02-17 08:55:20,"b'@jmmurph119 Congratulations on your high mileage, Janice. We\xe2\x80\x99d love to look into ways we can help you celebrate thi\xe2\x80\xa6 https://t.co/FYDilrPgKi'"
chevrolet,1229300231444975616,2020-02-17 07:03:09,"b""@jheadapo Thanks for reaching out. We'd like to gain further clarification on your inquiry. To do so, please send u\xe2\x80\xa6 https://t.co/spo8qRxTT6"""
chevrolet,1229281625646649346,2020-02-17 05:49:13,"b'@richdonahue1 We appreciate your outreach to our team here, Rich. At this time, we have followed up with you via DM\xe2\x80\xa6 https://t.co/0pa3Vgmk7f'"
chevrolet,1229175125813055489,2020-02-16 22:46:01,"b""@monicsqua We're sorry to hear this. Our team would be happy to investigate this further on your behalf. When you'r\xe2\x80\xa6 https://t.co/VxAfaP9m94"""
chevrolet,1229147498305843200,2020-02-16 20:56:14,"b'@hola_biscocho Hi, Felipe. So we can take a closer look into your myChevrolet app concern, please DM us with further details.'"
chevrolet,1229120166656503808,2020-02-16 19:07:38,"b'@434Finest Hello. We apologize for the frustration caused. Please send us a DM with your full contact info, VIN, mi\xe2\x80\xa6 https://t.co/8ZH8OKdY1V'"
chevrolet,1229106542361772033,2020-02-16 18:13:30,"b'@Veslozoltard We are sorry to hear of the paint concerns with your Malibu. Please know, if you still own the vehicl\xe2\x80\xa6 https://t.co/sxqGyLlMfW'"
chevrolet,1228526575416594432,2020-02-15 03:48:55,"b""@PerezM361KS Hi, Matthew. We've recently responded to your DM. Please review it at your earliest convenience. Thank you."""
chevrolet,1228502324559011841,2020-02-15 02:12:33,"b""@Banjojim2 We really regret to see that you're having Stabilitrak concerns on your Traverse.  Have you worked with\xe2\x80\xa6 https://t.co/ywfPGiWjca"""
chevrolet,1228500015326171137,2020-02-15 02:03:22,"b""@dclar24 Thanks for reaching out to us, Drew.  We truly regret to hear that you've had recurring concerns with your\xe2\x80\xa6 https://t.co/5VHsUp6Wr4"""
chevrolet,1228497214663622656,2020-02-15 01:52:15,"b'@ChrisDoe85 Thank you for reaching out and bringing this to our attention, Chris. We do apologize to hear of your f\xe2\x80\xa6 https://t.co/jqfoT6qPUh'"
chevrolet,1228493317630873601,2020-02-15 01:36:45,"b""@nolatrex We regret to hear you're experiencing concerns with your vehicle, Lee and would be more than happy to loo\xe2\x80\xa6 https://t.co/MLJwI8j4H2"""
chevrolet,1228491997029126144,2020-02-15 01:31:31,"b""@iAMLegaLBloNde We regret to hear you're considering leaving the Chevy family and would be more than happy to look\xe2\x80\xa6 https://t.co/GHyKHs9ICi"""
chevrolet,1228483990346027013,2020-02-15 00:59:42,b'@ALWAYSBEHESTON Thank you for reaching out and bringing this to our attention. We apologize to hear of your frustra\xe2\x80\xa6 https://t.co/KKiQSD4SJA'
chevrolet,1228482858118832128,2020-02-15 00:55:12,"b'@89reatta We regret to hear of your sentiments and that your vehicle is experiencing head gasket concerns, Chris. P\xe2\x80\xa6 https://t.co/bcptDlnD5b'"
chevrolet,1228476959140659202,2020-02-15 00:31:45,"b""@MikesportsM We're sorry to hear you're experiencing these concerns with your Equinox, as this is certainly not the\xe2\x80\xa6 https://t.co/IPCuCcUp8o"""
chevrolet,1228438250760491008,2020-02-14 21:57:56,"b""@frankpagani_ We regret to hear you've had to experience so many recalls, Frank.  Have you had service on those rec\xe2\x80\xa6 https://t.co/MbRmBhvr8B"""
chevrolet,1228437076288233472,2020-02-14 21:53:16,"b""@DeadSpider No\xc2\xa0need for chocolate when you've got all this eye candy. Could you please send us a DM?"""
chevrolet,1228435791908499457,2020-02-14 21:48:10,b'@TitusMcTerry Sounds like #ChevyEquinox love is in the air.'
chevrolet,1228430067488804864,2020-02-14 21:25:25,b'@Jodi_Hoppa A match made in\xc2\xa0Chevy heaven.'
chevrolet,1228402072833290243,2020-02-14 19:34:11,"b'@Prakash16192999 Our apologies for any dissatisfaction, Prakash. At this time, we\xe2\x80\x99ve responded to your DM. Please follow up with us there.'"
chevrolet,1228393938672701440,2020-02-14 19:01:52,"b""@ChristinaMWelsh We've responded to your DM, Christina. Please follow up with us there when you have a moment."""
chevrolet,1228372433905713152,2020-02-14 17:36:24,"b'@jmart1978 We\xe2\x80\x99ve followed up with you via DM, Jason. Please check there when you have a moment. https://t.co/uXlRBslaLT'"
chevrolet,1228333231126261760,2020-02-14 15:00:38,b'Ready to meet your Chevy match this #ValentinesDay? One of these beauties is set and ready to go. Already in a Chev\xe2\x80\xa6 https://t.co/OubEr6wRHv'
chevrolet,1228159709988802563,2020-02-14 03:31:07,"b""@dvaldez0518 We're terribly sorry to hear that your truck has been stolen, David.  Please send us a DM so that we c\xe2\x80\xa6 https://t.co/BqIRyCDdhA"""
chevrolet,1228134870095785984,2020-02-14 01:52:25,"b""@Wright_way_USA Thank you for reaching out. We apologize to hear of your frustrations. We'd like to look into this\xe2\x80\xa6 https://t.co/njD8QcqFTS"""
chevrolet,1228124278719012864,2020-02-14 01:10:20,"b""@troy_does_hair We're sorry to hear you're encountering concerns trying to use the app, Troy. Please send us a DM w\xe2\x80\xa6 https://t.co/IIMvlO6nvw"""
chevrolet,1228109792427687936,2020-02-14 00:12:46,"b'@Blasian254 We truly regret to see you this with our customers, as safety is our top priority at Chevrolet.  So tha\xe2\x80\xa6 https://t.co/cN5r6liSmx'"
chevrolet,1228107277585928193,2020-02-14 00:02:46,"b""@arejaygarseeya We're sorry to hear about your battery concerns, RJ. If you are still experiencing concerns, please\xe2\x80\xa6 https://t.co/g1OTdfBd63"""
chevrolet,1228100746412871681,2020-02-13 23:36:49,b'@gamire3 Hello. We apologize for the frustration caused. Please send us a DM at your at earliest convenience so we\xe2\x80\xa6 https://t.co/41tgShJxli'
chevrolet,1228098939842220032,2020-02-13 23:29:38,"b""@Shaud_we_trust Hey, Chad. If you're looking to purchase a new or CPO vehicle, we are more than happy to assist you\xe2\x80\xa6 https://t.co/Adtsj8SiPU"""
chevrolet,1228094913465597952,2020-02-13 23:13:38,"b""@theP0cketElf We're so sorry to hear this has been your purchasing experience. Allow us to help you connect to a de\xe2\x80\xa6 https://t.co/anSCaveR80"""
chevrolet,1228059688278749184,2020-02-13 20:53:40,"b""@KingKobadiah Not a problem, Koby. If you ever are in need of assistance, please don't hesitate to let us know."""
chevrolet,1228054700596944896,2020-02-13 20:33:51,"b'@gudygood We regret to hear these sentiments. So we can take a closer look into your MyLink concerns, please DM us with further details.'"
chevrolet,1228054204897484800,2020-02-13 20:31:53,"b'@CARandDRIVER @tigers No, THIS is the correct response.'"
chevrolet,1228052996140875776,2020-02-13 20:27:05,"b'@Jellis1905 Hey, Josh. We will be happy to further discuss the concerns with your vehicle. To do so, send us a DM with further details.'"
chevrolet,1228046633205501952,2020-02-13 20:01:48,"b""@KingKobadiah We're sorry to hear you're experiencing this fuel line issue with your Avalanche, Koby. Would you min\xe2\x80\xa6 https://t.co/bC6HmGci6t"""
chevrolet,1228042537606082565,2020-02-13 19:45:31,"b""@Keharris63 We're sorry to hear about this, Kailen. In order to better assist you, please DM us with your contact i\xe2\x80\xa6 https://t.co/QKep9qFHFc"""
chevrolet,1228035003965038592,2020-02-13 19:15:35,"b'@smithwhomlou Hey, Mary. Our team would like to take a closer into your concerns. So we can best assist, please sen\xe2\x80\xa6 https://t.co/mQGQvPWpbI'"
chevrolet,1228018086592167936,2020-02-13 18:08:21,"b'@Mschulzmn Our apologies for any inconvenience caused by this, Mark. There is a temporary service interruption with\xe2\x80\xa6 https://t.co/KpEmkMKRQb'"
chevrolet,1228015775148986368,2020-02-13 17:59:10,"b""@mrscharmedones We appreciate your quick response, Sue. If you have any future questions or concerns, please don't\xe2\x80\xa6 https://t.co/bQFqMyysLx"""
chevrolet,1228014318915964930,2020-02-13 17:53:23,"b'@mrscharmedones Our apologies for any inconvenience caused by this, Sue. There is a temporary service interruption\xe2\x80\xa6 https://t.co/nBFbZyZXHE'"
chevrolet,1228013534149132293,2020-02-13 17:50:16,"b'@spoomadden26 We sincerely apologize that you\xe2\x80\x99re unsatisfied with the assistance you\xe2\x80\x99ve received, Micheal.  Please\xe2\x80\xa6 https://t.co/QlMhPMniN7'"
chevrolet,1227785658644811776,2020-02-13 02:44:46,"b'@jonalexzanda Offering bold styling, advanced technologies, and the perfect blend of upscale comfort and powerful c\xe2\x80\xa6 https://t.co/cZN9akTveO'"
chevrolet,1227776616048332800,2020-02-13 02:08:50,"b'@johnwylie Thank you for reaching out, John. We apologize to hear of your frustrations regarding the situation with\xe2\x80\xa6 https://t.co/OZxk9OEv8C'"
chevrolet,1227773060461268992,2020-02-13 01:54:43,"b'@cptbuckybarnes We surely understand your frustrations with this matter, Alexandra and have recently responded to y\xe2\x80\xa6 https://t.co/Rg0x6JQNLC'"
chevrolet,1227769338691805189,2020-02-13 01:39:55,"b'@aLEX5antos Thank you for reaching out, Alex. We apologize to hear of your frustrations as this is not the type of\xe2\x80\xa6 https://t.co/PnrIlRsOaZ'"
chevrolet,1227768569045217280,2020-02-13 01:36:52,"b""@TheHomieRyno We're sorry to hear you're experiencing engine concerns with your Equinox and would be more than happ\xe2\x80\xa6 https://t.co/5gCIAbNX1E"""
chevrolet,1227761734464741377,2020-02-13 01:09:42,"b'@Bnicklow33 Thank you for reaching out, Brock. We apologize to hear of your frustrations as this is not the sort of\xe2\x80\xa6 https://t.co/NRzAuYckiH'"
chevrolet,1227754594203205633,2020-02-13 00:41:20,b'@Aztexan512 Thank you for reaching out. We apologize to hear of your frustrations as safety is our top priority and\xe2\x80\xa6 https://t.co/C5LHu9CeFi'
chevrolet,1227752553644994566,2020-02-13 00:33:13,"b""@deesalexisnaav We're sorry to hear about your brakes and would like to learn more about your situation. Please sen\xe2\x80\xa6 https://t.co/XxDbcS7lyM"""
chevrolet,1227752167731351554,2020-02-13 00:31:41,"b'@alexxthealright Thank you for reaching out, Alex. We apologize to hear of your frustrations as this is not the sor\xe2\x80\xa6 https://t.co/JbpCROLMJA'"
chevrolet,1227750049066766338,2020-02-13 00:23:16,"b'@mattketchum Hey, Matthew. Allow us to look into your recall further and learn more about your situation. For us to\xe2\x80\xa6 https://t.co/A7xg2sfWv7'"
chevrolet,1227740992729731074,2020-02-12 23:47:17,"b'@JessePi48545343 Hey, Jesse. We followed up with you by direct message. Please review it and provide more informati\xe2\x80\xa6 https://t.co/T8G6yDjWFL'"
chevrolet,1227740046654148613,2020-02-12 23:43:32,"b'@tarzaa_official Excellent choice, the Silverado 1500 offers best-in-class standard cargo volume. Our team would lo\xe2\x80\xa6 https://t.co/LOxyoTIDM5'"
chevrolet,1227737984117739526,2020-02-12 23:35:20,"b'@HONESTYxLOYALTY We regret to hear this, Angel. To learn more about your experience, we kindly ask you send us a DM\xe2\x80\xa6 https://t.co/7tehgUOzUV'"
chevrolet,1227727339775242241,2020-02-12 22:53:02,"b'@Survainn Hi, Nick. We apologize for the delayed reply. Our team has responded to your DM.'"
chevrolet,1227714366331637760,2020-02-12 22:01:29,b'@ThomasRGolden Nothing like a drive with a view.'
chevrolet,1227699660921409536,2020-02-12 21:03:03,"b""@tarzaa_official We are excited to hear about your interest, Marcus. Is there a specific model that you're interested in?"""
chevrolet,1227680919991001088,2020-02-12 19:48:35,"b'@genemannix Hi, Gene. As previously mentioned, we wanted to follow up to address your concerns. To do so, please se\xe2\x80\xa6 https://t.co/kjq6GQCF6s'"
chevrolet,1227676177684455426,2020-02-12 19:29:44,"b""@yofavsmilez We're glad to hear of the excitement about the Blazer. Interested in test driving one? Send us a DM wi\xe2\x80\xa6 https://t.co/IFD7w2pW78"""
chevrolet,1227665422541107205,2020-02-12 18:47:00,"b'@acuwuna Hey, Brandon. Our team will be happy to take a closer look into the battery concern with your Cruz. So we\xe2\x80\xa6 https://t.co/rigxOAOn1r'"
chevrolet,1227632627139653633,2020-02-12 16:36:41,"b'@jmart1978 Morning, Jason. At this time, we have responded to your DM and when you have a moment, we hope to review it.'"
chevrolet,1227631634268160000,2020-02-12 16:32:44,"b""@Survainn We're sorry to hear of the Equinox concerns, Nick. Please send us a DM with additional details and we'd b\xe2\x80\xa6 https://t.co/paLzU8AHbn"""
chevrolet,1227613068810739723,2020-02-12 15:18:58,"b""@AHill_Design Hi, Andrew. We're sorry to hear you're experiencing concerns with your Equinox. Please send us a DM w\xe2\x80\xa6 https://t.co/zollRmzhJm"""
chevrolet,1227607160655208450,2020-02-12 14:55:29,b'@cptbuckybarnes We\xe2\x80\x99d like the opportunity to learn more about your Spark. Have you had the chance to bring your cur\xe2\x80\xa6 https://t.co/pOFxFf3ItA'
chevrolet,1227569794213437445,2020-02-12 12:27:00,"b'@DocWashington When you have a moment, please review our reply to your DM.'"
chevrolet,1227520738074284033,2020-02-12 09:12:04,"b'@mallerieallison If you have any questions or concerns with your Cruze that our team can assist with, Mal, please f\xe2\x80\xa6 https://t.co/eTX72JHXUW'"
chevrolet,1227520425011355648,2020-02-12 09:10:50,b'@PerezM361KS Please send us a DM so we may learn more about your current concerns and experience.'
chevrolet,1227346867454980098,2020-02-11 21:41:10,b'@leezethh We are thrilled to hear that. What excites you the most about our 2020 Blazer?'
chevrolet,1227342721968431104,2020-02-11 21:24:42,"b""@misspelledrayne It's a #ChevyTrucks thing."""
chevrolet,1227342698560008193,2020-02-11 21:24:36,"b'@Jgmfan Thanks for asking. So we can best assist, could you please send further details to us via DM? We will keep\xe2\x80\xa6 https://t.co/653Vyt5MI4'"
chevrolet,1227341647316496387,2020-02-11 21:20:26,"b'@jennniarlette We regret to hear of the concerns with your Malibu, Jenn. Please know. our team will be happy to tak\xe2\x80\xa6 https://t.co/Nhzt2PFNRp'"
chevrolet,1227340893167980548,2020-02-11 21:17:26,b'@anda_panda7 Facts. \xf0\x9f\x92\xaa'
chevrolet,1227340195315507204,2020-02-11 21:14:40,"b'@FLATHEEM_BILLZ We are sorry to hear these sentiments. Please know, we will be happy to assist with any concerns yo\xe2\x80\xa6 https://t.co/EVWJ2rRc85'"
chevrolet,1227339943669903365,2020-02-11 21:13:40,"b""@jk2galloway We're still speechless."""
chevrolet,1227338745105539072,2020-02-11 21:08:54,b'@Layton2121 First steps. First crush. First Camaro. Another milestone in the books. \xf0\x9f\x94\xa5'
chevrolet,1227326380385370119,2020-02-11 20:19:46,"b""@drknlovely26 We're sorry to hear that you've been experiencing issues with your Cruze. Our team would like the opp\xe2\x80\xa6 https://t.co/P0lSi6kDOI"""
chevrolet,1227303273956331523,2020-02-11 18:47:57,"b""@ItsBigRickSon It's been a while since we last heard from you, Ricky. Rest assured, our team is only a DM away if y\xe2\x80\xa6 https://t.co/BwMHNaUF8G"""
chevrolet,1227297443970244611,2020-02-11 18:24:47,"b""@razorsharpwhit We're sorry to see you feel this way, Whitney. Our team can file a complaint on your behalf, no pro\xe2\x80\xa6 https://t.co/VXXjnlpBfh"""
chevrolet,1227291474037018627,2020-02-11 18:01:04,"b'@_NBAnalysis Hey, Brad. Our team will be happy to assist you with checking out your dream car, at your local Chevy\xe2\x80\xa6 https://t.co/BUNlzlZEiV'"
chevrolet,1227287974641045506,2020-02-11 17:47:09,"b""@jesicasoriano_ Hey, Jes. We're happy to hear of the excitement for the Blazer. Have you had the opportunity to che\xe2\x80\xa6 https://t.co/OEuRXLmSuE"""
chevrolet,1227283970305425409,2020-02-11 17:31:15,"b""@genemannix We're sorry to hear of the frustration, Gene. Please know, your safety is of the utmost importance to u\xe2\x80\xa6 https://t.co/JsI9PBd2fF"""
