chevrolet,1281331683434696705,2020-07-09 20:57:33,"b""@JeffreyKrambeer Hi, Jeffrey. We've recently followed up to your DM. Please review it at your earliest convenience. Thank you."""
chevrolet,1281306551337152512,2020-07-09 19:17:42,"b'@Sluggo317 This is certainly not something we like to hear, Joe. With safety being an utmost priority, we understan\xe2\x80\xa6 https://t.co/42salbBqeJ'"
chevrolet,1281299351445229569,2020-07-09 18:49:05,"b""@gogosgirly We are sorry to hear of your dissatisfaction, Teresa. If you'd like to discuss this further, feel free to send our team a DM."""
chevrolet,1281287124289941506,2020-07-09 18:00:30,"b""@mkmariles We're sorry to hear about your disappointing experience, Madison, and we\xe2\x80\x99d love to learn more about it.\xe2\x80\xa6 https://t.co/eV2qIvPmCg"""
chevrolet,1281280949351706624,2020-07-09 17:35:58,"b""@rhonda_jjenkins That's awesome to hear, Rhonda. We would love to share this compliment with them. When you have a\xe2\x80\xa6 https://t.co/XcUDd7mUBS"""
chevrolet,1281280722196590595,2020-07-09 17:35:03,"b'@rascon616 Thank you, Kyle. We will follow up with you there.'"
chevrolet,1281277205171933184,2020-07-09 17:21:05,"b'@rascon616 This is not what we like to hear from our valued customers, Kyle. When you get a chance, please send us\xe2\x80\xa6 https://t.co/KgSF0By21A'"
chevrolet,1281271665934995457,2020-07-09 16:59:04,"b""@LilxXandra We're happy to hear that you are interested in our Corvette. When you get send our team a DM, we'd be happy to assist."""
chevrolet,1281266508149088259,2020-07-09 16:38:34,"b'@NINOBILLIONS This is not what we like to hear. When you get a chance, please send our team a DM so we can gather more info.'"
chevrolet,1281250392894877702,2020-07-09 15:34:32,b'@_totalmoron We apologize to hear of your frustrations with your Cruze. Were you currently experiencing concerns wi\xe2\x80\xa6 https://t.co/TnQHzLKc7q'
chevrolet,1281236933247524864,2020-07-09 14:41:03,b'@SunnyFavs The 2020 Trax is a great vehicle to be considering. Have you had the chance to experience one in person?\xe2\x80\xa6 https://t.co/VruA2cUqAL'
chevrolet,1281235924701995012,2020-07-09 14:37:03,"b""@SaharahAmber We're glad to hear the Corvette caught your attention. Did you have a time frame for when you were lo\xe2\x80\xa6 https://t.co/kaKeEJyqOq"""
chevrolet,1281234508319043586,2020-07-09 14:31:25,"b'@Da_Shocker Great question, David. 2021 ordering is now scheduled to open up on July 30th, 2020. The Visual Order G\xe2\x80\xa6 https://t.co/7QkdOBX28f'"
chevrolet,1281223121593233408,2020-07-09 13:46:10,"b'@TheDryHeat115 This is music to our ears, Scott. We are happy to hear of your satisfaction.'"
chevrolet,1281220999816441856,2020-07-09 13:37:44,"b""@BartleyThom Hi, Thom. We're sorry to hear of the frustration. Can you please follow up with us via DM with additio\xe2\x80\xa6 https://t.co/wH7F2tB3GL"""
chevrolet,1281204907479977985,2020-07-09 12:33:48,b'@CryptoTiki We apologize for any dissatisfaction. Please know safety is our top priority and we appreciate this fee\xe2\x80\xa6 https://t.co/NKL3jTJL2o'
chevrolet,1281204139662303233,2020-07-09 12:30:45,"b""@lilnikki1212 Hey, Nikki. We're sorry to hear of the frustration with the clock in your vehicle. Send us a DM here\xe2\x80\xa6 https://t.co/hAqHBMQ6P1"""
chevrolet,1281198516144967680,2020-07-09 12:08:24,b'@Its_BreezyBabyy Sorry to hear this. Have you brought this to the attention of your Chevrolet dealership? They are\xe2\x80\xa6 https://t.co/FujWGX2znK'
chevrolet,1281073795793444865,2020-07-09 03:52:48,"b'@Randall01608486 This is certainly not the ownership experience we strive for our valued customers, Randall and wou\xe2\x80\xa6 https://t.co/ZpmS2rEXfL'"
chevrolet,1281072578480594950,2020-07-09 03:47:58,"b""@Carrie_Sterner We certainly respect your position, Carrie and appreciate the clarification. Please don't hesitate\xe2\x80\xa6 https://t.co/nvvxjjR7SW"""
chevrolet,1281062143832416257,2020-07-09 03:06:30,"b'@CastanedaPeter_ These are certainly not the sentiments we like to hear of, Paydro and would be happy to look furth\xe2\x80\xa6 https://t.co/GK4W0k0ySg'"
chevrolet,1281021354939052032,2020-07-09 00:24:25,"b""@Carrie_Sterner We're sorry to hear of the concerns with your Aveo, Carrie and would be happy to help you get in to\xe2\x80\xa6 https://t.co/iEu1QPezub"""
chevrolet,1280979331963973632,2020-07-08 21:37:26,"b""@HoldenthePage Hello, Holden. We've responded to your DM. Please let us know when you've had a chance to review our message."""
chevrolet,1280939845435535362,2020-07-08 19:00:32,b'@PrydeWater Driving almost half a million miles is a major accomplishment. We\xe2\x80\x99d like to explore ways to celebrate t\xe2\x80\xa6 https://t.co/waS5kEXvup'
chevrolet,1280911251401367553,2020-07-08 17:06:55,b'@canepilot13 You have the right to expect long term reliable performance from your vehicle and we apologize if this\xe2\x80\xa6 https://t.co/NAxa72zGhL'
chevrolet,1280877085142052864,2020-07-08 14:51:09,"b""@ClassSpin We can't wait for you to join the Chevrolet family. Have you found your perfect Silverado yet? If not, s\xe2\x80\xa6 https://t.co/6MvolDFkj6"""
chevrolet,1280873903565484041,2020-07-08 14:38:30,b'RT @ChevyTrucks: Haul some power into your #AnimalCrossing world with the perfect 2020 #Silverado hideaway. Download these items at\xc2\xa0https:/\xe2\x80\xa6'
chevrolet,1280867000613343233,2020-07-08 14:11:04,"b'@frink_tony Your frustrations are understood. If you change your mind, we are only a DM away. https://t.co/uXlRBslaLT'"
chevrolet,1280865148278734848,2020-07-08 14:03:43,"b""@JeffreyKrambeer We've followed up with you via DM, Jeffrey. Please check there when you have a moment. https://t.co/uXlRBslaLT"""
chevrolet,1280860338032750592,2020-07-08 13:44:36,"b""@Soymilksinatraa The Tahoe is an excellent choice when considering bold styling and advanced safety. We'd be happy\xe2\x80\xa6 https://t.co/POGQDjvJgW"""
chevrolet,1280857078865657859,2020-07-08 13:31:39,"b""@TitsMcgeeDaReal Hey there, Ryan. We'd be happy to see how we can assist. When you get a chance, send us a DM with\xe2\x80\xa6 https://t.co/KVyTX8izyo"""
chevrolet,1280854531761373185,2020-07-08 13:21:32,"b""We've added to the legacy. See all the updates to the 2021 #Corvette right now. https://t.co/m388cMH5NY https://t.co/NcbMAqMsPM"""
chevrolet,1280840414858113025,2020-07-08 12:25:26,"b'@TroyFelton17 We\xe2\x80\x99re sorry to hear about your disappointing experience, Troy. Please know, we strive for excellent c\xe2\x80\xa6 https://t.co/aYwPtOt3qi'"
chevrolet,1280839723997487104,2020-07-08 12:22:41,b'@robzombee We\xe2\x80\x99d like the opportunity to learn more about concerns you\xe2\x80\x99re currently experiencing. Please send us a D\xe2\x80\xa6 https://t.co/lqRUIOssw1'
chevrolet,1280679202543423494,2020-07-08 01:44:50,"b'@CalamariMimi Hi, Mimi. We recently to your DM. Please review it at your earliest convenience. Thank you.'"
chevrolet,1280669646840950784,2020-07-08 01:06:52,"b'@CalamariMimi Wow! 300,000 miles is a huge achievement, Mimi. We\xe2\x80\x99d like to explore ways to celebrate this milestone\xe2\x80\xa6 https://t.co/akSYTCJnpG'"
chevrolet,1280663565632851970,2020-07-08 00:42:42,"b'@JeffreyKrambeer Hi, Jeffrey. We recently responded to your DM. Please review it at your earliest convenience. Thank you.'"
chevrolet,1280599366479175680,2020-07-07 20:27:36,"b""@Megan48650487 Hello, Megan. Please know, we strive for excellent customer service, and this isn't the impression w\xe2\x80\xa6 https://t.co/NdemEhPwcS"""
chevrolet,1280575002467655680,2020-07-07 18:50:47,"b""@ciomara_cruz We regret to hear this was your purchasing experience, Santana. Please know we'd like to learn more a\xe2\x80\xa6 https://t.co/HSUBNkdEQB"""
chevrolet,1280570773774561281,2020-07-07 18:33:58,"b""@RDIDDY11 Thank you for your interest in the Tahoe. What caught your interest the most about this vehicle? We'd be\xe2\x80\xa6 https://t.co/P3ReGQA8fe"""
chevrolet,1280567534131875840,2020-07-07 18:21:06,b'@FUENTESx777 We apologize for any inconvenience this has caused you. Thank you for your valued feedback.'
chevrolet,1280566737579069440,2020-07-07 18:17:56,"b'@youngguns_22 Brandon, we would be more than happy to look into this for you. Please send us a DM with your VIN, co\xe2\x80\xa6 https://t.co/EayjfhMIqn'"
chevrolet,1280564868974653447,2020-07-07 18:10:31,"b'@RaniDoll_XO We are sorry to hear that you are experiencing concerns with your Impala. When you get a chance, send\xe2\x80\xa6 https://t.co/zQXekkAat1'"
chevrolet,1280518198224474113,2020-07-07 15:05:03,"b'@HoldenthePage Hey, Holden. We would be happy to discuss your case further. For privacy reasons, we kindly ask you\xe2\x80\xa6 https://t.co/NBo8mLDYoq'"
chevrolet,1280516826015969281,2020-07-07 14:59:36,"b""@DD_LONGWAY That's what we like to hear! If you need help locating a Silverado Crew Cab Short Box near you, send us\xe2\x80\xa6 https://t.co/Zeo2I415JD"""
chevrolet,1280514630490750982,2020-07-07 14:50:53,"b""@WhoCANWorrY Thank you for reaching out. We'd be happy to help locate a dealership in your region as well as set up\xe2\x80\xa6 https://t.co/2U4mfrGjHQ"""
chevrolet,1280511116221788160,2020-07-07 14:36:55,"b'@anicottirosie Our team is just a DM away if you would like to discuss this further, Tam.'"
chevrolet,1280510726185107457,2020-07-07 14:35:22,"b'@robzombee We\xe2\x80\x99re sorry to hear about these concerns with your Duramax, Rob. We\xe2\x80\x99d be happy to look into this for you\xe2\x80\xa6 https://t.co/Bnt4ao3n9X'"
chevrolet,1280510266170630153,2020-07-07 14:33:32,"b""@cm142034 This isn't what we like to hear, Chris. When you have a chance, please send us a direct message and be su\xe2\x80\xa6 https://t.co/w3Vh6SyTzG"""
chevrolet,1280509960154210311,2020-07-07 14:32:19,"b""@TraeThaTruth210 Hi, Trae. We'd be happy to connect you to a certified Chevrolet dealership for assistance with you\xe2\x80\xa6 https://t.co/kmh9LCWSZ0"""
chevrolet,1280509925974818818,2020-07-07 14:32:11,"b'@Polynesianfong Hi, Jaz. When you have a chance, please send us a direct message and be sure to click \xe2\x80\x9cMessage an A\xe2\x80\xa6 https://t.co/c9vsnyXlZg'"
chevrolet,1280505374412603392,2020-07-07 14:14:06,"b""@TimG_3x Hi, Tim. We'd be happy to clear up any confusion regarding your free OnStar trial. You are more than welco\xe2\x80\xa6 https://t.co/79TGvxwiK9"""
chevrolet,1280504875210682368,2020-07-07 14:12:07,"b""@Canderson012 We're sorry to hear of your transmission concern, Cason. To clarify, have you had the chance to bring\xe2\x80\xa6 https://t.co/Eg5STPBXYt"""
chevrolet,1280501761120391169,2020-07-07 13:59:45,"b""@Veronic63324823 This isn't what we like to see, Veronica. Have you had the chance to bring your Cruze to the deale\xe2\x80\xa6 https://t.co/MmO9ThGe3z"""
chevrolet,1280494947859234816,2020-07-07 13:32:40,"b'@azn2nr Hey there, Sonny. We assure you that we do care. Please send us a DM so we can get some additional details on your concern.'"
chevrolet,1280494547005366272,2020-07-07 13:31:05,"b'@anicottirosie We are truly sorry to hear this, Tam. When you get a chance, please send us a DM so we can gather some more info.'"
chevrolet,1280480698361507840,2020-07-07 12:36:03,"b""@juliemielke3 We're so glad to hear of the satisfaction when visiting your dealer, Julie. So that we can share this\xe2\x80\xa6 https://t.co/O8KHUvxppC"""
chevrolet,1280323886714773505,2020-07-07 02:12:56,"b'@_mattb1 These are certainly not the sentiments we like to hear of, Matt as this is nowhere near the ownership expe\xe2\x80\xa6 https://t.co/QDWNTdjxPu'"
chevrolet,1280322188092928001,2020-07-07 02:06:11,"b""@NicholasPinto1 These certainly aren't the sentiments we like to hear of, Nicholas as this is not the ownership exp\xe2\x80\xa6 https://t.co/DkuQqAWnve"""
chevrolet,1280237694245720064,2020-07-06 20:30:26,"b'@stormiiuwu We deeply regret to hear this was your experience, Stormi. Please know repair costs are determined at t\xe2\x80\xa6 https://t.co/858j1o3lgo'"
chevrolet,1280213834259562496,2020-07-06 18:55:37,"b""@KxngGio___ The Malibu and Impala are excellent choices, Gio. Send us a DM and we'd be happy to send over some addi\xe2\x80\xa6 https://t.co/CuruXomszN"""
chevrolet,1280213716152152064,2020-07-06 18:55:09,"b'@MouhamedB We appreciate your interest, Mouhamed. Have you been able to see either in person? We are happy to help\xe2\x80\xa6 https://t.co/An8MwTkaAp'"
chevrolet,1280213021713813504,2020-07-06 18:52:24,"b""@EmmanuelAbua1 Hey, Emmanuel. The Silverado has a starting MSRP of $28,500. Keep in mind this doesn't include tax,\xe2\x80\xa6 https://t.co/XcOEVK2S65"""
chevrolet,1280185285603721216,2020-07-06 17:02:11,b'It\xe2\x80\x99s time to earn some new racing stripes. Check back soon for #Corvette news. https://t.co/OqmOpsksii'
chevrolet,1280172560978591745,2020-07-06 16:11:37,"b""@MarshMadnezz Hi, Marshall. We'd be happy to connect you to a certified Chevrolet dealership for assistance with th\xe2\x80\xa6 https://t.co/3leC3uELho"""
chevrolet,1280171991757012993,2020-07-06 16:09:21,"b'@ChaseFording Thank you for contacting us, Chase. We are thrilled to hear that you are looking to get into a new Su\xe2\x80\xa6 https://t.co/pHZJtteqMr'"
chevrolet,1280149236026273794,2020-07-06 14:38:56,"b'@RasielPCorp We appreciate you following up, Rasiel. Your dealership is in the best position to determine if the cu\xe2\x80\xa6 https://t.co/Ey2CmdeRai'"
chevrolet,1280147313936089091,2020-07-06 14:31:18,"b""@sasssifrasss We'd like to learn more about your concerns with your Cruze and best help. Please send us a DM with s\xe2\x80\xa6 https://t.co/wHjl1lprsd"""
chevrolet,1280141152637775878,2020-07-06 14:06:49,"b""@Lost_Supercells We'd like to learn more about your rust concern. Please send us a DM with some additional details when you get a chance."""
chevrolet,1280131072756379649,2020-07-06 13:26:46,"b'@matt_nation We understand and do apologize, Matt. If there is anything we can assist you with in the future, pleas\xe2\x80\xa6 https://t.co/x4gF7FKWCo'"
chevrolet,1280128067029987330,2020-07-06 13:14:49,"b""@rowanwrites Hi, Rowan. We're sorry to hear of the frustration with the Infotainment screen in your Trax. This is c\xe2\x80\xa6 https://t.co/y2gynGhrqj"""
chevrolet,1280127059860221955,2020-07-06 13:10:49,"b""@so0okrispy Hi, Kristina. We're sorry to hear of the frustration with your Equinox and would be happy to look into\xe2\x80\xa6 https://t.co/yIRaIxUZjg"""
chevrolet,1280126212623351812,2020-07-06 13:07:27,"b'@abigmanrunning We understand, Dave. Your feedback will be documented for further review. If there is anything we c\xe2\x80\xa6 https://t.co/l0xJ0UI5qG'"
chevrolet,1280119519881474050,2020-07-06 12:40:51,"b""@abigmanrunning If you need any assistance, Dave, please know we're happy to help. Just follow up with us via a DM. https://t.co/uXlRBslaLT"""
chevrolet,1279868289750110215,2020-07-05 20:02:33,b'RT @TeamChevy: What an amazing way to close out race day on The #FourthofJuly. @AntonioGarcia_3 &amp; @jordan10taylor bring home the first win\xe2\x80\xa6'
chevrolet,1279222545481207809,2020-07-04 01:16:36,"b""@JonathanJussely Hello, Jonathan. We've reviewed your private message and have responded there. When have a chance,\xe2\x80\xa6 https://t.co/O28AESqc04"""
chevrolet,1279176466937200640,2020-07-03 22:13:30,"b""@talk2sindhu007 Hello, Ashish. We've recently responded to your DM."""
chevrolet,1279141654809546752,2020-07-03 19:55:10,b'@talk2sindhu007 Please send us a DM at your earliest convenience. We look forward to speaking with you soon.'
chevrolet,1279139725169713152,2020-07-03 19:47:30,b'@TheWckdSoul Thank you for reaching back out. Chevrolet is dedicated to improving the products we offer and your fe\xe2\x80\xa6 https://t.co/bujzvKyFPB'
chevrolet,1279139136163639296,2020-07-03 19:45:09,"b'@_Ohsea Sounds good, John. If you have any questions or concerns, please send us a DM. We are happy to assist.'"
chevrolet,1279134228752429056,2020-07-03 19:25:39,"b""@talk2sindhu007 This isn't what we like to hear, Ashish. If you're in need of assistance, please don't hesitate to\xe2\x80\xa6 https://t.co/APxPgH2R4y"""
chevrolet,1279121713809092608,2020-07-03 18:35:56,b'@TheWckdSoul Thank you for reaching out. We apologize to hear of your frustrations as this is not the type of exper\xe2\x80\xa6 https://t.co/rLyfIbmtTT'
chevrolet,1279113441026826250,2020-07-03 18:03:03,"b""@72danS This is not what we like to see, Dan. We'd love the opportunity to look into your situation. So that we may\xe2\x80\xa6 https://t.co/JT61vCyAOl"""
chevrolet,1279099268607782918,2020-07-03 17:06:44,"b'@areallycuteboy When you get a chance, we kindly ask that you send our team a DM. We would like to gather some more info.'"
chevrolet,1279086277648769025,2020-07-03 16:15:07,"b""@MarcusR_13 We're happy to hear that you are interested in our vehicles, Marcus. If you need any assistance locatin\xe2\x80\xa6 https://t.co/rtDwxy8R5E"""
chevrolet,1279069430496915456,2020-07-03 15:08:10,"b'@mel_mayberts We apologize for your frustration, Melissa. These are not the sentiments we like to hear from our val\xe2\x80\xa6 https://t.co/7IuqKFJbo7'"
chevrolet,1279060412550361089,2020-07-03 14:32:20,"b'@nickfromcana Thank you for considering our brand for your next vehicle, Nick. Which model were you considering? We\xe2\x80\xa6 https://t.co/a0NoyLgYY3'"
chevrolet,1279056469854269441,2020-07-03 14:16:40,"b""@DC_TREY Excellent choice, Danny. We'd be happy to assist in connecting you to your preferred Chevrolet dealer. Sen\xe2\x80\xa6 https://t.co/NkL31bQNqC"""
chevrolet,1278830369077252096,2020-07-02 23:18:14,"b""@Sweetened_Tea Hi, Tesa. We've recently responded to your DM. Please review it at your earliest convenience. Thank you."""
chevrolet,1278821688927379457,2020-07-02 22:43:44,"b'@Sweetened_Tea These are certainly not the kinds of sentiments we like to hear of, Tesa and would be happy to provi\xe2\x80\xa6 https://t.co/TDO5Xa5oOC'"
chevrolet,1278811522819436544,2020-07-02 22:03:20,"b""@CamoDeangelo Hi, Cameron. We're glad to hear you're interested in the Silverado. If you need any assistance locati\xe2\x80\xa6 https://t.co/qMceboVebT"""
chevrolet,1278781169971032064,2020-07-02 20:02:44,"b'@BufordTAmerica To clarify, are you still experiencing your concern with the locked infotainment system?'"
chevrolet,1278778404368560128,2020-07-02 19:51:44,"b'@jaylynnxoxo Hey, Jaylynn. We recently followed up with your DM. When you have a moment, please review it and conti\xe2\x80\xa6 https://t.co/Vr1gY1iac6'"
chevrolet,1278775924528275456,2020-07-02 19:41:53,"b'@BufordTAmerica We sorry to hear this happened. When you get a chance, send our team a DM and we will be happy to see how we can assist.'"
chevrolet,1278775107071078400,2020-07-02 19:38:38,"b""@2arinkorpool Your frustration is very much understood. We'd like to learn more about your situation and provide a\xe2\x80\xa6 https://t.co/aCOnIsBvCq"""
chevrolet,1278774072910831617,2020-07-02 19:34:32,"b""@ChinESE_SunShyn We're glad to hear that you were pleased with the loaner vehicle you were provided. In the future,\xe2\x80\xa6 https://t.co/717lgW2WYf"""
chevrolet,1278769578269532166,2020-07-02 19:16:40,"b""@Makingmerkins We'd be happy to connect with your involved dealership to gain some additional insight on this matte\xe2\x80\xa6 https://t.co/lFLN9yArzK"""
chevrolet,1278752769470377985,2020-07-02 18:09:52,"b'@DaveWatts_68 We are sorry to hear that you are experiencing this concern with your infotainment system, David. Whe\xe2\x80\xa6 https://t.co/VhXQHguCXi'"
chevrolet,1278747742643253254,2020-07-02 17:49:54,"b""@Astone112_ We certainly regret to hear you're having concerns with your infotainment system, Drew. Have you bought\xe2\x80\xa6 https://t.co/jin33hCHO2"""
chevrolet,1278729050245099520,2020-07-02 16:35:37,"b'@reeseboiflenex Hi, Reese. GM\xe2\x80\x99s culture is built on an environment that is safe, open and inclusive and we are comm\xe2\x80\xa6 https://t.co/eTpHAB6Vcs'"
chevrolet,1278717786856894464,2020-07-02 15:50:52,"b'@DilipMuthu We would like to learn more about your concerns with your Bolt and best help, Dilip. Please send us a D\xe2\x80\xa6 https://t.co/8fflP5P3Px'"
chevrolet,1278713203493498881,2020-07-02 15:32:39,"b'@Mally_Elizabeth Your candid feedback is valued, Elizabeth. Rest assured, we have documented it accordingly to impr\xe2\x80\xa6 https://t.co/D4lTOLpiKG'"
chevrolet,1278712439916204033,2020-07-02 15:29:37,"b'@ClintEPorter1 Hey, Clint. If you are currently exeriencing a concern with your Traverse, please send us a DM. We a\xe2\x80\xa6 https://t.co/sV8xYikGy4'"
chevrolet,1278709817142439938,2020-07-02 15:19:12,"b""@notJonbutYianni Hi, Yianni. We're sorry to hear about the A/C in your Malibu and would be happy to connect you to\xe2\x80\xa6 https://t.co/IA6rBFWysu"""
chevrolet,1278706342501339137,2020-07-02 15:05:23,"b""@KennyWo48300800 We're sorry to hear of the ongoing concern, Kenny. We'd be happy to assist and provide an addition\xe2\x80\xa6 https://t.co/RiixBKF1um"""
chevrolet,1278704126348558338,2020-07-02 14:56:35,"b""@BigDaddyE9 We're happy to provide you the contact information for your case agent, Albert. For privacy reasons, we\xe2\x80\xa6 https://t.co/pLLgaQmda3"""
chevrolet,1278696277874601985,2020-07-02 14:25:24,"b'@lorne1992 Hey, Lorne. Select mobile app features are still available at no charge with Connected Access, including\xe2\x80\xa6 https://t.co/eHW6Lw1FmA'"
chevrolet,1278691646012485634,2020-07-02 14:07:00,"b'@JovanniJoseph Thanks for the candid feedback, Blanche. Our team will sure to document it for further review.'"
chevrolet,1278689195448430592,2020-07-02 13:57:15,"b'@BigDaddyE9 We apologize for any dissatisfaction, Albert. Please know your case agent is in the best position to di\xe2\x80\xa6 https://t.co/cXU3MCV4DF'"
chevrolet,1278688396542500865,2020-07-02 13:54:05,"b""@WereGeek We understand completely, Deke. We've followed up with your DM at this time, as well. Please check there\xe2\x80\xa6 https://t.co/RgRkCatRgV"""
chevrolet,1278682476072677377,2020-07-02 13:30:33,"b""@pickledtink79 We'd like to learn more about your Silverado and best help, Lindsay. Please send us a DM with some a\xe2\x80\xa6 https://t.co/cz15HkEeLC"""
chevrolet,1278681185074348034,2020-07-02 13:25:25,"b""@WhatYeahOkay We'd like to learn more about your engine concern. Please send us a DM with some details when you get a chance."""
chevrolet,1278671357723635713,2020-07-02 12:46:22,"b""@WereGeek Hi, Deke. Field action letters are sent to the owner that is on file at the state's DMV. If vehicles and\xe2\x80\xa6 https://t.co/NmknsPSqk6"""
chevrolet,1278518240109408256,2020-07-02 02:37:56,"b""@_Ohsea We're sorry to hear you're having concerns with your Camaro, John and would be happy to look into this matt\xe2\x80\xa6 https://t.co/VBQjmO4AMi"""
chevrolet,1278495889510658048,2020-07-02 01:09:08,"b""@BrandyJoy301 We truly regret to hear this, Brandy. We'd be happy to locate other nearby dealerships for you. If th\xe2\x80\xa6 https://t.co/P0Ddsp3dq9"""
chevrolet,1278470990712852481,2020-07-01 23:30:11,b'@TracedInAir Thank you for bringing this situation to our attention. We have replied to your private message and ou\xe2\x80\xa6 https://t.co/ZtdVuW9CJA'
chevrolet,1278469355517300736,2020-07-01 23:23:41,"b""@0REDSOX7 Hello, Daniel. We regret to hear that you're experiencing concerns with your Silverado and we would like\xe2\x80\xa6 https://t.co/CMOy0ufNGx"""
chevrolet,1278415221728501760,2020-07-01 19:48:35,"b'@BigDaddyE9 We value this candid feedback, Al. If you would like to discuss your recent situation in more depth, pl\xe2\x80\xa6 https://t.co/o2V3d3gQq9'"
chevrolet,1278414848208994304,2020-07-01 19:47:06,b'@RethaMajorMama Sounds good. We recently responded to your DM and hope you find a moment to review our message.'
chevrolet,1278414638372098053,2020-07-01 19:46:16,"b'@AdrianSienko Hey there, Adrian. We recommend visiting https://t.co/Aqbu77N5uS. Here you will be able to look up if\xe2\x80\xa6 https://t.co/wyfVuyIYP7'"
chevrolet,1278414525704794112,2020-07-01 19:45:49,"b'@mel_twe Hey, Melissa. We recently responded to your DM. Please review it an follow up with us at your earliest convenience.'"
chevrolet,1278405176005558272,2020-07-01 19:08:40,"b""@RethaMajorMama We'd like to learn more about your headlight concern. Please send us a DM with some additional deta\xe2\x80\xa6 https://t.co/m4esOfC8Zq"""
chevrolet,1278400935778070530,2020-07-01 18:51:49,"b'@mel_twe We apologize if your experience was anything less than satisfactory, Melissa. Allow us to learn more about\xe2\x80\xa6 https://t.co/6Vcl43xMR1'"
chevrolet,1278398888496336896,2020-07-01 18:43:41,"b'@AdamDubbin Hey, Adam. If you are currently experiencing clutch concerns with your Aveo, we kindly ask you send us\xe2\x80\xa6 https://t.co/zoFLbExhP5'"
chevrolet,1278389772394704896,2020-07-01 18:07:27,"b'@regallytay Great choice, Tay. Have you had a chance to see the new 2020 Camaro in person? We are more than willing\xe2\x80\xa6 https://t.co/vCaV1lGlhu'"
chevrolet,1278385510163943425,2020-07-01 17:50:31,"b""@dpalford Thanks for reaching out to our team. We'd be happy to gather more info and look into this further. When y\xe2\x80\xa6 https://t.co/vk2KUsIYqu"""
chevrolet,1278380720625348609,2020-07-01 17:31:29,"b""@BrandyJoy301 We are sorry to hear of your dissatisfaction, Brandy. If you'd like us to locate a dealership located\xe2\x80\xa6 https://t.co/lArY5q0qda"""
chevrolet,1278373555793620993,2020-07-01 17:03:01,"b""@Fasho_tho You're very welcome, Warren. We have recently responded to your message and hope you find a chance to follow up."""
chevrolet,1278371510865014791,2020-07-01 16:54:53,b'The Chevy Open Road Sales Event is here! Get 10-15% of MSRP cash back on select 2020 Chevy models.* https://t.co/4SELRHLMFY'
