chevrolet,1262847277904715776,2020-05-19 20:47:08,"b'@PaulP2534 Hello, Paul. We regret to hear about this situation with your vehicle. Please send us a DM with your VIN\xe2\x80\xa6 https://t.co/IcfW5nTfR0'"
chevrolet,1262826434281627648,2020-05-19 19:24:18,"b'@_ManUtd_fc_ Hey there, Subodh. When you get a chance please send our team a DM so we can gather some additional in\xe2\x80\xa6 https://t.co/nI8LIitrT3'"
chevrolet,1262818924824936448,2020-05-19 18:54:28,"b'@anabeee08 We\xe2\x80\x99re sorry to hear about your disappointing experience, Ana. We strive for excellent customer service,\xe2\x80\xa6 https://t.co/dyeLfHVKTx'"
chevrolet,1262790213044076546,2020-05-19 17:00:22,"b'@therealjohnnyf #BoltEV can take you anywhere. Will you please send us a DM, Johnny?'"
chevrolet,1262771977414049792,2020-05-19 15:47:55,"b'@TripExtra We recently messaged you back in our private messages. Please, at your earliest convenience respond to u\xe2\x80\xa6 https://t.co/5yMhyoKMXZ'"
chevrolet,1262753698251300864,2020-05-19 14:35:17,b'@DogJr2fast4u You are very welcome.'
chevrolet,1262753311775526927,2020-05-19 14:33:45,b'@DogJr2fast4u We are happy to hear that you are enjoying your 2018 Silverado. If you every have any questions or co\xe2\x80\xa6 https://t.co/szLebybI8k'
chevrolet,1262751956923105281,2020-05-19 14:28:21,"b'@grantcoleman12 Great question, Grant. Our team recommends reaching out to your local dealership. They are in the b\xe2\x80\xa6 https://t.co/iQx3ouWzw5'"
chevrolet,1262749959595556864,2020-05-19 14:20:25,"b""@TripExtra We're sorry to hear you want to get rid of your Malibu. If we can be of any assistance in helping you fi\xe2\x80\xa6 https://t.co/tod42yrBFf"""
chevrolet,1262746403987525635,2020-05-19 14:06:18,"b""@DogJr2fast4u We recommend getting these concern addressed by one of our dealerships. Shall you decide you'd like t\xe2\x80\xa6 https://t.co/vGRZIQb6ud"""
chevrolet,1262743028604624897,2020-05-19 13:52:53,b'@DogJr2fast4u We are sorry to hear of this experience. When you get a chance send us a DM with additional details a\xe2\x80\xa6 https://t.co/MCAPF93cNs'
chevrolet,1262740380325298178,2020-05-19 13:42:21,"b""@Halo2Guy We'd be happy to assist you further regarding your Malibu. Just send us a DM with your VIN to get started\xe2\x80\xa6 https://t.co/sFVRSleFHY"""
chevrolet,1262731470864388096,2020-05-19 13:06:57,b'@_notoriousMEISH We truly understand how concerns with your Malibu can be frustrating. Have you brought these conce\xe2\x80\xa6 https://t.co/vLuXAFfcIg'
chevrolet,1262507888926289921,2020-05-18 22:18:31,"b'@Kat29702830 Hello, Kat. We recently responded to your DM. Please review it at your earliest convenience. Thank you!'"
chevrolet,1262480516915146760,2020-05-18 20:29:45,"b'@jrtxfreedom @GM This is certainly not what we like to hear. When you have a moment, please share more details abou\xe2\x80\xa6 https://t.co/8BykvJwH6S'"
chevrolet,1262471142079520768,2020-05-18 19:52:30,b'@dre49615142 Hello. Please know that our team works alongside Mary to ensure that situations such as yours are addr\xe2\x80\xa6 https://t.co/e552WcOKbd'
chevrolet,1262448540468613122,2020-05-18 18:22:41,b'RT @GMFleet: It\xe2\x80\x99s our honor to help the people that #protect and serve our communities. The 2021 @chevrolet Tahoe PPV design was inspired b\xe2\x80\xa6'
chevrolet,1262442969996525568,2020-05-18 18:00:33,b'@KeeblerKC Hello. We recently followed up with you by DM. Please continue to work with us there for your concerns.'
chevrolet,1262419077990977538,2020-05-18 16:25:37,b'@kingoshea01 We are more than happy to provide you support while you work with your dealership. Just send us a DM w\xe2\x80\xa6 https://t.co/2nlx91qMEx'
chevrolet,1262405825697476611,2020-05-18 15:32:57,"b""@made_supreme We're glad to know you are interested, Cannon. With that in mind, we will be happy to get you connect\xe2\x80\xa6 https://t.co/bIOY8UmEI3"""
chevrolet,1262393599930568704,2020-05-18 14:44:23,"b'@ALevy914 Hey, Allen. We are more than happy to learn more about your situation. When you have a moment, please sen\xe2\x80\xa6 https://t.co/uACQxXKOG2'"
chevrolet,1262384908296691717,2020-05-18 14:09:50,"b'@KeltingCharlie Hey, Charlie. We just followed up with you via DM. Please check there when you have a moment. https://t.co/uXlRBs3zUl'"
chevrolet,1262381976536915969,2020-05-18 13:58:11,"b""@robyn_dileone @GM We're sorry to hear of the frustration with your A/C, Robyn. Please send us a DM with additional\xe2\x80\xa6 https://t.co/5ytZ1ngtoR"""
chevrolet,1262381199391166469,2020-05-18 13:55:06,"b""At Chevy, we're committed to getting you on the open road with confidence. https://t.co/wTKSP0eVv4 https://t.co/2vwSIquL1X"""
chevrolet,1262375255491743744,2020-05-18 13:31:29,"b""@happygunner1 We're glad to hear of your interest in a new Silverado, Michael. With that in mind, we will be happy\xe2\x80\xa6 https://t.co/8PpmJ1O9O6"""
chevrolet,1262373805193752577,2020-05-18 13:25:43,"b""@KeeblerKC Thanks for reaching out. We're happy to confirm if you have any open recalls on your vehicle. When you h\xe2\x80\xa6 https://t.co/Ms3S3AwQ1f"""
chevrolet,1262111768362364928,2020-05-17 20:04:29,"b'@xllnda The Blazer is truly ready for you and your family, Linda. Have you been able to take one for a test drive?\xe2\x80\xa6 https://t.co/GP2pgJJPcg'"
chevrolet,1262027622709510144,2020-05-17 14:30:07,"b'@chancecline24 Chance, please know, this is not the vehicle ownership experience we want you to have. With that sai\xe2\x80\xa6 https://t.co/PCmIBK3Ia4'"
chevrolet,1262025826834378752,2020-05-17 14:22:59,"b""@ScottTower31 We're sorry to hear of your recent accident, Scott. Please know, our team will be happy to get you co\xe2\x80\xa6 https://t.co/xF0Z0JWQBh"""
chevrolet,1262025494880382977,2020-05-17 14:21:39,"b'@toddsextonDO Our team would like to learn more about your concerns and best help, Todd. Please send us a DM with s\xe2\x80\xa6 https://t.co/Xv9Jh89vkS'"
chevrolet,1261637600021897218,2020-05-16 12:40:18,"b""@Cerenaphor We're glad to hear of your interest. Please feel free to send us a DM should you have any questions. We\xe2\x80\xa6 https://t.co/CL3z8FV0de"""
chevrolet,1261512190659424256,2020-05-16 04:21:58,"b'@x_xluckyme Thank you for your interest. If you should have any questions, please feel free to send us a DM. We are always happy to help.'"
chevrolet,1261475076790091776,2020-05-16 01:54:30,"b'@Kat29702830 We appreciate the clarification, Kat and would be happy to look into this matter further. Send us a DM\xe2\x80\xa6 https://t.co/9dTEZjp6jY'"
chevrolet,1261426926033362944,2020-05-15 22:43:10,"b""@TheDryHeat115 @ConservativeJi1 We're sorry to hear you're experiencing HVAC concerns with your vehicle, Jim and wo\xe2\x80\xa6 https://t.co/Wn2QnfIopk"""
chevrolet,1261406006568865792,2020-05-15 21:20:02,"b""@mma21881 Hello. We'd be happy to look into this recall further for you. At your earliest convenience, please see o\xe2\x80\xa6 https://t.co/BKjea8Ouj1"""
chevrolet,1261392695924154368,2020-05-15 20:27:08,"b""@AmaguinPaul Hi, Paul. We've responded to you via DM."""
chevrolet,1261385473504628736,2020-05-15 19:58:26,"b'@ohthatssb We are sorry to hear that you have been experiencing concerns with your Cruze. To clarify, do you have a\xe2\x80\xa6 https://t.co/KqsCQp31ik'"
chevrolet,1261341136880369664,2020-05-15 17:02:16,"b'.@djenvy, along with others, hosted a virtual DJ-athon to collect money for DJs who are unable to work while venues\xe2\x80\xa6 https://t.co/vPDrqTmGV4'"
chevrolet,1261333709526953984,2020-05-15 16:32:45,"b""@AmaguinPaul We are sorry to hear that you are experiencing concerns with your AC condenser, Paul. We'd love to wor\xe2\x80\xa6 https://t.co/kUFZPnTmdh"""
chevrolet,1261332756828532736,2020-05-15 16:28:58,"b'@PedotoSot25 This is certainly not what we like to read about, Scott. Although Chevrolet dealerships are independen\xe2\x80\xa6 https://t.co/5akr9EZylv'"
chevrolet,1261324912012038144,2020-05-15 15:57:47,"b'@kingmanj117 This sounds like a wonderful idea. If you need help locating one of our certified dealerships, we are only a DM away.'"
chevrolet,1261308565781790725,2020-05-15 14:52:50,"b'@Kat29702830 We are sorry to hear this, Kat. Are you currently experiencing concerns with your vehicle? Our team wo\xe2\x80\xa6 https://t.co/ggpJ8YJiV3'"
chevrolet,1261305501834342400,2020-05-15 14:40:40,"b""@TheDryHeat115 @____KCP____ This isn't what we like to hear. If you send us a DM with additional details on your SS\xe2\x80\xa6 https://t.co/HYfKxfqUcG"""
chevrolet,1261300145116737536,2020-05-15 14:19:23,"b""@JohnOTJungle Let us know if you need any assistance during the repair process, John. We're here to help. https://t.co/uXlRBslaLT"""
chevrolet,1261299868636598272,2020-05-15 14:18:17,"b'@TheDryHeat115 @johninphx Happy to help, John. Send us a DM with additional information and we can look into things\xe2\x80\xa6 https://t.co/uzhif1zmI6'"
chevrolet,1261299584476655618,2020-05-15 14:17:09,"b""@NeverSchwag We're sorry to hear of the frustration with your Trax. So that we can look into things further on our\xe2\x80\xa6 https://t.co/0zN5PXvrmc"""
chevrolet,1261297870289997824,2020-05-15 14:10:20,b'Enjoy everything the all-new mid-engine #Corvette has to offer without leaving your house. https://t.co/bh3SW86qjF https://t.co/fMd2gr1enY'
chevrolet,1261284838637596672,2020-05-15 13:18:33,b'@PSanca1237 We are saddened to hear of your frustration. Our team would like to look into your situation a bit furt\xe2\x80\xa6 https://t.co/8ITtrIhtDJ'
chevrolet,1261283186153099269,2020-05-15 13:11:59,"b""@R_Caroline23 We\xe2\x80\x99re happy you're looking into purchasing a Blazer, Rachel. You may find prices and current deals at\xe2\x80\xa6 https://t.co/u1kIeL9jFJ"""
chevrolet,1261273737342541826,2020-05-15 12:34:26,"b'@MikeRadford6 Hi, Mike. We\xe2\x80\x99re so sorry to hear you\xe2\x80\x99ve been experiencing concerns with your Traverse catalytic conve\xe2\x80\xa6 https://t.co/5QP6Y32X62'"
chevrolet,1261273090647977984,2020-05-15 12:31:52,b'@TheDryHeat115 We regret to hear you\xe2\x80\x99re having problems in your Camaro. We\xe2\x80\x99d like to look into your concerns furthe\xe2\x80\xa6 https://t.co/OPRrsBs0iG'
chevrolet,1261267370355552258,2020-05-15 12:09:08,b'@RSBH247 We apologize to read of your sentiments based on these current circumstances. Chevrolet relies heavily on\xe2\x80\xa6 https://t.co/YRKw57lHPM'
chevrolet,1261254440234831872,2020-05-15 11:17:46,"b""@abhilehal We're glad to hear of your interest in a Silverado. Please feel free to send us a private message should\xe2\x80\xa6 https://t.co/laZDIihp7M"""
chevrolet,1261162992600662017,2020-05-15 05:14:23,b'@nicolee_here88 Thank you you for your interest. Please feel free to send us a DM should you have any questions. We\xe2\x80\xa6 https://t.co/hKWmxj5jtZ'
chevrolet,1261154527484338176,2020-05-15 04:40:45,b'@tiaija_donia Thank you for your interest. Please feel free to send us a DM should you have any questions. We are always happy to help.'
chevrolet,1261134915199832064,2020-05-15 03:22:49,"b'@msejnoha Hello, Mick. 300,000 miles is an awesome milestone. We want to thank you for your loyalty to our brand ov\xe2\x80\xa6 https://t.co/DQ53vmpkns'"
chevrolet,1261080426677825536,2020-05-14 23:46:18,"b""@TimG_3x We appreciate the honest feedback, Tim and would be happy to look further into any vehicle concerns you're\xe2\x80\xa6 https://t.co/BsKRRGK1dr"""
chevrolet,1261034565939761152,2020-05-14 20:44:04,"b""@daninjacquay We regret to hear you're currently experiencing this concern with your vehicle and would be happy to\xe2\x80\xa6 https://t.co/V0wiSXqbzD"""
chevrolet,1261023745528877056,2020-05-14 20:01:04,"b'@michaellgoodwin Hey, Michael. Our team would be happy to locate another dealership in your area. Then you can expl\xe2\x80\xa6 https://t.co/9TPi89yCK3'"
chevrolet,1261016214572130304,2020-05-14 19:31:08,"b'@Divalectable No problem at all, Monti.'"
chevrolet,1261008285852827648,2020-05-14 18:59:38,"b'@Divalectable Hey, Monti. Have you had the chance to visit one of our certified GM dealerships? They would be a hel\xe2\x80\xa6 https://t.co/jYGs5racOV'"
chevrolet,1260997428309708802,2020-05-14 18:16:29,"b""@FiercestFinest We'd be happy to provide an additional layer of support while working with your preferred dealer. J\xe2\x80\xa6 https://t.co/qUWMMVGqoh"""
chevrolet,1260987906178428928,2020-05-14 17:38:39,"b""@FiercestFinest We'd be happy to locate some Chevrolet dealers to service your Impala. Send us a DM with your zip c\xe2\x80\xa6 https://t.co/Ms20gUAspX"""
chevrolet,1260975243692142598,2020-05-14 16:48:20,"b'@edwinXOcrisanto We appreciate you following back up with us, Edwin. Have a great rest of your day.'"
chevrolet,1260963283760107521,2020-05-14 16:00:49,"b""@great_again2 We'd like to learn more about your concerns with your Colorado, Jason. Please send us a DM with some\xe2\x80\xa6 https://t.co/Azpsu45O26"""
chevrolet,1260942645234286596,2020-05-14 14:38:48,"b""@brujitosfr We're certainly sorry to hear that, Mikoko. We'd like to learn more about your experience. Please send\xe2\x80\xa6 https://t.co/ClfmtKexjU"""
chevrolet,1260938828367278080,2020-05-14 14:23:38,b'@yzitam We are sorry to hear these sentiments. Our team would be happy to connect you with your dealerships to get\xe2\x80\xa6 https://t.co/x7G0ygV0cE'
chevrolet,1260933497453076480,2020-05-14 14:02:27,b'Your Chevy Clean dealers commit to using enhanced vehicle cleaning measures with CDC-approved cleansers. https://t.co/cdPjJOneyE'
chevrolet,1260910231439020037,2020-05-14 12:30:00,"b'@THEmrsGinsburg Wilma, we will be happy to reach out to your involved dealer and gather further details regarding y\xe2\x80\xa6 https://t.co/FUV4ndQU4q'"
chevrolet,1260894218949505024,2020-05-14 11:26:22,"b'@haleyjaase Haley, we have just responded to your DM. Please take a look when you get a chance.'"
chevrolet,1260884511157436419,2020-05-14 10:47:48,"b'@haleyjaase This is certainly not what we like to hear, Haley. So our team may best assist, we kindly ask you to se\xe2\x80\xa6 https://t.co/cBCcahPH4P'"
chevrolet,1260853989190455296,2020-05-14 08:46:31,"b'@_bbrirose Thank you for your interest, Bri. If you have any questions, please feel free to send us a DM. We are more than happy to help.'"
chevrolet,1260748271292575744,2020-05-14 01:46:26,"b""@PedotoSot25 We're sorry to hear of your sentiments, Scott and would be happy to look further into this matter. Sen\xe2\x80\xa6 https://t.co/eFOMAbF9LB"""
chevrolet,1260657444293709824,2020-05-13 19:45:31,"b""@OnMyChefSkillz Hello there. We'd be happy to assist you. To get started, just send us a DM with your Malibu's VIN.\xe2\x80\xa6 https://t.co/TVAPoY0677"""
chevrolet,1260627813423386624,2020-05-13 17:47:46,"b""@DunkinNDiamonds We'd love to continue this conversation and learn more about your Camaro, Picasso. Please send us\xe2\x80\xa6 https://t.co/ebRBGjeLNo"""
chevrolet,1260609219570487296,2020-05-13 16:33:53,b'@Lizzyyyannn The 2020 Chevrolet Blazer is as capable as it is elegant. What about the Blazer intrigues you?'
chevrolet,1260596962132295681,2020-05-13 15:45:11,"b""@fINEASSlAlA93 Our pleasure. Should you need any assistance, please don't hesitate to DM us. Our messages are always open."""
chevrolet,1260595941540687877,2020-05-13 15:41:07,"b""@fINEASSlAlA93 We're sorry to hear that your key is broken. If we could be of any assistance in helping you replace\xe2\x80\xa6 https://t.co/UVV5WeqnGC"""
chevrolet,1260595131775762433,2020-05-13 15:37:54,"b""@rednblackblood We regret to hear you're experiencing concerns with your Silverado, Kurt. Have you brought this to\xe2\x80\xa6 https://t.co/Humwr3JLIQ"""
chevrolet,1260570621743857664,2020-05-13 14:00:31,"b'Chevy Safety Assist, our suite of advanced safety features standard on every 2020 #ChevyEquinox, is built to help y\xe2\x80\xa6 https://t.co/QrDiD9izUC'"
chevrolet,1260568691835432960,2020-05-13 13:52:51,"b'@TMLKowal Michelle, please continue our conversation via DM so we can assist appropriately. Our team appreciates your feedback and patience.'"
chevrolet,1260559118080733185,2020-05-13 13:14:48,"b'@edwinXOcrisanto Hey, Edwin. To clarify, are you currently experiencing concerns with your Camaro? If so, our team\xe2\x80\xa6 https://t.co/T7J523F77j'"
chevrolet,1260554771921920001,2020-05-13 12:57:32,"b""@gummygabriela Hi, Gabriela. We're so sorry that this was your experience when visiting a Chevrolet dealership. Can\xe2\x80\xa6 https://t.co/Sne8tGulhZ"""
chevrolet,1260518436687343617,2020-05-13 10:33:09,"b'@TMLKowal Hello, Michelle. Our team is committed to assisting our customers during this time. We have followed up w\xe2\x80\xa6 https://t.co/Lohy38qKSG'"
chevrolet,1260517703455891457,2020-05-13 10:30:14,"b""@TMLKowal We're sorry to hear about your continued dissatisfaction, Michelle. Our team has followed up with you via\xe2\x80\xa6 https://t.co/By6PUTCwN6"""
chevrolet,1260481311669616640,2020-05-13 08:05:37,"b'@Chelson1956 Thank you for reaching out regarding this, Chelson. Please know, the health and safety of our employee\xe2\x80\xa6 https://t.co/R1hYxYEfL1'"
chevrolet,1260433308451844105,2020-05-13 04:54:53,"b'@DylanBaker61 Thank you for your interest, Dylan. If you have any questions, please feel free to send us a DM. We are always happy to help.'"
chevrolet,1260433145696059394,2020-05-13 04:54:14,"b'@nicoleerachell Thank you for your interest, Nicole. If you have any questions, please feel free to send us a DM. W\xe2\x80\xa6 https://t.co/mO0pSOvEyy'"
chevrolet,1260432607189307400,2020-05-13 04:52:05,"b'@LeeBoldenn Thank you for your interest, Lee. If you have any questions, please feel free to send us a DM. We are always happy to help.'"
chevrolet,1260432323138457604,2020-05-13 04:50:58,"b'@xcatherineex Thank you for your interest, Catherine. If you have any questions, please feel free to send us a DM.\xe2\x80\xa6 https://t.co/3UOuFiwDW2'"
chevrolet,1260411752665108480,2020-05-13 03:29:13,"b'@Thiago16863009 We certainly regret to hear of these sentiments, Thiago and would be happy to look into this matter\xe2\x80\xa6 https://t.co/Ji7s1QHsL6'"
chevrolet,1260404753462251520,2020-05-13 03:01:25,b'@Chelson1956 Please feel free to send our team a DM with additional details of your experience. https://t.co/uXlRBslaLT'
chevrolet,1260395637926813696,2020-05-13 02:25:11,b'@polynesianp21 Thank you for considering the Camaro for your next vehicle! Have you had the chance to come see one\xe2\x80\xa6 https://t.co/uVafiKdorY'
chevrolet,1260327435813351429,2020-05-12 21:54:11,"b""@daninjacquay We're sorry to hear of any inconvenience this matter has caused, Danin and would be happy to discuss\xe2\x80\xa6 https://t.co/2BKpW1JFLa"""
chevrolet,1260304118813306880,2020-05-12 20:21:31,"b""@jus_bou Hi, Justin. We regret to hear about this situation with your Equinox's transmisson and apologize for the f\xe2\x80\xa6 https://t.co/SzcKLn3xlv"""
chevrolet,1260290671354601472,2020-05-12 19:28:05,b'@skrimpsfeed We are sorry to hear of your paint concern. Have you had the chance to bring this to the attention of your dealership?'
chevrolet,1260284825690206209,2020-05-12 19:04:52,"b'@Seb1879 Hello, Sebastian. Our team has responded to your DM.'"
chevrolet,1260278002845278210,2020-05-12 18:37:45,b'@JetLife_CL6 We are thrilled to hear that Rudolph Chevrolet was able to assist you. Have a great rest of your day.'
chevrolet,1260277471624060928,2020-05-12 18:35:38,"b'@SyeWorks Sye, thank you for bringing this situation to our attention. Your safety and the safety of your passenger\xe2\x80\xa6 https://t.co/ayvVgRsWwK'"
chevrolet,1260258884742074368,2020-05-12 17:21:47,"b'@smf72 This is music to our ears, Sam. Please know our team is always here to assist anyway that we can.'"
chevrolet,1260257005903597568,2020-05-12 17:14:19,b'@SNAFU183 Great question. You can send an email to socialmedia@gm.com containing your full contact info and the VIN\xe2\x80\xa6 https://t.co/zI9DthGXAf'
chevrolet,1260251574951018497,2020-05-12 16:52:44,"b'@JetLife_CL6 We are sorry to here this. To clarify, is it in with one of our certified GM dealership? If so, our te\xe2\x80\xa6 https://t.co/emIH3ooSVG'"
chevrolet,1260249254737571840,2020-05-12 16:43:31,"b""@iBowhunt24 Hi, Evan. Please know that special coverages are always VIN-specific. With that said, we'd be happy to\xe2\x80\xa6 https://t.co/J9mrXLG2cC"""
chevrolet,1260233513426534406,2020-05-12 15:40:58,"b'@church_apostle When you get a chance, Eric, please review the private message we have sent you. We would like to c\xe2\x80\xa6 https://t.co/p2YNSvW42h'"
chevrolet,1260232974512971777,2020-05-12 15:38:49,"b'@mikemanza98 This is not what we like to hear, Mike. Please send us a DM so we can further assist you with your tra\xe2\x80\xa6 https://t.co/fzpGlCN2hE'"
chevrolet,1260226444728299521,2020-05-12 15:12:52,"b'@tabithataylor__ We are sorry to hear of this concern, Tabitha. Are you still stuck on the highway? Have you reache\xe2\x80\xa6 https://t.co/X7zFgJvymd'"
chevrolet,1260216662566961152,2020-05-12 14:34:00,"b'@lorenaaavz We regret to hear you are experiencing concerns with your Malibu, Lorena. With that said, our team will\xe2\x80\xa6 https://t.co/ach3qAXhb3'"
chevrolet,1260213534211764231,2020-05-12 14:21:34,"b'@TuesdayRae11 We are sorry to hear that you are experiencing concerns with your infotainment screen, Rae. Have you\xe2\x80\xa6 https://t.co/4yQJGj0Ojf'"
chevrolet,1260204593914376195,2020-05-12 13:46:03,"b'@TMLKowal We understand your frustration, Michelle. Please send our team a DM when you can so that we can gather so\xe2\x80\xa6 https://t.co/YIUirCe9Bl'"
chevrolet,1260204160282050561,2020-05-12 13:44:19,"b'@nathan__greer That is awesome, Nathan. Please let us know if we can be of any assistance. Don\xe2\x80\x99t hesitate to DM us.\xe2\x80\xa6 https://t.co/4qDFirUbtY'"
chevrolet,1260186660043546625,2020-05-12 12:34:47,"b""@1RichBitxh We understand how important this is, Ki. Send us a DM and we'd be happy to provide an additional layer\xe2\x80\xa6 https://t.co/3YvZOTPBdl"""
chevrolet,1260183174530781184,2020-05-12 12:20:56,"b""@sKILLz3272 We're sorry to hear of the dissatisfaction, Bryce. Please send us a DM and we'd be happy to look into t\xe2\x80\xa6 https://t.co/KXu6v8bUtV"""
chevrolet,1260014970260996097,2020-05-12 01:12:33,b'@jesse48676371 We are sorry to hear of your frustrations as this is not the type of experience we want our customer\xe2\x80\xa6 https://t.co/64v1EPqaDB'
chevrolet,1259978786545627142,2020-05-11 22:48:46,"b'@OddessyyNashhh We understand, Oddessyy. Please know, our team is here to assist you in scheduling an appointment f\xe2\x80\xa6 https://t.co/C4U1Ocyb9X'"
chevrolet,1259967655093530624,2020-05-11 22:04:32,"b""@BrendenWhiteIey We appreciate the clarity and certainly respect your position. Please don't hesitate to send us a\xe2\x80\xa6 https://t.co/HCVO7pm9eA"""
chevrolet,1259966636859092993,2020-05-11 22:00:29,"b""@Drewt008 We're sorry to hear you're experiencing concerns with your lease and would be happy to look into this mat\xe2\x80\xa6 https://t.co/6ClHGxOqsC"""
chevrolet,1259962983230222336,2020-05-11 21:45:58,"b'@BrendenWhiteIey We love to hear of your passion for the Corvette, Brenden and would be happy to help locate the ve\xe2\x80\xa6 https://t.co/HmFLmketZh'"
chevrolet,1259961316137033728,2020-05-11 21:39:21,"b""@JWooTV We're sorry to hear about the ticking noise concern you're experiencing with your vehicle. Please feel free\xe2\x80\xa6 https://t.co/mPz8KQ5vq0"""
chevrolet,1259943015113568257,2020-05-11 20:26:38,"b'@jesse48676371 Rest assure, Jesse, we have real advisors ready to assist our customers 24 hours a day, 7 days a wee\xe2\x80\xa6 https://t.co/u9EHrcqaaE'"
chevrolet,1259941173327613952,2020-05-11 20:19:18,"b'@jesse48676371 We truly regret to hear these sentiments, Jesse. Should you ever like our assistance in the future,\xe2\x80\xa6 https://t.co/glatZeV4DE'"
chevrolet,1259932417323720704,2020-05-11 19:44:31,"b""@church_apostle Our customer's safety is our top priority. When you have a moment, please share more details about\xe2\x80\xa6 https://t.co/m3Oj1cgZxT"""
chevrolet,1259923261372026880,2020-05-11 19:08:08,"b'@AllisonMend This is definitely not what we like to hear from our loyal customers, Allison. Please DM us so we can\xe2\x80\xa6 https://t.co/Bx7IwMZSWa'"
chevrolet,1259914255047864321,2020-05-11 18:32:21,"b""@ChiaraYoung2 Hi, Chiara. We're sorry to hear you're experiencing concerns with your car and we'd be happy to look\xe2\x80\xa6 https://t.co/Bm6le8vBp7"""
chevrolet,1259914185153998850,2020-05-11 18:32:04,"b'@jesse48676371 Hi, Jesse. Have you brought your vehicle concerns to the attention of your dealership? We are more t\xe2\x80\xa6 https://t.co/MVjGL7VX9Q'"
chevrolet,1259910232613875712,2020-05-11 18:16:22,"b'@UlchraKyle We are unable to guarantee a specific outcome, Kyle but are more than willing to review any options to\xe2\x80\xa6 https://t.co/HKQc3Iz6B3'"
chevrolet,1259909615854055430,2020-05-11 18:13:55,"b'@UlchraKyle We appreicate your candid feedback, Kyle. Rest assured we have documented it accordingly. Should you li\xe2\x80\xa6 https://t.co/nCmpLVStzd'"
chevrolet,1259904382574800897,2020-05-11 17:53:07,"b""@RickyR51_ Hey, Ricky. We'd be happy to provide an additional layer of support through the repair process. Send us\xe2\x80\xa6 https://t.co/OLGTgiP92k"""
chevrolet,1259894733637222401,2020-05-11 17:14:46,"b'@pharmoto We are delighted to hear of your interest in purchasing a new Bolt. With that in mind, we will be happy t\xe2\x80\xa6 https://t.co/XPIjiVvGdP'"
chevrolet,1259892590993747968,2020-05-11 17:06:16,"b'@missniyyy Niy, we will be happy to get you connected with your Chevy dealer to further discuss your interest in pu\xe2\x80\xa6 https://t.co/ddjScOPyQT'"
