chevrolet,1242471359407517698,2020-03-24 15:20:30,"b'@MattWeeks1995 Hi, Matt. Our team will be happy to get you into your local Chevy dealer to have your Corvette inspe\xe2\x80\xa6 https://t.co/l6Aez2kbSF'"
chevrolet,1242458432147345408,2020-03-24 14:29:08,"b'@MayemSnyph We know that these are uncertain and challenging times, and your vehicle should be the least of your wo\xe2\x80\xa6 https://t.co/GvGUTpmNlR'"
chevrolet,1242448223974887424,2020-03-24 13:48:34,"b'@adanielle96 Awesome choice, Ashley. Have you seen the all-new Blazer? We\xe2\x80\x99d be happy to assist with setting you up\xe2\x80\xa6 https://t.co/56d0jf5eSA'"
chevrolet,1242445723330732032,2020-03-24 13:38:38,"b'@ArmstrongsShop We know that these are uncertain times, and your vehicle should be the least of your worries. That\xe2\x80\x99\xe2\x80\xa6 https://t.co/N9ZOqc06Xh'"
chevrolet,1242439708967178242,2020-03-24 13:14:44,"b'@PoliticalMojo_ MJ, your safety and the safety of your passengers is of upmost importance to us. Our team would lik\xe2\x80\xa6 https://t.co/VLx42oknYd'"
chevrolet,1242372063723016192,2020-03-24 08:45:56,"b'@MattMadrid10 If you have any questions at this time, Matt, or need any help finding the right Chevrolet vehicle fo\xe2\x80\xa6 https://t.co/hmRNz5tfre'"
chevrolet,1242265399959244800,2020-03-24 01:42:06,"b'@GainesvilleKid When you have a moment, please send us a  DM with additional details to your concern. So that we ca\xe2\x80\xa6 https://t.co/CGM2zyUnJM'"
chevrolet,1242254519813017602,2020-03-24 00:58:52,"b'@puppy_mum We certainly understand your position, Colleen and would be more than happy to look further into any veh\xe2\x80\xa6 https://t.co/qyrUmauhss'"
chevrolet,1242240751494295552,2020-03-24 00:04:09,"b'@EOD_K9 Thank you for reaching out, Jason. For this type of situation, we do recommend speaking with your local Che\xe2\x80\xa6 https://t.co/O1gsMPIj6j'"
chevrolet,1242233382248972288,2020-03-23 23:34:52,"b""@troyglidden Unfortunately, we're unable to speculate on Carfax reports, but would like the opportunity to look int\xe2\x80\xa6 https://t.co/NAobvEfbim"""
chevrolet,1242209853734445056,2020-03-23 22:01:22,"b""@JonathanTaleric Hi, Johnathan. We\xe2\x80\x99re happy to hear of your enthusiasm, we're equally excited. We are unable to pro\xe2\x80\xa6 https://t.co/RC7JjrHn2I"""
chevrolet,1242195993572999168,2020-03-23 21:06:18,"b'@dwt135 We definitely understand how inconvenient this must be. Can you please DM us your contact info, VIN, prefer\xe2\x80\xa6 https://t.co/7E3rBEhQ7e'"
chevrolet,1242195197594726400,2020-03-23 21:03:08,"b""@PhxLexCO Hi, Alexis.\xc2\xa0We are sorry to see your service experience hasn't met your expectations. Please feel free to\xe2\x80\xa6 https://t.co/qxvKKe2i2F"""
chevrolet,1242189590003249152,2020-03-23 20:40:51,"b""@eddiehaskell50 Hi, Eddie. We're sorry to hear about this situation with your vehicle's HVAC system. Please send us\xe2\x80\xa6 https://t.co/4lxIckKFMt"""
chevrolet,1242184485585600512,2020-03-23 20:20:34,b'@SketchedAll Chevrolet is responding to the rapidly changing COVID-19 situation with health and safety as our prior\xe2\x80\xa6 https://t.co/8lQFXI7Ae6'
chevrolet,1242149473347747840,2020-03-23 18:01:27,"b'@jcbusta07 Hey, Juan. We\xe2\x80\x99re sorry you\xe2\x80\x99ve run into concerns with your Equinox. So we can look into this, please DM u\xe2\x80\xa6 https://t.co/vuz0Jdmynu'"
chevrolet,1242137784292270081,2020-03-23 17:15:00,"b""@PabloRo27300558 Hey, Pablo. We're sorry to hear of the concerns with your A/C and would be happy to look into thin\xe2\x80\xa6 https://t.co/ge9HHtpxPy"""
chevrolet,1242120205293113344,2020-03-23 16:05:09,"b'@HeavenlysMommie Hi, Cheri. Please know, the safety of you and your daughter is extremely important to us. Please s\xe2\x80\xa6 https://t.co/3YhAwtnFDJ'"
chevrolet,1242101334595141633,2020-03-23 14:50:09,"b""@EH72880889 Hi there. We're sorry to hear about your repeated vehicle concerns. Please send us a DM with more detai\xe2\x80\xa6 https://t.co/amW4ybtnuj"""
chevrolet,1242091484255416320,2020-03-23 14:11:01,b'@1CryptoPodcast We will be happy to assist with any current vehicle concerns you are experiencing. Please DM us wit\xe2\x80\xa6 https://t.co/bilpXDkb7L'
chevrolet,1242090359963803648,2020-03-23 14:06:33,"b'@_iAmTimmy Hi, Timmy. If you are interested in purchasing a Camaro, we will be happy to get you into your local Che\xe2\x80\xa6 https://t.co/vafpswzoDS'"
chevrolet,1242086307196596225,2020-03-23 13:50:27,"b""@awkward_daily We're sorry to hear of the ongoing frustration with your paint. While we're unable to guarantee any\xe2\x80\xa6 https://t.co/2xUcuNhfOz"""
chevrolet,1242086006007812096,2020-03-23 13:49:15,"b""@shecycles1 Hi, Mary. If there is anything we can assist you with, please don't hesitate to send us a DM. https://t.co/uXlRBslaLT"""
chevrolet,1242084111625248768,2020-03-23 13:41:43,"b'@Beerus69420 This is never something we like to hear, Beerus. Our team would like to look into this further for you\xe2\x80\xa6 https://t.co/rlMJlNccQJ'"
chevrolet,1242077033569505281,2020-03-23 13:13:36,"b""@bdweis We're sorry about this, Barry. To change your mailing preferences, please visit https://t.co/yOOj5fi1UR. Pl\xe2\x80\xa6 https://t.co/bnXllPBDKv"""
chevrolet,1242048612160303104,2020-03-23 11:20:39,"b'@BrookieNightly Please send our team a DM with additional details, Brooklyn, so we have the chance to learn more ab\xe2\x80\xa6 https://t.co/RnGCmZr5MA'"
chevrolet,1242043306860662784,2020-03-23 10:59:35,b'@La_Vane_Guey So that our team has the chance to learn more about your current situation and concerns and best assi\xe2\x80\xa6 https://t.co/0kY1I6INW4'
chevrolet,1241671834799460352,2020-03-22 10:23:29,"b""@cubs1717 Hey, John. We'd be happy to help with this. Is there any specific vehicle model you were looking for? Ple\xe2\x80\xa6 https://t.co/Hdg1pepN4b"""
chevrolet,1241388081556709378,2020-03-21 15:35:57,b'RT @GM: We are working with Ventec Life Systems to rapidly scale production of important respiratory products to support the fight against\xe2\x80\xa6'
chevrolet,1241149480985964544,2020-03-20 23:47:50,"b'@TightOff Thanks for showing interest in the new Spark. Our incentives change frequently, so we recommend discussin\xe2\x80\xa6 https://t.co/PcMFe60BB9'"
chevrolet,1241128171837075456,2020-03-20 22:23:09,b'@bwillcole2 Thank you for bringing this to our attention. We apologize to hear of your frustrations as this is not\xe2\x80\xa6 https://t.co/vKkjbufESG'
chevrolet,1241076616962248704,2020-03-20 18:58:18,"b""@sanjay62884739 Hey, Sanjay. We're sorry to hear of the dissatisfaction with your maintenance and would be happy to\xe2\x80\xa6 https://t.co/sgbj0ZKb3e"""
chevrolet,1241075289142071296,2020-03-20 18:53:01,"b'@Phil72637 Thanks for reaching out and sharing your thoughts, Phil. Chevrolet is dedicated to improving the product\xe2\x80\xa6 https://t.co/5IX9rvy3X8'"
chevrolet,1241057180893114375,2020-03-20 17:41:04,b'@SharkeyShyster We\xe2\x80\x99re very sorry to see that this situation with your ignition has caused you to question your trus\xe2\x80\xa6 https://t.co/wUvyej7hnZ'
chevrolet,1241041152976941058,2020-03-20 16:37:22,b'@RussRogers1 We are sad to hear that this has been your experience. Our team would like to look into this further a\xe2\x80\xa6 https://t.co/RyUEffoQVa'
chevrolet,1241040026659483649,2020-03-20 16:32:54,"b""@Taylorrob28Rob Thanks, Rob. We've followed up with you via DM. Please check there when you have a moment. https://t.co/uXlRBslaLT"""
chevrolet,1241033583961067521,2020-03-20 16:07:18,"b""@Elmnator We're sorry to hear of the delay and do apologize for your frustration. Please send us a DM with addition\xe2\x80\xa6 https://t.co/edSe14r2qB"""
chevrolet,1241023493837180928,2020-03-20 15:27:12,"b""@Nebraskaner Hi, Dean. We're sorry to hear you're experiencing concerns with your battery and would be happy to con\xe2\x80\xa6 https://t.co/ie3DkpQwtm"""
chevrolet,1241020555421048833,2020-03-20 15:15:32,"b""@martinshawn64 Hi, Shawn. We're so sorry to hear of this situation and would like the opportunity to learn more as\xe2\x80\xa6 https://t.co/b9exfXZWdB"""
chevrolet,1241019116363776003,2020-03-20 15:09:49,"b'@Kimberly5179 We are sorry to hear that this has been your experience, Kimberly. Our team would like to look into y\xe2\x80\xa6 https://t.co/Fa6GAi8RAP'"
chevrolet,1241007663535677442,2020-03-20 14:24:18,"b""@lancegregmason We're sorry to read of your sentiments, Lance. Please know that we're here anytime you have questio\xe2\x80\xa6 https://t.co/4bHrVboJNs"""
chevrolet,1241004264278740992,2020-03-20 14:10:48,"b""@MARCD78078667 Hey, Marc. Seating up to 9, the 2020 Tahoe has a starting MSRP of $49,000. Keep in mind, this doesn'\xe2\x80\xa6 https://t.co/OcNkMOPz7f"""
chevrolet,1241003579478953986,2020-03-20 14:08:04,"b'@spaztastic999 We are sorry to hear that you are unsatisfied, Luke. When you get a chance, please send us a DM so w\xe2\x80\xa6 https://t.co/h4FN49Fs2r'"
chevrolet,1240999054642839553,2020-03-20 13:50:05,"b""@lrmortensen We're sorry to hear of this situation and would be happy to look into things further on our end. Pleas\xe2\x80\xa6 https://t.co/rinzro96Lb"""
chevrolet,1240996219658203142,2020-03-20 13:38:50,"b""@Bobbyjo42224694 Hi, Bobby. We're sorry to hear of the dissatisfaction. So that we can look into your concerns furt\xe2\x80\xa6 https://t.co/eZIky0WJnt"""
chevrolet,1240994661612716033,2020-03-20 13:32:38,"b'@Taylorrob28Rob Should you wish to discuss any current concerns in further detail, Rob, please know our team is onl\xe2\x80\xa6 https://t.co/BIvbLS6elz'"
chevrolet,1240989392077897729,2020-03-20 13:11:42,"b'@mws9591 Good morning, Mike. Our team would like to reach out to your dealership and gather more information on you\xe2\x80\xa6 https://t.co/wpuM6uxTna'"
chevrolet,1240986580723970050,2020-03-20 13:00:31,"b'@lancegregmason We are sorry to hear about your concern, Lance. Our team would like to reach out to your dealership\xe2\x80\xa6 https://t.co/md5pvyETKw'"
chevrolet,1240976870826360832,2020-03-20 12:21:56,"b'@DParker___ When you have a moment, Dymond, please do not hesitate to send our team a DM so we can learn more and b\xe2\x80\xa6 https://t.co/n0v5MFQIci'"
chevrolet,1240974687514947584,2020-03-20 12:13:16,"b""@cashregister1 We've followed up to your DM, Brian. Please check there when you have a moment. https://t.co/uXlRBslaLT"""
chevrolet,1240963741971124224,2020-03-20 11:29:46,"b""@DaisyDiamond18 We're sincerely sorry to hear this, as we strive for all of our loyal customers to have positive ow\xe2\x80\xa6 https://t.co/GG5K3gt4l8"""
chevrolet,1240808396074278913,2020-03-20 01:12:29,"b""@Dahveedcastle Thanks for reaching out to us, Dahveed.  We regret to hear you're experiencing vehicle concerns.  Pl\xe2\x80\xa6 https://t.co/EYctO0mr9J"""
chevrolet,1240807519259254784,2020-03-20 01:09:00,b'@TheRealDrePapi Thanks for following up with us.  We appreciate the clarification. Should you ever need our assista\xe2\x80\xa6 https://t.co/PJ08T6KXn5'
chevrolet,1240804675504373760,2020-03-20 00:57:42,"b""@Nothavingit We're sorry to hear you're experiencing concerns with your Impala and would be happy to look further i\xe2\x80\xa6 https://t.co/h4rQQctPFK"""
chevrolet,1240788933698437120,2020-03-19 23:55:09,"b'@AlbertCamaril12 Thank you for reaching out, Albert. Chevrolet does make the Express Passenger van, which can seat\xe2\x80\xa6 https://t.co/K2zNX6Z4fR'"
chevrolet,1240777777772544000,2020-03-19 23:10:49,"b'@TheRealDrePapi Thanks for sharing your experiences with us.  To clarify, have the repairs to your vehicle been com\xe2\x80\xa6 https://t.co/4tfMePjr4D'"
chevrolet,1240757949741420544,2020-03-19 21:52:02,"b'@AllcapsDcboyz Wow, 286,000 miles is quite the accomplishment! Please send us a DM with additional details when you\xe2\x80\xa6 https://t.co/hDWaUNnYyj'"
chevrolet,1240749990705655808,2020-03-19 21:20:24,b'@chronically1999 We regret to hear your dad is experiencing concerns with his Tahoe and would be more than happy to\xe2\x80\xa6 https://t.co/RG0ZLc4Sf2'
chevrolet,1240733085680824320,2020-03-19 20:13:13,"b'@NikkiJoMassmann Thank you for bringing this to our attention, Nikki. We apologize to hear of your frustrations reg\xe2\x80\xa6 https://t.co/MSKAYuCMPM'"
chevrolet,1240730386394566656,2020-03-19 20:02:30,"b'@TedJones48 Hi, Ted. We understand that unexpected costs can be frustrating. We\xe2\x80\x99d like the opportunity to look into\xe2\x80\xa6 https://t.co/JTf8Oq7pRf'"
chevrolet,1240720256550588417,2020-03-19 19:22:15,"b""@kaotikvaper Hi, Theo. Thanks for reaching out. Please DM us for more assistance. We'll keep an eye out for your me\xe2\x80\xa6 https://t.co/WnwNvtNg04"""
chevrolet,1240705536871395333,2020-03-19 18:23:45,"b""@Jro7272 We're sorry to hear of the frustration and would be happy to assist further. Please send us a DM with addi\xe2\x80\xa6 https://t.co/b0mVGsBhg6"""
chevrolet,1240704733200830470,2020-03-19 18:20:34,"b""@SpecApe Hi, John. Sounds like you're having some trouble locating a dealer? Send us a DM and we'd be happy to assi\xe2\x80\xa6 https://t.co/TA0YlgDEsD"""
chevrolet,1240703235473588224,2020-03-19 18:14:37,"b""@Double_D541 We're sorry to hear about the scratches on your wheels and would be happy to look into things further.\xe2\x80\xa6 https://t.co/gGH6lYy9Em"""
chevrolet,1240701268344967168,2020-03-19 18:06:48,"b'@mikeboswell333 Hi, Michael. Our team would like to take a closer look into your situation. So we can best assist,\xe2\x80\xa6 https://t.co/4BkazBHck4'"
chevrolet,1240684372954509312,2020-03-19 16:59:39,"b""@Jeres_Rant The 2020 Bolt is a great choice. Interested in a test drive? Send us a DM with your zip code and we'd b\xe2\x80\xa6 https://t.co/TfESPK7lms"""
chevrolet,1240669740567126018,2020-03-19 16:01:31,"b""@_pristhekilla Please don't hesitate to send us a DM with some additional details, so we may best help. https://t.co/uXlRBslaLT"""
chevrolet,1240656938892836864,2020-03-19 15:10:39,"b""@Meddle98 We'd be happy to connect you with a dealer in your area to set up a test drive. If interested, please fol\xe2\x80\xa6 https://t.co/5wYspIhhgi"""
chevrolet,1240649648156471297,2020-03-19 14:41:40,"b""@KennyMcCumbee Thanks, Kenny. We've responded to your DM. Please follow up with us there when you have a moment. https://t.co/uXlRBslaLT"""
chevrolet,1240646490676006913,2020-03-19 14:29:08,b'@xr0_llc We regret to hear of the concerns you are experiencing with your Camaro and would like to take a closer lo\xe2\x80\xa6 https://t.co/M2AR7dDYC4'
chevrolet,1240642072039710726,2020-03-19 14:11:34,"b""@torresssjacob4 Good morning, Jake. If we can be of any assistance in helping you please don't hesitate to send us\xe2\x80\xa6 https://t.co/6FqFuKnvgO"""
chevrolet,1240641650537291778,2020-03-19 14:09:54,"b""@bo_bogard We're happy to hear that you were well taken care of and love your new vehicle. Please know, we have doc\xe2\x80\xa6 https://t.co/aaHIFV76qN"""
chevrolet,1240635344405409792,2020-03-19 13:44:50,b'@BlueCol65086376 Thanks for reaching out and sharing your thoughts. Chevrolet is dedicated to improving the product\xe2\x80\xa6 https://t.co/sGwXbxG19T'
chevrolet,1240632859930451968,2020-03-19 13:34:58,"b'@EdwardRSouth Hi, Edward. Can you please follow up with us via DM? From there, we can look into your inquiry furthe\xe2\x80\xa6 https://t.co/J2pTOmOvZo'"
chevrolet,1240632178960039937,2020-03-19 13:32:15,"b'@lyssalouuuu Hi, Lyssa. Have you had a chance to visit one of our certified GM dealerships to get this concern look\xe2\x80\xa6 https://t.co/cJF6Zd30y8'"
chevrolet,1240612052483207168,2020-03-19 12:12:17,b'@KickingUpDust We would be happy to look up some of our certified GM dealerships in your area. Just send us a DM co\xe2\x80\xa6 https://t.co/Q697xd4nDi'
chevrolet,1240610982805659648,2020-03-19 12:08:02,"b'@BooSTIn_gio Hey, Jhovanny. Have you been to one of our dealerships to get this looked at? Our team would be happy\xe2\x80\xa6 https://t.co/YO34LN4tDi'"
chevrolet,1240589064731910144,2020-03-19 10:40:56,"b'@Therealgdubs1 When you get the chance, feel free to send our team a DM with some clarifying details regarding your\xe2\x80\xa6 https://t.co/S2uwi4AxfO'"
chevrolet,1240567952606289920,2020-03-19 09:17:03,"b'@RCoA Please know that we take your feedback into high consideration, Russ, and appreciate the honest insight. Shou\xe2\x80\xa6 https://t.co/Eex1OIYasG'"
chevrolet,1240553115603984385,2020-03-19 08:18:05,"b'@mccleery_w Our team is only a DM away, and would certainly appreciate the chance to further discuss your current v\xe2\x80\xa6 https://t.co/7AVa7gZOgz'"
chevrolet,1240552191456206849,2020-03-19 08:14:25,b'@Scottyballgame3 Please feel free to send our team a DM with additional details regarding your current concerns wit\xe2\x80\xa6 https://t.co/ijEulJN5vy'
chevrolet,1240547676258594816,2020-03-19 07:56:28,"b'@cashregister1 Should you like to further discuss any current concerns you are still experiencing with your Tahoe,\xe2\x80\xa6 https://t.co/HYjYRbYXz7'"
chevrolet,1240521511737241607,2020-03-19 06:12:30,"b'@only_accounts When you have a moment, Tom, please review our reply to your DM.'"
chevrolet,1240519673520607232,2020-03-19 06:05:12,"b'@DParker___ Please send our team a DM with some additional information, Dymond, so we have the chance to learn more\xe2\x80\xa6 https://t.co/cJlpd6QIoA'"
chevrolet,1240487305640472578,2020-03-19 03:56:35,b'@only_accounts Hi there. We\xe2\x80\x99re sorry to hear you\xe2\x80\x99re experiencing concerns with your Silverado\xe2\x80\x99s paint. We\xe2\x80\x99d be happ\xe2\x80\xa6 https://t.co/fDtQZKSgAh'
chevrolet,1240460902219911168,2020-03-19 02:11:40,b'@jesse48676371 Thank you for reaching out. We apologize to hear of your frustrations as this is not the type of exp\xe2\x80\xa6 https://t.co/dU1YWC1rHI'
chevrolet,1240458131408207873,2020-03-19 02:00:39,"b""@BaconSynyster We're happy to gather information and determine how to best assist you.  For our assistance, please\xe2\x80\xa6 https://t.co/XhcZ73PfHg"""
chevrolet,1240451750814822400,2020-03-19 01:35:18,"b""@Brooklynjadeee We regret to hear you're experiencing vehicle concerns, Brooklyn.  We'd like to gather information\xe2\x80\xa6 https://t.co/M6uzPjJDJa"""
chevrolet,1240451391908274176,2020-03-19 01:33:52,"b""@BlueCol65086376 Thanks for reaching out to us.  We're happy to gather information to answer your questions.  For u\xe2\x80\xa6 https://t.co/zjyHZ9ce0v"""
chevrolet,1240402623167189001,2020-03-18 22:20:05,"b'@gilbymaxxxx We do understand your frustration at this time.  We assure you, your safety is our top priority.  We h\xe2\x80\xa6 https://t.co/O1M7h6ZtT9'"
chevrolet,1240396599530065922,2020-03-18 21:56:09,"b'@AngelaE98207141 Thanks for reaching out to us, Angela.  We sincerely regret your dissatisfaction with your Malibu.\xe2\x80\xa6 https://t.co/hxmg0DOkOo'"
chevrolet,1240331611763138560,2020-03-18 17:37:55,"b""@DansberryLi We're happy your taking precaution's and getting your recalls repaired. Please know that we\xe2\x80\x99re here an\xe2\x80\xa6 https://t.co/FaX9YJ9wR9"""
chevrolet,1240327116379443201,2020-03-18 17:20:03,b'@_lovin_my_life Kindly have her send more info regarding the concerns she has been experiencing with her check engi\xe2\x80\xa6 https://t.co/jdWNHbxOHJ'
chevrolet,1240310747072098305,2020-03-18 16:15:00,"b'@jshanno21 Sorry to hear of your frustrations, Julie. Our team works with Mary to see if we can address issues such\xe2\x80\xa6 https://t.co/fqRLnYBCwd'"
chevrolet,1240310323216674816,2020-03-18 16:13:19,"b""@_lovin_my_life We regret to hear of your mother's check engine light concern and would like to take a closer look\xe2\x80\xa6 https://t.co/HK6TnKXWdP"""
chevrolet,1240279035298496517,2020-03-18 14:08:59,"b'@marksiptvhd Hi, Marco. If you are experiencing concerns with the rear camera on your Equinox, our team will be hap\xe2\x80\xa6 https://t.co/oeDLLyq2sm'"
chevrolet,1240276629995139080,2020-03-18 13:59:26,"b""@HectorGarciaJr1 Good morning, Hector. If there's anything you need assistance with, please don't hesitate to send\xe2\x80\xa6 https://t.co/QwdA5aZKPd"""
chevrolet,1240273292176420865,2020-03-18 13:46:10,"b'@KazumaGShep This is not the feeling we want you to have in your Equinox, Kazuma. Please send us a DM so we can fur\xe2\x80\xa6 https://t.co/DSKB1f1p86'"
chevrolet,1240270726004760576,2020-03-18 13:35:58,"b'@JustplainAlba We are sorry to hear that you are less than satisfied, Alba. Are you currently experiencing concerns\xe2\x80\xa6 https://t.co/z0r9SyPnoh'"
chevrolet,1240263303378554880,2020-03-18 13:06:29,"b""@CourtniBreann Hey, Courtni. How can we help you today? Send us a DM and we'd be happy to assist. https://t.co/uXlRBslaLT"""
chevrolet,1240202269007597569,2020-03-18 09:03:57,b'@magnew45 Please send our team a DM at your earliest convenience so we have the chance to further discuss your curr\xe2\x80\xa6 https://t.co/gTPWriHD4c'
chevrolet,1240197908168728576,2020-03-18 08:46:37,"b""@BeeZad Hello, Brad. We'd be happy to assist with scheduling an appointment at your local certified GM dealership r\xe2\x80\xa6 https://t.co/ybs8k8twFx"""
chevrolet,1240121007333167111,2020-03-18 03:41:03,"b""@draktus Hi, Kendall. While we can't speculate on future incentives, we would be happy to see what offers are curre\xe2\x80\xa6 https://t.co/cH88VbyQtq"""
chevrolet,1240025460345470976,2020-03-17 21:21:22,"b'@theamandasmith1 Thank you for reaching out, Amanda. We apologize to hear of your frustrations as this is not the t\xe2\x80\xa6 https://t.co/b9RDq9YJJY'"
chevrolet,1240012472167227392,2020-03-17 20:29:46,"b""@mrbaileysays Thank you for following up with us. If you do decide you would like to further discuss this, we're only a DM away."""
chevrolet,1239989883332001792,2020-03-17 19:00:00,"b'@notDerek4 We understand the importance of dependability and do apologize for the dissatisfaction, Derek. Please se\xe2\x80\xa6 https://t.co/zheNmCSPfn'"
chevrolet,1239983589225148416,2020-03-17 18:35:00,"b""@Speechless4real We've responded to your DM. Please follow up with us there when you have a moment. https://t.co/uXlRBslaLT"""
chevrolet,1239980456759578624,2020-03-17 18:22:33,"b""@sydneyzaccanti We're sorry to hear of the ongoing frustration with your Cruze, Sydney. If there is anything we can\xe2\x80\xa6 https://t.co/NQqyJlkn03"""
chevrolet,1239978926534873089,2020-03-17 18:16:28,b'@mrbaileysays We regret to hear about these multiple concerns with your Malibu. If you would like to further discus\xe2\x80\xa6 https://t.co/h6wubRHuoQ'
chevrolet,1239924146059874304,2020-03-17 14:38:47,b'@Curtis_Do1023 We are sorry to hear of your dissatisfaction with your Camaro and will be happy to take a closer loo\xe2\x80\xa6 https://t.co/dC4aKKTGt1'
chevrolet,1239906727744552961,2020-03-17 13:29:34,b'@tblfan58 We understand how frustrating this must be. Allow us to provide you a layer of support while working with\xe2\x80\xa6 https://t.co/HkbEoaER2K'
chevrolet,1239902627522965504,2020-03-17 13:13:17,"b""@Speechless4real Our team regrets to hear of your mother's recent service experience. With that said, we would like\xe2\x80\xa6 https://t.co/bjZ4ScM3f7"""
chevrolet,1239895918654062593,2020-03-17 12:46:37,"b""@YoPaulie28 We'd like to learn more about your brake concern. Please don't hesitate to send us a DM with some detai\xe2\x80\xa6 https://t.co/ohg89heJuF"""
chevrolet,1239867891266154496,2020-03-17 10:55:15,"b""@LiamMenus Thanks for reaching out to us regarding your HHR concern. If you would like our team's assistance, feel\xe2\x80\xa6 https://t.co/mWqyNb8BSE"""
chevrolet,1239724108398473216,2020-03-17 01:23:55,"b'@sswankss Unexpected costs can be frustrating. We can look into this if you DM us with more details, including your\xe2\x80\xa6 https://t.co/ygzLWQxUXa'"
chevrolet,1239722272635551744,2020-03-17 01:16:37,"b""@PinkDiamondMami We regret to hear of the concerns with your Cruze. If you're currently experiencing concerns with\xe2\x80\xa6 https://t.co/3r8sIKgmD9"""
chevrolet,1239721507342790657,2020-03-17 01:13:34,"b'@Piper87C Hey, Jeff. This isn\xe2\x80\x99t the experience we want our customers to have. We\xe2\x80\x99d like to see how we can help with\xe2\x80\xa6 https://t.co/9kx2NB3sHU'"
chevrolet,1239660169568518144,2020-03-16 21:09:50,"b'@mario36875695 We regret to hear of the scary accident you were involved in, Mario and relieved to hear you are saf\xe2\x80\xa6 https://t.co/g6gfiDuYN4'"
chevrolet,1239658939433644032,2020-03-16 21:04:57,"b'@jimtavare Hi, Jim. We recently responded to your DM. Please review it at your earliest convenience. Thank you.'"
chevrolet,1239649775743414274,2020-03-16 20:28:32,"b'@CoreyDemond We understand how frustrating this must be, Corey. When you have a moment, please send us a DM with mo\xe2\x80\xa6 https://t.co/u72zrDuT5F'"
chevrolet,1239599959323918338,2020-03-16 17:10:35,"b""We've always been here to help. That's a promise we'll keep. For more information, visit https://t.co/AS2uCfWEYM. https://t.co/D37czmllZK"""
chevrolet,1239597599633465344,2020-03-16 17:01:13,"b'@VikasMi92572057 We regret to hear of your dissatisfaction with your recent service experience, Vikas. So we can ta\xe2\x80\xa6 https://t.co/D050XrjDfw'"
chevrolet,1239574385826004992,2020-03-16 15:28:58,"b'@duval500 Hi, Lisa. Thanks for reaching out. As our dealerships are independently owned and operated, they are empo\xe2\x80\xa6 https://t.co/VmlRohQyMl'"
chevrolet,1239565092460494848,2020-03-16 14:52:02,"b'@myyrandat Understood, Myranda. Should you decide to proceed with our assistance, while working with your dealer, p\xe2\x80\xa6 https://t.co/veMMX0e0Xn'"
chevrolet,1239561162267586567,2020-03-16 14:36:25,"b'@louholloway Our apologies for any dissatisfaction, Lauren. Please know, vehicle design and operation does change a\xe2\x80\xa6 https://t.co/Dxc74fJTkE'"
