Entrepreneur,1255953267340836871,2020-04-30 20:12:48,"b""Tomorrow's free webinar will cover how to lead with integrity, even when making difficult decisions. Register here:\xe2\x80\xa6 https://t.co/Y7CkPOXZ2G"""
Entrepreneur,1255950414547161089,2020-04-30 20:01:27,b'Chat with vetted strategy and business experts who can help you start thinking about how to recover from the corona\xe2\x80\xa6 https://t.co/ETXY42LMGw'
Entrepreneur,1255945692339716100,2020-04-30 19:42:42,b'FREE Two-Day Livestream Event May 14 &amp; 15 - Learn to Fortify Your Business from Founders Who Know How to PIVOT. Cri\xe2\x80\xa6 https://t.co/YmyOFCnNoa'
Entrepreneur,1255943767007342592,2020-04-30 19:35:03,b'Lessons on Warmth in Leadership From NFL Commissioner Roger Goodell | by @stevenherz https://t.co/swFJQ4tXCW'
Entrepreneur,1255928670851661824,2020-04-30 18:35:03,b'The Social Selling System: Flipping a Follower into a Client | by @kwalshphillips https://t.co/K2dqEE4Bhz'
Entrepreneur,1255921123792912384,2020-04-30 18:05:04,"b""Startup Founders Can't Afford to Ignore Mental Health | by @Gleb_Tsipursky https://t.co/0ouLm0L5id"""
Entrepreneur,1255907297013960707,2020-04-30 17:10:07,b'What Do You Have to Do to Launch Your Own Clothing Line? Whatever It Takes. cc: @public_rec https://t.co/q00uhhiJWt'
Entrepreneur,1255905723957026817,2020-04-30 17:03:52,b'Empowering Women Entrepreneurs (Sponsored by @DellSmbUS) https://t.co/KdihNRGn7l'
Entrepreneur,1255898470944247808,2020-04-30 16:35:03,b'Stop Wasting Email Sends on Non-Verified Addresses. This Tool Promises 99 Percent Deliverability. https://t.co/9eh2pVGo7z'
Entrepreneur,1255893444041551875,2020-04-30 16:15:05,b'Unlocking Your iPhone While Wearing a Mask Will Get Easier With Upcoming iOS Update | by @michael_kan https://t.co/g9nmZXE4wD'
Entrepreneur,1255890934027505667,2020-04-30 16:05:06,b'Everything Coming to Disney+ in May https://t.co/FdpvDupEK2'
Entrepreneur,1255889092979699713,2020-04-30 15:57:47,b'Why Bad Audio Is Bad for Your Business #badaudioisbadbusiness (Sponsored by @Eposaudio) https://t.co/I6kz7WfNVu'
Entrepreneur,1255888412885819392,2020-04-30 15:55:05,"b'An Exercise-Bike Company and At-Home ""Botox"" Business Had Nothing in Common - Until They Did | by @jlthoms https://t.co/MXTbqX2l9K'"
Entrepreneur,1255885530245607430,2020-04-30 15:43:38,"b""Learn how to craft the perfect Instagram profile in today's @EntMagInsider workshop. Starts at 12 p.m. EDT. Join he\xe2\x80\xa6 https://t.co/3SuI8tQCJa"""
Entrepreneur,1255883096022532096,2020-04-30 15:33:57,"b""Last chance to join today's free webinar with @rhone co-founder and CEO @natechecketts. Starts at 12 p.m. EDT. Regi\xe2\x80\xa6 https://t.co/oQxJ03Ds0L"""
Entrepreneur,1255880852493516806,2020-04-30 15:25:03,"b'The Top 11 Companies in the Franchise 500, Ranked From Cheapest to Most Expensive | by @MWMcCreary https://t.co/oVKi7mRH7u'"
Entrepreneur,1255878344576577536,2020-04-30 15:15:05,"b'To Survive the COVID-19 Crisis, You Have to Think Long Term | by @heyfeifer https://t.co/rG3d3UaBXC'"
Entrepreneur,1255873498469281792,2020-04-30 14:55:49,"b""Elon Musk Hastily Deleted Tweet Saying 'LIBERTY' After Calling Lockdowns 'Fascist' https://t.co/2gCsF7Ug4L"""
Entrepreneur,1255870766618423296,2020-04-30 14:44:58,"b'RT @jwfell: If your business now involves shipping products from home, here are ways to make the process more efficient and cost-effective.\xe2\x80\xa6'"
Entrepreneur,1255860741896364033,2020-04-30 14:05:08,b'How to Avoid Making Disastrous Decisions | by @davidmeltzer https://t.co/TVzv1hMJfl'
Entrepreneur,1255853172373049345,2020-04-30 13:35:03,"b'The First-Ever Live, Virtual Reality Comedy Special Could Only Happen Now | by @KennyHerzog cc: @CEEK\xe2\x80\xa6 https://t.co/Wg1mH2az90'"
Entrepreneur,1255848442557014016,2020-04-30 13:16:15,"b'On this episode of #HowBrandsAreBorn with @kristenaldridge presented by #CardoneVentures, meet @omaze, the celebrit\xe2\x80\xa6 https://t.co/dKZ1n41rZY'"
Entrepreneur,1255845635661746176,2020-04-30 13:05:06,"b""How Gen.G's COO Arnold Hur Envisions Tomorrow's Normal for Investing, E-Sports and Beyond https://t.co/YJDXcL7y60"""
Entrepreneur,1255845318777806848,2020-04-30 13:03:51,b'RT @DanBova1: Always a hoot talking with these maniacs. (@Discovery @DeadliestCatch) https://t.co/HmesFXdk98'
Entrepreneur,1255830531213791232,2020-04-30 12:05:05,"b""Free Fireside Chat | May 4: Donn Davis's Plans on Recovering https://t.co/aCtVynlIHa"""
Entrepreneur,1255697141495889920,2020-04-30 03:15:02,b'16 Brilliant Ways To Get the Best Deals at the Grocery Store Every Time | on @LiveRicher https://t.co/sY7B2VrbQt'
Entrepreneur,1255679534965428224,2020-04-30 02:05:05,"b'Join @ChesnutRob, Chief Ethics Officer of @Airbnb, as he discusses the importance of corporate integrity during a c\xe2\x80\xa6 https://t.co/sTLiXMYaHT'"
Entrepreneur,1255664428810407944,2020-04-30 01:05:03,"b'In this @EntMagInsider workshop, you\xe2\x80\x99ll learn how to craft the perfect Instagram profile so your message is CLEAR a\xe2\x80\xa6 https://t.co/2YoE9Ukvj6'"
Entrepreneur,1255649330813440008,2020-04-30 00:05:03,"b""Join tomorrow's fireside chat with @rhone's @natechecketts on how your brand can help those affected during this cr\xe2\x80\xa6 https://t.co/nuGxbBrnLD"""
Entrepreneur,1255635488569987075,2020-04-29 23:10:03,"b""3 Ways to Give Back That Don't Require a Financial Investment | by @stinubu https://t.co/rv4znLQtSp"""
Entrepreneur,1255627936612454407,2020-04-29 22:40:03,b'5 Ways to Capture Email Addresses From Landing Page Traffic | by @Robertbly https://t.co/IAsWM9VzrE'
Entrepreneur,1255606555426402305,2020-04-29 21:15:05,b'How COVID-19 Could Affect Your Life Insurance Coverage | by @greenbergbrian https://t.co/VwlRCCHMWd'
Entrepreneur,1255601397971763204,2020-04-29 20:54:35,b'RT @CherylSnapp: Loved the chance to take a look at the positive innovation coming about as companies and executives grapple with the chall\xe2\x80\xa6'
Entrepreneur,1255601278287327232,2020-04-29 20:54:07,"b'RT @aytekintank: I just published ""How to Stay Sane While Working From Home"" @Entrepreneur \nhttps://t.co/GMbdi8BdMl'"
Entrepreneur,1255596500320751616,2020-04-29 20:35:08,b'The One Question Every Founder Should Ask Before Rebuilding Their Business | by @mhiggins https://t.co/E8dEXVCWF1'
Entrepreneur,1255591841082363904,2020-04-29 20:16:37,b'3 Easy Ways to Stay Productive in Stressful Times | by @haleyhoffsmith https://t.co/BxTEdu9KrR'
Entrepreneur,1255589592666984450,2020-04-29 20:07:41,"b'Learn about courage, leadership, and resilience from researcher and author Bren\xc3\xa9 Brown in conversation with SMB Mar\xe2\x80\xa6 https://t.co/r8hdwwm4kF'"
Entrepreneur,1255576356265627649,2020-04-29 19:15:05,b'4 Telltale Signs Your Business Is Ripe for a Cybersecurity Attack (and How to Respond) | by @BizFamous https://t.co/OV2Ed3kNKw'
Entrepreneur,1255572880479444992,2020-04-29 19:01:16,"b""On today's episode of #HowSuccessHappens with @roberttuchman, Iron Chef winner @MarcForgione discusses owning a res\xe2\x80\xa6 https://t.co/s3b2M79wbl"""
Entrepreneur,1255567538756423680,2020-04-29 18:40:03,"b'Meet the Black, Female Entrepreneurs Making a Safe Space for Minority Professionals | by @KanikaTolver https://t.co/UDb9rmICEl'"
Entrepreneur,1255563767108317184,2020-04-29 18:25:03,b'Makers of Tomorrow: CareerBuilder CEO Irina Novoselsky | by @tpopomaronis https://t.co/BtNZTH1OFF'
Entrepreneur,1255546854839914496,2020-04-29 17:17:51,b'Need expert help getting through these tough times? Entrepreneur NEXT powered by @hireassemble has your back. Hire\xe2\x80\xa6 https://t.co/cJPniBYoJB'
Entrepreneur,1255544443761025030,2020-04-29 17:08:16,"b""RT @GreenEntrprnr: Join today's free webinar with @Codie_Sanchez, a managing director and partner at @EEffectCapital at 3 p.m. EDT. Registe\xe2\x80\xa6"""
Entrepreneur,1255543634604285953,2020-04-29 17:05:04,b'5 Technological Innovations Changing Medical Practice | by @pritomrocker https://t.co/dhUNT5ms8B'
Entrepreneur,1255539040041959426,2020-04-29 16:46:48,"b'RT @stevenherz: In an economic downturn, job security is more important than ever. Read my piece in @Entrepreneur to find out which 3 soft-\xe2\x80\xa6'"
Entrepreneur,1255538967837118467,2020-04-29 16:46:31,"b'RT @haleyhoffsmith: Ever wondered how to land PR? Read THIS to build your PR toolbox, so you\xe2\x80\x99re ready to go when it\xe2\x80\x99s time to pitch that ne\xe2\x80\xa6'"
Entrepreneur,1255536859041710082,2020-04-29 16:38:08,b'.@DeadliestCatch Captains Explain Working and Living in Pure Chaos | by @DanBova1 https://t.co/AhxKeuc4Cc'
Entrepreneur,1255532311845666816,2020-04-29 16:20:04,b'5 Proven Ways to Keep Visitors on Your Website | by @greenbergbrian https://t.co/JJgRh1X4wX'
Entrepreneur,1255520678889037825,2020-04-29 15:33:50,"b""Raise Money for Charity With Instagram's New Live Donations https://t.co/Yw1Ov2rwEh"""
Entrepreneur,1255513456167583749,2020-04-29 15:05:08,"b'Last chance to join today\'s free webinar, ""How @GenG\'s COO Arnold Hur Envisions Tomorrow\'s Normal for Investing, Es\xe2\x80\xa6 https://t.co/o5ykAKuqxD'"
Entrepreneur,1255505901378777088,2020-04-29 14:35:07,b'Need Help Telling Your Startup Story? This Illustration Kit Is on Sale for $100 Off. https://t.co/jFwX0BAs7h'
Entrepreneur,1255501462446145550,2020-04-29 14:17:29,"b""Nathan's Famous is among the latest publicly held companies to return a sizable SBA PPP loan. https://t.co/fVa4UvWRhp"""
Entrepreneur,1255483237335515137,2020-04-29 13:05:04,"b""The First Question to Ask Yourself If You Want to Be An Entrepreneur But Don't Know Where to Start | by @jeffbonaldi https://t.co/OAQ3VThJax"""
Entrepreneur,1255342311149572098,2020-04-29 03:45:04,"b""Don't Be Intimidated By Giants in Your Market. Use These Strategies to Figure Out Who Your Real Competition Is. https://t.co/KqNCFT8d6R"""
Entrepreneur,1255324688705822720,2020-04-29 02:35:03,b'3 Ways Strong Leaders Can Support Work-From-Home Employees https://t.co/b8Jneo4bFi'
Entrepreneur,1255305815008960515,2020-04-29 01:20:03,b'Working From Home? Try This Top-Rated Meditation App to Stay Focused. https://t.co/JiPNeiTDTQ'
Entrepreneur,1255286942301896704,2020-04-29 00:05:03,"b'.@natechecketts will discuss how entrepreneurs can get involved by donating to their community, the logistics behin\xe2\x80\xa6 https://t.co/P94AVXuf5A'"
Entrepreneur,1255271845093392384,2020-04-28 23:05:04,"b'.@Codie_Sanchez, a managing director and partner at @EEffectCapital, will give useful advice on where to cut costs\xe2\x80\xa6 https://t.co/Kdw1fzNub2'"
Entrepreneur,1255259259014656001,2020-04-28 22:15:03,b'Creative and Practical Steps for Franchises to Survive the COVID-19 Crisis https://t.co/oJTAYMiTt0'
Entrepreneur,1255246681333006343,2020-04-28 21:25:04,"b""A Navy SEAL's Guide to Thriving in Close Quarters: Engagement Tactics | by @aldenmills https://t.co/8qaxhYtjqj"""
Entrepreneur,1255242802885201922,2020-04-28 21:09:40,"b'RT @5by5agency: ""New normal just might be better than old normal. Here are three areas in your organization that shouldn\xe2\x80\x99t revert back to \xe2\x80\x9c\xe2\x80\xa6'"
Entrepreneur,1255242731858939907,2020-04-28 21:09:23,"b'RT @aytekintank: I just published ""7 Ways to Train Your Brain to Make Better Decisions"" @Entrepreneur \nhttps://t.co/m2MooFEgcb'"
Entrepreneur,1255229065860132866,2020-04-28 20:15:04,b'How to Create a Symbiotic CEO and CFO Partnership | by @georgedeeb https://t.co/EKXo6cwkmz'
Entrepreneur,1255227548235153409,2020-04-28 20:09:03,b'Author Bren\xc3\xa9 Brown talks with SMB Marketing SVP Marie Rosecrans about strategies for cultivating more daring leader\xe2\x80\xa6 https://t.co/Z7dNJfPNJx'
Entrepreneur,1255219009202589696,2020-04-28 19:35:07,b'How to Recruit Employees With Equity | by @_AlexGold https://t.co/P0VV0480EK'
Entrepreneur,1255214431853850624,2020-04-28 19:16:55,"b'On today\xe2\x80\x99s episode of #HabitsandHustle with @therealjencohen, @RyanLochte talks about how he prepares mentally and\xe2\x80\xa6 https://t.co/ppnSga3Jbv'"
Entrepreneur,1255206416014626817,2020-04-28 18:45:04,b'Hallmark Financial Services and Legacy Housing Corporation are now among the growing ranks of publicly held compani\xe2\x80\xa6 https://t.co/WQVFiaifE9'
Entrepreneur,1255203903416778753,2020-04-28 18:35:05,"b'Join our free webinar, ""How @GenG\'s COO Arnold Hur Envisions Tomorrow\'s Normal for Investing, Esports and Beyond"" t\xe2\x80\xa6 https://t.co/gwKN5q8XXm'"
Entrepreneur,1255196356693680128,2020-04-28 18:05:06,b'6 Tips for Negotiating in a Crisis | by @alexbcarter https://t.co/SN00y8SUS2'
Entrepreneur,1255183774612172803,2020-04-28 17:15:06,b'How Plant-Based Brands Are Infiltrating the Beverage Industry | by @reducetarian https://t.co/qLXrBK7JnH'
Entrepreneur,1255173388043255813,2020-04-28 16:33:50,b'Entrepreneur NEXT powered by @hireassemble is that easy and we guarantee all our experts and their work. Get starte\xe2\x80\xa6 https://t.co/H3enSM6nhM'
Entrepreneur,1255167406307250177,2020-04-28 16:10:04,b'Why You Must Follow These 6 Basic Marketing Rules | by @kwalshphillips https://t.co/V1cxVPH8Vl'
Entrepreneur,1255162091536887809,2020-04-28 15:48:57,b'L.A. Lakers Latest Private Company to Return PPP Funds | by @KennyHerzog https://t.co/X9l0D5SwpU'
Entrepreneur,1255158599128625153,2020-04-28 15:35:04,b'3 Ways to Retain Your Top Employees https://t.co/Awfo3JOL4q'
Entrepreneur,1255156288218107904,2020-04-28 15:25:53,"b""Leaders are made in a time of crisis because they're willing to look at their own flaws. Listen to today's bonus ep\xe2\x80\xa6 https://t.co/kWvY34GniB"""
Entrepreneur,1255152306753961986,2020-04-28 15:10:04,"b'A slew of multi-million-dollar businesses have been granted government recovery funds, to much controversy. Here ar\xe2\x80\xa6 https://t.co/H05Dj5rIKY'"
Entrepreneur,1255147272100171777,2020-04-28 14:50:03,b'UK Rejects Apple-Google Coronavirus Contact Tracing System | by @adamndsmith https://t.co/8JM9U0Kice'
Entrepreneur,1255144143371685895,2020-04-28 14:37:37,"b'UPS, CVS Use Drones to Deliver Prescriptions to Florida Retirement Community https://t.co/7twoSosgSF'"
Entrepreneur,1255139721325318150,2020-04-28 14:20:03,b'Stay Productive With a Set of Noise-Cancelling Headphones for Less Than $50 https://t.co/EEMbBH4RSu'
Entrepreneur,1255138046543974401,2020-04-28 14:13:24,b'RT @jwfell: Some of the reasons and personal factors explaining why running your own business has never been more popular or viable. https:\xe2\x80\xa6'
Entrepreneur,1255128396788531200,2020-04-28 13:35:03,b'This Serial Entrepreneur Started Practicing Door-to-Door Sales When He Was 5 Years Old | by @davidmeltzer https://t.co/4BIq7joOvO'
Entrepreneur,1255126484613816320,2020-04-28 13:27:27,b'Tune in to Thursday\xe2\x80\x99s new episode of #HowBrandsAreBorn with @kristenaldridge presented by #CardoneVentures featurin\xe2\x80\xa6 https://t.co/SsndrYy1oz'
Entrepreneur,1255120859456573440,2020-04-28 13:05:06,b'Beat the Pandemic by Implementing the Franchise Equation Strategy https://t.co/23XrLjlCWN'
Entrepreneur,1255105755633647616,2020-04-28 12:05:05,b'Free Webinar | May 1: Leading with Integrity During Times of Crisis https://t.co/Jrwzrg4ke7'
Entrepreneur,1254979914962526208,2020-04-28 03:45:02,b'This $30 Cushion Is a Major Ergonomic Upgrade to Your Work-From-Home Office https://t.co/rRzr2uafBB'
Entrepreneur,1254959778830434304,2020-04-28 02:25:01,b'How to Test and Choose the Best Name for Your Business https://t.co/vH0TKeow83'
Entrepreneur,1254939650122305537,2020-04-28 01:05:02,"b'Fight for Your Franchise Challenge, Week 4: Evaluate, Adapt and Overcome https://t.co/sZlSK6hSrN'"
Entrepreneur,1254934616034758656,2020-04-28 00:45:02,"b""How to Succeed In a Our 'New Normal' as a Remote Workforce https://t.co/94MdH10cXO"""
Entrepreneur,1254916998624169984,2020-04-27 23:35:02,b'5 Decentralization Trends to Watch in 2020 | by @pritomrocker https://t.co/ZbLeArQe09'
Entrepreneur,1254909454916739078,2020-04-27 23:05:03,b'Free Webinar | April 29: Cutting Costs in Times of Crisis https://t.co/Dtzs9NC2Yr https://t.co/uh1Gv0ALfF'
Entrepreneur,1254904424008425478,2020-04-27 22:45:04,b'The Case for Every Entrepreneur Learning Adobe CC and Where to Learn It https://t.co/QHer1mwdNj'
Entrepreneur,1254896881450340352,2020-04-27 22:15:06,"b""What It's Like to Be the Chief Content Officer of Goop | by @davidmeltzer https://t.co/QGr3lELp8R"""
Entrepreneur,1254885557727105027,2020-04-27 21:30:06,b'Did the Rockefellers Already Know? Family Exited Oil Investments in 2016. https://t.co/dZSe5khHh3'
Entrepreneur,1254879254124298241,2020-04-27 21:05:03,b'6 Strategies You Need to Run Your Company Through Uncertainty | by @stephenkeymedia https://t.co/LSaax7vVL6'
Entrepreneur,1254872704911577088,2020-04-27 20:39:01,"b'RT @SMACKELI: Empathy, Clarity &amp; Service. Here\xe2\x80\x99s how. https://t.co/gq28djnQMD'"
Entrepreneur,1254869775630643202,2020-04-27 20:27:23,"b'Learn about courage, leadership, and resilience from researcher and author Bren\xc3\xa9 Brown in conversation with SMB Mar\xe2\x80\xa6 https://t.co/Fpvon9FsA9'"
Entrepreneur,1254866676857712640,2020-04-27 20:15:04,"b'""I\'m Having a Hard Time, But Others Have It Worse. Can I Complain?"" | by @dylanessertier https://t.co/2kltvtP2uY'"
Entrepreneur,1254864131737350144,2020-04-27 20:04:57,"b'50,000 Entrepreneurs Tell Us How to Avoid Stress and Anxiety | by @benangel https://t.co/CGn8gzO5mD'"
Entrepreneur,1254854085905248264,2020-04-27 19:25:02,b'How Low-Value Work Is Hurting Your Bottom Line | by @aytekintank https://t.co/YjjmB8kFvG'
Entrepreneur,1254852002292654080,2020-04-27 19:16:46,"b'.@TheRock and business partner @DanyGarciaCo have a rule: ""We aren\'t attached to the process. We\'re only attached t\xe2\x80\xa6 https://t.co/MRvXGAE1sG'"
Entrepreneur,1254844732796174342,2020-04-27 18:47:52,"b'RT @KennyHerzog: If you want to keep track of which large, publicly traded companies have done the SBA PPP walk of shame by returning their\xe2\x80\xa6'"
Entrepreneur,1254844026152521728,2020-04-27 18:45:04,b'Make Your Microsoft Excel Skills Relevant Again with 60 Hours of Training for $50 https://t.co/Az2omXtA5Z'
Entrepreneur,1254835925059874816,2020-04-27 18:12:52,"b""Happy Monday! What time is it? Time to hire experts to help you start that company you've always dreamed off. Take\xe2\x80\xa6 https://t.co/Xoo2R9ekHa"""
Entrepreneur,1254826411644387328,2020-04-27 17:35:04,b'COO Arnold Hur will tell us how @GenG is navigating the ever changing tomorrow for their business and customers. Re\xe2\x80\xa6 https://t.co/meefP7XHWB'
Entrepreneur,1254818864870952960,2020-04-27 17:05:05,"b'Yes, There Can Still Be Positive Workplace Disruption | by @drpattifletcher https://t.co/3KhZg4yWTv'"
Entrepreneur,1254806279282925569,2020-04-27 16:15:04,b'Decentralization Can Be Your Friend | by @jennspencer21 https://t.co/GAfb5l0e9I'
Entrepreneur,1254804067357995010,2020-04-27 16:06:17,b'Which Public Companies Have Returned Their SBA PPP Loans? | by @KennyHerzog https://t.co/fVa4UvWRhp'
Entrepreneur,1254802450961309702,2020-04-27 15:59:52,b'RT @bzimmatore: Just another Monday: How Hackers Take Advantage of us During the COVID-19 Pandemic https://t.co/RTEGpSVoSJ\n\n#mondaythoughts\xe2\x80\xa6'
Entrepreneur,1254802254705627139,2020-04-27 15:59:05,b'Sustainable Shipping Practices for Your At-Home Business (Sponsored by @PitneyBowes) https://t.co/I1bHh7beGN'
Entrepreneur,1254802037365227527,2020-04-27 15:58:13,"b'RT @debbieallencsp: My new featured article in Entrepreneur today ""Looking for Business Opportunities Ahead of the Economic Fallout. Chek i\xe2\x80\xa6'"
Entrepreneur,1254798742412242945,2020-04-27 15:45:07,b'This App is Like Having a Personal Translator by Your Side at All Times https://t.co/T6cnp1f4oq'
Entrepreneur,1254795009100038146,2020-04-27 15:30:17,"b""Facebook Goes After Zoom With 'Messenger Rooms' Video Chat | by @michael_kan https://t.co/TkYcaeAT1B"""
Entrepreneur,1254793690289254400,2020-04-27 15:25:03,b'Join our experts today at 12 p.m. EDT as they discuss the steps to getting the most out of your franchise organizat\xe2\x80\xa6 https://t.co/bYSnFO9QNC'
Entrepreneur,1254791575659360257,2020-04-27 15:16:39,b'RT @GreenEntrprnr: Free Webinar | April 29: Cutting Costs in Times of Crisis https://t.co/tNXXconS0E'
Entrepreneur,1254787779600343042,2020-04-27 15:01:34,b'FBI: Think Twice Before Posting Your High School Photos on Social Media | by @michael_kan https://t.co/tHfKa2HH1I'
Entrepreneur,1254783315141210117,2020-04-27 14:43:49,b'Amazon Loses Appeal to Deliver Non-Essential Items in France During Pandemic https://t.co/rXtMgg2jqB'
Entrepreneur,1254773560897200138,2020-04-27 14:05:04,b'From a Crisis of Conscience to Consumer Packaged Goods Success | by @davidmeltzer https://t.co/IGsID6mO7U'
Entrepreneur,1254760983219798017,2020-04-27 13:15:05,b'8 Ways to Train Your Mind to Succeed During Uncertain Times | by @oliverzok https://t.co/Im8kweuZVV'
Entrepreneur,1254753391764549632,2020-04-27 12:44:55,"b""This 'Amazon Choice' Game Combines Mini Golf and Beer Pong https://t.co/jZHsLk3CNk"""
Entrepreneur,1254743367558316033,2020-04-27 12:05:05,b'Free Fireside Chat | April 30: How Your Brand Can Help Those Affected During This Crisis https://t.co/EjET4O12YW'
Entrepreneur,1254607459202842625,2020-04-27 03:05:02,"b'Burnouts, Crashes and Endless Business Plateaus https://t.co/ziTFGfTSxi'"
Entrepreneur,1254592359158988800,2020-04-27 02:05:02,b'The 15 Characteristics of People Who Succeed at Sales https://t.co/Agk9CZ3bwT'
Entrepreneur,1254577260876742656,2020-04-27 01:05:02,b'5 Creativity Exercises to Keep You Sharp While Working From Home https://t.co/Jl0PsBEJZj'
Entrepreneur,1254562165673132033,2020-04-27 00:05:03,b'4 Secrets to Becoming an (Even Higher) Achiever https://t.co/NEnbLrINRa'
Entrepreneur,1254547069227974657,2020-04-26 23:05:04,b'18 Freelance Sites to Find Your Next Gig https://t.co/pLKejaHEgi'
Entrepreneur,1254531964704559111,2020-04-26 22:05:03,"b""Free Webinar | April 29: What's Available To You From The U.S. Small Business Administration https://t.co/WNTgzazHDa"""
Entrepreneur,1254516864878854145,2020-04-26 21:05:03,"b""Here's how to be the leader your organization needs right now. https://t.co/wqwzWGlowL"""
Entrepreneur,1254501765808095232,2020-04-26 20:05:03,b'How Business Owners Can Optimize Cash Flow During A Crisis https://t.co/oB684QHuWg'
Entrepreneur,1254486676338081802,2020-04-26 19:05:05,b'5 Ways to Protect Your Business and Personal Credit Scores During a Crisis https://t.co/udUR5K5YGe'
Entrepreneur,1254471569675636736,2020-04-26 18:05:03,b'9 Better Things to Do Than Worry What Others Think About You https://t.co/KbCFFyGWdO'
Entrepreneur,1254456469585567746,2020-04-26 17:05:03,b'The Keys to Developing a Personal Brand https://t.co/PLUuZV5Cv4'
Entrepreneur,1254441368463781888,2020-04-26 16:05:03,b'Making Things Up: Why Fake Words May Be Right for Your New Business Name https://t.co/HGJ8dyhueK'
Entrepreneur,1254433817689051143,2020-04-26 15:35:03,b'Free Webinar | April 27: Beat the Pandemic by Implementing the Franchise Equation Strategy https://t.co/FtYCQMbxMC https://t.co/A4ShDBeR1J'
Entrepreneur,1254426273880907776,2020-04-26 15:05:04,b'Why Marketing Activities and Tracking Will Help Your Ageless Startup Succeed https://t.co/SquON8SaUi'
Entrepreneur,1254411182653485056,2020-04-26 14:05:06,b'The Online Sales Easy Button https://t.co/igWn9Uy9Sf'
Entrepreneur,1254396081317740546,2020-04-26 13:05:05,"b""He Designed Peloton and SoulCycle Bikes. Now He's Made a Tool to Stop COVID-19. https://t.co/SxrRhYG2va"""
Entrepreneur,1254380972889583616,2020-04-26 12:05:03,"b""Free Webinar | April 29: How Gen.G's COO Arnold Hur Envisions Tomorrow's Normal for Investing, E-Sports and Beyond https://t.co/oTRlWkGk8K"""
Entrepreneur,1254365871952269312,2020-04-26 11:05:03,b'The Complete Guide to TikTok Advertising for Marketers | on @hootsuite https://t.co/zGkzRGLb2I'
Entrepreneur,1254245071936991243,2020-04-26 03:05:02,b'How to Get More Out of Every Day: Lifestyle Optimization for High Performers https://t.co/ungrER9XnK'
Entrepreneur,1254229973403144192,2020-04-26 02:05:02,b'Have you ever you wondered how certain people have gotten so successful? https://t.co/W80yLkpseH'
Entrepreneur,1254214874655309827,2020-04-26 01:05:02,b'How to Exceed Expectations and Never Overpromise https://t.co/oudydNBD9u'
Entrepreneur,1254199784245780480,2020-04-26 00:05:05,b'How to Make Every Marketing Dollar Count During a Crisis https://t.co/Httevq1wdz'
Entrepreneur,1254184672730525699,2020-04-25 23:05:02,b'Managing People in a Distributed Workforce https://t.co/eM65PULtPC'
Entrepreneur,1254169576692162562,2020-04-25 22:05:03,b'How to Stay Sane While Working From Home https://t.co/bp25wEgEQ2'
Entrepreneur,1254154477495562240,2020-04-25 21:05:03,"b""Three ways to make remote employees feel like they're part of the larger goal. https://t.co/plm2ou7N5J"""
Entrepreneur,1254139381801197569,2020-04-25 20:05:04,b'Understanding the Small Business Relief Package https://t.co/GwxcCw3lv3'
Entrepreneur,1254124283103772673,2020-04-25 19:05:04,"b""Don't think short-term fixes. Think long-term solutions. https://t.co/3RK1ocQSPd"""
Entrepreneur,1254109179154960384,2020-04-25 18:05:03,b'8 Mindset Shifts Entrepreneurs Must Make to Achieve Their Ultimate Goal https://t.co/32qT9YHv60'
Entrepreneur,1254094086384029696,2020-04-25 17:05:04,b'ICYMI: Resetting Small Business America with @jontaffer https://t.co/UnJI3PhGGF'
Entrepreneur,1254078980933763072,2020-04-25 16:05:03,"b""A new report illustrates how they're doing, and the various ways both men and women workers need more support. https://t.co/6KEXHjDT85"""
Entrepreneur,1254063884887117825,2020-04-25 15:05:04,b'Minority-Owned Small Businesses Need Stimulus Loans the Most. They May Finally Get Some. https://t.co/5gZofqIkqk'
