Entrepreneur,1266853151791087617,2020-05-30 22:05:03,b'How to Lead in the Face of Doubt https://t.co/CowdvHlrqE'
Entrepreneur,1266848926172356612,2020-05-30 21:48:15,"b'For businesses in the midst of their reopening plans, Bob Prosen will discuss the most important things to communic\xe2\x80\xa6 https://t.co/oSfXSh68mf'"
Entrepreneur,1266838052808339457,2020-05-30 21:05:03,b'Ready for Summer? Here are 8 Beachy Business Reads. https://t.co/vSjl324bio'
Entrepreneur,1266822957835436034,2020-05-30 20:05:04,b'5 Things You Can Do Right Now to Prepare for the Post-Coronavirus Business World https://t.co/t9mXCvRlf2'
Entrepreneur,1266807863470624769,2020-05-30 19:05:05,b'4 Surprising Silver Linings to COVID-19 https://t.co/xVOmIso0w6'
Entrepreneur,1266792765519802370,2020-05-30 18:05:05,"b""How New York's Legendary Grimaldi's Pizzeria Adapted to the Crisis https://t.co/HvJAqFtLPo"""
Entrepreneur,1266777659327078401,2020-05-30 17:05:04,b'15 Work Apps That Can Help You Run Your Company Better https://t.co/zLc4ZWrm0f'
Entrepreneur,1266762568514797574,2020-05-30 16:05:06,b'Why You Should Bet On the Future of Ecommerce https://t.co/69kzFjf4vr'
Entrepreneur,1266747458220109825,2020-05-30 15:05:03,b'6 Cybersecurity Must-Haves for Your Business https://t.co/CXYoTdtzQY'
Entrepreneur,1266732361326174209,2020-05-30 14:05:04,b'How Remote Education Is Evolving During the Crisis https://t.co/NgfRFc6N8X'
Entrepreneur,1266717263404707842,2020-05-30 13:05:04,b'Will Remote-Work Policies Lead to a Bay Area Exodus? (Infographic) https://t.co/YWdByW9vQw'
Entrepreneur,1266702166301032448,2020-05-30 12:05:05,"b'The 3 Most Dangerous Words In Entrepreneurship: ""This Is Impossible"" https://t.co/C3mAGVOi01'"
Entrepreneur,1266687060078923778,2020-05-30 11:05:03,b'Free Webinar | June 1: Franchise Bible: Technology Enabled Franchise Systems https://t.co/rjTjfRCmoJ'
Entrepreneur,1266566269064667137,2020-05-30 03:05:04,b'Dr. Adam Splaver Has Your Prescription For Freedom | by @MikeKoenigs https://t.co/GNkTvEnysw'
Entrepreneur,1266551159847817216,2020-05-30 02:05:02,b'7 Methods to Maximize Your Decision-Making | by @TannerSimkins https://t.co/be6YxGoZfg'
Entrepreneur,1266536065613037569,2020-05-30 01:05:03,b'How to Effectively Communicate to Your Organization in Turbulent Times | by @eagles__flight https://t.co/3fxNE5Dzng'
Entrepreneur,1266520966135455744,2020-05-30 00:05:03,b'Learn how to use technology to improve your business model and hear about how other business owners are implementin\xe2\x80\xa6 https://t.co/xxAPwA1t52'
Entrepreneur,1266505863075893249,2020-05-29 23:05:02,b'How Brick-and-Mortar Stores Can Move Online in a Hurry | by @tpopomaronis https://t.co/ghqT42od6t'
Entrepreneur,1266490769067651072,2020-05-29 22:05:04,b'10 Reasons the Stock Market Will Likely Crash Again | by @oliverzok https://t.co/hPsCpedfpf'
Entrepreneur,1266475672895094788,2020-05-29 21:05:05,b'How Leaders Can Remotely Create a Strong Workplace Culture | by @johnrampton https://t.co/8wMYHaSmUr'
Entrepreneur,1266470644805439489,2020-05-29 20:45:06,b'Follow These 6 Steps to Bulletproof Your Digital Business Strategy | by @bzimmatore https://t.co/CCNwzBFfWi'
Entrepreneur,1266464264342196225,2020-05-29 20:19:45,b'RT @jeffbonaldi: Check out my new article in Entrepreneur Magazine at the link below!\n\nI am big believer that we need to align what we are\xe2\x80\xa6'
Entrepreneur,1266460567323250690,2020-05-29 20:05:03,b'How to Reward Employees in Uncertain Times | by @jboitnott https://t.co/W0fUHnEb2N'
Entrepreneur,1266454060187766784,2020-05-29 19:39:12,b'The SBA Gives $6.8 Billion in PPP to Business Owners of Color | by @FrancesDodds1 https://t.co/2skC3tb0sr'
Entrepreneur,1266453018649808901,2020-05-29 19:35:03,"b""A Navy SEAL's Guide to Thriving in Close Quarters, Part 4: Opportunity | by @aldenmills https://t.co/zj4VXYpAWJ"""
Entrepreneur,1266444561557016576,2020-05-29 19:01:27,b'Need a mentor? Book a session with @dustinmathews today! https://t.co/xG38g29xAe https://t.co/ylGjU5MK08'
Entrepreneur,1266437923211280384,2020-05-29 18:35:04,b'This Handy Wand Adds Another Line of Defense Against Germs https://t.co/gvQ0my3doe'
Entrepreneur,1266432350273056768,2020-05-29 18:12:56,b'The Future of Work is here to stay. Entrepreneur NEXT powered by @hireassemble allows businesses to quickly scale u\xe2\x80\xa6 https://t.co/rec65KuYT4'
Entrepreneur,1266414390506663943,2020-05-29 17:01:34,b'Smart Ways to Save and Make Money Amid Challenging Times (Sponsored by @PitneyBowes) https://t.co/H4sSW2TI3B'
Entrepreneur,1266402922465767425,2020-05-29 16:16:00,"b'RT @EntBooks: ""The Business Owner\'s Guide to Financial Freedom"" by @markkohler reveals the secrets behind successfully investing in your bu\xe2\x80\xa6'"
Entrepreneur,1266402691003101185,2020-05-29 16:15:04,b'Every Government Agency Has Become an Entrepreneur | by @jonathonende https://t.co/J3QiBhaFmY'
Entrepreneur,1266384221213528064,2020-05-29 15:01:41,"b'In this free webinar with @DocuSign, learn how the right technology can not only sustain but grow your business dur\xe2\x80\xa6 https://t.co/G18QNwlRPv'"
Entrepreneur,1266373312684285954,2020-05-29 14:18:20,b'Tesla CEO Elon Musk Gets $700 Million in First Performance-Based Payout | by @mariella_moon https://t.co/NLTmem0IQF'
Entrepreneur,1266369580865253382,2020-05-29 14:03:30,"b""Twitter Slapped a 'Glorifying Violence' Label on a Trump Tweet That Threatened George Floyd Protesters in Minneapol\xe2\x80\xa6 https://t.co/SryDHh0eu1"""
Entrepreneur,1266354890865065985,2020-05-29 13:05:08,b'Free Webinar | June 2: Everything You Need to Know to Get Your Business Reopened Safely and Profitably https://t.co/A4r0ZELhUl'
Entrepreneur,1266215199671009282,2020-05-29 03:50:03,"b'An Exercise-Bike Company and At-Home ""Botox"" Business Had Nothing in Common - Until They Did https://t.co/OF0BHONmaZ'"
Entrepreneur,1266197580649762816,2020-05-29 02:40:02,b'8 Things To Keep In Mind Before Your First Upwork Assignment https://t.co/5b0zKUklC8'
Entrepreneur,1266181222046339073,2020-05-29 01:35:02,"b'Finally, a Tool That Seamlessly Imports Google Docs to WordPress Without Ditching the Formatting https://t.co/TZ4U1Bt2Bp'"
Entrepreneur,1266163605046792193,2020-05-29 00:25:02,b'Why a Strong Mindset is the Foundation of a Successful Entrepreneurial Career | by @jennspencer21 https://t.co/8sme53R7W5'
Entrepreneur,1266143482571341824,2020-05-28 23:05:04,b'3 Marketing and Customer Experience Trends That Are Transforming Manufacturing | by @alpmimar https://t.co/W6CwdxbkQW'
Entrepreneur,1266129639623266304,2020-05-28 22:10:04,b'5 Things Business Leaders Hate (And How to Deal With Them) | by @TannerSimkins https://t.co/1OgSh6EDqa'
Entrepreneur,1266115797946175488,2020-05-28 21:15:04,b'Innovative Steps Startups Are Taking to Reduce App Costs and Detect Fake Accounts | by @vcsamuelson https://t.co/AgvdZ5YHn3'
Entrepreneur,1266103211074740227,2020-05-28 20:25:03,b'4 Ways Founders Can Build Their Social Media Presence | by @lawofambition https://t.co/1wMqR0DXIK'
Entrepreneur,1266089479988809730,2020-05-28 19:30:29,b'Use promo code INSIDERVIP and get a 1-year digital subscription to Entrepreneur magazine for only $1! (U.S. only)\xe2\x80\xa6 https://t.co/yy0j5fq64L'
Entrepreneur,1266084341781803008,2020-05-28 19:10:04,b'7 Side Hustles That Pay $150 Per Hour | by @jjeffrose https://t.co/99PxDPlbJK'
Entrepreneur,1266080921826009093,2020-05-28 18:56:29,b'1. Have a hashtag strategy.\n2. Organic data can inform paid social.\n3. Run Facebook Ads.\n4. Swipe up link at 10K fo\xe2\x80\xa6 https://t.co/dyg8nxgF96'
Entrepreneur,1266075528886452224,2020-05-28 18:35:03,"b'Is Your Marketing Failing the ""Trudge to the Bathroom"" Test? | by @neilcanhelp https://t.co/ykW6W0bUxf'"
Entrepreneur,1266069250315366400,2020-05-28 18:10:06,b'Will Remote-Work Policies Lead to a Bay Area Exodus? (Infographic) | by @jlthoms https://t.co/NvHQH8jm2H'
Entrepreneur,1266066799415758849,2020-05-28 18:00:22,"b'RT @carlosgil83: While opportunities may be limited or in different industries than you usually work with, many businesses still need your\xe2\x80\xa6'"
Entrepreneur,1266064509132816384,2020-05-28 17:51:15,b'Angela Duckworth and Andy Puddicombe are ready to share their advice. Join us to hear strategies for developing gri\xe2\x80\xa6 https://t.co/YiUXpQx3rh'
Entrepreneur,1266054142931406853,2020-05-28 17:10:04,"b'The What, Why and How of Programmatic Advertising (and 5 Tips on Using It) | by @Harry_Kab https://t.co/baz3pDAKKA'"
Entrepreneur,1266043675928338439,2020-05-28 16:28:28,b'Apple Will Reportedly Team Up With Martin Scorsese on a $180 million Movie https://t.co/T8xwHh3AtX'
Entrepreneur,1266039022071296002,2020-05-28 16:09:59,"b'Amazon Just Launched a Major Video Game, But It Looks to Already Be a Major Flop https://t.co/s4ucIVTWmS'"
Entrepreneur,1266032983049474049,2020-05-28 15:45:59,"b""It Looks Like Trump's Draft Executive Order Targeting Facebook and Twitter Got Leaked Online | by @shonaghosh https://t.co/3y9K5wJHOZ"""
Entrepreneur,1266029330817339393,2020-05-28 15:31:28,"b'Last chance to join today\'s free webinar, ""It\'s Never Too Late: How to Start Your Own Business at Any Age."" Starts\xe2\x80\xa6 https://t.co/FRq7hOOFnC'"
Entrepreneur,1266026612715372551,2020-05-28 15:20:40,b'Giannis Antetokounmpo (@Giannis_An34) Has Put His Money Where His Message Is | by @KennyHerzog https://t.co/ThN5TheWcY'
Entrepreneur,1266022701187153920,2020-05-28 15:05:08,b'The Work-From-Home Era Is the Perfect Time to Start Your Cloud-Computing Career | by @KanikaTolver https://t.co/SEpS1MmkPD'
Entrepreneur,1266021392295886848,2020-05-28 14:59:56,b'3 Ways This Small Business Is Surviving\xe2\x80\x94and Thriving\xe2\x80\x94During the Health Crisis (Sponsored by @squarespace) https://t.co/t40hvHZY9k'
Entrepreneur,1266010122549170176,2020-05-28 14:15:09,b'Former UFC Champion Tito Ortiz on Overcoming Drug Addiction and His Toughest Opponents | by @davidmeltzer https://t.co/PCGncJ7enn'
Entrepreneur,1265991362740211713,2020-05-28 13:00:36,"b'The 3 Most Dangerous Words In Entrepreneurship: ""This Is Impossible"" | by @heyfeifer https://t.co/G1ixldL4Ya'"
Entrepreneur,1265854067718475777,2020-05-28 03:55:02,b'8 Books to Help Plan Your Next Steps as a Leader https://t.co/cvydEWLwFt'
Entrepreneur,1265836450039435272,2020-05-28 02:45:02,b'5 Personal-Finance Mistakes That Kill Promising Companies https://t.co/HfSAKy9Gdh'
Entrepreneur,1265813802341326850,2020-05-28 01:15:02,"b'When Negotiating Term Sheets, How Much Is Too Much? | by @_AlexGold https://t.co/EpcTkjoRMW'"
Entrepreneur,1265803736254988300,2020-05-28 00:35:02,b'20 Hidden Sources of Income Lying Around Your House | on @LiveRicher https://t.co/IdXH9xReo7'
Entrepreneur,1265796189477310466,2020-05-28 00:05:03,b'8 Ways to Grow Your Audience to a Million Followers | by @oliverzok https://t.co/ZScfvXFFqY'
Entrepreneur,1265784859940859905,2020-05-27 23:20:02,b'9 Strategies To Build An Employee-First Culture | by @AngeKYoumatter https://t.co/BNLv8UboRM'
Entrepreneur,1265765991839039489,2020-05-27 22:05:03,"b""We've Been Talking About the Tech Skills Gap for 10 Years. Why Hasn't the Conversation Gotten Any More Productive?\xe2\x80\xa6 https://t.co/QCPEe4x1ro"""
Entrepreneur,1265759696381673472,2020-05-27 21:40:02,b'5 Ways HR Leaders Can Engage and Empower Hourly Workers | by @mynameisdesmond https://t.co/PMaEYUEbql'
Entrepreneur,1265738314327482368,2020-05-27 20:15:05,"b'Why Brands are Ditching Their Agencies for New, High-Growth, Venture-Backed Business Models https://t.co/x9I0aJSNHG'"
Entrepreneur,1265732355395858433,2020-05-27 19:51:24,"b""On today's episode of #HowSuccessHappens with @roberttuchman, Suri Kasirer discusses building @kasirernyc, the numb\xe2\x80\xa6 https://t.co/FJKsD7VaTJ"""
Entrepreneur,1265731786434379777,2020-05-27 19:49:08,b'RT @aldenmills: Check out my latest Entrepreneur Article to learn how to engage with teammates and build bonds that make us unstoppable. ht\xe2\x80\xa6'
Entrepreneur,1265727019226206209,2020-05-27 19:30:12,b'Improving Productivity for Remote and Distributed Work Forces | by @sethaelliott https://t.co/DNnHh7IJFP'
Entrepreneur,1265721643340566529,2020-05-27 19:08:50,b'Focus on nurturing the long-term relationship with your customers. Identify where you can help your customers today\xe2\x80\xa6 https://t.co/rZgfiAuFhP'
Entrepreneur,1265717108358422528,2020-05-27 18:50:49,"b'Join tomorrow\'s free webinar, ""It\'s Never Too Late: How to Start Your Own Business at Any Age."" Register here:\xe2\x80\xa6 https://t.co/rKsUFHg5cz'"
Entrepreneur,1265708116668268546,2020-05-27 18:15:05,b'Podcasts as Practice | by @HowardDvorkin https://t.co/qLfXv1nDgJ'
Entrepreneur,1265698901601943552,2020-05-27 17:38:28,"b""In this free webinar with @NetSuite, Kara Goldin, the founder and CEO of Hint, explains how her company's culture o\xe2\x80\xa6 https://t.co/WnHJfCflH2"""
Entrepreneur,1265690496183255040,2020-05-27 17:05:04,b'Is The Air In Your Home Making You Stupid? You Might Be Surprised. | by @benangel https://t.co/VnwGkuienv'
Entrepreneur,1265682945391710216,2020-05-27 16:35:04,"b""Everyone Should Have an Emergency Kit. This One's on Sale. https://t.co/9mhBbmbAuu"""
Entrepreneur,1265670368964067336,2020-05-27 15:45:05,"b""HBO Max Is Available Today. Here's What You Need to Know. https://t.co/2qEx21iDqU"""
Entrepreneur,1265665409845510144,2020-05-27 15:25:23,"b""That Money Network Envelope Isn't Spam; It's Your Stimulus Debit Card | by @KennyHerzog https://t.co/Gvxt9EdhAa"""
Entrepreneur,1265662825718067200,2020-05-27 15:15:07,"b""5 Ways to Discover Your Blog Readership's Most Pressing Questions | by @tpopomaronis https://t.co/s6Nq9g4qNm"""
Entrepreneur,1265661308290113536,2020-05-27 15:09:05,"b""6 Ways to Watch SpaceX's Historic First Rocket Launch of NASA Astronauts Live Online https://t.co/ZOz9l1BCKJ"""
Entrepreneur,1265645198413115392,2020-05-27 14:05:04,"b""Why This Entrepreneur Treats His Ego Like a Speaker System's Volume | by @davidmeltzer https://t.co/WFAICMc7s8"""
Entrepreneur,1265627545631932427,2020-05-27 12:54:55,"b""Learn Today's Best Social Media Practices with This $30 Bundle https://t.co/6kGQVNSP73"""
Entrepreneur,1265489161190019072,2020-05-27 03:45:02,b'This $25 Bundle Can Help Prepare You for a Career in Project Management https://t.co/qdYQsSYOkb'
Entrepreneur,1265471548032462849,2020-05-27 02:35:03,b'33 Inspiring Quotes About Achieving Your Dreams as an Entrepreneur https://t.co/RTXIYlF1Hy'
Entrepreneur,1265451416686125058,2020-05-27 01:15:03,"b""'The 7 Habits of Highly Effective People' Update: A Win-Win Is Always The Best Negotiating Strategy https://t.co/la6tUyUldp"""
Entrepreneur,1265433797748756480,2020-05-27 00:05:02,b'3 Keys to Growing Sales and Views on YouTube | by @brendangahan https://t.co/rI1Wp4vQqa'
Entrepreneur,1265426254804770818,2020-05-26 23:35:04,b'5 Things You Can Do Right Now to Prepare for the Post-Coronavirus Business World https://t.co/t9mXCvRlf2'
Entrepreneur,1265411150382018561,2020-05-26 22:35:03,"b""The No. 1 Mistake I've Seen Promising Startups Make | by @stuallard https://t.co/tQj4BNlVLk"""
Entrepreneur,1265403602778144769,2020-05-26 22:05:03,"b""During Uncertain Times, Your Startup Should be a Camel, Not a Unicorn. Here's How to Be Prepared. | by @Alex_Lazarow https://t.co/Red2QAdDdR"""
Entrepreneur,1265397987565539329,2020-05-26 21:42:44,"b'While it\xe2\x80\x99s natural to feel unsure of the future right now, digital solutions and business processes are helping SMB\xe2\x80\xa6 https://t.co/Kp9X5WAJHR'"
Entrepreneur,1265392275196121091,2020-05-26 21:20:02,b'3 Tips for Maximizing Customer Relationships | by @actonsoftware https://t.co/uBds4ZfYpU'
Entrepreneur,1265387644512583681,2020-05-26 21:01:38,b'This webinar will provide action strategies to help you launch your own small enterprise at any age. Register here:\xe2\x80\xa6 https://t.co/hpgZ34Uqyf'
Entrepreneur,1265381847380430848,2020-05-26 20:38:36,b'How does a brand that is known predominantly as a magazine not only maintain but thrive in a digital age? Listen to\xe2\x80\xa6 https://t.co/61aaQCgx8A'
Entrepreneur,1265373408495390720,2020-05-26 20:05:04,b'5 Ways This Crisis Is Changing Venture Capital Investment Strategy | by @pritomrocker https://t.co/6J6krN3TkU'
Entrepreneur,1265368379474554882,2020-05-26 19:45:05,"b""Learn 2020's Most Important Digital Marketing Skills in This $35 Course https://t.co/O5enwsY6GB"""
Entrepreneur,1265358309932044290,2020-05-26 19:05:04,b'How to Start a Limited Liability Company (LLC) | by @myseosucks https://t.co/KRvtw3r7BF'
Entrepreneur,1265356968337735680,2020-05-26 18:59:45,"b'Many entrepreneurs have pivoted online, offering new digital services in order to keep their business afloat. Now w\xe2\x80\xa6 https://t.co/1EaTuKSNwq'"
Entrepreneur,1265348239848603651,2020-05-26 18:25:04,b'3 Nonprofit Funding Avenues All Founders Should Know About | by @CreditSuite1 https://t.co/iOnNYasSDb'
Entrepreneur,1265344565277573121,2020-05-26 18:10:27,"b'Last chance to join today\'s free webinar, ""Money-Saving Efficiency Strategies for Your Business."" Starts at 3 p.m.\xe2\x80\xa6 https://t.co/YFTvE2Yn3d'"
Entrepreneur,1265343204800565249,2020-05-26 18:05:03,b'How to Make Instagram Your Not-So-Secret Sales Weapon | by @EchelonCopy https://t.co/6gAF4iJu01'
Entrepreneur,1265338174433366016,2020-05-26 17:45:04,"b""Here's the final update of our long-running list of publicly traded companies who returned their PPP loans.  https://t.co/fVa4UvWRhp"""
Entrepreneur,1265332112443543554,2020-05-26 17:20:58,"b""During tomorrow's webinar with @salesforce, Salesforce exec Tiffani Bova will answer the top 10 most common questio\xe2\x80\xa6 https://t.co/6MavUSphCq"""
Entrepreneur,1265329365019250688,2020-05-26 17:10:03,b'How to Lead in the Face of Doubt | by @ThomasHEdwards https://t.co/RdbQHlIwFj'
Entrepreneur,1265320555160506368,2020-05-26 16:35:03,b'The Top 5 Ways to Close a Deal | by @TannerSimkins https://t.co/6HHNmisQ0G'
Entrepreneur,1265313016087826437,2020-05-26 16:05:06,b'Why Did This 17-Year-Old Turn Down $8 Million for His Coronavirus-Tracking Website? | by @GeneMarks https://t.co/e6qYedKq9x'
Entrepreneur,1265304839409545216,2020-05-26 15:32:36,b'How Well Do You Know Your Own Freight Agency? (Sponsored by @LandstarSystem) https://t.co/xTwDiECjG3'
Entrepreneur,1265300431108014083,2020-05-26 15:15:05,"b""Improve Any Team's Online Communication with These 3 Military Email Protocols https://t.co/4SOeqn7dsc"""
Entrepreneur,1265297696597966849,2020-05-26 15:04:13,b'6 Cybersecurity Must-Haves for Your Business | by @TannerSimkins https://t.co/fKj9bJSb6C'
Entrepreneur,1265291816255004672,2020-05-26 14:40:51,"b'Develop more clarity about how you can better serve your customers, create a strategy to do so, and set it into mot\xe2\x80\xa6 https://t.co/ninEDQ3NFL'"
Entrepreneur,1265290406079668225,2020-05-26 14:35:15,b'4 Surprising Silver Linings to COVID-19 | by @oliverzok https://t.co/xVOmIso0w6'
Entrepreneur,1265270234774212610,2020-05-26 13:15:06,b'5 Games to Play on Your Next Virtual Happy Hour https://t.co/ehqjWgChwn'
Entrepreneur,1265252615484592128,2020-05-26 12:05:05,b'5 Tips for Hiring and Team Building Remotely | by @jenlfitzgerald https://t.co/UVRJHPS71u'
Entrepreneur,1265237511753924608,2020-05-26 11:05:04,b'15 Work Apps That Can Help You Run Your Company Better | by @anthony_ejiofor https://t.co/zLc4ZWrm0f'
Entrepreneur,1265116707833688072,2020-05-26 03:05:02,b'Never forget the basics. https://t.co/XP8OgoAXEZ'
Entrepreneur,1265101606976131072,2020-05-26 02:05:02,b'Why Every Franchise Should Pivot Right Now https://t.co/w0vr1F7bpS'
Entrepreneur,1265086510346493953,2020-05-26 01:05:02,b'6 Predictions for How This Crisis Will Impact Small Businesses Long-Term https://t.co/XYeNeYopDv'
Entrepreneur,1265071409803509761,2020-05-26 00:05:02,b'12 Things First-Time Leaders Need to Succeed https://t.co/9WyKhN0vqi'
Entrepreneur,1265056316395008002,2020-05-25 23:05:04,b'Older Workers Must Be Proactive About Their Future https://t.co/mYRvNGUFM4'
Entrepreneur,1265026113421676546,2020-05-25 21:05:03,b'10 TV Shows Every Entrepreneur Should Watch on Netflix https://t.co/A0sLmXtUya'
Entrepreneur,1265011018394148866,2020-05-25 20:05:04,b'The 5 Top-Ranked Franchises You Can Buy for as Little as 5 Figures https://t.co/e0gMUCmKtf'
Entrepreneur,1264995917855436803,2020-05-25 19:05:03,"b""45 Ways to Master Slack While You're Working From Home https://t.co/EeLFKtZkzF"""
Entrepreneur,1264988365541212161,2020-05-25 18:35:03,b'Ready for Summer? Here are 8 Beachy Business Reads. | by @TannerSimkins https://t.co/vSjl324bio'
Entrepreneur,1264980824430125056,2020-05-25 18:05:05,b'8 Books to Help You Grow During the Coronavirus Pandemic https://t.co/JAmg1E0SMc'
Entrepreneur,1264973270736125959,2020-05-25 17:35:04,b'26 Inspiring Quotes About Crisis Management and Teamwork from Military Veteran Entrepreneurs | by @DanBova1 https://t.co/3kwjsuodHI'
Entrepreneur,1264965732707840003,2020-05-25 17:05:07,"b'What Is the Planning Fallacy, and How Can You Avoid It? https://t.co/1hJnsDbupW'"
Entrepreneur,1264958166657314816,2020-05-25 16:35:03,b'5 Tips for Military Vets Transitioning Into a Remote Workforce or Business | by @sixfigurewriter https://t.co/XNQesmkUAd'
Entrepreneur,1264950632877903874,2020-05-25 16:05:07,"b'Entrepreneurs Are Prepared for Crisis, Whether They Know It or Not https://t.co/sYCLcc8bP7'"
Entrepreneur,1264943076721725441,2020-05-25 15:35:05,b'Need a New Workstation? HP is Slashing Prices on Laptops and More Right Now https://t.co/ARdGPiRMwm'
Entrepreneur,1264935542514487297,2020-05-25 15:05:09,b'What Freelancers Can Teach You About Keeping Your Skills Sharp https://t.co/GAiirZEtET'
Entrepreneur,1264927969967058945,2020-05-25 14:35:03,"b'Fight for Your Franchise Challenge, Week 8: No-Nonsense Techniques to Improve Your Cashflow https://t.co/JjMvlfWh1p'"
Entrepreneur,1264923908303699968,2020-05-25 14:18:55,"b'Join ""Franchise Bible"" author Rick Grossmann in tomorrow\'s free webinar, ""Money-Saving Efficiency Strategies for Yo\xe2\x80\xa6 https://t.co/Zw478KULoF'"
Entrepreneur,1264920442470612995,2020-05-25 14:05:09,b'4 Inspiring Ways Professional Communities Are Coping With Crisis https://t.co/yBr0oLhDsS'
Entrepreneur,1264916526022483974,2020-05-25 13:49:35,b'The business environment that you land in when the pandemic comes to an end may be very different from what it was\xe2\x80\xa6 https://t.co/QW3KTOcLIG'
Entrepreneur,1264913001804705795,2020-05-25 13:35:35,b'10 Apps on Sale for Memorial Day That Every Freelancer Needs https://t.co/4w7VpctymW'
Entrepreneur,1264905344213553158,2020-05-25 13:05:09,b'Want A Side Hustle? These 10 Franchises Can Be Run Part Time https://t.co/g2kImA3PdH'
Entrepreneur,1264890234501607426,2020-05-25 12:05:07,"b""Free Webinar | May 28: It's Never Too Late: How to Start Your Own Business at Any Age https://t.co/6Eb6dUFZpJ"""
Entrepreneur,1264882668761747457,2020-05-25 11:35:03,b'Secrets From a Navy SEAL on Courage During Crisis | by @CherylSnapp https://t.co/KpchNrX6Fq'
Entrepreneur,1264875124974587904,2020-05-25 11:05:04,b'Make a Personal Connection to Honor the Fallen This Memorial Day https://t.co/Fbxoqup8ov'
Entrepreneur,1264754320463015938,2020-05-25 03:05:02,b'How Sleep Can Help -- and Heal -- During This Really Weird Time https://t.co/i5HTXdThjy'
Entrepreneur,1264739220423421953,2020-05-25 02:05:02,b'Successful Leadership Tactics in a Time of Crisis https://t.co/hxCpiEnG6Y'
Entrepreneur,1264724122967343104,2020-05-25 01:05:03,"b'The 3-Step Strategy to Help You Determine Your Business Mission, Values and Goals https://t.co/FREsHLFCJi'"
Entrepreneur,1264709029135298562,2020-05-25 00:05:04,b'The Social Selling System: Flipping a Follower into a Client https://t.co/F8tIoUYWNc'
Entrepreneur,1264693922472906752,2020-05-24 23:05:02,b'10 Movies All Entrepreneurs Should Watch on Hulu https://t.co/ePfNfaUg0m'
Entrepreneur,1264678825859911688,2020-05-24 22:05:03,b'Packing and Shipping Companies Are More Important Than Ever. Here Are 5 of the Best You Can Buy. https://t.co/knpKaEbPsK'
Entrepreneur,1264671274216890369,2020-05-24 21:35:02,b'Can Marketing Be Compassionate? | by @davidmeltzer https://t.co/H5o5nqkOq9'
Entrepreneur,1264663724629123074,2020-05-24 21:05:02,b'How to Make Every Marketing Dollar Count During a Crisis https://t.co/Httevq1wdz'
Entrepreneur,1264656177163653121,2020-05-24 20:35:03,b'10 Work-from-Home Essentials on Sale for Memorial Day https://t.co/j5SVPnVn0Q'
Entrepreneur,1264648626866978818,2020-05-24 20:05:03,"b""Free Webinar | May 28: It's Never Too Late: How to Start Your Own Business at Any Age https://t.co/6Eb6dUooyb"""
Entrepreneur,1264641074384994309,2020-05-24 19:35:02,b'Is Your Content Marketing Strategy Falling Short? This $35 Bundle Can Help. https://t.co/wI2bB2ybnP'
Entrepreneur,1264633532292399106,2020-05-24 19:05:04,b'How Remote Education Is Evolving During the Crisis https://t.co/NgfRFc6N8X'
Entrepreneur,1264625974060232711,2020-05-24 18:35:02,"b""How New York's Legendary Grimaldi's Pizzeria Adapted to the Crisis https://t.co/FR5kV6hNGf"""
Entrepreneur,1264618430134616064,2020-05-24 18:05:03,b'SEO Needs to Be Part of Your PR Strategy https://t.co/h24ESZ9wkM'
Entrepreneur,1264616084478492683,2020-05-24 17:55:44,"b'In this webinar, ""Franchise Bible"" author Rick Grossmann focuses on a variety of operational strategies to improve\xe2\x80\xa6 https://t.co/UTamaiTwFX'"
Entrepreneur,1264612764733050881,2020-05-24 17:42:33,"b'While you can\xe2\x80\x99t predict what\xe2\x80\x99s coming with perfect certainty, you can develop more clarity about how you can better\xe2\x80\xa6 https://t.co/ft8BbsMOZL'"
Entrepreneur,1264610875467542535,2020-05-24 17:35:02,"b""If Coronavirus Is a War, Let's Do What the Military Does to Get Through It | by @johnpanaccione https://t.co/dbKZ8HgiVj"""
