Entrepreneur,1279129058547314689,2020-07-03 19:05:07,b'How to Build a Brand Story That Buyers Emotionally Connect With https://t.co/Bg4B65P7Au'
Entrepreneur,1279113958683795456,2020-07-03 18:05:07,"b'The 3 Most Dangerous Words In Entrepreneurship: ""This Is Impossible"" https://t.co/C3mAGVOi01'"
Entrepreneur,1279098869318639616,2020-07-03 17:05:09,b'7 Tips for Managing Workplace Disruption and Maximizing Remote Workers https://t.co/9IhbTIeRQQ'
Entrepreneur,1279084194371641352,2020-07-03 16:06:50,b'4 Fun Ways for Millennials to Dip Their Toes Into Investing https://t.co/DsUnEB2OWg'
Entrepreneur,1279078492399898625,2020-07-03 15:44:11,b'Book a mentoring session with business coach @AminaAlTai! https://t.co/IUMHZycD3d https://t.co/oo5otErfQJ'
Entrepreneur,1279068840169791488,2020-07-03 15:05:50,b'Why Your Next Failure Is Actually Your Secret Weapon https://t.co/Zs9iNAyZ6n'
Entrepreneur,1279053769758650369,2020-07-03 14:05:57,b'5 Things to Do to Transition Your Business From Partially Closed to Reopened https://t.co/ccVlJfK5i5'
Entrepreneur,1279045994047508482,2020-07-03 13:35:03,b'This Innovative Company Is Changing the Way Kids Practice Sports https://t.co/yfvmz8WSYL'
Entrepreneur,1279038793232850949,2020-07-03 13:06:26,b'3 Simple Things You Can Do to Help Your Business and Your Community at the Same Time https://t.co/vNG4ZbUGTF'
Entrepreneur,1279028280755212291,2020-07-03 12:24:39,b'10 Products on Sale for July 4th That You Will Use Every Day https://t.co/DAev4VgtIW'
Entrepreneur,1279023401320022016,2020-07-03 12:05:16,b'How the Best Entrepreneurs Combine Analytical and Emotional Instincts https://t.co/r4LpYEFHYt'
Entrepreneur,1279007834194292736,2020-07-03 11:03:25,"b""Don't overload your to-do list by running your #paidmedia. We've got the experts to do it for you, giving you more\xe2\x80\xa6 https://t.co/iUurcMNr71"""
Entrepreneur,1278901308163047426,2020-07-03 04:00:07,b'How to Hone and Harness Intuition in Your Career and Business | by @haleyhoffsmith https://t.co/QANfFxNiOa'
Entrepreneur,1278893745346412549,2020-07-03 03:30:04,b'Why Small Businesses Should Be Thinking (and Hiring) Globally During Covid-19 Isolation | by @BarrettAll https://t.co/kdcXTFuSRM'
Entrepreneur,1278886207901048832,2020-07-03 03:00:07,b'Free Webinar | July 27: How to Scale Your Training with Video and Learning Management Systems https://t.co/ZFfoturnjJ'
Entrepreneur,1278878645755547649,2020-07-03 02:30:04,b'Are You Open to Opposing Viewpoints? 3 Tips for Improving Critical Thinking. https://t.co/VIUfQbkps5'
Entrepreneur,1278871193618190337,2020-07-03 02:00:27,b'Theodore Roosevelt Was Wrong. Critics Do Count. by @stevenherz https://t.co/CL69ErMi7z'
Entrepreneur,1278863546667933696,2020-07-03 01:30:04,b'How Your Business Can Make Professional-Grade Videos on a Bootstrapped Budget | by @EchelonCopy https://t.co/qAGrRA3dFG'
Entrepreneur,1278856218807726080,2020-07-03 01:00:57,b'Everything Coming to HBO and HBO Max in July https://t.co/POYRl39Vgm'
Entrepreneur,1278848448314425347,2020-07-03 00:30:04,b'Free Webinar | July 20: Working with Co-Founders and Splitting Equity https://t.co/hH8d4vLadf'
Entrepreneur,1278841179480756227,2020-07-03 00:01:11,"b""The Headline That Made Gary Vaynerchuk's Head Explode | by @DanBova1 https://t.co/0GehuPu8Tx"""
Entrepreneur,1278833347129638912,2020-07-02 23:30:04,b'The Billion-Dollar Time Management Secret | by @PeterVoogd23 https://t.co/DTnewbKIjA'
Entrepreneur,1278826175662563331,2020-07-02 23:01:34,"b""How to Support Employees' Mental Health as You Return to the Office | by @jboitnott https://t.co/pcxaAZAcTE"""
Entrepreneur,1278822019572826113,2020-07-02 22:45:03,b'How to Craft An Elevator Pitch That Gives People Chills in Under 20 Seconds https://t.co/ccpMFXhVrk'
Entrepreneur,1278818253981339648,2020-07-02 22:30:05,b'Apple Has Now Re-Closed 77 Stores | by @mthwgeek https://t.co/6LWHIza9O8'
Entrepreneur,1278814468487643144,2020-07-02 22:15:03,"b""Required Masks, 'Peace of Mind Commitments' and Temperature Checks: What to Expect When Traveling This Summer | by\xe2\x80\xa6 https://t.co/l6ozrW78LP"""
Entrepreneur,1278811954107289603,2020-07-02 22:05:03,b'Facebook to Shutter TikTok Clone Lasso and Hobbi on July 10 https://t.co/ogGWeBZAA3'
Entrepreneur,1278796851320365056,2020-07-02 21:05:02,b'How to Boost Sales When Consumers are Spending Less | by @tpopomaronis https://t.co/p7mSMERKFD'
Entrepreneur,1278780900176728066,2020-07-02 20:01:39,b'PowerSetter Is Helping People Save Big on Their Electric Bills and Go Green https://t.co/A2jyV4mB9N'
Entrepreneur,1278758168982585344,2020-07-02 18:31:20,b'RT @roberttuchman: @craft_ventures Really enjoyed great insight from @jefffluhr on when people will actually be back at events. Great story\xe2\x80\xa6'
Entrepreneur,1278757914820386817,2020-07-02 18:30:19,"b'Working from Home with Toddlers? You Need This Fun, Educational App. | by @Entrepreneur https://t.co/lT9WrTtvFk'"
Entrepreneur,1278752604936441856,2020-07-02 18:09:13,"b'In this free webinar with @salesforce, learn how to anticipate expectations going forward and understand the tools\xe2\x80\xa6 https://t.co/yd4iZcSJdc'"
Entrepreneur,1278751062128840706,2020-07-02 18:03:05,"b'Fail Often, Fail Fast, Fail Cheap | by @davidmeltzer https://t.co/pus0vOVBEq'"
Entrepreneur,1278735910910263298,2020-07-02 17:02:53,b'Free Webinar | July 15: Finding Developers and Tech Talent https://t.co/Iq6A4kjfdV'
Entrepreneur,1278725673692139521,2020-07-02 16:22:12,b'Get a 1-year digital subscription to Entrepreneur magazine for only $1! Use promo code INSIDERVIP. (U.S. only)\xe2\x80\xa6 https://t.co/aaBPRK27vF'
Entrepreneur,1278723894703198209,2020-07-02 16:15:08,b'How to Provide Investor Updates the Right Way | by @_AlexGold https://t.co/HG51LGfr3T'
Entrepreneur,1278716752860344322,2020-07-02 15:46:45,"b""RT @garyvee: The Headline That Made Gary Vaynerchuk's Head Explode via @Entrepreneur @DanBova1 https://t.co/0GAM0zpdMM \n\nfunny headline, fu\xe2\x80\xa6"""
Entrepreneur,1278713856139894784,2020-07-02 15:35:15,b'Building a brand that customers love is a dream of almost every entrepreneur. Building a brand that is also a comme\xe2\x80\xa6 https://t.co/WthZybdENs'
Entrepreneur,1278705734151278594,2020-07-02 15:02:58,"b""Are You Ready to Start With Paid Media? Here's What You Need to Know. | by @Entrepreneur https://t.co/cikXHAxR10"""
Entrepreneur,1278691136962510848,2020-07-02 14:04:58,"b'Under the Hood with The Diesel Brothers: Big Fun, Big Trucks and Really Big Beards | by @DanBova1 https://t.co/MmjXqglAJe'"
Entrepreneur,1278660521319940096,2020-07-02 12:03:19,"b""Get access to one of the largest networks of top #experts. We'll hire the experts, you watch your #business grow wi\xe2\x80\xa6 https://t.co/K9su3IMl0j"""
Entrepreneur,1278523813743992832,2020-07-02 03:00:05,"b'Free Webinar | August 20: How to Find Ruthless Consistency: Refocus, Realign and Recommit Yourself for Results https://t.co/xhC8bcNKzf'"
Entrepreneur,1278508766225403905,2020-07-02 02:00:18,b'3 Strategies For Business Communication During Crisis | by @PritomRocker https://t.co/6pEaz2Zz0c'
Entrepreneur,1278493780363153408,2020-07-02 01:00:45,b'How Hiring Women and Moms Propels Economic Recovery | by @CherylSnapp https://t.co/eY4ns6cZuj'
Entrepreneur,1278478718093135872,2020-07-02 00:00:54,b'Free Webinar: Is My Idea Any Good? https://t.co/HsciYEznlX'
Entrepreneur,1278463676341727234,2020-07-01 23:01:07,b'Free Webinar: Nailing Your Competitive Advantage https://t.co/oRyVcdrzp7'
Entrepreneur,1278455866086342656,2020-07-01 22:30:05,b'The Tools You Need to Create a YouTube Recording Studio | by @jjeffrose https://t.co/eL90SgCzy1'
Entrepreneur,1278454605857292289,2020-07-01 22:25:05,"b'In this free webinar with @TriNet, hear from HR experts on the considerations to transition employees from traditio\xe2\x80\xa6 https://t.co/0du615MNc7'"
Entrepreneur,1278433666834804738,2020-07-01 21:01:52,b'Looking Back and Looking Forward: The Navigation of a Crisis for a Small Business https://t.co/Hn8rJkECCR'
Entrepreneur,1278418678980149250,2020-07-01 20:02:19,"b""Who Are Your 'Friends'? Inclusive Leadership Starts With Your Social Circles https://t.co/XxvIg1tqWC"""
Entrepreneur,1278412396575457281,2020-07-01 19:37:21,"b'When will fans be allowed back into events and what will events even look like going forward? @jefffluhr, the found\xe2\x80\xa6 https://t.co/LDvr1SCopb'"
Entrepreneur,1278410573303164928,2020-07-01 19:30:07,b'Has There Been $1 Billion in PPP Fraud? | by @FrancesDodds1 https://t.co/KMSSZ3xtkY'
Entrepreneur,1278404273420800000,2020-07-01 19:05:05,"b'Accessibility should be an essential element of your website. If you need help with building a better website, the\xe2\x80\xa6 https://t.co/GnvHLQAm2W'"
Entrepreneur,1278388424135913474,2020-07-01 18:02:06,b'A Portable UV-C Case Can Disinfect Your Phone and Small Belongings | by @Entrepreneur https://t.co/KSydQPPRLc'
Entrepreneur,1278373775919271938,2020-07-01 17:03:53,b'Supercharge Your Marketing with a Great Deal on This Award-Winning Adobe Lightroom Alternative | by @Entrepreneur https://t.co/Xc6P7t1GyY'
Entrepreneur,1278366863739817984,2020-07-01 16:36:25,b'5 Tips for Landing Your First Bank Loan (Sponsored by @usbank) https://t.co/gsuxWVBsgs'
Entrepreneur,1278343512019406848,2020-07-01 15:03:38,b'The Next Normal for Private Company Governance https://t.co/KIm0zS2gXW'
Entrepreneur,1278331294699659264,2020-07-01 14:15:05,b'A Brief Guide to Letting Black Entrepreneurs Be Entrepreneurs | by @MarySpio https://t.co/FKcPiDhWAn'
Entrepreneur,1278313985109037056,2020-07-01 13:06:18,"b'Join today\'s free webinar, ""How to Get to Market Fast and \'Lean\' \xe2\x80\x93 Developing Your MVP!"" Starts at 3 p.m. EDT. Regi\xe2\x80\xa6 https://t.co/RMuiIBEJaG'"
Entrepreneur,1278304957276585992,2020-07-01 12:30:26,"b""Your paid media should capture the viewer's attention and achieve the desired action. Let the Entrepreneur NEXT exp\xe2\x80\xa6 https://t.co/NNnd5ZhYHu"""
Entrepreneur,1278298716424863744,2020-07-01 12:05:38,b'14 Cheap Ways To Invest In Your Health | on @GOBankingRates https://t.co/1IUlMxnOSg'
Entrepreneur,1278116360460042242,2020-07-01 00:01:01,b'I Went to Prison for SBA Loan Fraud: 7 Things to Know When Taking COVID-19 Relief Money https://t.co/253GQIRwao'
Entrepreneur,1278090228193005569,2020-06-30 22:17:10,b'Register for this free webinar with @NetSuite and get inside information on what it takes to build a brand that cus\xe2\x80\xa6 https://t.co/LWDetVamWL'
Entrepreneur,1278078378667585541,2020-06-30 21:30:05,"b'What Is Empathy, and Why Is It So Important for Great Leaders? | by @MWMcCreary https://t.co/3JZfybsm1H'"
Entrepreneur,1278063281505173504,2020-06-30 20:30:06,b'3 Key Things Companies Need to Consider About Stock Options Right Now https://t.co/6freelPt9Q'
Entrepreneur,1278051142640025601,2020-06-30 19:41:52,"b'On today\xe2\x80\x99s episode of #HabitsandHustle with @therealjencohen, @kerrileewalsh discusses having her husband as her co\xe2\x80\xa6 https://t.co/sIuSvTEOhr'"
Entrepreneur,1278048196095328259,2020-06-30 19:30:09,b'What It Takes to Launch a Successful Online Clothing Brand in 2020 https://t.co/umKmz9Jft8'
Entrepreneur,1278033125713629185,2020-06-30 18:30:16,b'Why Being Persuasive Is More Important than Having a Great Idea | by @aytekintank https://t.co/GisD9zTVjz'
Entrepreneur,1278029300072054788,2020-06-30 18:15:04,"b'As Pride Month Ends, Here Are 3 Ways To Continue Supporting The LGBTQ+ Community https://t.co/yUQmNPhZ0Y'"
Entrepreneur,1278026153505292288,2020-06-30 18:02:34,b'This $35 Bundle Can Teach You the Skills to Become a Successful Leader | by @Entrepreneur https://t.co/VouGmg0IHa'
Entrepreneur,1278020697995063297,2020-06-30 17:40:53,b'Gen Z Considers This Benefit More Important Than Salary | by @FrancesDodds1 https://t.co/0OUbQjkyCY'
Entrepreneur,1278018042501480455,2020-06-30 17:30:20,b'5 Public Space Companies to Invest in Over the Next Decade | by @oliverzok https://t.co/63xsXHWUbV'
Entrepreneur,1278011246076403712,2020-06-30 17:03:20,"b""Success Doesn't Happen Overnight | by @davidmeltzer https://t.co/gJWyfARl1O"""
Entrepreneur,1278008332654084102,2020-06-30 16:51:45,b'Your achievements deserve recognition! Submit a nomination to the 2020 International Business Awards\xc2\xae by the\xe2\x80\xa6 https://t.co/93MNZpz87G'
Entrepreneur,1278003043494252548,2020-06-30 16:30:44,b'5 Myths About Successful Franchisees | by @GreenbergScott https://t.co/94xHTOT5CH'
Entrepreneur,1277987924949307393,2020-06-30 15:30:39,b'How to Lessen Loneliness and Boost Belonging at Work | by @theRyanJenks https://t.co/7UFLpNhvc8'
Entrepreneur,1277981143367692292,2020-06-30 15:03:42,b'How to Fight Learned Helplessness at Work | by @johnrampton https://t.co/mAxMSawGw3'
Entrepreneur,1277966659727134722,2020-06-30 14:06:09,"b'Got an amazing business idea, but unsure as to how to turn it into a functioning enterprise? Join our live webinar\xe2\x80\xa6 https://t.co/SlZBUgQIUX'"
Entrepreneur,1277957758923485185,2020-06-30 13:30:47,b'4 Lessons Entrepreneurs Can Learn From Filmmakers | by @jennspencer21 https://t.co/MZmnIIaT0C'
Entrepreneur,1277953816499978240,2020-06-30 13:15:07,"b""Free Webinar w/ @salesforce: How to Future-Proof Your Business and Prepare for the New 'Normal' https://t.co/PzgGfbeJne"""
Entrepreneur,1277951610229084162,2020-06-30 13:06:21,"b'Join Peter Merriman, one of Hawaii\'s most prominent restaurateurs, for today\'s free webinar, ""How Can Restaurants T\xe2\x80\xa6 https://t.co/dVxOppKwU9'"
Entrepreneur,1277810352600875010,2020-06-30 03:45:03,b'This Expert Guide to Building a Professional-Quality WordPress Site Is Just $30 https://t.co/HKtDQJA8aT'
Entrepreneur,1277769009866444800,2020-06-30 01:00:46,b'5 Ways the Cloud Can Benefit Your Business During the Pandemic https://t.co/03yC9zEmau'
Entrepreneur,1277754987163107329,2020-06-30 00:05:03,b'Roofstock Is Making Investing in Property Possible for Millennials https://t.co/tdf4Ms0Wwx'
Entrepreneur,1277738963684466689,2020-06-29 23:01:22,b'5 Tips for Landing Your First Bank Loan https://t.co/KxmRhC27ao'
Entrepreneur,1277731091995152384,2020-06-29 22:30:06,b'50 Things You Need to Succeed in the Perpetually Changing World of Modern Finance https://t.co/eCt3OjQj4g'
Entrepreneur,1277716946503557123,2020-06-29 21:33:53,"b'In this free webinar with @TriNet, hear from HR experts on what the ongoing COVID-19 landscape could mean for SMBs.\xe2\x80\xa6 https://t.co/TnxlmOedCx'"
Entrepreneur,1277715996908929024,2020-06-29 21:30:07,b'How the Behavior of Job-Seekers Has Changed Since February (Infographic) | by @jlthoms https://t.co/72u6GrRNqK'
Entrepreneur,1277709687882944513,2020-06-29 21:05:02,b'Perfect Your Photography Skills with 20 Online Courses for $40 https://t.co/mAPaRR4X5S'
Entrepreneur,1277700900291821570,2020-06-29 20:30:07,b'Free Webinar | July 23: How to Build a Successful Brand App https://t.co/hlz33TNnza'
Entrepreneur,1277697109299531777,2020-06-29 20:15:03,"b'Starbucks, Coca-Cola, Diageo Join Major Companies Pausing or Pulling Back on Facebook and Social Media Ads | by\xe2\x80\xa6 https://t.co/yFWOczhgWQ'"
Entrepreneur,1277693786882277382,2020-06-29 20:01:51,b'How to Kickstart Your Capital Funding https://t.co/2BZIp2el46'
Entrepreneur,1277689022391791617,2020-06-29 19:42:55,b'RT @jwfell: Is your brand memorable? https://t.co/JPB7EnuIKE w/ @Sync'
Entrepreneur,1277685810633101312,2020-06-29 19:30:10,"b'5 Steps on How to Start a Business and Get It to Market, Quick and Lean https://t.co/hK7bP5zfeD'"
Entrepreneur,1277685331211550720,2020-06-29 19:28:15,"b""In today's episode of #ProblemSolvers with @heyfeifer, hear the stories of four entrepreneurs who rethought their b\xe2\x80\xa6 https://t.co/gHqEgYePpN"""
Entrepreneur,1277663773013225472,2020-06-29 18:02:35,"b""This Highly-Rated App Gives You A Personalized Health and Fitness Plan and It's On Sale https://t.co/2asr1dmSZo"""
Entrepreneur,1277659359091326979,2020-06-29 17:45:03,"b""Former FBI Agent's Call to Entrepreneurs and Business Leaders: Love Is the Cure for Social Injustice https://t.co/dMejAsy70M"""
Entrepreneur,1277655691340193797,2020-06-29 17:30:29,"b'How the Crisis is Changing Consumer Behavior, and How Entrepreneurs Can Act on It | by @jboitnott https://t.co/xdqLIOf8Ex'"
Entrepreneur,1277655247524159488,2020-06-29 17:28:43,b'Tune in to hear Chip and Joanna Gaines share their journey and small business advice with Salesforce SMB Marketing\xe2\x80\xa6 https://t.co/ByWuq4GPPr'
Entrepreneur,1277649300571459588,2020-06-29 17:05:05,b'The Recovery Brings the Unique Opportunity to Shift Societal Norms | by @apprenticareers https://t.co/UBc3xFXBc6'
Entrepreneur,1277640644794687494,2020-06-29 16:30:41,b'How Retail Companies Are Adapting to Improve Profitability |\xe2\x81\xa0\xe2\x81\xa0 by @tpopomaronis https://t.co/VYHRDn1pdA'
Entrepreneur,1277627902855651328,2020-06-29 15:40:03,"b'Facebook to Slap Labels on Newsworthy, But Rule-Breaking Posts From Politicians | by @Michael_Kan https://t.co/kS6dvDmomH'"
Entrepreneur,1277621619775746053,2020-06-29 15:15:05,"b""Report: iPhone 12 Won't Include a Charger or EarPods | by @mthwgeek https://t.co/Q7HXNmWzhn"""
Entrepreneur,1277618714825932801,2020-06-29 15:03:33,"b'Zak Williams, Son of the Late Robin Williams, Is Willing to Get Personal for the Sake of Public Mental Health | by\xe2\x80\xa6 https://t.co/Ocd6KVEc6i'"
Entrepreneur,1277610425128017922,2020-06-29 14:30:36,b'- Use automated email marketing campaigns to convert customers \n- Create a loyalty program \n- Have a presence acros\xe2\x80\xa6 https://t.co/SPqhev44Bb'
Entrepreneur,1277604418951819266,2020-06-29 14:06:44,"b'Got an amazing business idea, but unsure as to how to turn it into a functioning enterprise? Join our live webinar\xe2\x80\xa6 https://t.co/MoceFHYcuL'"
Entrepreneur,1277596445026254849,2020-06-29 13:35:03,b'How a Unique Perspective Is a Valuable Asset | by @davidmeltzer https://t.co/N6ZRf279gg'
Entrepreneur,1277589173675982850,2020-06-29 13:06:10,"b""How can restaurants thrive in today's new normal? Join Peter Merriman, one of Hawaii's most prominent restaurateurs\xe2\x80\xa6 https://t.co/Ut0SPRpzfo"""
Entrepreneur,1277573808921206789,2020-06-29 12:05:06,"b'Join today\'s free webinar, ""The Future of Business and Franchising: Strategies for Momentum and Growth,"" today at 3\xe2\x80\xa6 https://t.co/krNrJ7tjGn'"
Entrepreneur,1277437897059205120,2020-06-29 03:05:02,b'The Dangers of Overpromising and Under-Delivering https://t.co/RQeTaB4iyr'
Entrepreneur,1277422802237349893,2020-06-29 02:05:04,b'Successful Leadership Tactics in a Time of Crisis https://t.co/hxCpiEnG6Y'
Entrepreneur,1277407695126085632,2020-06-29 01:05:02,b'5 Ways to Beat Zoom Fatigue https://t.co/K3xoyzl8oG'
Entrepreneur,1277392597410025473,2020-06-29 00:05:02,b'4 Tips for Building Your PR Toolbox https://t.co/AgmDMiO6fw'
Entrepreneur,1277377499077447681,2020-06-28 23:05:02,"b""If You Want to Communicate Like a Pro, Get This: It's Not About You https://t.co/icwHMm5G8x"""
Entrepreneur,1277362403001487367,2020-06-28 22:05:03,b'5 Science-Based Tips for Reducing Work-Related Stress https://t.co/mvOaeUq3Mi'
Entrepreneur,1277347300042575872,2020-06-28 21:05:02,b'Why Your Brand Should Double Down on Owned Media https://t.co/aQottUEg3R'
Entrepreneur,1277332209700044800,2020-06-28 20:05:05,b'SEO Needs to Be Part of Your PR Strategy https://t.co/h24ESZ9wkM'
Entrepreneur,1277317112613277699,2020-06-28 19:05:05,"b""4 Tips for Simplifying Due Diligence (and Why It's Even Needed) https://t.co/c4cfkXh2fJ"""
Entrepreneur,1277301998573047809,2020-06-28 18:05:02,b'4 Questions to Ask Yourself to Make Sure Your Brand Is Resonating https://t.co/MlRRt2V9iT'
Entrepreneur,1277286905625878529,2020-06-28 17:05:03,b'How Leaders Can Remotely Create a Strong Workplace Culture https://t.co/WUExh6tl4Q'
Entrepreneur,1277271815321202688,2020-06-28 16:05:05,b'4 Businesses That Have Pulled Off Feel-Good Pivots on the Fly https://t.co/ctkD3CnTUk'
Entrepreneur,1277256709652742151,2020-06-28 15:05:04,b'How to Step Back and Still Keep Your Team Accountable https://t.co/zpEv5lc03A'
Entrepreneur,1277249157573554177,2020-06-28 14:35:03,"b""How can restaurants thrive in today's new normal? Join Peter Merriman, one of Hawaii's most prominent restaurateurs\xe2\x80\xa6 https://t.co/QlS4XWnYvQ"""
Entrepreneur,1277241607100776450,2020-06-28 14:05:03,b'10 Movies Dealing With Racial Injustice That All Entrepreneurs Can Learn From https://t.co/eT2akAjPlo'
Entrepreneur,1277226511041470464,2020-06-28 13:05:04,b'Are you motivating people the wrong way? https://t.co/LXvbpMcb1L'
Entrepreneur,1277218963177570304,2020-06-28 12:35:05,b'Do you need help optimizing your #website with #SEO practices? We have the SEO experts to help:\xe2\x80\xa6 https://t.co/C8KRjp0Gb0'
Entrepreneur,1277211409278021635,2020-06-28 12:05:04,b'5 Workouts You Can Do at Home for Free Right Now https://t.co/GbfIHBltBS'
Entrepreneur,1277203857987305472,2020-06-28 11:35:03,b'These past months have brought about about global changes that have left a lasting impact on businesses and franchi\xe2\x80\xa6 https://t.co/KLIwIBeIhp'
Entrepreneur,1277196303609495555,2020-06-28 11:05:02,"b""Free Webinar | July 1: How to Get to Market Fast and 'Lean' \xe2\x80\x93 Developing Your MVP! https://t.co/N9YKLISwoq"""
Entrepreneur,1277075508656779266,2020-06-28 03:05:02,b'How Much Should You Tell Your Employees? https://t.co/ebZszbNIA2'
Entrepreneur,1277060406008299521,2020-06-28 02:05:02,b'12 Things First-Time Leaders Need to Succeed https://t.co/9WyKhN0vqi'
Entrepreneur,1277045309802254339,2020-06-28 01:05:02,b'7 Ways to Enhance Your Blog Posts for More Traffic https://t.co/iKWjqdodi7'
Entrepreneur,1277030207904514053,2020-06-28 00:05:02,b'How to Overcome Burnout Without a Netflix Marathon https://t.co/OSUkbcucFF'
Entrepreneur,1277015115804573697,2020-06-27 23:05:04,b'How I (Almost) Doubled My Productivity While Working From Home https://t.co/4pruSAYa3w'
Entrepreneur,1277000013613236229,2020-06-27 22:05:03,b'9 Ways Leaders Accidentally Ruin Good Employees https://t.co/EFklOo7lwD'
Entrepreneur,1276984915305922560,2020-06-27 21:05:03,b'3 Digital Strategies Every Company Should Implement Now https://t.co/a4MmAm1cam'
Entrepreneur,1276969818273562625,2020-06-27 20:05:04,"b""Is Your Personality Permanent? New Research Says 'No.' https://t.co/t5GYqU7u2P"""
Entrepreneur,1276954717646659585,2020-06-27 19:05:04,"b""Painful Lessons for Getting an Investment Deal on 'Shark Tank' https://t.co/V5Aeg9m5Yd"""
Entrepreneur,1276939620417232896,2020-06-27 18:05:04,b'24 Words and Phrases That Make You Sound Boring and Turn People Off https://t.co/4AiC8qnzSG'
Entrepreneur,1276924518213222400,2020-06-27 17:05:03,b'How the Coronavirus Has Changed the Future of Work https://t.co/CcYW4XjrKG'
Entrepreneur,1276909436771209221,2020-06-27 16:05:08,b'The 4 Most Common Business Setbacks and How to Recover https://t.co/qwelChC5QL'
Entrepreneur,1276894329525743617,2020-06-27 15:05:06,b'Empathy fuels productive conversations. https://t.co/Azi0m510P9'
Entrepreneur,1276879221445595138,2020-06-27 14:05:04,"b'What Is Empathy, and Why Is It So Important for Great Leaders? https://t.co/ZQZSPIqUja'"
Entrepreneur,1276864130771812356,2020-06-27 13:05:06,"b""4 Simple Ways to Change People's Minds https://t.co/Z8q5gybK0R"""
Entrepreneur,1276849024004493314,2020-06-27 12:05:04,"b""Here's What Your Daily Schedule Should Look Like for Maximum Productivity (Infographic) https://t.co/F093YjOZKd"""
Entrepreneur,1276841466632065025,2020-06-27 11:35:02,b'Are you ready to get your next #project started? Check out our services and reach out to the Entrepreneur NEXT\xe2\x80\xa6 https://t.co/e0yArJT0jd'
Entrepreneur,1276833919908876291,2020-06-27 11:05:03,"b""Join chef Peter Merriman as he discusses reopening strategies, rethinking business models, resetting diners' expect\xe2\x80\xa6 https://t.co/R6FZEDZEoO"""
Entrepreneur,1276723191860297731,2020-06-27 03:45:03,b'How the Legacy of the Pandemic Will Reshape the Future of Work https://t.co/tYhW0Aucpc'
Entrepreneur,1276705569068519430,2020-06-27 02:35:02,b'This Temperature-Checking Kiosk Can Help You Safely Reopen Your Business https://t.co/5UlHebcsAw'
Entrepreneur,1276685439047434240,2020-06-27 01:15:02,b'How to Minimize Risk and Protect Your Money During Times of Crisis https://t.co/hmbLUtq0JZ'
Entrepreneur,1276667825608962048,2020-06-27 00:05:03,b'5 Easy Font and Text Tricks to Modernize Your Website | by @greenbergbrian https://t.co/clyUvaCx4i'
Entrepreneur,1276652721945403393,2020-06-26 23:05:02,"b""How Millenials Are Changing Today's Housing Market | by @indexsy https://t.co/sKh0Yaq1Mv"""
Entrepreneur,1276625052683943944,2020-06-26 21:15:05,b'These past months have brought about about global changes that have left a lasting impact on businesses and franchi\xe2\x80\xa6 https://t.co/waYeuQx4yW'
Entrepreneur,1276614974857793539,2020-06-26 20:35:03,b'3 Things You Need to Know Before Starting a Delivery Service Business | by @sarahaustin https://t.co/fkHVqodQqw'
Entrepreneur,1276607431603257345,2020-06-26 20:05:04,"b""If you're struggling to stand out amongst the crowd of marketing #emails, we've got your back. Contact the Entrepre\xe2\x80\xa6 https://t.co/T4C4QRlMW7"""
Entrepreneur,1276592336345214977,2020-06-26 19:05:05,b'Why Hard Work is the Most Important Trait A Successful Entrepreneur Should Have | by @oliverzok https://t.co/zZUfQLNdWy'
Entrepreneur,1276577236997615616,2020-06-26 18:05:05,"b""What Can Marketers Learn From Quibi's Failure? | by @brendangahan https://t.co/34jkRjvPOe"""
Entrepreneur,1276569545873018881,2020-06-26 17:34:31,b'Need a mentor? Book a session with @NicoleLapin today! https://t.co/nCPgeuO6Yy https://t.co/6OZA9EGXs6'
Entrepreneur,1276562132230963205,2020-06-26 17:05:04,b'Practice What You Preach: Why Leaders Should Maintain Work-Life Balance During the Most Stressful Times | by\xe2\x80\xa6 https://t.co/f9zIAeLgbT'
