Entrepreneur,1248076929909088258,2020-04-09 02:35:02,b'5 Things You Need to Know About Acquiring a Business https://t.co/1zoUdJfdwV'
Entrepreneur,1248054280885547010,2020-04-09 01:05:02,b'Local Partnerships Will Be Crucial Amidst International Travel Restrictions | by @craig1812000 https://t.co/nF7QwfyBfQ'
Entrepreneur,1248041701706543105,2020-04-09 00:15:03,b'4 Statistical Reasons Data Security Should Be a Top Priority for Small Businesses | by @tpopomaronis https://t.co/VNWe5enk9Y'
Entrepreneur,1248031631409065984,2020-04-08 23:35:02,b'8 Steps to Webinar Success | by @Robertbly https://t.co/gOK85xFIYQ'
Entrepreneur,1248008984520323073,2020-04-08 22:05:03,b'The Complete Toolkit for Leading Remote Workers | by @theRyanJenks https://t.co/TXcPiPVsu0'
Entrepreneur,1247996856077975552,2020-04-08 21:16:51,b'Join our expert @KimPerell tomorrow for a free webinar where she will guide you through her 3 SIMPLE STEPS to start\xe2\x80\xa6 https://t.co/eqo7aZQXEv'
Entrepreneur,1247995157514944512,2020-04-08 21:10:06,b'8 Books to Help You Grow During the Coronavirus Pandemic | by @peterdaisyme https://t.co/MHwTbsiKuS'
Entrepreneur,1247989429802799104,2020-04-08 20:47:21,b'3 Smart Ways to Save Time by Streamlining Shipping (Sponsored by @PitneyBowes) https://t.co/kKmBmpOl5I'
Entrepreneur,1247987125968080896,2020-04-08 20:38:11,b'RT @roberttuchman: Really liked interviewing @smart  great interview https://t.co/BTYSsgrBrj'
Entrepreneur,1247981319201730565,2020-04-08 20:15:07,b'This App Contains Everything Your Small Business Needs to Manage Its Finances Online https://t.co/Db5QbSXn77'
Entrepreneur,1247981216793591808,2020-04-08 20:14:43,"b""On today's episode of #HowSuccessHappens with @roberttuchman, @splice's Steve Martocci (@smart) discusses changing\xe2\x80\xa6 https://t.co/KPSP7rb2E2"""
Entrepreneur,1247980160114180096,2020-04-08 20:10:31,"b""This Entrepreneur Has COVID-19. Here's How He's Leading His Company | by @heyfeifer https://t.co/fUzh0K1Dz4"""
Entrepreneur,1247971245716639744,2020-04-08 19:35:05,"b""'Technology Is More Broken Than Ever': Centercode CEO Luke Freiler on Creating More Meaningful Tech | by @theoracles https://t.co/MgaNtayO4N"""
Entrepreneur,1247963689417879557,2020-04-08 19:05:04,"b'Are Virtual Games, Workouts or Happy Hours Most Popular Right Now? (Infographic) | by @jlthoms https://t.co/db0EZgX6SU'"
Entrepreneur,1247963043549589505,2020-04-08 19:02:30,b'The 5:30 A.M. Warrior Call: Wuhan Ends Its Lockdown After 78 Days (4/08/2020) | by @realjoedesena https://t.co/biT3KLu0j7'
Entrepreneur,1247959694385319936,2020-04-08 18:49:11,"b'Last chance to join, ""5 \xe2\x80\x9cKeeps\xe2\x80\x9d for Business Continuity &amp; Lessons from Past Disruptions."" Join @JeffreyHayzlett at\xe2\x80\xa6 https://t.co/CtUBnyZnmz'"
Entrepreneur,1247955539579088903,2020-04-08 18:32:41,b'Want to be a part of one of the fastest growing franchises in the country? Kona Ice has been ranked #1 in Franchise\xe2\x80\xa6 https://t.co/9YE6ZHtg1W'
Entrepreneur,1247953621263831048,2020-04-08 18:25:03,b'A Venture Capitalist Shares 6 Ways Startups Can Prepare for the Unexpected | by @rudina11 https://t.co/LwyDoLlOrL'
Entrepreneur,1247951780689915911,2020-04-08 18:17:44,b'We have stories on the stimulus package that you can check out here: https://t.co/rQUXDXzO7y. But we want to know s\xe2\x80\xa6 https://t.co/tPkppzGApE'
Entrepreneur,1247945258257825793,2020-04-08 17:51:49,"b""Have you applied for an SBA or PPP loan as part of the government's recent stimulus package? What has the experience been like for you?"""
Entrepreneur,1247942879529631745,2020-04-08 17:42:22,b'Get a 1-year digital subscription to Entrepreneur magazine for only $1! Use promo code INSIDERVIP. (Only available\xe2\x80\xa6 https://t.co/jVAtrTvhsc'
Entrepreneur,1247936022568206337,2020-04-08 17:15:07,b'Could You Be Doing Better with Email Marketing? This Tool Helps. https://t.co/nStT6kBM33'
Entrepreneur,1247929948251308037,2020-04-08 16:50:59,b'These three tips will help you save time by streamlining shipping. (Sponsored by @PitneyBowes) https://t.co/id2c2chesP'
Entrepreneur,1247926320014733318,2020-04-08 16:36:34,b'Bernie Sanders Ends 2020 Presidential Bid https://t.co/S9tNo8XWZm'
Entrepreneur,1247925939494948865,2020-04-08 16:35:03,b'How to Run a 6-Figure Freelance Business in 20 Hours a Week | by @sixfigurewriter https://t.co/YNlIp4zrZK'
Entrepreneur,1247910844991770629,2020-04-08 15:35:05,b'Twitter Chief Jack Dorsey Donates $1 Billion to COVID-19 Fight https://t.co/oFvwPW7xYj'
Entrepreneur,1247908325322350594,2020-04-08 15:25:04,b'How to Establish Marketing Authority in a Niche Industry | by @aimeetariq https://t.co/JutVHXV4ho'
Entrepreneur,1247907158550863873,2020-04-08 15:20:26,"b'Last chance to join today\'s free webinar with @DanielleScorp. ""Utilizing Media to Create New Opportunities For Your\xe2\x80\xa6 https://t.co/GAh8zmlC9F'"
Entrepreneur,1247904551291813888,2020-04-08 15:10:04,b'How AI Is Helping in the Fight Against COVID-19 https://t.co/Z8QDwFiOqv'
Entrepreneur,1247890712399511555,2020-04-08 14:15:05,"b""If You're Trying to Limit Grocery Store Trips and Still Eat Healthy, This Might be for You https://t.co/dEl8zrFpe1"""
Entrepreneur,1247880642744004608,2020-04-08 13:35:04,b'Top Tips for Video Interviews in the New World https://t.co/NG9gHPyFuC'
Entrepreneur,1247874629215096833,2020-04-08 13:11:10,b'Your Setbacks During COVID-19 Will Fuel Your Success Tomorrow | by @heyfeifer https://t.co/V5LpN0KHt5'
Entrepreneur,1247865537956282370,2020-04-08 12:35:03,b'Why Fear Can Be Your Best Feedback | by @davidmeltzer https://t.co/jo6W7DJl17'
Entrepreneur,1247732155524022273,2020-04-08 03:45:02,"b'How a Hockey Player Making Less Than $30,000 a Year Turned His Career Upside Down and Started a Multimillion-Dollar\xe2\x80\xa6 https://t.co/ewnH9VPK8G'"
Entrepreneur,1247709508509540354,2020-04-08 02:15:02,b'Building an Email List? This $12 Scraper Might Be Exactly What You Need. https://t.co/xUmVjMp4wB'
Entrepreneur,1247700700928376832,2020-04-08 01:40:02,b'The Zero-Sum Mindset: How to Avoid Toxic Thinking in Moments of Crisis https://t.co/CRu8TdRSer'
Entrepreneur,1247679316651016196,2020-04-08 00:15:04,b'Make the Most of Your Frozen Fruit and Vegetable Supply with a Nutribullet https://t.co/EQZMu7fpnc'
Entrepreneur,1247669242599800834,2020-04-07 23:35:02,b'How to Support Your Team While WFH | by @aytekintank https://t.co/bex9e1Nlzz'
Entrepreneur,1247649113816039425,2020-04-07 22:15:03,b'How to Automate Technology to Help Run Your Businesses | by @andrewmedal https://t.co/rAE2IyHWYR'
Entrepreneur,1247635269811146755,2020-04-07 21:20:02,b'5 Essential Traits of Successfully Executed Businesses | by @EchelonCopy https://t.co/DsOtCrl8li'
Entrepreneur,1247627727198453761,2020-04-07 20:50:04,"b'At this critical juncture in our world, we must focus on and navigate through the next 60 days. Join\xe2\x80\xa6 https://t.co/6teZ6dXBIP'"
Entrepreneur,1247623947425845250,2020-04-07 20:35:03,"b'Join @markkohler and @matsorensen today at 5 p.m. EDT for ""8 Ways Business Owners Can Take Advantage of the Federal\xe2\x80\xa6 https://t.co/fzL4HJctZp'"
Entrepreneur,1247621628185509891,2020-04-07 20:25:50,"b'In today\xe2\x80\x99s episode of #HabitsandHustle with @therealjencohen, @DeniseAustin shares how she jumpstarted her career,\xe2\x80\xa6 https://t.co/HcgotHF7oN'"
Entrepreneur,1247618244900503552,2020-04-07 20:12:23,"b'In this free webinar, @DanielleScorp will provide you with tips and best practices on how you can utilize media to\xe2\x80\xa6 https://t.co/Jkqo0kFBfG'"
Entrepreneur,1247616402611228673,2020-04-07 20:05:04,b'Seeking Capital? Ask Yourself These 3 Questions First | by @art_langer https://t.co/kbCN7y1aHk'
Entrepreneur,1247615858022719488,2020-04-07 20:02:54,"b""RT @DanBova1: Ty Burrell doesn't just play an insanely nice and funny guy on TV \xe2\x80\x94 he's one in real life. Had a great chat with the @ModernF\xe2\x80\xa6"""
Entrepreneur,1247615835440644096,2020-04-07 20:02:49,"b'RT @heyfeifer: I love how @TheRock and @DanyGarciaCo think about business. Take chances, methodically expand, and constantly reinvent.\n\nMy\xe2\x80\xa6'"
Entrepreneur,1247607255262015489,2020-04-07 19:28:43,"b'Even though COVID-19 has hit the economy hard, joining the restoration industry may be a great idea right now. Here\xe2\x80\xa6 https://t.co/w6dXUEugD2'"
Entrepreneur,1247606285643759616,2020-04-07 19:24:52,b'It\xe2\x80\x99s #NationalBeerDay! Tag your favorite brewery and tell us what beer you wish you could fill this pint glass with. https://t.co/IM38FqtwSB'
Entrepreneur,1247603819967643655,2020-04-07 19:15:04,b'3 Social-Intelligence Methods for Building Strong Stakeholder Relationships | by @Gleb_Tsipursky https://t.co/ghrwJwFVv5'
Entrepreneur,1247601042381996033,2020-04-07 19:04:02,b'The 5:30 A.M. Warrior Call: COVID-19 Vaccine to Begin Human Trial (4/07/2020) | by @realjoedesena\xe2\x80\xa6 https://t.co/us5NEh8qyC'
Entrepreneur,1247593754690826240,2020-04-07 18:35:04,b'How to Take Your Book Tour Online | by @sgstorey https://t.co/zDUaw2OeHw'
Entrepreneur,1247593276623818753,2020-04-07 18:33:10,"b""Last chance to join today's free webinar with @markkohler and @matsorensen. Starts at 3 p.m. EDT. Register here:\xe2\x80\xa6 https://t.co/5ClZL1vt7v"""
Entrepreneur,1247586199633567750,2020-04-07 18:05:03,"b'The Top 100 Franchises for Less Than $150,000 in 2020 https://t.co/jlm8wGthNf'"
Entrepreneur,1247581844972941312,2020-04-07 17:47:45,b'RT @jwfell: Now is a perfect time to see about improving ourselves. https://t.co/f3QVyj4UNC'
Entrepreneur,1247578651941654528,2020-04-07 17:35:04,b'5 Effective Low-Budget Marketing Strategies for Startups https://t.co/c3cWFjEfh2'
Entrepreneur,1247571111702921218,2020-04-07 17:05:06,b'Free Webinar | April 7: 8 Ways Business Owners Can Take Advantage of the Federal Stimulus Package https://t.co/1rlThXeq9Y'
Entrepreneur,1247562865986416641,2020-04-07 16:32:20,b'.@MarieKondo Visited My Quarantine Workspace to Give Me a Lesson on Letting Go https://t.co/WsuVH3GTGd'
Entrepreneur,1247558526630866944,2020-04-07 16:15:05,b'This Could be a Secret Weapon for New Freelance Designers Looking to Land Clients https://t.co/B77GFqhY3x'
Entrepreneur,1247551202700771330,2020-04-07 15:45:59,b'Hear from Mark Cuban and Salesforce about the opportunities within challenges. (Sponsored by @essentials)\xe2\x80\xa6 https://t.co/qxGadubfSi'
Entrepreneur,1247550970051035137,2020-04-07 15:45:04,"b""Why Millions of Americans Are Struggling to File for Unemployment Benefits, When They've Never Been More Generous https://t.co/axrqZ7Qfyg"""
Entrepreneur,1247549052213960707,2020-04-07 15:37:27,"b'RT @heyfeifer: \xe2\x80\x9cWe are not attached to process,\xe2\x80\x9d they told me. \xe2\x80\x9cWe are only attached to outcome.\xe2\x80\x9d\n\nIt\xe2\x80\x99s a great way to think about our curr\xe2\x80\xa6'"
Entrepreneur,1247548470287912960,2020-04-07 15:35:08,b'Forget Unicorns. Startups Should Be Camels. https://t.co/FhewXrhCIZ'
Entrepreneur,1247543424703578113,2020-04-07 15:15:05,b'Autonomous Shuttles Ferry COVID-19 Tests Around Florida https://t.co/glx0ugBGiO'
Entrepreneur,1247541856906301443,2020-04-07 15:08:51,"b'For many of us, video interviews are brand new to us. Join today\'s free webinar, ""Top Tips for Video Interviews in\xe2\x80\xa6 https://t.co/LZNZHPu1OF'"
Entrepreneur,1247540906497998851,2020-04-07 15:05:04,"b'The Top 100 Franchises for Less Than $100,000 in 2020 https://t.co/ZegBzb6jOx'"
Entrepreneur,1247537076330872832,2020-04-07 14:49:51,b'How to Compartmentalize Work and Life Stress During Difficult Times | by @johnrampton https://t.co/cAzg1mAl1B'
Entrepreneur,1247533718199140353,2020-04-07 14:36:31,"b'RT @SevenBucksProd: ""We have the opportunity to make people feel good"" - A simple but profound realization made years ago by @TheRock and @\xe2\x80\xa6'"
Entrepreneur,1247533641590132743,2020-04-07 14:36:12,"b'RT @TheRock: Cheers to innovation, passion &amp; gratitude. Thx @entrepreneur &amp; editor-in-chief @heyfeifer for the chat w/ @danygarciaco &amp; myse\xe2\x80\xa6'"
Entrepreneur,1247530848754139137,2020-04-07 14:25:07,b'Why Learning a New Language Now Could Make You a More Successful Entrepreneur https://t.co/9IOrCsXtdO'
Entrepreneur,1247527410947375106,2020-04-07 14:11:27,"b""Dwayne (@TheRock) Johnson and @DanyGarciaCo's Business Strategy: Rethink Everything! | by @heyfeifer https://t.co/RolczB0Ebp"""
Entrepreneur,1247518256874885120,2020-04-07 13:35:04,"b'In case you missed yesterday\'s free webinar with @IvanMisner, you can now watch ""Networking in the New Normal"" on-d\xe2\x80\xa6 https://t.co/gzv9CJd3Zr'"
Entrepreneur,1247513952260689922,2020-04-07 13:17:58,"b'Tune in to Thursday\xe2\x80\x99s new episode of #HowBrandsAreBorn w/@kristenaldridge presented by #CardoneVentures, featuring\xe2\x80\xa6 https://t.co/mpBZb6e9Zx'"
Entrepreneur,1247510339819835394,2020-04-07 13:03:37,b'RT @DanyGarciaCo: Thank you @Entrepreneur for taking @TheRock &amp; I down memory lane to the pivotal moment we decided how powerful and import\xe2\x80\xa6'
Entrepreneur,1247509057235300352,2020-04-07 12:58:31,"b""RT @markkohler: It's tomorrow at 1 PM MDT on @Entrepreneur!\nRegister here: https://t.co/miWCJojxWr https://t.co/th96gsaGDm"""
Entrepreneur,1247495608501403648,2020-04-07 12:05:05,b'Free Webinar | April 10: Leading &amp; Communicating in Turbulent Times https://t.co/SsjqRFiQxJ'
Entrepreneur,1247485534311768071,2020-04-07 11:25:03,"b""Here's the Secret to Absorbing Key Ideas from Stacks of Business Books Every Year https://t.co/8PHJvfAmqc"""
Entrepreneur,1247362220050255874,2020-04-07 03:15:02,b'300 Franchises to Open With Nearly Any Budget in 2020 https://t.co/xz8ZYQ2z6u'
Entrepreneur,1247348379111350272,2020-04-07 02:20:02,b'Learn to Use Music Production Software Like Ableton Pro https://t.co/lI6M0aw1cI'
Entrepreneur,1247332020126191632,2020-04-07 01:15:02,b'How a Sinking Ship and an Airplane Inspired Pam Jordan to Leave the Corporate World and Start Her Own Business | by\xe2\x80\xa6 https://t.co/XlWSQpbRmD'
Entrepreneur,1247323212255543296,2020-04-07 00:40:02,b'4 Ways to Turn Uncertainty into Strength for Your Business https://t.co/3RaZKDza8J'
Entrepreneur,1247303098961481728,2020-04-06 23:20:07,b'Is a Virtual Assistant the Secret to Keeping Your Small Business Afloat? https://t.co/iD7U9e4pL3'
Entrepreneur,1247299306014617600,2020-04-06 23:05:02,"b'With the COVID-19 crisis, job seekers and employers had to quickly shift from in-person interviews to video intervi\xe2\x80\xa6 https://t.co/5vjy062D2o'"
Entrepreneur,1247294272883372037,2020-04-06 22:45:02,b'Why Curbside Pickup Is the Right Thing to Do | by @syedbalkhi https://t.co/lR2hiz5cie'
Entrepreneur,1247288603828518916,2020-04-06 22:22:31,b'Free Webinar | April 7: 8 Ways Business Owners Can Take Advantage of the Federal Stimulus Package https://t.co/tFqNI8szhd'
Entrepreneur,1247286738239840258,2020-04-06 22:15:06,"b'The Top 100 Franchises for Less Than $50,000 in 2020 https://t.co/fSsPuBY9Z2'"
Entrepreneur,1247276655883825152,2020-04-06 21:35:02,b'What Every Entrepreneur Can Learn From The Wing Controversy | by @jyancey https://t.co/z9vjBKMDRR'
Entrepreneur,1247272882914430978,2020-04-06 21:20:03,b'4 Tips for Keeping Your Data Secure While Everyone Works From Home | by @jennspencer21 https://t.co/5qLS6Gqygv'
Entrepreneur,1247257786242805768,2020-04-06 20:20:03,b'5 Ways Entrepreneurs Can Keep Their Children Busy and Learning While You Get Work Done https://t.co/wFAzwf8oJd'
Entrepreneur,1247254011897675777,2020-04-06 20:05:03,"b'Focus on Networking With People Who Are Engines, Not Anchors | by @ivanmisner https://t.co/6lqgrLNnw8'"
Entrepreneur,1247250233354043394,2020-04-06 19:50:03,b'How NASCAR Champion @julialandauer Handles Her Fear | by @davidmeltzer https://t.co/e5AvNMvh7P'
Entrepreneur,1247245241100402690,2020-04-06 19:30:12,b'5 Things Advertisers Should Consider Amidst the COVID-19 Pandemic https://t.co/WzysJ8KyIp'
Entrepreneur,1247240173152239624,2020-04-06 19:10:04,b'The 5:30 A.M. Warrior Call: How a Tiger at the Bronx Zoo Tested Positive for COVID-19 (4/06/2020) | by\xe2\x80\xa6 https://t.co/tGYLmvi3Wb'
Entrepreneur,1247231358214250497,2020-04-06 18:35:02,"b""Have an Idea to Help Combat COVID-19? Here's How to Find Partners and Investors. https://t.co/vlsgTxUhiG"""
Entrepreneur,1247228063466823682,2020-04-06 18:21:57,"b'Join @markkohler and @matsorensen in tomorrow\'s webinar, ""Understanding The New Emergency Paid Sick Leave Act &amp; Fam\xe2\x80\xa6 https://t.co/uVMtioBJ2E'"
Entrepreneur,1247224174558543876,2020-04-06 18:06:30,b'@diana_rdrgs @IvanMisner Here you go: https://t.co/1jFzagyiSe'
Entrepreneur,1247223811445075972,2020-04-06 18:05:03,"b""Increase Sales With 'The Dessert Pitch' | by @kwalshphillips https://t.co/3nHUNjBmsE"""
Entrepreneur,1247223172862222336,2020-04-06 18:02:31,"b""RT @heyfeifer: Entrepreneurs have so many ideas to combat COVID-19. Here's how to find partners and investors https://t.co/PqhpFBuR9V"""
Entrepreneur,1247212489412169728,2020-04-06 17:20:04,b'This All-in-One Tool Makes Managing Social Media More Efficient https://t.co/Qi33TJ7k8M'
Entrepreneur,1247208717260652545,2020-04-06 17:05:04,"b'Now Is a Good Time to Read for Joy, Not Productivity | by @aytekintank https://t.co/jxHM3x87Q1'"
Entrepreneur,1247203686755024897,2020-04-06 16:45:05,b'How to Deal With a Workplace Bully (Infographic) | by @jlthoms https://t.co/u0wlvKLDcJ'
Entrepreneur,1247196176501411841,2020-04-06 16:15:14,b'@diana_rdrgs @IvanMisner Yes! Once it is over you will be able to access it on-demand.'
Entrepreneur,1247196134646386690,2020-04-06 16:15:04,b'Revealing the Secrets to Peak Professional and Personal Performance | by @tpopomaronis https://t.co/VXCNquAzou'
Entrepreneur,1247186063577288711,2020-04-06 15:35:03,"b'Last chance to join today\'s free webinar, ""Networking in the New Normal"" with @IvanMisner. Starts at 12 p.m. EDT. https://t.co/uGPw1bytaJ'"
Entrepreneur,1247183043816820736,2020-04-06 15:23:03,"b'Almost Two-Thirds of U.S. Workforce Must Work From Home, Many with Crap Internet | by @egriffith https://t.co/42KXrpPzQR'"
Entrepreneur,1247179771789938689,2020-04-06 15:10:03,b'3 Critical Sales Touch Points to Grow Your Business | by @SchoolSAFECom https://t.co/DPDeKLzTaF'
Entrepreneur,1247178047998083073,2020-04-06 15:03:12,b'How to Submit Your SBA PPP Loan Application and Calculate the Loan Amount | by @matsorensen https://t.co/s5RT9VYquk'
Entrepreneur,1247174604583469057,2020-04-06 14:49:31,b'Tesla Shows How It Builds Ventilators Using Model 3 Parts https://t.co/ma9LQxoRHG'
Entrepreneur,1247173484612071424,2020-04-06 14:45:04,"b""What It's Like to Become a Streaming Sensation | by @davidmeltzer https://t.co/FBgTW5gSER"""
Entrepreneur,1247169365109243904,2020-04-06 14:28:42,"b'Join @IvanMisner today at 12 p.m. EDT for a free webinar on ""Networking in the New Normal."" Register here:\xe2\x80\xa6 https://t.co/1JfPmrLew1'"
Entrepreneur,1247168447466872832,2020-04-06 14:25:03,b'Apple Is Producing 1 Million Face Shields a Week for Health Workers | by @mthwgeek https://t.co/fyRMkQyXR0'
Entrepreneur,1247165939063406593,2020-04-06 14:15:05,b'Fight for Your Franchise https://t.co/oYyVY7MweD'
Entrepreneur,1247159781355388929,2020-04-06 13:50:37,"b'RT @jwfell: Though it may seem like your products don\xe2\x80\x99t cause much of an impact when it comes to global emissions, you can always be more a\xe2\x80\xa6'"
Entrepreneur,1247155874839302144,2020-04-06 13:35:06,b'This Password Manager Makes Collaboration Easy for Small-Business Owners https://t.co/GmpHMNvA0Z'
Entrepreneur,1247148155600330753,2020-04-06 13:04:25,b'Popular Time-Blocking or Time-Management Techniques You Can Use While Working Remotely | by @johnrampton https://t.co/QKUT778trJ'
Entrepreneur,1247133247676579841,2020-04-06 12:05:11,b'Free Webinar | April 9: 3 Simple Steps to Start Your Side Hustle https://t.co/KfPmAvLIAM'
Entrepreneur,1246997313970716673,2020-04-06 03:05:02,b'26 Questions to Help You Decide If a Late-in-Life Business Is Right for You https://t.co/RaulVp8JjW'
Entrepreneur,1246982214178521091,2020-04-06 02:05:02,b'4 Tips for Successfully Breaking Into a Saturated Industry https://t.co/RTtgJkXDLV'
Entrepreneur,1246967114923155457,2020-04-06 01:05:02,"b""How to Keep Your Kids Busy While You're at Work https://t.co/M7LAMJjpBu"""
Entrepreneur,1246952023658049542,2020-04-06 00:05:04,b'Creative Marketing to Promote Your Business NOW in Uncertain Times https://t.co/OyBFX5HT8W'
Entrepreneur,1246936925006692355,2020-04-05 23:05:04,"b'For International Dominatrix Mistress Eva Oh, Business Is Booming https://t.co/nhoevWOjOv'"
Entrepreneur,1246929366157852674,2020-04-05 22:35:02,b'Free Webinar | April 6: Networking in The New Normal https://t.co/uGPw1bytaJ'
Entrepreneur,1246921819447341057,2020-04-05 22:05:03,b'This Company Is Making Texting With Your Doctor the New Normal https://t.co/Jnh21TbTZU'
Entrepreneur,1246906718736584705,2020-04-05 21:05:02,"b'Free Webinar | April 8: 5 ""Keeps"" for Business Continuity &amp; Lessons from Past Disruptions https://t.co/6ozAPeQwDE'"
Entrepreneur,1246891626074714115,2020-04-05 20:05:04,b'5 Ways to Protect Your Company From Cybercrime https://t.co/CqsH3gV2XU'
Entrepreneur,1246876523853996033,2020-04-05 19:05:03,b'Smart Tips for Setting the Pace at Your New Job https://t.co/5PanKn6xXA'
Entrepreneur,1246861423092871169,2020-04-05 18:05:03,b'This guide can help guide you and your business during difficult times. https://t.co/L4zLEGOUNj'
Entrepreneur,1246846322981863425,2020-04-05 17:05:03,b'7 Ways to Recover From Too Many Online Meetings During the Day  https://t.co/WQyeYogtZD'
Entrepreneur,1246831225400184833,2020-04-05 16:05:03,b'Free Webinar| April 8: Utilizing Media to Create New Opportunities For Your Business https://t.co/YBTwrhZ8VL'
Entrepreneur,1246816122860638214,2020-04-05 15:05:03,b'6 Ways to Ask for Help Without Being Embarrassed https://t.co/1rMrbb2WoV'
Entrepreneur,1246801026507837440,2020-04-05 14:05:03,b'9 Better Things to Do Than Worry What Others Think About You https://t.co/KbCFFyGWdO'
Entrepreneur,1246785927265112068,2020-04-05 13:05:03,b'8 Habits of Highly Effective Entrepreneurs https://t.co/Bv3BZwRxQW'
Entrepreneur,1246770827468648448,2020-04-05 12:05:03,b'8 Trustworthy Tips on How to Stay Physically and Mentally Healthy Right Now https://t.co/PFZv0EXnZ1'
Entrepreneur,1246755723880644609,2020-04-05 11:05:02,b'Free Webinar | April 7: Top Tips for Video Interviews in the New World https://t.co/NErvJTDdrc'
Entrepreneur,1246634925555580928,2020-04-05 03:05:02,b'Starting a Business That People Need https://t.co/KcQbAX4ZoC'
Entrepreneur,1246619825406980096,2020-04-05 02:05:02,b'10 TV Shows Every Entrepreneur Should Watch on Netflix https://t.co/A0sLmXtUya'
Entrepreneur,1246604730413076481,2020-04-05 01:05:03,b'New Stimulus Bill Unlocks IRA and 401(k) Dollars for Financially Affected https://t.co/5q7a3mtR57'
Entrepreneur,1246589640339083264,2020-04-05 00:05:05,b'Add these five under-the-radar shows to your list. https://t.co/eQ9XJwMoih'
Entrepreneur,1246574528832180229,2020-04-04 23:05:02,"b""Don't Make These 5 Mistakes When Starting Your Next Business https://t.co/VlkKoKvgig"""
Entrepreneur,1246559432886059008,2020-04-04 22:05:03,b'5 Tips and Tricks You Need to Know About Slack https://t.co/Gh5D1FyIzt'
Entrepreneur,1246544337711910918,2020-04-04 21:05:04,b'How to Access Your Retirement Account Funds Under the new Stimulus Act https://t.co/1aHGc0Vn2F'
Entrepreneur,1246529241795170308,2020-04-04 20:05:05,"b""The 7 'Senses' of Self-Development https://t.co/ePipYEUQLC"""
Entrepreneur,1246514133027229699,2020-04-04 19:05:03,b'8 Ways Business Owners Can Take Advantage of the Federal Stimulus Package https://t.co/JnxVH67KoI'
Entrepreneur,1246499039790665729,2020-04-04 18:05:04,b'These nine billionaires are proving its possible to do well and do good at the same time. https://t.co/wG0l6OefKx'
Entrepreneur,1246483936148144140,2020-04-04 17:05:03,"b""Want to establish an at-home workout routine but don't know how? Try these five resources. https://t.co/GbfIHBltBS"""
Entrepreneur,1246468842160828417,2020-04-04 16:05:04,b'Free Webinar: 20 Online Income Streams to Explore in 2020 https://t.co/pJTIuFisdG'
Entrepreneur,1246453755723288576,2020-04-04 15:05:08,b'The hilarious actor is leading a relief effort in Salt Lake City to raise money for out-of-work bar and restaurant\xe2\x80\xa6 https://t.co/5Sdk4dV08q'
Entrepreneur,1246438639808196609,2020-04-04 14:05:04,"b'Long Beach Beer Lab Could Have Closed; Instead, They Became Essential https://t.co/eAociZ2ax9'"
Entrepreneur,1246423539277848576,2020-04-04 13:05:03,b'Inside the DIY Movement to Make Face Shields and Masks for Healthcare Workers https://t.co/ql6cP4GW8n'
Entrepreneur,1246408442945961984,2020-04-04 12:05:04,b'3 Financial Steps Small-Business Owners Should Take Right Now https://t.co/RpI5k9IOTd'
Entrepreneur,1246393345938722822,2020-04-04 11:05:05,b'Free Webinar: Coronavirus Emergency Loans For Small Businesses https://t.co/FJWZLYiHK9'
Entrepreneur,1246282605307269127,2020-04-04 03:45:02,b'Why Your Best Move Might Be to Ditch Your Day Job for a Dream Job https://t.co/1t55fP8HBo'
Entrepreneur,1246262476192301056,2020-04-04 02:25:03,b'3 Simple Tactics for Finishing Your Workweek Early https://t.co/lSb99N0Z9s'
Entrepreneur,1246252413520162816,2020-04-04 01:45:04,b'6 Savvy Ways to Diversify Your Investment Portfolio https://t.co/gTce1lcdkN'
Entrepreneur,1246228501323227142,2020-04-04 00:10:03,b'Launching a New Site? Make Sure You Understand Digital ADA Compliance | by @EchelonCopy https://t.co/KNaOTvau5O'
Entrepreneur,1246219691380674561,2020-04-03 23:35:02,b'3 Tricks for Getting More Email Clicks | by @zerobounce1 https://t.co/Q8xwbJlmE6'
Entrepreneur,1246200819910873090,2020-04-03 22:20:03,b'What COVID-19 Means for Ecommerce Startups https://t.co/38kW1zGLg6'
