gsuite,1240514970145689600,2020-03-19 05:46:31,"b'@iamsushansharma Hi Sushan, are you able to access the admin account for that domain? If not, please send us a DM o\xe2\x80\xa6 https://t.co/cPbwbntBDi'"
gsuite,1240435449006624768,2020-03-19 00:30:31,"b""@lexmakesthings Hey Alex, thanks for reaching out. If you're referring to recording Meet sessions, it is available\xe2\x80\xa6 https://t.co/R62Nt0QB2a"""
gsuite,1240427364456239111,2020-03-18 23:58:24,"b'@erikhoegsveen Please send us a DM with your domain name, and error message.-JG'"
gsuite,1240426815639953408,2020-03-18 23:56:13,"b'@erikhoegsveen Hello Erik, are you getting any error messages?\n-JG'"
gsuite,1240423715600584704,2020-03-18 23:43:54,"b'@giusgrapa Hello Gius, it seems that the closest service we have to the one you use as a reference will be Google h\xe2\x80\xa6 https://t.co/L0K4IbdcVw'"
gsuite,1240416421986865158,2020-03-18 23:14:55,"b'@itsMrsKing Hello Melisa, sorry to read about this, many users are requesting this feature, we have this site\xe2\x80\xa6 https://t.co/MjpiEZXdLW'"
gsuite,1240367371250008065,2020-03-18 20:00:00,"b'In our commitment to helping employees, educators and students, we are rolling out free access to our advanced\xe2\x80\xa6 https://t.co/IZX8P1dDvo'"
gsuite,1240321870207029249,2020-03-18 16:59:12,"b'@leodavesne Hi L\xc3\xa9o, thanks for your message. Just for clarification, do you want to know how to allow external user\xe2\x80\xa6 https://t.co/M2ikBsjMOA'"
gsuite,1240272936558264320,2020-03-18 13:44:45,"b'@t102219581 Hey there, instructors who are upgraded to G Suite Enterprise for Education get unlimited access to ori\xe2\x80\xa6 https://t.co/9aSqanlfeA'"
gsuite,1240271765974200321,2020-03-18 13:40:06,b'@priscillacodes Happy to hear that Priscilla\xf0\x9f\xa5\xb0 Would you mind popping us a DM with the case number so we can send th\xe2\x80\xa6 https://t.co/DYUXWNXlo1'
gsuite,1240200956651986944,2020-03-18 08:58:44,"b""@cardaba Hi Javier, we are sorry to hear that the feature is currently not available to your home country. We'd rec\xe2\x80\xa6 https://t.co/P1GKyt5zMR"""
gsuite,1240147775133822976,2020-03-18 05:27:25,"b'@t102219581 Hi there, do you mean the originality reports that allow teachers to check for plagiarism through Googl\xe2\x80\xa6 https://t.co/zCFzyR5jQb'"
gsuite,1240012020977733633,2020-03-17 20:27:58,"b'@steves01x Hi Steve, at the moment selective sync is not an option with Google File Stream. Feel free to submit it\xe2\x80\xa6 https://t.co/37eQ3Wmwo1'"
gsuite,1240008438752727040,2020-03-17 20:13:44,b'We want to help businesses and people who are now working remotely during this challenging time. Here are 8 tips to\xe2\x80\xa6 https://t.co/KU5o2xX8YI'
gsuite,1239997659919912962,2020-03-17 19:30:54,"b'@_jcbotelho Oi JC, lamento que n\xc3\xa3o esteja conseguido acessar sua conta. Voc\xc3\xaa pode ir em https://t.co/nvrFylPt08 e d\xe2\x80\xa6 https://t.co/muoX8DtltN'"
gsuite,1239994037903462405,2020-03-17 19:16:31,b'@rikkipoynter @gmail Thank you for your response. The error is a bit vague. Perhaps your Directory settings do not\xe2\x80\xa6 https://t.co/JClf94jnSz'
gsuite,1239992218582122505,2020-03-17 19:09:17,"b""@rikkipoynter @gmail Hello Rikki, thank you for your message. I'm truly sorry about the issue affecting you. Could\xe2\x80\xa6 https://t.co/zDmt4Z25kR"""
gsuite,1239989593467912193,2020-03-17 18:58:51,"b'RT @googlecloud: Out of concern for the health and safety of our customers, partners, employees and local communities, we will be postponin\xe2\x80\xa6'"
gsuite,1239975864055394304,2020-03-17 18:04:18,"b""@Rev_Jackson Hi Elizabeth, we're happy this is making a huge difference for you! The Google Hangouts Meet premium f\xe2\x80\xa6 https://t.co/CsU1Cro91V"""
gsuite,1239958405806051328,2020-03-17 16:54:55,"b'@daniel7720 @GoogleSmallBiz Hey Dan, can you DM us with a detailed description of your issue? -LH'"
gsuite,1239927435875028994,2020-03-17 14:51:52,"b""@JonathanSaipe Without troubleshooting, it will be hard to guess what is causing this. I'd recommend you contact yo\xe2\x80\xa6 https://t.co/cVYzzzlF7T"""
gsuite,1239915276478619648,2020-03-17 14:03:33,"b'@JonathanSaipe Hey Jonathan, sorry to hear this. Did you checked the article to troubleshoot about video quality? I\xe2\x80\xa6 https://t.co/QtWNpW9T96'"
gsuite,1239873416645226498,2020-03-17 11:17:12,"b'@LuckyOkoedion Hey Lucky, thank you for flagging us in your tweet. I was hoping you could send us a DM so I can pro\xe2\x80\xa6 https://t.co/6xU9Z3cM1Q'"
gsuite,1239792476816314368,2020-03-17 05:55:35,"b'@jrivascamacho @Google @googlemexico Hi Josu\xc3\xa9, thanks for reaching out. You will find all the tips and options avai\xe2\x80\xa6 https://t.co/R1PkrJLrp1'"
gsuite,1239702551462842369,2020-03-16 23:58:15,"b""@RaniaBenman Glad to hear that Rania. You're welcome anytime! -BI"""
gsuite,1239687893666463746,2020-03-16 23:00:00,b'Working remotely tips: \n\n\xe2\x9c\x85 Create a team alias \n\xe2\x9c\x85 Schedule meetings \n\xe2\x9c\x85 Practice good workplace etiquette \n\nLearn mo\xe2\x80\xa6 https://t.co/v5r8Ko8vMa'
gsuite,1239679047099199488,2020-03-16 22:24:51,"b'@AlexMcCollister @Google Hi Alex, thank you for your feedback, we really appreciate it. Feel free to submit it as a\xe2\x80\xa6 https://t.co/h2xOHHbYOb'"
gsuite,1239672853328474114,2020-03-16 22:00:14,b'Sync with coworkers while working remotely by creating a meeting in #HangoutsMeet \xe2\x86\x92 https://t.co/1jJ4W4Muv0 https://t.co/Wq6YycEq3t'
gsuite,1239582197058875395,2020-03-16 16:00:00,b'Keep your team productive while working remotely with these helpful #gsuite tools tips \xe2\x86\x93 https://t.co/AsA8OAD8IL'
gsuite,1239565394005889025,2020-03-16 14:53:14,"b'@MagnusHambleton Hey Magnus, thanks for the suggestion. To leave feedback for Google Meet, head to\xe2\x80\xa6 https://t.co/MfEVQEd7Eh'"
gsuite,1239561631622926336,2020-03-16 14:38:17,"b'@nickweisser Hi Nick, you will need to enable the settings in https://t.co/nvrFylPt08 with your Admin email and pas\xe2\x80\xa6 https://t.co/clZtqiKO9U'"
gsuite,1239548262081855488,2020-03-16 13:45:10,b'Work from around the \xf0\x9f\x8c\x8e without internet by accessing files offline in #GoogleDrive \xe2\x86\x92 https://t.co/ZENmRPPRwm https://t.co/sBNQfJ0b3p'
gsuite,1239368053693001734,2020-03-16 01:49:05,"b'@GC_Wood @Google Certainly. This is great feedback. At the moment, it is better to check with support, to be certai\xe2\x80\xa6 https://t.co/7aNxWpd5mF'"
gsuite,1239367158779514880,2020-03-16 01:45:31,"b""@GC_Wood @Google What you seek may be possible, but I'd recommend you to better check with support. As appointment\xe2\x80\xa6 https://t.co/sZMsP9y8z8"""
gsuite,1239352304521838597,2020-03-16 00:46:30,"b'@GC_Wood @Google Hi Dr. Gary, thank you for reaching out. This setting is managed in your Admin Console by going th\xe2\x80\xa6 https://t.co/ZUKFrxVkdd'"
gsuite,1239301353186476044,2020-03-15 21:24:02,"b'@AlexMcCollister Hi Alex, thanks for the note! We keep track of request like this through our Feature Idea portal\xe2\x80\xa6 https://t.co/ScLz52FMlB'"
gsuite,1239229376992075776,2020-03-15 16:38:01,"b'@RaniaBenman Hi Rania, sorry to hear this. Can you pop us a DM with your domain name so we can have a look? -JR'"
gsuite,1239219862708334592,2020-03-15 16:00:13,b'Send links and say more in video calls with chat in #HangoutsMeet \xe2\x86\x92 https://t.co/Nna6SVTCIj https://t.co/rSeATZV1fI'
gsuite,1239219632227131394,2020-03-15 15:59:18,"b'@NoStressTech Hi Jason, thanks for getting in touch. You are right, there is an option in the admin console to turn\xe2\x80\xa6 https://t.co/Y83pgeg5sT'"
gsuite,1239197338826084352,2020-03-15 14:30:43,"b'@ImNotRio Hi there, sorry to hear this. Would you mind sending us a DM with your domain name?'"
gsuite,1239157930076880899,2020-03-15 11:54:07,"b'@maheshheda Hi Mahesh, thanks for reaching out. You can use our migration tools to migrate emails from\xe2\x80\xa6 https://t.co/Sx88PsJ4Dr'"
gsuite,1239129259026907136,2020-03-15 10:00:11,"b'@huzefamotiwala Hi Huzefa, thanks for reaching out. Can you please pop us a DM with your domain name? -JR'"
gsuite,1238864246701789190,2020-03-14 16:27:08,b'@you_ssef512 Thanks for your response Youssef! Would you mind sending us a DM with more details about your institution? -JR'
gsuite,1238857421201817600,2020-03-14 16:00:00,b'Check out these working remote tips for how to optimize your collaboration and productivity \xe2\x86\x93  https://t.co/AsA8OAD8IL'
gsuite,1238844498949611520,2020-03-14 15:08:39,"b""@you_ssef512 Hi Youseef, thanks for your interest in our platform. We'd recommend reaching out to a G Suite For Edu\xe2\x80\xa6 https://t.co/wlmyag0Ghj"""
gsuite,1238647438585614337,2020-03-14 02:05:36,"b'@bot44472012 @Google Hey there, best way to get this videos off of the platform will be by following steps here\xe2\x80\xa6 https://t.co/lPelkiyOOW'"
gsuite,1238636499899420672,2020-03-14 01:22:08,"b'@RachelTravels_ Hello Rachel, allow me to share this sites learning center https://t.co/Rf9IXp8UT8 where you can fi\xe2\x80\xa6 https://t.co/EW6XmbuOJm'"
gsuite,1238574965584248832,2020-03-13 21:17:38,b'RT @KatieLyman4: Location never hinders collaboration when you are a Google District!  #Google #Hangouts #TeamWork #IgnitingTheRoadToExcell\xe2\x80\xa6'
gsuite,1238570573875249158,2020-03-13 21:00:10,b'Share your ideas outside of the office \xf0\x9f\x8f\xa2. Learn how to present meetings in #HangoutsMeet \xe2\x86\x92  https://t.co/QzP9BzNrxu https://t.co/blz64DHhkL'
gsuite,1238540366724415488,2020-03-13 19:00:09,"b'Working from \xf0\x9f\x8f\xa1, quickly create a document from #GoogleDrive with this keyboard shortcut \xe2\x86\x92 https://t.co/EPgzL7bnEo https://t.co/k3kI3Bs8bi'"
gsuite,1238520216281329666,2020-03-13 17:40:04,"b'@44 We love to hear new ideas! Thanks for sharing it, Menotti! Feel free to submit it here: https://t.co/pHPtg8WjZL. -LC'"
gsuite,1238498889046646785,2020-03-13 16:15:20,b'Our latest installment of #gsuite Pro Tips is here. Learn from @gregsramblings how to use filters in #gmail to easi\xe2\x80\xa6 https://t.co/srWccvFxkK'
gsuite,1238494518460252162,2020-03-13 15:57:57,"b'@stevekirtley Hi Steve, sorry to hear this. Can you send us a DM with your domain name and more details about your\xe2\x80\xa6 https://t.co/nMJDXmLdSJ'"
gsuite,1238461105564979201,2020-03-13 13:45:11,b'Attn Admins \xf0\x9f\x93\xa3 Set up MX records for #gsuite to specify the mail server responsible for accepting email messages on\xe2\x80\xa6 https://t.co/N84LCRt4PZ'
gsuite,1238457192715616258,2020-03-13 13:29:38,"b'@Jr24293504 Hey there, you can report this content here: https://t.co/0RqpyrtpoL. For more information or if you ha\xe2\x80\xa6 https://t.co/9qVS8A3M5R'"
gsuite,1238397606486855680,2020-03-13 09:32:52,"b'@uumarrr Hi Umar, sorry to hear that. Could you please DM us more details about the account and about the error mes\xe2\x80\xa6 https://t.co/59OfKyEnYb'"
gsuite,1238280165534425088,2020-03-13 01:46:12,"b'@k4shif Hello Kashif, thank you for reaching out. At the moment, what you seek is not available. However, you can c\xe2\x80\xa6 https://t.co/7pphAJHWjF'"
gsuite,1238208172768342023,2020-03-12 21:00:07,"b""Don't let working remote keep your teams from staying connected \xf0\x9f\x8c\x90. From #GoogleDocs, you can email your collaborato\xe2\x80\xa6 https://t.co/9SWYKniVRC"""
gsuite,1238183816273035269,2020-03-12 19:23:20,"b'@quiquedcc Hi Quique, the Google Classroom service is available for G Suite for Education accounts. Learn more and\xe2\x80\xa6 https://t.co/rHOmZhbB3r'"
gsuite,1238182186945318912,2020-03-12 19:16:52,b'RT @javimesparza: Spain closed schools due to #CODVID19 My daughter will be covering her regular class schedule using @Google Hangouts + @G\xe2\x80\xa6'
gsuite,1238163038852861953,2020-03-12 18:00:47,"b'@Sheetal62852825 Hi Sheetal, sorry to hear this issue persists. Have you tried using our chat and email support channels? -EC'"
gsuite,1238162844627197958,2020-03-12 18:00:00,b'Keep your team connected and organized from anywhere with these 8\xef\xb8\x8f\xe2\x83\xa3 tips on optimizing for remote collaboration \xe2\x86\x93 https://t.co/zT1QZ6BiZz'
gsuite,1238147827748032516,2020-03-12 17:00:20,b'The latest episode of #gsuite Pro Tips is coming soon \xf0\x9f\x91\x80. Check back Friday to learn how you can increase your produ\xe2\x80\xa6 https://t.co/KMSS9YFlQn'
gsuite,1238142244617621505,2020-03-12 16:38:09,"b'@Sheetal62852825 Hey Sheetal, sorry to hear this. Did you report this to our technical support? If so, can you DM u\xe2\x80\xa6 https://t.co/IUdVRC0PuY'"
gsuite,1238111975864926211,2020-03-12 14:37:52,b'@puntano23 You can do it by opening a support ticket here https://t.co/haVJRpkLLm -LH'
gsuite,1238104453666033664,2020-03-12 14:07:59,"b'@beagonza5 Hey there, you will be able to talk with one of our agents by chat, email or phone. You need to create a\xe2\x80\xa6 https://t.co/nnjvjZ4ZBb'"
gsuite,1238101486346866688,2020-03-12 13:56:11,"b'@puntano23 While the Toolbox is not covered by our support teams, they will be happy to assist with analysing the f\xe2\x80\xa6 https://t.co/BzuHq4m86h'"
gsuite,1238100811001008128,2020-03-12 13:53:30,"b'@beagonza5 Hey there, sorry to hear that. To contact our support Team, please follow the steps in this link\xe2\x80\xa6 https://t.co/KYd72VQTMN'"
gsuite,1238098674753908737,2020-03-12 13:45:01,"b'Niko J\xc3\xa4rvinen, founder of @breathenaava, was determined to improve office air quality and create inspired work envi\xe2\x80\xa6 https://t.co/7d9kWtip3f'"
gsuite,1238097743542980621,2020-03-12 13:41:19,"b""@puntano23 Hey Hugo, we weren't able to recreate this on our end. Can you try clear cache and cookies to see if tha\xe2\x80\xa6 https://t.co/llmYJumuFx"""
gsuite,1237948254035345408,2020-03-12 03:47:18,"b'@hopskotchSunDAY Hello there, could you send us your domain name via DM? - MG'"
gsuite,1237850422775132163,2020-03-11 21:18:33,"b'@whalen Hi Dan, at this moment you can avoid this situation by Live streaming a video meeting:\xe2\x80\xa6 https://t.co/gmglUe9Kot'"
gsuite,1237845760965636106,2020-03-11 21:00:02,b'Grab and Go with #ChromeEnterprise enables employees to:\n \n\xf0\x9f\x91\xa8\xe2\x80\x8d\xf0\x9f\x92\xbb Work from anywhere\n\xf0\x9f\x9a\x97 Test-drive #Chromebooks\n\xf0\x9f\x95\x92 Save\xe2\x80\xa6 https://t.co/X8mwZQ7LWn'
gsuite,1237833617763598351,2020-03-11 20:11:46,"b'Whether you\xe2\x80\x99re distance learning or working remotely, check out these tips for staying productive from anywhere  \xe2\x86\x93 https://t.co/vrQGAbPhq3'"
gsuite,1237815607128662016,2020-03-11 19:00:12,b'\xe2\x9c\x85 Email your team\n\xe2\x9c\x85 Plus in co-workers \n\xe2\x9c\x85 See changes made \n\nAll from the comfort of your #GoogleDocs \xe2\x86\x92\xe2\x80\xa6 https://t.co/nDWKjS5hcK'
gsuite,1237801980766179328,2020-03-11 18:06:04,b'RT @GoogleSmallBiz: Can you find 4\xef\xb8\x8f\xe2\x83\xa3 of our favorite @gsuite tools?\n\nD I R W U G B K F\nR A D N E L A C J\nI  G M A I  L P D N\nV C T V X L Z\xe2\x80\xa6'
gsuite,1237784097520484352,2020-03-11 16:55:00,b'Attn Admins \xf0\x9f\x93\xa3: From understanding how to give your workforce access to the tools they need to being prepared to pro\xe2\x80\xa6 https://t.co/rS2Mwmr6bY'
gsuite,1237763799282855938,2020-03-11 15:34:20,"b'Happy #WomensHistoryMonth! We\xe2\x80\x99re proud to provide tools, like Hangouts, that help innovators like Emily &amp; Betsy bui\xe2\x80\xa6 https://t.co/uzm1dWmOhd'"
gsuite,1237753369273544705,2020-03-11 14:52:54,"b'@jsptoa Hey Joseph, thanks for the suggestion. To share your idea with us, open up the help menu at\xe2\x80\xa6 https://t.co/e5szJ5je92'"
gsuite,1237736285521031169,2020-03-11 13:45:01,b'Attn Admins \xf0\x9f\x93\xa3 Sign up to try the new #GoogleGroups interface!  Explore our updated experience and prepare your user\xe2\x80\xa6 https://t.co/DQT3EFPkak'
gsuite,1237717268106223616,2020-03-11 12:29:27,"b""@jondcarroll @googlejamboard Hey Jon, you can use this link to access a playlist of all videos we've released in re\xe2\x80\xa6 https://t.co/sEgXyixrb2"""
gsuite,1237707728304439297,2020-03-11 11:51:32,"b'@phillbjones Hi Phill, sorry to hear this. Could you DM us with the case number and the domain name so I can have a\xe2\x80\xa6 https://t.co/zHDTr0xYBM'"
gsuite,1237626338271428608,2020-03-11 06:28:07,"b""@MiraiWonderCafe Hey there, very sorry to hear that you're having trouble getting into the Admin Console. Can you D\xe2\x80\xa6 https://t.co/kG5PvTAOiy"""
gsuite,1237548438604017666,2020-03-11 01:18:34,"b'@MrTASpence I see, not sure we can deal with the add on causing the issue, but I will like to recommend to speak wi\xe2\x80\xa6 https://t.co/0retSzC416'"
gsuite,1237546239563988992,2020-03-11 01:09:50,"b'@MrTASpence Hello Timothy, when you mention forms approval, are you referring to a tool you use with your forms? yo\xe2\x80\xa6 https://t.co/uO6ZDh3dIa'"
gsuite,1237499117645041664,2020-03-10 22:02:35,"b""@arddhu This feature is only available for images, but as it's new, is subject to changes. Feel free to submit it a\xe2\x80\xa6 https://t.co/hCXKAng3BC"""
gsuite,1237495342326833153,2020-03-10 21:47:35,"b'@KChatlosh This information would need to be confirmed by your carrier. Once you have a dial in number, your carrie\xe2\x80\xa6 https://t.co/d27lKKEGIG'"
gsuite,1237491674584100865,2020-03-10 21:33:01,"b'@KChatlosh Yes, regular call charges will apply. To confirm the charges you would have to get in contact with your phone carrier. -LN'"
gsuite,1237489392954028033,2020-03-10 21:23:57,"b'@arddhu Hi Arddhu, this feature is available for Google Docs at this moment. You can always be on top for any futur\xe2\x80\xa6 https://t.co/uhttNe9vXf'"
gsuite,1237484105580888068,2020-03-10 21:02:56,"b""@KChatlosh Hi Kelsey, this option is not toll free. Charges depend on the number you select, based on the country's\xe2\x80\xa6 https://t.co/yhAI4tlCZC"""
gsuite,1237483370889842693,2020-03-10 21:00:01,b'\xe2\x86\x92\xe2\x86\x93\xe2\x86\x92\xe2\x86\x93\xe2\x86\x92\xe2\x86\x93\xe2\x86\x92\xe2\x86\x93\xe2\x86\x92\xe2\x86\x93\xe2\x86\x92\xe2\x86\x93\xe2\x86\x92\xe2\x86\x93\xe2\x86\x92\xe2\x86\x93\xe2\x86\x92\xe2\x86\x93\xe2\x86\x92\xe2\x86\x93\xe2\x86\x92\xe2\x86\x93\xe2\x86\x92\xe2\x86\x93\xe2\x86\x92\xe2\x86\x93\xe2\x86\x92\xe2\x86\x93\xe2\x86\x92\xe2\x86\x93\xe2\x86\x92\n\n Announcing improved Image positioning for #GoogleDocs \n\n\xe2\x86\x92\xe2\x86\x93\xe2\x86\x92\xe2\x86\x93\xe2\x86\x92\xe2\x86\x93\xe2\x86\x92\xe2\x86\x93\xe2\x86\x92\xe2\x86\x93\xe2\x86\x92\xe2\x86\x93\xe2\x86\x92\xe2\x86\x93\xe2\x86\x92\xe2\x86\x93\xe2\x86\x92\xe2\x86\x93\xe2\x86\x92\xe2\x86\x93\xe2\x86\x92\xe2\x86\x93\xe2\x86\x92\xe2\x86\x93\xe2\x86\x92\xe2\x80\xa6 https://t.co/4x9TOHs9k0'
gsuite,1237424300531073025,2020-03-10 17:05:18,"b'This week on \xe2\x80\x9cThe Suite Life,\xe2\x80\x9d Laura Mae Martin demonstrates how to download your #GoogleDrive files as \n\n\xe2\x9c\x85 .pdf\n\xe2\x9c\x85\xe2\x80\xa6 https://t.co/pGMzvD1Ouz'"
gsuite,1237412392260247555,2020-03-10 16:17:58,"b""@hakarune We're glad we could help, feel free to contact us anytime you need assistance. -LH"""
gsuite,1237404584617873409,2020-03-10 15:46:57,"b'@hakarune Hey Ace, from the Admin console. Go Devices &gt; Device Management &gt; Password Settings. You can choose to au\xe2\x80\xa6 https://t.co/lHVhfmGDMp'"
gsuite,1237400319467950080,2020-03-10 15:30:00,"b""Work from anywhere while staying productive with these tips from #gsuite's @YouTube playlist \xe2\x86\x93  https://t.co/NrsrA4BvCu"""
gsuite,1237381478260105221,2020-03-10 14:15:08,"b'@brookhouser Hey Kevin, we can confirm that any participant in a Meet can remove any other participant. There is no\xe2\x80\xa6 https://t.co/TDcyiWQmlL'"
gsuite,1237373908019486721,2020-03-10 13:45:03,"b'Whether an intern, a seasonal worker, or a volunteer, learn how #gsuite can help manage temporary accounts. More vi\xe2\x80\xa6 https://t.co/pDTUKmIsO6'"
gsuite,1237136081667141642,2020-03-09 22:00:01,b'Take your typing from \xf0\x9f\x90\xa2 to \xf0\x9f\x90\x87 in #GoogleDocs with help from the new autocorrect and Smart Compose features \xe2\x86\x92\xe2\x80\xa6 https://t.co/34Re5S64I2'
gsuite,1237121017258139649,2020-03-09 21:00:09,b'Scheduling meetings is a team effort. Keep your team connected by creating a shared #GoogleCalendar \xf0\x9f\xa4\x9d \xe2\x86\x92\xe2\x80\xa6 https://t.co/OGvPPsNU0E'
gsuite,1237105884813295617,2020-03-09 20:00:01,"b'In an effort to reduce wasteful processes and improve efficiency, @Sunrun runs on #ChromeEnterprise. Learn how the\xe2\x80\xa6 https://t.co/ioaVgHOpk8'"
gsuite,1237026523913302018,2020-03-09 14:44:40,"b'@murtaman Hey there, up to 100 people can edit and comment a file at the same time. If you need to share the file w\xe2\x80\xa6 https://t.co/FXzq6hJoC6'"
gsuite,1237011614097948672,2020-03-09 13:45:26,"b'Google Developers Expert, @AStillman, sat down with us to discuss how he uses #gsuite\xe2\x80\x99s capabilities to build solut\xe2\x80\xa6 https://t.co/0wG13hpszG'"
gsuite,1236993235521867777,2020-03-09 12:32:24,"b'@MistaSped Hey there, sorry to hear this. Can you send us a DM with your domain name along with details about when\xe2\x80\xa6 https://t.co/QUx1qBKQ46'"
gsuite,1236880890762072064,2020-03-09 05:05:59,"b'@LightTheoryLLC Hey there, thanks for looking into this! Please check out the Google Security Reward Programs here:\xe2\x80\xa6 https://t.co/FC72IpBezp'"
gsuite,1236820056807559168,2020-03-09 01:04:15,"b'@ThaddeusJiang Hey there, have you discussed this with Community Support? If so, send me the link to your discussio\xe2\x80\xa6 https://t.co/ngSlxUlG8B'"
gsuite,1236817882488676352,2020-03-09 00:55:36,"b'@daborsk Hi Shawn, sorry for the hassle. It may be due to multiple sessions on the same browser. Does the problem p\xe2\x80\xa6 https://t.co/LCM07gwIom'"
gsuite,1236713320868167686,2020-03-08 18:00:07,"b'Get to know #gsuite Developer Programs Engineer, @asrivas_dev, who is working to inspire new developers to create m\xe2\x80\xa6 https://t.co/J1pH4RiTSk'"
gsuite,1236707610570690561,2020-03-08 17:37:25,b'@c8455 Hey there! Thanks for the note. -BI'
gsuite,1236705535824625665,2020-03-08 17:29:11,b'Changing the conversation in the developer-world is the goal for Googler @TechandEco. Today we celebrate her dream\xe2\x80\xa6 https://t.co/fcAJhqoQv6'
gsuite,1236683183091068933,2020-03-08 16:00:21,"b'RT @googlecloud: To celebrate #IWD2020, we\xe2\x80\x99re highlighting women who have made significant contributions to the developer community. Here a\xe2\x80\xa6'"
gsuite,1236481716308660225,2020-03-08 02:39:48,"b'@Eric_G_Mathias Always a pleasure, you also have the option to use any of the methods here https://t.co/TFZPcf7u04\xe2\x80\xa6 https://t.co/lC0zbpf0Ad'"
gsuite,1236469888165851137,2020-03-08 01:52:48,"b'@Eric_G_Mathias I see, yes my bad, in that case a good solution is to add all domain names under the same account,\xe2\x80\xa6 https://t.co/a7Ef6XXzbY'"
gsuite,1236462932541747200,2020-03-08 01:25:10,"b'@Eric_G_Mathias Hello Eric, there is a way to send emails with your other accounts by adding aliases, on this Artic\xe2\x80\xa6 https://t.co/XxaKwR9wBc'"
gsuite,1236427161650835460,2020-03-07 23:03:01,"b'@fahad14646801 Hello Fahad, please send us a DM with your domain name so that we can help you better.\n-JG'"
gsuite,1236356370066288643,2020-03-07 18:21:43,"b'@Shoukatsardar5 Hey there, how can we help? -LN'"
gsuite,1236335889636372480,2020-03-07 17:00:20,"b'With #AppsScript, #gsuite users can automate notifications from apps to improve workflows. See how Apps Script user\xe2\x80\xa6 https://t.co/teJW265WTw'"
gsuite,1236127120625209344,2020-03-07 03:10:46,"b'@bethfrye29 Hello Bethany, allow me to inform you that Google plus is no longer available for Gsuite accounts, you\xe2\x80\xa6 https://t.co/8oOvHIydQk'"
gsuite,1236064075441991688,2020-03-06 23:00:15,"b'Check out these \xe2\x80\x9csuite\xe2\x80\x9d tips on how to get more done with #gmail, like how to turn emails into #GoogleTasks with\xe2\x80\xa6 https://t.co/JeoeLpVV3r'"
gsuite,1236033820371103744,2020-03-06 21:00:01,b'Enhanced visibility \xf0\x9f\x91\x80\nSimpler management \xf0\x9f\xa7\xa0\nIncreased security for your browser fleet \xf0\x9f\x94\x92\n\nDiscover the benefits of\xe2\x80\xa6 https://t.co/OkqvZnqxCC'
gsuite,1236020212874571776,2020-03-06 20:05:57,b'RT @Hallel_Santos: Thankful for @gsuite to allow for dramatic shifts in remote workforce for us Gov folks. The ability to seamlessly go fro\xe2\x80\xa6'
gsuite,1235997352227454976,2020-03-06 18:35:07,"b'\xf0\x9f\x8e\x89 Introducing a new #gsuite and @Adobe collaboration: @creativecloud for Gmail Add-On \xf0\x9f\x8e\x89. Now, creative professional\xe2\x80\xa6 https://t.co/vM3DRjLXeo'"
gsuite,1235950140273410051,2020-03-06 15:27:30,"b""@a_maiuri Hi Anthony, if you didn't sign up for a G Suite account, we recommend contacting your financial instituti\xe2\x80\xa6 https://t.co/mQNJwxQ9JH"""
gsuite,1235939521994395650,2020-03-06 14:45:19,b'Migrating to #gsuite has enabled @atbfinancial to give its employees the flexibility of the modern workplace throug\xe2\x80\xa6 https://t.co/tEQli2svgZ'
gsuite,1235859367490015232,2020-03-06 09:26:49,"b""@unfakeit Hi Vinay, sorry to hear that. Could you please DM us your domain name? We'll help you with it. Thanks. -IG https://t.co/45lLmPEdHm"""
gsuite,1235858990673694720,2020-03-06 09:25:19,"b'@andreeaonline Hi Andreea, you can get a G Suite account for your personal use if you want and if you have your own\xe2\x80\xa6 https://t.co/b5TmUtzSEH'"
gsuite,1235691188742688769,2020-03-05 22:18:32,"b'@marthacisneros \xf0\x9f\x8e\x89 Congratulations, Martha! We are proud. \xf0\x9f\x98\x89 -LN'"
gsuite,1235686529642696705,2020-03-05 22:00:01,"b'With help from #gsuite, @generalmobile was able to reduce IT issues by 20%. See how the leading smartphone manufact\xe2\x80\xa6 https://t.co/0VZmTO9ONp'"
