gsuite,1280262918727249920,2020-07-06 22:10:40,b'RT @LogitechVC: Don\xe2\x80\x99t miss our next Taco Tuesday \xf0\x9f\x8c\xae\xe2\x80\x94 we\xe2\x80\x99ll be joined by experts from @Randstad and @googlecloud to discuss how organizations\xe2\x80\xa6'
gsuite,1280249925658386438,2020-07-06 21:19:02,b'RT @GoogleSmallBiz: Which tool has been the most helpful for your business during COVID-19?'
gsuite,1280196861782089731,2020-07-06 17:48:11,"b""@dstrausser83 Thank you for your feedback and glad to hear it's resolved! -BI"""
gsuite,1280194662268010496,2020-07-06 17:39:27,"b""@dstrausser83 To reactivate your subscription, please click on the 'Apps' icon &gt; 'Add services' &gt; 'Start trial'  un\xe2\x80\xa6 https://t.co/sPUxuOQ7dP"""
gsuite,1280193251497181186,2020-07-06 17:33:50,"b'@dstrausser83 Hi David, sorry to read that. Are you still able to sign in to your G Suite Admin Console? We recomme\xe2\x80\xa6 https://t.co/DkPGYRMl6s'"
gsuite,1280183448662147072,2020-07-06 16:54:53,"b'Go from \xf0\x9f\x8c\x95 to \xf0\x9f\x8c\x91 with Dark theme support in #GoogleDocs, #GoogleSheets and #GoogleSlides on Android. Learn more \xe2\x86\x92\xe2\x80\xa6 https://t.co/HseBM3P9MG'"
gsuite,1280182463042592768,2020-07-06 16:50:58,b'@BatuhanDesigner You can also post in the YouTube community in that case: https://t.co/K2VcYXd4hr and one of our pr\xe2\x80\xa6 https://t.co/BPnFGXAI3x'
gsuite,1280178815403274240,2020-07-06 16:36:28,b'RT @Google: Level up on your skills. Learn how to...\n\xf0\x9f\x97\xa3 Have a dialogue\n\xf0\x9f\x94\x8e  Restore old versions \n\xf0\x9f\x91\xa5  Present your work \n\xf0\x9f\xa4\xb3  Work offline \n\xf0\x9f\x92\xbb  C\xe2\x80\xa6'
gsuite,1280177813795020800,2020-07-06 16:32:30,b'@BatuhanDesigner Thank you. Feel free to post in the Gmail Help Community: https://t.co/w7NfqYpPNR in order to get\xe2\x80\xa6 https://t.co/AvVKhQUBEJ'
gsuite,1280175146540597249,2020-07-06 16:21:54,"b'@BatuhanDesigner Hey there, sorry to hear about this. Can you confirm if you are using a @gmail.com or a G Suite account? -LC'"
gsuite,1280173932969177089,2020-07-06 16:17:04,"b""@HJL_Greenberg Hi Henry, sorry to hear you're having trouble. To report any issues with the Google Meet Grid View e\xe2\x80\xa6 https://t.co/9YYwnDSTpr"""
gsuite,1280169673670242315,2020-07-06 16:00:09,"b'@kookiandtaebear Hi there, sorry to hear that. Can you confirm if you have a G Suite account? -JR'"
gsuite,1280169649028714498,2020-07-06 16:00:03,"b""Starting July 14th, discover the interactive solutions to your biggest challenges at #GoogleCloudNext '20: OnAir. G\xe2\x80\xa6 https://t.co/b3kKUk6nA3"""
gsuite,1280153791904583683,2020-07-06 14:57:02,"b'@realChuckGraham Hey Charles, sorry to hear that. If you were still charged after cancelling your subscription, ple\xe2\x80\xa6 https://t.co/950syDmhtN'"
gsuite,1280141714733350914,2020-07-06 14:09:03,b'@hatmattman Thank you for let us know. -TP'
gsuite,1280132237430853632,2020-07-06 13:31:23,"b'@hatmattman Thank you for sharing the results with us. Clear cache &amp; cookies may resolve this, but let us know if i\xe2\x80\xa6 https://t.co/CP6kCidhD7'"
gsuite,1280130295728087047,2020-07-06 13:23:40,"b""@hatmattman Hi there \xf0\x9f\x91\x8b, thank you for flagging this. We're not aware of any issue with Google Calendar, neither Goo\xe2\x80\xa6 https://t.co/8pUoDJXV8Y"""
gsuite,1280111613434093569,2020-07-06 12:09:26,"b""@pigol1 Hey Piyush \xf0\x9f\x91\x8b, thank you for letting us know this. We're not aware of any general issue with Google Meet. Pl\xe2\x80\xa6 https://t.co/43mrQHczG1"""
gsuite,1280048976348282880,2020-07-06 08:00:32,"b'@rkravindra Hello there \xf0\x9f\x91\x8b, thank you for bringing this to our attention. Please let us know by DM the reason the re\xe2\x80\xa6 https://t.co/i9GIYLG8Me'"
gsuite,1280004300194885634,2020-07-06 05:03:01,"b""@roshanbh Hey Roshan, thanks for reaching out to us about this! I'm sorry that you're having this trouble with Goog\xe2\x80\xa6 https://t.co/XToNXW4eYZ"""
gsuite,1279994643879510021,2020-07-06 04:24:38,"b""@revirdnhoj Hey John, thanks for flagging this! I'm sorry that you're having this trouble, and thanks for doing som\xe2\x80\xa6 https://t.co/G0f25mVmx5"""
gsuite,1279938858466099206,2020-07-06 00:42:58,b'@ajobbins Sorry to read that Adam. We recommend that you reach out to our G Suite Support team\xe2\x80\xa6 https://t.co/wg0s49VmLV'
gsuite,1279928678969982976,2020-07-06 00:02:31,"b""@neilphillips Thank you for your response. It must have been a transient problem, certainly. I'm glad it worked aft\xe2\x80\xa6 https://t.co/Q7yQGOPmfS"""
gsuite,1279926739054080001,2020-07-05 23:54:49,b'@neilphillips Thank you for your response. Can you create your own meeting? - MG'
gsuite,1279925436777222144,2020-07-05 23:49:38,"b'@neilphillips Hello there, thank you for reaching out. We have not received reports of similar issues, so it could\xe2\x80\xa6 https://t.co/LJGrNly63t'"
gsuite,1279925339918131201,2020-07-05 23:49:15,"b'@ajobbins Hello there, thank you for reaching out. We have not received reports of similar issues, so it could be a\xe2\x80\xa6 https://t.co/l8Ak3YiEuf'"
gsuite,1279897041443917826,2020-07-05 21:56:48,"b'@WiSha1212 Hello Sheila, thank you for reaching out. At the moment, unfortunately, what you seek is not currently p\xe2\x80\xa6 https://t.co/kTK3SodjjQ'"
gsuite,1279719259829161984,2020-07-05 10:10:22,"b'@AncestorsAnd Hey there, sorry to hear this. Could you DM us with a screenshot of the error you are getting?  -TP https://t.co/45lLmPVP5W'"
gsuite,1279623559271219200,2020-07-05 03:50:05,"b'@RVARVARVARVAR Hello Ravi, that sounds like a great feature to be added, you can find here: https://t.co/R6N8YM8ijh\xe2\x80\xa6 https://t.co/4Vf1hommHC'"
gsuite,1279549376692715522,2020-07-04 22:55:18,"b'@CoburnCori Hello Cori, we are so sorry to hear about this. Could you please share with us via DM further informati\xe2\x80\xa6 https://t.co/LSWLRhZoP4'"
gsuite,1279532620527869958,2020-07-04 21:48:43,"b'@mnm1350 Hello Matt, G Suite works in a post paid system, meaning that the first of the moth you get the bill for t\xe2\x80\xa6 https://t.co/6EMhmtbW2b'"
gsuite,1279494537275113478,2020-07-04 19:17:24,b'@Sanjay1985twt Feel free to reach our community of experts here https://t.co/47eU8iNt5d Many of them surely have us\xe2\x80\xa6 https://t.co/9VZHOPHJhi'
gsuite,1279479781814345729,2020-07-04 18:18:46,"b'@Sanjay1985twt Hi Sanjay, thanks for getting in touch. You can find all the keyboard shortcuts for Google Sheets he\xe2\x80\xa6 https://t.co/do2AXzBssI'"
gsuite,1279243286796996609,2020-07-04 02:39:01,"b'@MdAyaz009 @gmail Hey there, Gmail offers help on how to recover your Gmail account here: https://t.co/VFIh6Y2dcV I\xe2\x80\xa6 https://t.co/bIKIlYmYA1'"
gsuite,1279179493014409218,2020-07-03 22:25:31,"b'@kensthetic_ Hey Kendra, glad we could help you the way you deserve. Thank you so much for sharing the love to Carl\xe2\x80\xa6 https://t.co/tlS6zNb3nM'"
gsuite,1279172933898960903,2020-07-03 21:59:27,"b'@OviFan8 Hey there, thanks for reaching out. You can find the sessions related to G Suite under topic 2 ""Productivi\xe2\x80\xa6 https://t.co/5bldiAYBs4'"
gsuite,1279127770845646849,2020-07-03 19:00:00,b'See what #gsuite sessions are coming to #GoogleCloudNext \xe2\x80\x9920: OnAir:\n\n\xf0\x9f\x95\xb6 The Future of #Gmail and #GoogleMeet\n\xf0\x9f\x94\x8e Powe\xe2\x80\xa6 https://t.co/jLrtzMIPr7'
gsuite,1279112263270633474,2020-07-03 17:58:22,"b'@juanchifla Hey there, sorry to hear about this. Please DM us the exact date when you cancelled the service and you\xe2\x80\xa6 https://t.co/mhTciGnZ5D'"
gsuite,1279099340536020994,2020-07-03 17:07:01,"b'@rickt Hi Rick, sorry to hear about this. Since the issue persists on different browsers and devices, I strongly su\xe2\x80\xa6 https://t.co/7S16FeI175'"
gsuite,1279082530378002432,2020-07-03 16:00:14,b'Estimating the costs &amp; benefits of switching to #Chromebooks? Get help with this total cost of ownership (TCO) calc\xe2\x80\xa6 https://t.co/4rdWTuxEDZ'
gsuite,1278983271204913153,2020-07-03 09:25:48,"b'@Nishant15817501 Hi Nishant, if you are having issues with your G Suite account, would you mind sending us a DM wit\xe2\x80\xa6 https://t.co/3TqH0xxVbl'"
gsuite,1278973310613835777,2020-07-03 08:46:14,"b""@nayikwei For further help, I'd highly recommend reaching out to the Help Community on the forums here: https://t.co/udROmKblWv -GW"""
gsuite,1278972074602758144,2020-07-03 08:41:19,"b""@nayikwei Hi Joseph, I'm very sorry to hear about the issues stemming from access issues on your @gmail.com email a\xe2\x80\xa6 https://t.co/6mMFVc4pur"""
gsuite,1278919607127101441,2020-07-03 05:12:50,"b'@darcydarnoc Hi Darcy, sorry to hear that. Could you please DM us more details about the issue and the case number\xe2\x80\xa6 https://t.co/s3GGCnIt8x'"
gsuite,1278881137876664322,2020-07-03 02:39:58,"b'@tekeous Please share with us via DM your domain name, and any case number from support if you contacted support before.\n-JG'"
gsuite,1278878181244784640,2020-07-03 02:28:13,"b'@tekeous Hey there, sorry to read that, G Suite is a post paid service, most of the times the charge you get today\xe2\x80\xa6 https://t.co/bcx7g3VR8F'"
gsuite,1278822076149792769,2020-07-02 22:45:16,"b""@DavidToonsYT Hi David, sorry to hear you're having trouble. Let us send you a DM with more details to help resolve\xe2\x80\xa6 https://t.co/AzCNFDb5d8"""
gsuite,1278765352739110914,2020-07-02 18:59:53,"b""We are excited to announce that #gsuite Vice President @jsoltero will be speaking at #GoogleCloudNext '20: OnAir. J\xe2\x80\xa6 https://t.co/eXEpYpp2hd"""
gsuite,1278751426802573312,2020-07-02 18:04:32,"b'@zerrudo_ Hi there, we are so sorry to hear about this. Could you please confirm you are referring to this process\xe2\x80\xa6 https://t.co/AroATXvw5d'"
gsuite,1278751052100231168,2020-07-02 18:03:03,"b'@devlin_charles Hello there Devlin, thank you for reaching out. Could you share more details via DM with us about w\xe2\x80\xa6 https://t.co/5xej71A8HC'"
gsuite,1278720040368553986,2020-07-02 15:59:49,"b""Here's how #ChromeEnterprise is supporting businesses that are running remotely \xe2\x86\x92 https://t.co/jwRyLbmbGY https://t.co/Rq0MD4azY1"""
gsuite,1278712237251796993,2020-07-02 15:28:49,"b'@droidpree @GSuiteDevs No problem, glad we could help. -LH'"
gsuite,1278712022100774915,2020-07-02 15:27:58,"b""@figdigital @gmail Thank you for providing your feedback, Chris. We'll share it with the team. -TP"""
gsuite,1278707938585128961,2020-07-02 15:11:44,"b""@droidpree @GSuiteDevs We don't have any other reports of an issue on our end so this looks to be a local issue, ca\xe2\x80\xa6 https://t.co/RYmKrS10gS"""
gsuite,1278707302808379396,2020-07-02 15:09:12,"b""@ThibaultVlacich Hi there, thank you for bringing this to our attention. We're not aware of any issue with the Admi\xe2\x80\xa6 https://t.co/ONLKoqkevj"""
gsuite,1278705518803124224,2020-07-02 15:02:07,"b'@droidpree @GSuiteDevs Hey Preeti, can you try clear cache and cookies to see if that resolves the issue? https://t.co/7qYuRKlpNT -LH'"
gsuite,1278617186173681666,2020-07-02 09:11:07,"b""@AlfSumz Hey there, we're so glad to hear you're enjoying the product. Thank you for this great feedback! \xf0\x9f\x98\x8a -RC"""
gsuite,1278605824559104000,2020-07-02 08:25:58,"b'@myselfgudri Hi there, sorry to hear that. Could you pop us a DM with your domain name and screenshot of the error you are getting? -JR'"
gsuite,1278439264313901057,2020-07-01 21:24:07,"b'@Miles_Fame If the issue is not resolved by adding a different card, you may want to reach to Google Payments for b\xe2\x80\xa6 https://t.co/YHcj2TggHF'"
gsuite,1278437210807820288,2020-07-01 21:15:57,"b""@Miles_Fame They're different subscriptions. Please DM us a screenshot of the error you're getting, and we'll assist you better. -BI"""
gsuite,1278431655519293443,2020-07-01 20:53:53,"b'@Miles_Fame Is that through your G Suite account setup or Google Domains? That way, we\xc2\xb4ll route you to the correct Suport Team. -BI'"
gsuite,1278430947445288972,2020-07-01 20:51:04,"b""@Miles_Fame Hey there, sorry to read that. Is that a debit or credit card? What is the error you're getting? We'll\xe2\x80\xa6 https://t.co/VUUVYD1tos"""
gsuite,1278418049616482304,2020-07-01 19:59:49,"b'We are rolling out improvements to our existing #GoogleMeet layouts. With these upgraded viewing options, your team\xe2\x80\xa6 https://t.co/nFgFcVCcxT'"
gsuite,1278397266718588928,2020-07-01 18:37:14,"b'@JustinBrady Hi Justin, sorry to hear about this. Make sure you have followed these steps: https://t.co/muTMTsTtQC.\xe2\x80\xa6 https://t.co/3gRoi3xqhf'"
gsuite,1278395956355006468,2020-07-01 18:32:02,"b'@chris_is_tech Hi Chris, thanks for sharing this feedback! Feel free to submit it as feature idea here:\xe2\x80\xa6 https://t.co/SkyFuc1TQL'"
gsuite,1278390279331078144,2020-07-01 18:09:28,"b""@Meliora_Tec Hey there, sorry to hear about this. Feel free to share the error message, if you're getting one, and more details via DM. -LC"""
gsuite,1278387761091878912,2020-07-01 17:59:28,"b""@Manoj_NHPC Hi Manoj, sorry to hear about that. Do you get any error message? Please also confirm your device's ope\xe2\x80\xa6 https://t.co/0JagI9Dxjs"""
gsuite,1278378610097893379,2020-07-01 17:23:06,"b'@manlikeNU Hey there, make sure to follow these steps: https://t.co/k8xY1PGXNK in order to automatically create a s\xe2\x80\xa6 https://t.co/Dc9ZMP6LQP'"
gsuite,1278375336711987201,2020-07-01 17:10:05,"b'Get more out of your data with #GoogleSheets. See how new features like Connected Sheets, Smart Fill, and Smart Cle\xe2\x80\xa6 https://t.co/2qUwIhNjyv'"
gsuite,1278370797128749056,2020-07-01 16:52:03,"b'@Vinay8484 Hey there, thank you for looping us in. Can you DM us more info about your request so we can route it appropriately? -VS'"
gsuite,1278367136822460416,2020-07-01 16:37:30,"b'@canyon289 Hi Ravin, sorry to hear this. How long ago did you cancel your subscription? Also, could you please shar\xe2\x80\xa6 https://t.co/ELCUEejRUU'"
gsuite,1278361479545270272,2020-07-01 16:15:02,b'@alexYQR Glad it is working now! No worries! Have a lovely day! :) -LC'
gsuite,1278354797389905920,2020-07-01 15:48:29,"b'@alexYQR Hi Alex, G Suite sync tools are currently available for Outlook 2019: https://t.co/lLzze2ZdKM Let us know\xe2\x80\xa6 https://t.co/SmA4edLqOI'"
gsuite,1278353922894098434,2020-07-01 15:45:00,b'#DYK: #GoogleDoc\xe2\x80\x99s neural network-powered grammar suggestions are now available in Spanish to make writing and edit\xe2\x80\xa6 https://t.co/kbLj7PqTUN'
gsuite,1278345096140816385,2020-07-01 15:09:56,"b'RT @ericcurts: Google Meet getting many new features including backgrounds, 7x7 grid, end meeting, mute all, disable chat, hand raising, wh\xe2\x80\xa6'"
gsuite,1278344478185619456,2020-07-01 15:07:28,"b""@louis_trance Hi Louis, we're currently looking into reports of an issue, stay tuned for further updates and don't\xe2\x80\xa6 https://t.co/nsjFFz72fx"""
gsuite,1278320178053419009,2020-07-01 13:30:55,"b'@Kriti65138470 Hi Kriti, thank you for flagging this. Did you try to access the meeting through your Google Calenda\xe2\x80\xa6 https://t.co/LhdlkmEzyi'"
gsuite,1278319297882927104,2020-07-01 13:27:25,"b""@SachinBDMotwani Hi Sachin, thank you for flagging this. We're not aware of any issue with Google Forms. Please sen\xe2\x80\xa6 https://t.co/hPC0kr0U7K"""
gsuite,1278315450154323968,2020-07-01 13:12:07,"b'@asutosh73 @Google Hi Asutosh, thank you for flagging this. Can you DM us with the error you are getting when you t\xe2\x80\xa6 https://t.co/3ziBAJFPeT'"
gsuite,1278304353401606144,2020-07-01 12:28:02,"b""@dee_Monney_ Hey Jackie, please pop us a DM with more info about the issue that you're having and we'll be happy to\xe2\x80\xa6 https://t.co/RICGXZkSp1"""
gsuite,1278301171459948546,2020-07-01 12:15:23,"b""@jaycee77 Hi there, I'm very sorry to hear that you're having trouble with Gmail at this moment. Have you been able\xe2\x80\xa6 https://t.co/Dx0NFy8En2"""
gsuite,1278182250232852480,2020-07-01 04:22:50,"b'@SanderDorigo Hey Sander, these alerts will be sent out to a primary or secondary email address that is related to\xe2\x80\xa6 https://t.co/o0kPc43d0M'"
gsuite,1278124040406872064,2020-07-01 00:31:32,"b'@LaurenStreng Hello Lauren, sorry to read this, I wonder if any of steps here: https://t.co/7YaK3tf11R to recover y\xe2\x80\xa6 https://t.co/rRScH6wqcJ'"
gsuite,1278099144603832324,2020-06-30 22:52:36,"b""@Arrtibuss Hi there, thanks for following up. We replied to the DM you sent a few minutes ago. We've forwarded your\xe2\x80\xa6 https://t.co/uzIQJ8rEzj"""
gsuite,1278064386133893121,2020-06-30 20:34:29,b'@tastybeers Thank you very much for this report. We are currently investigating this issue. Please keep an eye on o\xe2\x80\xa6 https://t.co/BZamBDm98G'
gsuite,1278063432726720512,2020-06-30 20:30:42,b'@soarescode Thank you very much for this report. We are currently investigating this issue. Please keep an eye on o\xe2\x80\xa6 https://t.co/6jhmZFEjAa'
gsuite,1278059817320529920,2020-06-30 20:16:20,"b'@kokeramos Hey there, everything is up and running according to our G Suite status dashboard:\xe2\x80\xa6 https://t.co/tquQNkpJKM'"
gsuite,1278055656260583424,2020-06-30 19:59:48,b'Customize your browser experience and enhance your extension reporting with #Chrome Browser Cloud Management Takeou\xe2\x80\xa6 https://t.co/eBACdA1J4u'
gsuite,1278054127449378816,2020-06-30 19:53:43,"b'@TechNerdings Hey there, everything is up and running according to our G Suite status dashboard:\xe2\x80\xa6 https://t.co/B6konfUG1i'"
gsuite,1278052117807280129,2020-06-30 19:45:44,"b""@sjpfisher Hi Simon, we're happy to know you're making the best out of these features! Thanks for sharing your experience! \xf0\x9f\x99\x8c\xf0\x9f\x8f\xbb -LC"""
gsuite,1278049492093341697,2020-06-30 19:35:18,"b""@Suganthanmn Glad it is working now. Don't hesitate to DM us in case you encounter any other issue. Have a nice day! :) -LC"""
gsuite,1278048091900436480,2020-06-30 19:29:44,"b'@Suganthanmn Hey there, everything is up and running according to our G Suite status dashboard:\xe2\x80\xa6 https://t.co/vzNh2HmuxP'"
gsuite,1278029482121662465,2020-06-30 18:15:47,b'@mymargic No worries! You can always posts your questions in the Gmail Help Community: https://t.co/w7NfqYpPNR to g\xe2\x80\xa6 https://t.co/ILFfy4c2ch'
gsuite,1278025514440101891,2020-06-30 18:00:01,"b'This week on \xe2\x80\x9cThe Suite Life,\xe2\x80\x9d Google Productivity Advisor Laura Mae Martin demonstrates how to step up your presen\xe2\x80\xa6 https://t.co/Fce84qCMsu'"
gsuite,1278019914041868290,2020-06-30 17:37:46,"b'@mymargic @gmail Hey there, sorry to hear about this. Can you confirm if you are using a G Suite or a @gmail.com account? -LC'"
gsuite,1278004771031580675,2020-06-30 16:37:36,"b'@sesiegler Hi Sara, thanks for reaching out. We recommend posting this question in the Drive Community at\xe2\x80\xa6 https://t.co/ztGk11uRWM'"
gsuite,1277997755147915264,2020-06-30 16:09:43,"b'Analyze petabytes of data easily with Connected Sheets, Smart Fill and Smart Cleanup in #GoogleSheets \xf0\x9f\x93\x8a. Learn more\xe2\x80\xa6 https://t.co/DBOdUbhlWx'"
gsuite,1277977514535604225,2020-06-30 14:49:17,b'RT @marcuseast: Exciting new features coming soon to Google Meet \xe2\x80\x94 the product team must be working around the clock! #google #googlemeet #\xe2\x80\xa6'
gsuite,1277960615366197249,2020-06-30 13:42:08,b'@msracheldaniels Hi Mrs Rachel. You can check here https://t.co/eIE196ZDVk the MX records you need to set up on God\xe2\x80\xa6 https://t.co/LgPSfmptY9'
gsuite,1277854734729314311,2020-06-30 06:41:24,"b""@8020Mentor Hey there, I'm sorry to hear that you've had this trouble with sharing permissions. It'll be important\xe2\x80\xa6 https://t.co/J1IQweCwcp"""
gsuite,1277799150462087172,2020-06-30 03:00:32,"b'@fzits_ Hey there, have you tried using Community Support where our team and other experts can give you a response?\xe2\x80\xa6 https://t.co/QQHKyn7nBQ'"
gsuite,1277711265453006849,2020-06-29 21:11:19,"b'RT @ASMOliver: Today\xe2\x80\x99s Google Meet was a mixture of smiles, tears, and memories. This group of children will forever carry a special piece\xe2\x80\xa6'"
gsuite,1277706377788563458,2020-06-29 20:51:53,b'@alokc83 Hello Alok  this is a follow up to see if you still require assistance with the problem you reported. - MG'
gsuite,1277703349761171458,2020-06-29 20:39:51,"b""@xBytezz Thank you for the details. I'd recommend to post this in our community support here:\xe2\x80\xa6 https://t.co/0cCo3mnR1k"""
gsuite,1277700803382456320,2020-06-29 20:29:44,"b'Check up on those who give you checkups. #GoogleMeet is free for all, including the healthcare workers who are work\xe2\x80\xa6 https://t.co/kMz3zU5tx5'"
gsuite,1277694185139814402,2020-06-29 20:03:26,"b'@xBytezz Hello xBytezz, thank you for reaching out. It is possible to make these changes and the steps are availabl\xe2\x80\xa6 https://t.co/62Z95sxAvz'"
gsuite,1277667685611028488,2020-06-29 18:18:08,"b""@ThiagoTDotCom Hi Thiago, thanks for sharing this awesome idea. You're welcome to suggest new functionalities as de\xe2\x80\xa6 https://t.co/rEDyX0xQPN"""
gsuite,1277659734401785857,2020-06-29 17:46:33,"b'@chadkirchner Hi Chad, you can disable the option to automatically add Google Meet video conferences to your events\xe2\x80\xa6 https://t.co/lp0p9HNW9a'"
gsuite,1277659456432738305,2020-06-29 17:45:26,"b'RT @gregsramblings: Sure, it\xe2\x80\x99s a fun feature, but it\xe2\x80\x99s also super important because, like school uniforms, it allows students to avoid shar\xe2\x80\xa6'"
gsuite,1277622506250285056,2020-06-29 15:18:37,"b""@csandanov Hey there, I've asked the Support Team to look into this. Please DM me a contact email address in case w\xe2\x80\xa6 https://t.co/eH7CeqL1uv"""
gsuite,1277568355063529474,2020-06-29 11:43:26,"b'@maheshheda Sure, you can. Buying storage licenses allows you to assign the license to any user of your G Suite acc\xe2\x80\xa6 https://t.co/qEIzxVcRON'"
gsuite,1277556592515395585,2020-06-29 10:56:42,b'@ProfNKPandey Hi Narendra. Record and live stream your meetings and many other features are available in Google Mee\xe2\x80\xa6 https://t.co/5YXrsib8cd'
gsuite,1277525555995455488,2020-06-29 08:53:22,b'@slavikdev Amazing Slavik! Well done on all your hard work :) -JR'
gsuite,1277458908920057856,2020-06-29 04:28:32,"b""@dominicmalmonte Hey there, thanks for reaching out. If you need to reset your password when you log in, it's becau\xe2\x80\xa6 https://t.co/xyWFnPHxXM"""
gsuite,1277447014880600064,2020-06-29 03:41:16,"b""@alokc83 We'll be expecting your response. - MG"""
gsuite,1277446012265791488,2020-06-29 03:37:17,"b""@alokc83 Thank you for your response. Could you please send us a screenshot of the error and the formula you're using? - MG"""
gsuite,1277414865473323009,2020-06-29 01:33:31,b'@msracheldaniels You need your MX records to point to GoDaddy? Could you please send me your domain name via DM? - MG'
gsuite,1277412709726904321,2020-06-29 01:24:57,"b'@dimaxjr Hello Dimas, thank you for reaching out. How can we assist you? - MG'"
gsuite,1277412359796129794,2020-06-29 01:23:34,"b'@msracheldaniels If your domain is hosted by Google Domains, you would have to check with them https://t.co/QeopxaiX4u - MG'"
gsuite,1277406885377949696,2020-06-29 01:01:49,b'@msracheldaniels Thank you for the additional details. Have you made any changes to your DNS host? This issue can b\xe2\x80\xa6 https://t.co/rLZjWIUrze'
gsuite,1277405946415808512,2020-06-29 00:58:05,"b""@msracheldaniels Hi Mrs. Sanders, sorry to read that. What is your domain name? We'll gladly look into this for you. -BI"""
gsuite,1277351150522699780,2020-06-28 21:20:20,"b""@KathyGreenstone Hello Kathy, thank you for reaching out. The 'host' of a meeting is the first person to join. If y\xe2\x80\xa6 https://t.co/iCx2xv4Aer"""
gsuite,1277302565160583169,2020-06-28 18:07:17,"b""@acklaygames You're most welcome. -BI"""
gsuite,1277300326152974336,2020-06-28 17:58:23,"b""@acklaygames Try this URL https://t.co/gwP7g5wX6k and let us know if you're able to bypass that step. -BI"""
gsuite,1277297127312498690,2020-06-28 17:45:40,"b""@acklaygames Hi Jordan, thank you for reaching out. First, you'll need to cancel your subscription to be able to de\xe2\x80\xa6 https://t.co/ncQucQkXw1"""
gsuite,1277133285601300481,2020-06-28 06:54:37,"b""@Clare_Hendry Hey Clare, I'm sorry to hear that you're having trouble with Google Docs at the moment. Please check\xe2\x80\xa6 https://t.co/xq9RLaVP59"""
gsuite,1276979155779883010,2020-06-27 20:42:10,"b'@pankaj981859358 Hello Pankaj, we are so sorry to hear you have trouble reaching support. Please ensure you are fol\xe2\x80\xa6 https://t.co/zNqq6j8TvM'"
gsuite,1276909670255464449,2020-06-27 16:06:03,"b'RT @googlenest: Meet with everyone, whether you\xe2\x80\x99re trying to...\n\n\xf0\x9f\x92\xaa Lead a workout\n\xf0\x9f\x93\x96 Get with your book club\n\xf0\x9f\xa7\x98\xe2\x80\x8d\xe2\x99\x80\xef\xb8\x8f Organize a group meditatio\xe2\x80\xa6'"
gsuite,1276691462332219394,2020-06-27 01:38:59,"b""@mvsmanvirsingh @gmail We'd like to take a closer look at this Manvir, could you please share the email address via Direct Message? -ES"""
gsuite,1276683517913632769,2020-06-27 01:07:24,"b'@mvsmanvirsingh @gmail Hello Manvir, thank you for reaching out. Could you please share more details about the erro\xe2\x80\xa6 https://t.co/Mi5agIVv7p'"
gsuite,1276583983816597505,2020-06-26 18:31:54,"b'@adamdaniells Hello Adam, we have a site to keep track of ideas like the one you are sharing with us here:\xe2\x80\xa6 https://t.co/5hHJtwB1EP'"
gsuite,1276575967515901952,2020-06-26 18:00:02,"b""Employees are the core of any organization. Here's how to empower them with the right resources and support their p\xe2\x80\xa6 https://t.co/vbeFQJHwAm"""
