gsuite,1217637575269199872,2020-01-16 02:39:55,"b'@jackiearnettrd Hello Jackie, would you be so kind to send us a DM with your full email address and domain name?\n-JG'"
gsuite,1217582268576911362,2020-01-15 23:00:09,b'Highlight a slice \xf0\x9f\x8d\xb0 in a #GoogleSheets pie chart to showcase some sweet data \xe2\x86\x92 https://t.co/duQqTFiJIC https://t.co/6ueQJc1gKs'
gsuite,1217577103555792897,2020-01-15 22:39:37,"b'@peateedee Hello Pete, Thank you for sharing with us that you are enjoying some of the new features, sorry about yo\xe2\x80\xa6 https://t.co/Y6pp4hU47Q'"
gsuite,1217572196673036290,2020-01-15 22:20:07,b'Attn Admins: We\xe2\x80\x99re simplifying the Advanced Protection enrollment process while maintaining the same high level of\xe2\x80\xa6 https://t.co/pZAheu2RSn'
gsuite,1217562171795701760,2020-01-15 21:40:17,"b'RT @sundarpichai: The Advanced Protection Program is our strongest level of security for Google Accounts. Today, we\xe2\x80\x99re simplifying the enro\xe2\x80\xa6'"
gsuite,1217522267065933825,2020-01-15 19:01:43,"b""@GingerVieira @GSuiteDevs Hello Ginger, thank you for reaching out. I'm truly sorry abut this situation. Could you\xe2\x80\xa6 https://t.co/880oMAxD69"""
gsuite,1217509765762383878,2020-01-15 18:12:03,"b'@carloslage Hi Carlos, sorry for the hassle. Feel free to DM us your domain name and a screenshot of your migration\xe2\x80\xa6 https://t.co/lo3uOpxIr3'"
gsuite,1217506739245010945,2020-01-15 18:00:01,b'Check out these 4\xef\xb8\x8f\xe2\x83\xa3 tips to use your messaging and email apps more effectively \xe2\x86\x92 https://t.co/LlrFL9fIA9 https://t.co/OnFUcyM4vs'
gsuite,1217502142250000386,2020-01-15 17:41:45,"b""@msbertschmann Thanks for your kind words, Kelly! We're proud to play a part on your students experience and bringi\xe2\x80\xa6 https://t.co/pqLIdMvlUi"""
gsuite,1217479690585288704,2020-01-15 16:12:32,b'@kaleighherter We can see your case number but are still waiting for you to provide an email address which you can be contacted on. -LH'
gsuite,1217457714965688320,2020-01-15 14:45:13,b'Find out how @FA is getting ready to accomplish this year and next year\xe2\x80\x99s GOALLSSS with #gsuite \xe2\x86\x92\xe2\x80\xa6 https://t.co/FmLYXgHneo'
gsuite,1217457282059067392,2020-01-15 14:43:29,b'@kaleighherter Can you DM us your case number and an email address you have access to so we can let the support team know? -LH'
gsuite,1217454423657648132,2020-01-15 14:32:08,"b'@kaleighherter Hey Kaleigh, during our password reset process we ask you to provide an email address which you can\xe2\x80\xa6 https://t.co/XqfZzGDNkP'"
gsuite,1217452268108374018,2020-01-15 14:23:34,"b""@aloadv1 Hey there, thanks for reaching out. You can DM us more information about your issue and we'll have a look\xe2\x80\xa6 https://t.co/Al9zRlLZrt"""
gsuite,1217418515726131200,2020-01-15 12:09:27,"b'@saydgains Hi Sayd, sorry to hear that you are having an issue with Google Drive. Send us a DM with detailing your\xe2\x80\xa6 https://t.co/wpbIzI8nQr'"
gsuite,1217270746092908545,2020-01-15 02:22:16,"b'@srbodkhe @GSuiteDevs @GoogleAppMaker Thank you, and you as well, Shivaji :) - MG'"
gsuite,1217270308656295938,2020-01-15 02:20:32,"b'@srbodkhe @GSuiteDevs @GoogleAppMaker Hello Shivaji, thank you for reaching out. At the moment, there is no officia\xe2\x80\xa6 https://t.co/1PFSCG1M4e'"
gsuite,1217230566191521793,2020-01-14 23:42:36,"b""@mrlerchclass Hello there, thank you for sharing your achievement with us! We hope you'll be able to empower your s\xe2\x80\xa6 https://t.co/OFDnU0MHD5"""
gsuite,1217189649661267968,2020-01-14 21:00:01,"b""Need help migrating from Windows 7? Learn how #Chrome's continued support for enterprises using Windows 7 can help\xe2\x80\xa6 https://t.co/nOElj1B1zr"""
gsuite,1217177246902996993,2020-01-14 20:10:44,"b'@Sharonthemezzo Way to go, Sharon! Congratulations! Keep it up! \xf0\x9f\x91\x8f\xf0\x9f\x8f\xbb -LC'"
gsuite,1217154498415800321,2020-01-14 18:40:20,"b'In the latest episode of \xe2\x80\x9cThe Suite Life,\xe2\x80\x9d Productivity Advisor, Laura Mae Martin, explains how to manage time \xe2\x8f\xb0 ar\xe2\x80\xa6 https://t.co/IOIaGUIeUa'"
gsuite,1217153293279006723,2020-01-14 18:35:33,"b'@paulbudding Hi Paul, sorry to read that. Please DM us your domain name, and case number, in case you received one\xe2\x80\xa6 https://t.co/gFOip4idXx'"
gsuite,1217141200010010627,2020-01-14 17:47:30,"b'@kaleighherter Hi Kaleigh, sorry to hear about your experience. We do provide password recovery options for Admins\xe2\x80\xa6 https://t.co/AuvHdaGxXh'"
gsuite,1217120224127877120,2020-01-14 16:24:09,b'RT @benlcollins: Mega thread of #GoogleSheets #productivity tips &amp; tricks coming up... \n\nStarting with this humdinger\n\nType \xe2\x80\x9chttps://t.co/A\xe2\x80\xa6'
gsuite,1217110443787014146,2020-01-14 15:45:17,"b""@MrsCzak Congratulations Sarah! We're happy for you. \xf0\x9f\x99\x8c -MM"""
gsuite,1217095276881686531,2020-01-14 14:45:01,b'Lifestyle brand @GANT1949 was able to button up their workflow with #gsuite products like #GoogleDrive and #Gmail.\xe2\x80\xa6 https://t.co/mQVyUdgU39'
gsuite,1217087829668499456,2020-01-14 14:15:25,"b""@james Hi James, we're sorry to hear this. Can you please send us a DM with more details about the issue? -JR https://t.co/45lLmPVP5W"""
gsuite,1216977082112233472,2020-01-14 06:55:21,"b'@apurva Hey there Apurva, sorry to hear about your trouble. Could you pop me a DM with your old domain name please?\xe2\x80\xa6 https://t.co/u9ZKUOh3Yy'"
gsuite,1216894202954600448,2020-01-14 01:26:01,b'@DreamBigRB @missweinstein39 @amandagrobles @rbmsROCKETS @rbpsEAGLES @RedBankSup @iste @GoogleForEdu @Google @rbbef\xe2\x80\xa6 https://t.co/1UpjB52TYd'
gsuite,1216858046137237504,2020-01-13 23:02:20,b'Learn how to become a #gsuite pro with our YouTube \xe2\x80\x9cHow-To\xe2\x80\x9d playlist. Find even more:\n\n      \xe2\x9c\x85 #GoogleDocs Tips\xe2\x80\xa6 https://t.co/KVVDTRMZ21'
gsuite,1216812253460287493,2020-01-13 20:00:23,"b'Fred Klein, VP of Business Development at @Box, talks about Box\xe2\x80\x99s newest #gsuite integrations \xe2\x86\x93 https://t.co/1HHlni5rXz'"
gsuite,1216811183354847234,2020-01-13 19:56:08,"b""@donovanroubos Helo Donovan, I'm truly sorry abut the problem you're facing. Could you send me a DM with the email\xe2\x80\xa6 https://t.co/YqRIRyalaY"""
gsuite,1216766860122820608,2020-01-13 17:00:00,"b'From Sweden \xf0\x9f\x87\xb8\xf0\x9f\x87\xaa to England \xf0\x9f\x87\xac\xf0\x9f\x87\xa7 to Portugal \xf0\x9f\x87\xb5\xf0\x9f\x87\xb9, see how @GANT1949 teams around the world used #gsuite to launch its fl\xe2\x80\xa6 https://t.co/fAQfcURw0w'"
gsuite,1216761888555573253,2020-01-13 16:40:15,b'@razbarrie @Office365 Can you DM us your case number from your contact with support? -LH'
gsuite,1216756815872110598,2020-01-13 16:20:05,"b'@razbarrie Hey there, we recommend emailing your reseller to state that you wish to exit the contract you have sign\xe2\x80\xa6 https://t.co/kywSfpI9ts'"
gsuite,1216732919072542720,2020-01-13 14:45:08,b'\xf0\x9f\x8e\x89 Enhancements to data security \n\xf0\x9f\x8e\x8a New policies &amp; performance improvements\n\xf0\x9f\xa5\xb3 Tools for adopting modern security pro\xe2\x80\xa6 https://t.co/vsVJ2PU7z1'
gsuite,1216634378622730240,2020-01-13 08:13:34,"b""@lifensoul Hi Steve, sorry to hear that? Could you please DM us your case number? We'll have a look into it. Thanks\xe2\x80\xa6 https://t.co/b5ZJoG4Y13"""
gsuite,1216464869458837506,2020-01-12 21:00:00,b'Lifestyle brand @GANT1949 was able to launch their London store in just 3\xef\xb8\x8f\xe2\x83\xa3 months with the help of #gsuite. Learn\xe2\x80\xa6 https://t.co/4Uuu8hhIYN'
gsuite,1216449774330818560,2020-01-12 20:00:01,"b""\xf0\x9f\x9b\x8d\xef\xb8\x8f Ensure high-quality products\n\xe2\x8f\xb1\xef\xb8\x8f Reduce wait times\n\xf0\x9f\x91\xa8\xe2\x80\x8d\xf0\x9f\x91\xa9\xe2\x80\x8d\xf0\x9f\x91\xa6 Offer personalized experiences\n\nHere's how retailers can\xe2\x80\xa6 https://t.co/vuYwKgYx15"""
gsuite,1216162919257387014,2020-01-12 01:00:09,b'#Smallbiz tip: Teamwork makes the dream work \xf0\x9f\xa4\x9d. Learn how to create a shared #GoogleCalendar for your employees \xe2\x86\x92\xe2\x80\xa6 https://t.co/jWWQfmRbns'
gsuite,1216119515156709377,2020-01-11 22:07:41,b'@creativeedtech @JakeMillerTech @jmattmiller @KarlyMoura @bribriggs @GoogleForEdu @SlidesCarnival @googleslides\xe2\x80\xa6 https://t.co/10wUlaPsOP'
gsuite,1215829944292511747,2020-01-11 02:57:02,"b'@g8t0r Thanks for the update, sometimes an office network may have some sort of vpn or internal policies that may b\xe2\x80\xa6 https://t.co/KKR8XkR0BG'"
gsuite,1215791675588665345,2020-01-11 00:24:58,"b'@stuholden Hey there Stu, sorry to hear about that. Can you send us a DM with your case number to take a further look at this? -ES'"
gsuite,1215790489057796097,2020-01-11 00:20:15,"b'@eduGOOGdroid @Jentechnology WOW Mr. G, congratulations! Thank you for sharing this success with us, never stop learning! Keep it up. -ES'"
gsuite,1215763295271116807,2020-01-10 22:32:12,b'@serenekxc We are always happy to hear you are enjoying the new features Serene! We are always working to improve a\xe2\x80\xa6 https://t.co/jxClZDN4eV'
gsuite,1215755409836908545,2020-01-10 22:00:52,"b'Whether it\xe2\x80\x99s a hammer, a lasso, or a shield\xe2\x80\x94all superheroes need super tools \xf0\x9f\x92\xaa. Learn how you can use #gsuite tools\xe2\x80\xa6 https://t.co/NOLD744wPh'"
gsuite,1215731258535313413,2020-01-10 20:24:53,"b""@lifensoul Hi Steve, feel free to contact our tech support team: https://t.co/ZjrWv6SpH8 they'll be more than happy\xe2\x80\xa6 https://t.co/OU7najd2MT"""
gsuite,1215692955207467008,2020-01-10 17:52:41,b'@minton Thank you for bringing this up Minton. This refers to a situation where users may be on a different version\xe2\x80\xa6 https://t.co/huspYfjtkK'
gsuite,1215689514041081858,2020-01-10 17:39:01,"b""@g8t0r Hi Rusty, thank you for reaching out. I've tested this on my side and I was able to make it work. Have you t\xe2\x80\xa6 https://t.co/z3OVKTOE5V"""
gsuite,1215659035191582720,2020-01-10 15:37:54,"b'RT @GSuiteDevs: \xf0\x9f\x93\xa9 Incoming message!\n\nIn Sheets to Apps, @presactlyalicia shows how to create your own custom YouTube notifications and trac\xe2\x80\xa6'"
gsuite,1215645758571020293,2020-01-10 14:45:09,b'Ask questions \xe2\x9c\x85 \nGet answers \xe2\x9c\x85 \nMake questions mandatory in #GoogleForms with this helpful tip \xe2\x86\x92\xe2\x80\xa6 https://t.co/RROONDZtrt'
gsuite,1215583474146594817,2020-01-10 10:37:39,"b'@AlanPeters96 Hi Alan, Search Console is not part of the core suite of G Suite services. But I recommend reaching o\xe2\x80\xa6 https://t.co/Sm4Kkl8d02'"
gsuite,1215453729614331907,2020-01-10 02:02:05,"b""@ChelseaRhane @JessicaGottlieb Hello Chelsea, I'm truly sorry about what's going on at the moment with your account\xe2\x80\xa6 https://t.co/7jqAxyFAQa"""
gsuite,1215415455155925001,2020-01-09 23:30:00,"b'Learn how to get the most out of your #GoogleSlides by adding #GoogleForms, incorporating shared #GoogleDocs, and m\xe2\x80\xa6 https://t.co/IaL8RbkToO'"
gsuite,1215396402425188354,2020-01-09 22:14:17,"b'@gerryblevins Hi Gerry, sorry to hear about your experience. Can you DM us the case number and more details about t\xe2\x80\xa6 https://t.co/M1azSzsZ2f'"
gsuite,1215375546990956557,2020-01-09 20:51:25,"b'@dionbrowne Hi there Dion, thank you for reaching out. We recommend to double check this: https://t.co/Ffmv1gBuvC t\xe2\x80\xa6 https://t.co/T0puU84sV6'"
gsuite,1215317374016139266,2020-01-09 17:00:16,b'Employees are spending more time in their web browsers than ever before. Learn how #Chrome Browser empowers employe\xe2\x80\xa6 https://t.co/aJkTZK0aeQ'
gsuite,1215283333548036101,2020-01-09 14:45:00,b'Admins \xf0\x9f\x93\xa3: Learn how to avoid exfiltration with data loss prevention in #gsuite \xe2\x86\x92 https://t.co/OCzwtHHx2S https://t.co/T4fEavqiqk'
gsuite,1215280426455048195,2020-01-09 14:33:27,"b'@DigitalHimal @Google @GSuiteDevs Hey Himal, using our direct billing we will not be able to accept pre-paid cards,\xe2\x80\xa6 https://t.co/pz8dW8KsXU'"
gsuite,1215067219689951234,2020-01-09 00:26:14,"b'@leovonp Hello Leonardo, we have specialist that can help you with this, have you contacted support? do you have a\xe2\x80\xa6 https://t.co/F9S1Qaw760'"
gsuite,1215056266709684224,2020-01-08 23:42:43,b'@eltoozero Thank you so much for bringing this up. Could you please share with us additional details about your sup\xe2\x80\xa6 https://t.co/dkfnP7nOms'
gsuite,1215045558991228928,2020-01-08 23:00:10,"b'From the integration of Cloud Search in #GoogleSites to Dark mode for #GoogleTasks on iOS, here are all the excitin\xe2\x80\xa6 https://t.co/VQMTECZ1p3'"
gsuite,1215029395032813573,2020-01-08 21:55:56,"b'RT @GoogleForEdu: Start 2020 with a clean slate by leveraging @gsuite organization tools \xf0\x9f\x97\x82\xef\xb8\x8f. Get inspired by Michael, an administrator who\xe2\x80\xa6'"
gsuite,1215023814905606150,2020-01-08 21:33:46,"b'@JoeArmstrongC4s Thanks for your feedback, Joe. This is an interesting functionality. Would you mind submitting mor\xe2\x80\xa6 https://t.co/NC9a56hfky'"
gsuite,1215007768458993671,2020-01-08 20:30:00,b'See how the @FA kicks off their 2\xe2\x9a\xbd\xef\xb8\x8f2\xe2\x9a\xbd\xef\xb8\x8f strategy with #gsuite \xe2\x86\x92 https://t.co/iN6Sjb9V0K https://t.co/TZmNTv4nL1'
gsuite,1214928155355602944,2020-01-08 15:13:39,"b'@manavanand Hi Manav, sorry to hear that. Could you please DM us more details about when you cancelled your G Suite\xe2\x80\xa6 https://t.co/cDlOA7CkPT'"
gsuite,1214920949725827072,2020-01-08 14:45:01,"b'Since switching to Acer #Chromebooks, @ervia reduced its IT support calls by 75%. Learn more about the impact of\xe2\x80\xa6 https://t.co/TuvI0oI8wY'"
gsuite,1214911420556619778,2020-01-08 14:07:09,"b'@janeadamsgb Hi Jane, sorry to hear that. Could you please DM us more details about your account and the error you\xe2\x80\xa6 https://t.co/lprmOrNJp1'"
gsuite,1214873063608791042,2020-01-08 11:34:44,"b'@PMakongo Hey Patrick, sorry to hear about this trouble. Could you pop me a DM with your domain name and a screensh\xe2\x80\xa6 https://t.co/6PFzvcZgaN'"
gsuite,1214848190220034048,2020-01-08 09:55:53,"b'@BazualdoD Thanks for highlighting! In general, temporary issues and ""oops"" errors can be resolved by following the\xe2\x80\xa6 https://t.co/R9Ls89lYVL'"
gsuite,1214842126909001728,2020-01-08 09:31:48,"b""@BazualdoD Hey there, hope you don't mind me jumping in here! I'm sorry to hear that you're having trouble with you\xe2\x80\xa6 https://t.co/YfKlDPHJRo"""
gsuite,1214702626954260480,2020-01-08 00:17:29,"b""@jwsamuel @Google Hello Jim, thank you for reaching out. I'm truly sorry about this situation you have faced. Could\xe2\x80\xa6 https://t.co/ejSFdHlo9J"""
gsuite,1214683164477706240,2020-01-07 23:00:08,b'#TuesdayTip: Stay on top of changes in shared documents by setting notification rules in #GoogleSheets \xe2\x86\x92\xe2\x80\xa6 https://t.co/CQhGgr7q9H'
gsuite,1214682212756533249,2020-01-07 22:56:21,"b'@thejuliedaniel Hi Julie, sorry to read about that. You can restore a user account up to 20 days after deleting it.\xe2\x80\xa6 https://t.co/IUzm9FHGTr'"
gsuite,1214681986469711872,2020-01-07 22:55:27,"b'@AlexDRocca Hi Alex, sorry to hear this. Could you please share more details via DM? You can include your domain name. -LN'"
gsuite,1214671369268580353,2020-01-07 22:13:16,"b'@SouthernMel_ @Accredible Hello Melissa, awesome job! keep  them coming.\n-JG'"
gsuite,1214648658488115203,2020-01-07 20:43:01,"b""@kofres Great! We're so glad to know that its now fixed. -ES"""
gsuite,1214641226823155712,2020-01-07 20:13:30,"b'@daledavies_me Hi Dale, sorry to hear this. Could you please share more details via DM? You can include your domain name. -LN'"
gsuite,1214637857140289537,2020-01-07 20:00:06,"b'Analyze, chart and report on @Zendesk activity directly from #GoogleSheets with the new Zendesk Data Connector \xe2\x86\x92\xe2\x80\xa6 https://t.co/1sKGO9zuLh'"
gsuite,1214618329534611458,2020-01-07 18:42:30,"b'@kofres Hey there Kofres, thank you for reaching out. Can you share with us via DM your domain name to take a further look? -ES'"
gsuite,1214597816531730437,2020-01-07 17:21:00,"b'In the latest episode of \xe2\x80\x9cThe Suite Life,\xe2\x80\x9d learn how to work in #GoogleDrive from anywhere around the \xf0\x9f\x8c\x8e, even witho\xe2\x80\xa6 https://t.co/dnSWkFKJII'"
gsuite,1214558564297117696,2020-01-07 14:45:01,b'Deploying and managing #ChromeEnterprise is simple. Familiarize yourself with IT management options for modern ente\xe2\x80\xa6 https://t.co/r9utR9P7dn'
gsuite,1214514963731144706,2020-01-07 11:51:46,"b'@cRigter Hey Chris, thanks for your continued support! Atm, Google Assistant with G Suite accounts is in Beta and y\xe2\x80\xa6 https://t.co/6y0rMphIuZ'"
gsuite,1214322002569420806,2020-01-06 23:05:01,b'Flexible #gsuite tools like #GoogleDocs and #GoogleSheets make it easy for employees at @SuiteSpotTech  to work fro\xe2\x80\xa6 https://t.co/JEodfxzJ59'
gsuite,1214275445006487554,2020-01-06 20:00:00,b'Set your business up for success in the new year by reviewing #gsuite:\n\n\xe2\x9c\x85 Settings\n\xe2\x9c\x85 Apps \n\xe2\x9c\x85 Devices \n\nLearn more v\xe2\x80\xa6 https://t.co/tRaNyxXJfd'
gsuite,1214259084846755840,2020-01-06 18:55:00,"b'New year, .new way to open #GoogleDocs \xf0\x9f\x8e\x89 \xe2\x86\x92 https://t.co/7w2z9X0HJl https://t.co/qIP8sa9zcB'"
gsuite,1214254222532849665,2020-01-06 18:35:41,"b'@jpwallhorn Thank you so much for the confirmation JP. Please, if the situation persists, let us know. We will make\xe2\x80\xa6 https://t.co/CXCujtU93E'"
gsuite,1214234174401449984,2020-01-06 17:16:01,"b'@jpwallhorn Hi JP, we are sorry to hear you are having issues with your emails. Is there any chance you can share w\xe2\x80\xa6 https://t.co/SX5i7I2qEo'"
gsuite,1214221690462441472,2020-01-06 16:26:24,"b'@ritlocus @Google Sorry, we should have mentioned that this is a function on the desktop version. -LH'"
gsuite,1214219807601635336,2020-01-06 16:18:55,"b'@ritlocus @Google Hey Ritesh, sometimes the sorting alithogram may sort an email to the wrong tab, but you can drag\xe2\x80\xa6 https://t.co/vaaCXwKoTX'"
gsuite,1214196384586457088,2020-01-06 14:45:51,"b""Here's what you need to know to help get your business started on #GoogleDrive \xe2\x86\x92 https://t.co/kGrBGPNoub https://t.co/KrGxErHrKR"""
gsuite,1213976570878201856,2020-01-06 00:12:23,"b'@eduGOOGdroid Hello Mr. G, It certainly looks good. It should be what they need. - MG'"
gsuite,1213943258050682882,2020-01-05 22:00:01,b'Find out how #ChromeEnterprise helped @Hacker0x01 find &amp; eliminate security vulnerabilities for their customers thr\xe2\x80\xa6 https://t.co/AtGbWyPtVh'
gsuite,1213876598950248448,2020-01-05 17:35:08,"b'@PrettyOldSoul__ Hey there, you sure can. Feel free to DM us your domain name so we can assist you better. -BI'"
gsuite,1213867803083714573,2020-01-05 17:00:11,b'Get to know your #GoogleCalendar and become a scheduling superhero \xf0\x9f\x99\x8c\xe2\x86\x92 https://t.co/CiD4xfjKmO https://t.co/8ZHvDRHfIj'
gsuite,1213783504363905025,2020-01-05 11:25:13,"b""@dawnieando Hi Dawn, I'm not aware of any issue with Gmail, and the status dashboard https://t.co/Y3OJ3Lg1ML doesn'\xe2\x80\xa6 https://t.co/d3WplHTPxr"""
gsuite,1213708613967130625,2020-01-05 06:27:37,"b""@sojournimages Hey there, sorry to hear that you're having an issue with Google Voice. Could you please confirm if\xe2\x80\xa6 https://t.co/1AD0gDYIGf"""
gsuite,1213520562515001344,2020-01-04 18:00:22,b'Attn Admins \xf0\x9f\x93\xa3: #DYK you can control access to sensitive information based on the attributes of users? Learn more \xe2\x86\x92\xe2\x80\xa6 https://t.co/EvoQiS6dpc'
gsuite,1213457791563763718,2020-01-04 13:50:57,"b""@jwsamuel @Microsoft365 Hey Jim, we're sorry to hear you're having an issue, can you send us a DM with your case number? -LH"""
gsuite,1213203381831000064,2020-01-03 21:00:01,b'See how writer @VivianaRiveroES used #GoogleDocs to engage fans in the creative process of her latest novel \xe2\x86\x92\xe2\x80\xa6 https://t.co/3Ejzjp3Ew1'
gsuite,1213181320358170625,2020-01-03 19:32:21,"b'@farazamiruddin Hi Faraz, have you discussed this with Community Support? If so, send me the link to your discussio\xe2\x80\xa6 https://t.co/WhfdVDMPe3'"
gsuite,1213142984461635589,2020-01-03 17:00:01,b'#DYK you can curate and send content automatically using #GoogleSheets and Apps Script? Here\xe2\x80\x99s how \xe2\x86\x92\xe2\x80\xa6 https://t.co/tWloGEX0ZO'
gsuite,1213109038948466688,2020-01-03 14:45:08,b'Organize your data by moving a row \xe2\xac\x86\xef\xb8\x8f or \xe2\xac\x87\xef\xb8\x8f in #GoogleSheets \xe2\x86\x92 https://t.co/FT0hs9ZuZC https://t.co/UnbVoFMx6q'
gsuite,1213090571901980672,2020-01-03 13:31:45,"b'@ITTechDavid Hey there, could you please DM us more details about the issue?  Thanks. -IG https://t.co/45lLmPVP5W'"
gsuite,1213087190898675714,2020-01-03 13:18:19,"b""@abid_patel Thank you for sharing your feedback. We're happy to hear your thoughts about Google Forms. -TP"""
gsuite,1213065240910450691,2020-01-03 11:51:05,b'@oreseun Congratulations Seun! Thanks for sharing this and thanks for your kind words about our platform. Cheers! -MM'
gsuite,1213052202123743232,2020-01-03 10:59:17,"b'@soamjena Hi Soumendra, sorry to hear that. Can you send us a DM with more details about your issue, please? Thanks\xe2\x80\xa6 https://t.co/2SutfNeERQ'"
gsuite,1213048916624756736,2020-01-03 10:46:13,"b'@essigodini Hi Rob, sorry to hear that you are having issues with your G Suite account. Could you DM us so I can pr\xe2\x80\xa6 https://t.co/gAVIUPVNr3'"
gsuite,1213042583049580544,2020-01-03 10:21:03,"b'@ramlevi Hey there, we have no information about it at the moment. But I recommend checking for updates in https://t.co/MRNQpHbYPs. -MM'"
gsuite,1213037737089159168,2020-01-03 10:01:48,"b'@srinu565 Hi Srinivas, sorry to hear this. This channel only supports G Suite core products, for issues related wit\xe2\x80\xa6 https://t.co/KDTobYfIZP'"
gsuite,1212965135737901057,2020-01-03 05:13:18,"b'@SuchiG Hey there, the month after cancelling a G Suite account you will be billed any outstanding charges:\xe2\x80\xa6 https://t.co/Nt2bOTByw8'"
gsuite,1212955931564265473,2020-01-03 04:36:44,"b'@BBH6585 You can feel free to send a DM, or contact any of the support methods found on this URL:\xe2\x80\xa6 https://t.co/5wHIkg9Mwl'"
gsuite,1212948161439948801,2020-01-03 04:05:51,"b'@BBH6585 Hello Bhavesh, sorry to read that, we offer different forms to contact support, are you able to send a DM\xe2\x80\xa6 https://t.co/BQeFPgQHCf'"
gsuite,1212848602126659585,2020-01-02 21:30:15,"b""@antoinemussard Hi Antoine, since this is about Google Domains, we'd recommend you to get in touch with them at:\xe2\x80\xa6 https://t.co/YOFmZHcXDx"""
gsuite,1212841065729970176,2020-01-02 21:00:18,b'#Chrome Browser is centered around security. See how built-in layers of protection can help you mitigate risk and e\xe2\x80\xa6 https://t.co/YteqFznMcJ'
gsuite,1212834664844533768,2020-01-02 20:34:52,"b'@SecondChanceJob Hi @SecondChanceJob, we are are deeply sorry you are experiencing problems with the billing of you\xe2\x80\xa6 https://t.co/w7Ln4eDpUh'"
gsuite,1212780665202204673,2020-01-02 17:00:17,b'Admins \xf0\x9f\x93\xa3: Here\xe2\x80\x99s a quick guide on how to manage mobile and desktop devices that access #gsuite in your network \xe2\x86\x92\xe2\x80\xa6 https://t.co/MyAEB4UKb5'
gsuite,1212772253018075138,2020-01-02 16:26:51,b'@RadioTutor Support are only contactable via the Admin console. You may have lost access if the subscription has en\xe2\x80\xa6 https://t.co/FKfFHU1bpF'
gsuite,1212768170278301699,2020-01-02 16:10:38,b'@RadioTutor We recommend opening a support case to make a request for a refund. Check here to see how to open a sup\xe2\x80\xa6 https://t.co/PTgMqwjINV'
gsuite,1212766638824706048,2020-01-02 16:04:33,"b'@RadioTutor Hey there, do you still have access to your Admin console? -LH'"
gsuite,1212735300763574273,2020-01-02 14:00:01,"b'""Enabling digital transformation for our customers and our own company is a core tenet of our technology strategy\xe2\x80\x9d\xe2\x80\xa6 https://t.co/Y6PaVjEN5Z'"
gsuite,1212733938864730113,2020-01-02 13:54:37,"b'@Vusys It looks like expected behaviour. However, if you add a custom logo to your G Suite account it will show thi\xe2\x80\xa6 https://t.co/bT2S2LXZ4i'"
gsuite,1212723303812653058,2020-01-02 13:12:21,"b'@Vusys Hi Bryan, when exactly are you seeing the old logo? -JR'"
gsuite,1212700920150208512,2020-01-02 11:43:24,"b'@InTheEyesOfLiz Hi Liz, thanks for reaching out to us. Can you send us a DM along with your domain name? Thanks. -MM https://t.co/45lLmPVP5W'"
gsuite,1212690590573436930,2020-01-02 11:02:22,"b'@Markus306 Hi Markus, sorry to hear that. Can you send us a DM so we can help you reaching out to the Support Team?\xe2\x80\xa6 https://t.co/1hszWhTdhB'"
gsuite,1212639312002592768,2020-01-02 07:38:36,"b'@ochonogorgabby Hey Gabriel, glad to hear you enjoy working with our platform \xf0\x9f\x98\x80-JR'"
gsuite,1212448486463066114,2020-01-01 19:00:20,b'Get creative in the new year by learning how to copy formats in #GoogleSlides with format painter \xf0\x9f\x8e\xa8 \xe2\x86\x92\xe2\x80\xa6 https://t.co/UN3GicKCcT'
gsuite,1212392523752235010,2020-01-01 15:17:57,b'@ImAnandKarna Happy new year to you too! :) -IG'
gsuite,1212391988579966976,2020-01-01 15:15:49,b'Start the new year with #gsuite \xf0\x9f\x8e\x89 #NewYearsDay https://t.co/hgPtWLR2gS'
gsuite,1212355057016020996,2020-01-01 12:49:04,"b'@the_ankish Hi A n k i s h, sorry to hear that. Can you send us a DM with more details along with your domain name?\xe2\x80\xa6 https://t.co/6yCzkSZOuO'"
gsuite,1212048820298821632,2019-12-31 16:32:12,b'@godigtl Happy New Year! -LH'
