gsuite,1256005524996440068,2020-04-30 23:40:27,"b'@pyus13 Hello Piyush, please continue sending feedback where suggested previusly and also, ask your administrator t\xe2\x80\xa6 https://t.co/XfrN0njfgV'"
gsuite,1256004703349018624,2020-04-30 23:37:11,"b'@DanGeekyWorld Hey there, have you tried using Community Support here: https://t.co/HUwQmslxfn  where our team and\xe2\x80\xa6 https://t.co/vWMGerIKOd'"
gsuite,1256000706730958850,2020-04-30 23:21:18,"b'@tylerwince Hello Ty, we have a site to keep track of good ideas, please follow steps here: https://t.co/R6N8YLQHrJ\xe2\x80\xa6 https://t.co/RN3YHKcSwf'"
gsuite,1255996897262780424,2020-04-30 23:06:10,"b""@ronweasly20 Hi Ron, we'll be glad to walk you through. Feel free to DM us your domain name so we can assist you better. -BI"""
gsuite,1255980187700924416,2020-04-30 21:59:46,"b'@DVentemilla Hi there David, thank you for bringing this up. Meetings are limited to 60 minutes for the free produc\xe2\x80\xa6 https://t.co/TAzJPRHwpc'"
gsuite,1255968049125036038,2020-04-30 21:11:32,"b'RT @sherimatsuda: Spreading the love, #Google Meet is free for everyone!   https://t.co/CN1eGVdFkt https://t.co/fuXMJUNQ7i'"
gsuite,1255958204724457472,2020-04-30 20:32:25,b'RT @GoogleCloud_UKI: \xf0\x9f\x91\x8b #MeetOurTeam: The EMEA Social Media team! \n\nPost your own team picture using tiled view in #GoogleMeet and use the h\xe2\x80\xa6'
gsuite,1255943015874658305,2020-04-30 19:32:03,"b'@SDGIS Hi Ari, thanks for getting in touch. We are always looking for ways to improve our products. We recommend us\xe2\x80\xa6 https://t.co/eQfhlnh32X'"
gsuite,1255942206965325825,2020-04-30 19:28:51,b'RT @YahooFinance: Highlight: @Google G Suite Vice President and GM @jsoltero on the rise in popularity of Google Meet amid coronavirus: htt\xe2\x80\xa6'
gsuite,1255934993165103104,2020-04-30 19:00:11,"b""@dafingaz Hi there Marcus, thank you for reaching out! Although we don't have free certifications at the moment, yo\xe2\x80\xa6 https://t.co/Kpu87rsY3K"""
gsuite,1255933838729101313,2020-04-30 18:55:35,"b'RT @Mt_Innes: The more we all do from home, the more we all do to help. #GoogleMeet was built for secure business #video meetings and now w\xe2\x80\xa6'"
gsuite,1255928307654238208,2020-04-30 18:33:37,"b'@danielsrosehill Hi Daniel, thank you for your feedback, we really appreciate it. Feel free to submit a Feature Ide\xe2\x80\xa6 https://t.co/zIXpJ4FxVt'"
gsuite,1255918771144994816,2020-04-30 17:55:43,"b'@merylkevans Unfortunately, this feature is only available when using Slides on a computer. We are always looking f\xe2\x80\xa6 https://t.co/Mf5fXg08oZ'"
gsuite,1255916486419451905,2020-04-30 17:46:38,"b'@clodonoghue Hi Claire, sorry to hear about this. What seems to be the problem? Feel free to DM us more details. -LC'"
gsuite,1255914784010260481,2020-04-30 17:39:52,"b'@merylkevans Hi Meryl, thanks for reaching out. Yes, live captions will be available. You can find more details her\xe2\x80\xa6 https://t.co/iLkYNnH1wu'"
gsuite,1255913325134843910,2020-04-30 17:34:05,b'We\xe2\x80\x99re proud to be partnering with @Sothebys for a special MayDay COVID-19 Charity Auction benefiting @RESCUEorg. St\xe2\x80\xa6 https://t.co/1RTCpErbPu'
gsuite,1255895772786241536,2020-04-30 16:24:20,"b""@ErinWalk Hi Erin, at the moment you'll have both options available, however you can find more info about this tran\xe2\x80\xa6 https://t.co/gi2IhTHdyE"""
gsuite,1255873459311259649,2020-04-30 14:55:40,b'Tune in on Tuesday to learn best practices for transitioning your teams to working from home using #gsuite and\xe2\x80\xa6 https://t.co/QkK4fjoPV7'
gsuite,1255869181981085696,2020-04-30 14:38:40,b'@UtkarshMittal3 It should already be available on your G Suite account. Send us a DM if you noticed that is somethi\xe2\x80\xa6 https://t.co/q0dqLRQoVH'
gsuite,1255861480601325568,2020-04-30 14:08:04,"b""@RTLDigitalMedia Hey there. We can help you have a look at what's going on. Pop us a message with the domain name,\xe2\x80\xa6 https://t.co/GuZOeWFzkR"""
gsuite,1255860240727314433,2020-04-30 14:03:08,"b'@UtkarshMittal3 Hi Utkarsh, thank you for your question. Google Meet will allow you to have 250 participants in the\xe2\x80\xa6 https://t.co/dQgzU1Mrwe'"
gsuite,1255853310042611720,2020-04-30 13:35:36,"b'@merylkevans Hi Meryl, thanks for your message. You can check how to contact the Support Team for accessibility rea\xe2\x80\xa6 https://t.co/JqnttwW9Pc'"
gsuite,1255811110718132224,2020-04-30 10:47:55,"b""@cornishant You're welcome. Feel free to contact us if any assistance is needed. -TP"""
gsuite,1255809029928091649,2020-04-30 10:39:39,"b'@cornishant Hi Antony, thank you for reaching out. Your son should be able to login using his G Suite for Education\xe2\x80\xa6 https://t.co/UY7KSe0j6k'"
gsuite,1255806100642902016,2020-04-30 10:28:00,"b'@ecarsontc Hey there, thanks for the feedback. We recommend using the ""Send Feedback"" option in Google Meet to send us your suggestion.-LH'"
gsuite,1255792961880821760,2020-04-30 09:35:48,"b""@okherbalistyaho Hi Hakeem, that's an excellent question. G Suite is charged by the number of users you have on you\xe2\x80\xa6 https://t.co/cfP66wVJZo"""
gsuite,1255789493908582401,2020-04-30 09:22:01,"b'@sherjinjenish Hey there, sorry to hear this. Could you DM us with the domain name, so I can help you? -TP https://t.co/45lLmPVP5W'"
gsuite,1255784572278779904,2020-04-30 09:02:28,"b""@S68057213 Hey there, sorry to hear this. Can you DM us with your email address, and I'll be happy to help you. -TP https://t.co/45lLmPVP5W"""
gsuite,1255773335310544897,2020-04-30 08:17:48,"b'@Thehappyhairco1 Hey there, sorry to hear that. Could you please DM us more details about the issue and the case re\xe2\x80\xa6 https://t.co/TeXyawzBSH'"
gsuite,1255749634179444737,2020-04-30 06:43:38,"b'@anubhavn22 Hey Anubhav, thanks for getting in touch. In this scenario you can create a live stream event and add u\xe2\x80\xa6 https://t.co/T7ZBH8c4hT'"
gsuite,1255655035058434048,2020-04-30 00:27:43,"b'@jadry92 Hello Johan, Glad you are enjoying the recent updates! have a great rest of your day! thank you for sharin\xe2\x80\xa6 https://t.co/RGWOHhjVsM'"
gsuite,1255652164728389635,2020-04-30 00:16:19,"b'@mooring871 Hello Mooring, our dedicated team has mentioned that they tried connecting with you with no luck. Could\xe2\x80\xa6 https://t.co/UqWaGVpY66'"
gsuite,1255638544137289730,2020-04-29 23:22:12,"b""@mooring871 Hi there Mooring, thanks for the case number. I'll ask the Support Team to check on this as soon as possible. -ES"""
gsuite,1255597786088853504,2020-04-29 20:40:14,"b""@ScottAdamsSays @Google Hi Scott, we're sorry to hear about this. Can you DM us with your domain name and any more details so we can help?"""
gsuite,1255585782141722641,2020-04-29 19:52:32,"b'@ajakeanderson Hi there Jake! Thank you for bringing this up. There is no specified date for now, but we recommend\xe2\x80\xa6 https://t.co/1WmiumBfWc'"
gsuite,1255577908338450433,2020-04-29 19:21:15,"b'RT @RobertEnslin: Just like my team, you can stay connected with #GoogleMeet, which is coming soon\xe2\x80\x94free\xe2\x80\x94for anyone with an email address. S\xe2\x80\xa6'"
gsuite,1255572548311486472,2020-04-29 18:59:57,"b'@XianNewman Hi Christian, thank you for reaching out. Feel free to check out Google Meet training and help article\xe2\x80\xa6 https://t.co/Y6mfL5eorj'"
gsuite,1255569586998644738,2020-04-29 18:48:11,b'RT @uhoelzle: Coming soon: #GoogleMeet available for free and for anyone (developer or user) with an email address. More info here.  \n\nhttp\xe2\x80\xa6'
gsuite,1255559956365008898,2020-04-29 18:09:55,"b""@alexpaluzzi Hi Alex, you're welcome to post this inquiry to the Google Nest community so other users and Product E\xe2\x80\xa6 https://t.co/xOyderZ6gh"""
gsuite,1255555998414254081,2020-04-29 17:54:11,"b""@itsme_kumara Hi Kumara, sorry to hear you're going through this. You'll need to post your question to the Gmail Co\xe2\x80\xa6 https://t.co/2CEoc98Azc"""
gsuite,1255550077415886849,2020-04-29 17:30:40,"b""@thatonehacker5 Hi there, thanks for looping ust. You're welcome to submit your improvement suggestions as describe\xe2\x80\xa6 https://t.co/BPeGub39c3"""
gsuite,1255533306378178561,2020-04-29 16:24:01,"b'@ChrisFoltz Hi Christopher, thanks for reaching out. Feel free to contact our billing team: https://t.co/ZjrWv6SpH8\xe2\x80\xa6 https://t.co/NVK36gYNMb'"
gsuite,1255526809074126850,2020-04-29 15:58:12,"b'RT @awagonfeld: Thanks to @jsoltero and our awesome @gsuite team, we\xe2\x80\x99ve re-engineered #GoogleMeet to make it free and available for all.  B\xe2\x80\xa6'"
gsuite,1255525815011479557,2020-04-29 15:54:15,"b""RT @jsoltero: We've been working hard to enhance and grow Meet. Making it available to everyone is the next important step. \n\nThe service w\xe2\x80\xa6"""
gsuite,1255514645705654277,2020-04-29 15:09:52,"b'\xe2\x80\x9cPeople want familiar, secure tools that they can use across all facets of their lives\xe2\x80\x9d \xe2\x80\x94@jsoltero, VP of #gsuite\xe2\x80\xa6 https://t.co/VzyF0YZPYn'"
gsuite,1255500085728874498,2020-04-29 14:12:01,"b'@FerProfeEOI Hi Fernanda, if you are referring to the Chrome tab update, the feature is fully rolled out to Rapid R\xe2\x80\xa6 https://t.co/UNAVXqPGID'"
gsuite,1255499100168085512,2020-04-29 14:08:06,b'RT @CaroleeGearhart: You asked us for more features - we delivered. You didn\xe2\x80\x99t ask us to give them to you for free - but we are. Through Se\xe2\x80\xa6'
gsuite,1255497461185089537,2020-04-29 14:01:35,b'@Sksv13 We kindly ask you to send us a DM with your domain name for further investigation. -JR'
gsuite,1255495635970777089,2020-04-29 13:54:20,"b'@Sksv13 Hi there, sorry to hear that. Would you mind sending us a DM with the case number and domain name so we can\xe2\x80\xa6 https://t.co/FaHcd12Tis'"
gsuite,1255486717525712900,2020-04-29 13:18:53,"b'@interplato @googlefonts Hey there, thanks for getting in touch. We recommend using the ""Send Feedback"" option with\xe2\x80\xa6 https://t.co/XiM0p7LJeb'"
gsuite,1255483144653897742,2020-04-29 13:04:42,"b'RT @RickHarshman: Excited to share that starting in early May, #GoogleMeet will be free for anyone with an email address! From using Meet t\xe2\x80\xa6'"
gsuite,1255470690213474306,2020-04-29 12:15:12,"b""@esilvas Hey Emilio, we're currently in the process of rolling this feature out to everyone. Once rolled out to you\xe2\x80\xa6 https://t.co/Kq9o9UMlw0"""
gsuite,1255469090719838211,2020-04-29 12:08:51,"b'@tim2c4v2 That is good question, Tim. With Google Meet you can switch to a different layout if you want. Check more\xe2\x80\xa6 https://t.co/POQ9uHI38K'"
gsuite,1255464557063086080,2020-04-29 11:50:50,"b'@mady1234567890 @Google For issues with personal Gmail accounts, please post in the Gmail Help Forum:\xe2\x80\xa6 https://t.co/6H8ZYlHJsq'"
gsuite,1255463144895512576,2020-04-29 11:45:13,"b'@mady1234567890 @Google Hey Prakash, are you having an issue with your G Suite account? If so can you let us know the details? -LH'"
gsuite,1255449750079279104,2020-04-29 10:52:00,"b'@pyus13 That can be something we may consider in future releases, Piyush. You can submit the suggestion through the\xe2\x80\xa6 https://t.co/Qj1BitscAG'"
gsuite,1255444187006341121,2020-04-29 10:29:53,"b'@chicgeek Hi Laura, much appreciate your feedback. These are the current keyboard shortcuts available in Google Mee\xe2\x80\xa6 https://t.co/drcaQhRPIl'"
gsuite,1255437978241040385,2020-04-29 10:05:13,"b""Coming soon \xf0\x9f\x93\xa3: We'll be offering #GoogleMeet for free to anyone with an email address to help people, businesses, &amp;\xe2\x80\xa6 https://t.co/QCkr47tfL2"""
gsuite,1255413948993634304,2020-04-29 08:29:44,"b'@bonniegillespie Thanks Bonnie, I am right on it! -JR'"
gsuite,1255404019524214785,2020-04-29 07:50:17,"b'@bonniegillespie Hi Bonnie, sorry to hear about this. Would you mind popping us a DM with your domain name and case\xe2\x80\xa6 https://t.co/qMZzL8NeQF'"
gsuite,1255359836549713922,2020-04-29 04:54:43,"b""@Bowman_John Hey John, I'm sorry your having trouble with your G Suite account. Can you pop a DM our way with more\xe2\x80\xa6 https://t.co/3GFge0RW2b"""
gsuite,1255340787686092805,2020-04-29 03:39:01,b'@astadnicki Thank you so much for this information and we are so sorry to hear you are having this problem. Could y\xe2\x80\xa6 https://t.co/5DuSQFEop1'
gsuite,1255339758806589441,2020-04-29 03:34:56,"b'@astadnicki Hi there Andrew, thank you for bringing this up with us. Is there an specific error you are getting whe\xe2\x80\xa6 https://t.co/utuz9R0bA9'"
gsuite,1255278100486782980,2020-04-28 23:29:55,"b'@TheCrandiKing Sorry for the hassle Justin. If your account was deleted, and your card is cancelled, the domain ren\xe2\x80\xa6 https://t.co/TCGRo1uRQu'"
gsuite,1255248789163724809,2020-04-28 21:33:27,"b'@istaylearning @historysandoval Hello Raul, thank you for reaching out. Please, as a workaround, try uploading the\xe2\x80\xa6 https://t.co/CoIv54EFlp'"
gsuite,1255240378564915201,2020-04-28 21:00:02,b'Managing your workforce remotely? Here are some ways to improve #Chrome Browser extension management through permis\xe2\x80\xa6 https://t.co/Cn1mjmNn7i'
gsuite,1255231689447608321,2020-04-28 20:25:30,"b""@AlinaPatel18 If you're the Super Admin of the G Suite account, you need to enable this feature following the steps\xe2\x80\xa6 https://t.co/rYvKR9jjF4"""
gsuite,1255227333931401217,2020-04-28 20:08:12,"b'@fran_esco42 Hi Franscisco, thank you for the additional details and sorry for the delay. Is that issue with your G\xe2\x80\xa6 https://t.co/rj9QnLGy1q'"
gsuite,1255223148930310146,2020-04-28 19:51:34,"b'@AlinaPatel18 Hi Alina, premium features should be available for all G Suite editions, these features will be avail\xe2\x80\xa6 https://t.co/a9UHOFc2k9'"
gsuite,1255219292414644226,2020-04-28 19:36:14,"b'RT @mavenwave: When working remotely, our Mavens stay connected using Google Meet! #MeetOurTeam that hopped on a morning coffee break today\xe2\x80\xa6'"
gsuite,1255205129952862208,2020-04-28 18:39:58,"b""@NoStressTech Hi there Jason, that's actually a neat idea! I'd recommend to contact your G Suite Admin or to access\xe2\x80\xa6 https://t.co/2U5PZ285Gf"""
gsuite,1255195126491762688,2020-04-28 18:00:13,"b'Stay on top of changes to your files while working remotely. This week on \xe2\x80\x9cThe Suite Life,\xe2\x80\x9d Laura Mae Martin demons\xe2\x80\xa6 https://t.co/hWe3WbxV6F'"
gsuite,1255190681393430529,2020-04-28 17:42:33,"b'@taeplex Hi there, thanks for reaching out. If the basics (clearing cache &amp; cookies, trying other networks, OS, com\xe2\x80\xa6 https://t.co/ubRRarxZv3'"
gsuite,1255182184434077698,2020-04-28 17:08:47,"b'RT @Lionesses: \xf0\x9f\xa4\xa3 @ellsbells89, @stephhoughton2 and a serious case of the giggles. \n\nThe #Lionesses Coffee Club returns \xe2\x98\x95\xef\xb8\x8f\n\n#FootballsStayin\xe2\x80\xa6'"
gsuite,1255178765602295811,2020-04-28 16:55:12,"b'@TheCrandiKing Hi Justin, whenever you purchase a domain, you make an unique payment for a year of service. Since y\xe2\x80\xa6 https://t.co/tswsOmb14s'"
gsuite,1255177639595212801,2020-04-28 16:50:44,"b'@tenishyllon Hi Tenishyllon, thanks for getting in touch. We are always looking for ways to improve our products, t\xe2\x80\xa6 https://t.co/OdHitoHbpD'"
gsuite,1255169192015388672,2020-04-28 16:17:09,"b'@dsautosolutions Hey there, sorry to hear about this. Feel free to DM us your domain name and more details about this. -LC'"
gsuite,1255146153886101512,2020-04-28 14:45:37,b'@Lorenatv507 Hi Lorena. Could you DM us with the version of the Android installed on your tablet? -TP https://t.co/45lLmPEdHm'
gsuite,1255145995651870722,2020-04-28 14:44:59,"b""@AutoMarcio_ That's likely the issue Marcio! Let us know how it goes! -JR"""
gsuite,1255132502727024640,2020-04-28 13:51:22,"b'@AutoMarcio_ Hi Marcio, sorry to hear that. Can you test it in an incognito window and in a different network? -JR'"
gsuite,1255094060538363904,2020-04-28 11:18:37,b'@nemanjagrujicic Hi Nemanja. Sorry to hear this but Google Cloud Search is available to G Suite Business and Enterp\xe2\x80\xa6 https://t.co/NXIr1FGycY'
gsuite,1255069058682294279,2020-04-28 09:39:16,"b""@Musa54040477 Hi Musa, if you're having trouble finding your domain host, check out these steps which might help yo\xe2\x80\xa6 https://t.co/NIEfk8WQor"""
gsuite,1255031489881935872,2020-04-28 07:09:59,"b""@TheRealStillie Hey there, thanks for reaching out. If you cancel your G Suite account, you won't be able to receiv\xe2\x80\xa6 https://t.co/2KSggXk8Wl"""
gsuite,1255030713386139649,2020-04-28 07:06:54,"b'@AlinaPatel18 Hi Alina, as stated on the article https://t.co/40GlthKbsp, the recording functionality will be avail\xe2\x80\xa6 https://t.co/MQ2sl2aocp'"
gsuite,1255016543546748928,2020-04-28 06:10:35,"b'@ivankozik Hi Ivan, please send us a DM of your domain name and we will have a look for you. -CA https://t.co/45lLmPVP5W'"
gsuite,1254907721293475841,2020-04-27 22:58:10,"b'@JonnieJensen @googlenest Hello Jonnie, thank you for reaching out. Please find the steps you need to export your i\xe2\x80\xa6 https://t.co/Wq7LN9LazA'"
gsuite,1254880534175592448,2020-04-27 21:10:08,b'RT @yzthakker: Virtual Meetings on #GoolgeMeet just got better with the tile view. Here is our always enthusiastic South East Aisa team at\xe2\x80\xa6'
gsuite,1254869835009462272,2020-04-27 20:27:37,b'RT @Softlinegroup: Now it\xe2\x80\x99s official! Thumbs up to the new expanded tiled view in #GoogleMeet from Softline team! #MeetOurTeam #GoogleCloud\xe2\x80\xa6'
gsuite,1254868910643478529,2020-04-27 20:23:57,"b'@AshRust Hi Ash, thank you for reaching out. Have you tried using Community Support where our team and other expert\xe2\x80\xa6 https://t.co/mfeEOCVL58'"
gsuite,1254865844334665729,2020-04-27 20:11:46,"b'@gjimenezf Hi Gerald, sorry to read that. Did you create the Shared Drive? -BI'"
gsuite,1254854733749039106,2020-04-27 19:27:37,b'RT @springMLInc: Proud #GSuite users and @GCPcloud @googlecloud @GoogleAI partner #MeetOurTeam #GoogleMeet https://t.co/bEv47T41hw'
gsuite,1254828986242342912,2020-04-27 17:45:18,"b""@_hannaheccard Hi Hannah, sorry to hear about your experience. Can you DM us more details about the issue you're ha\xe2\x80\xa6 https://t.co/2LxgJlb5FI"""
gsuite,1254817584924459009,2020-04-27 17:00:00,b'We want to meet your team! \n\n \xf0\x9f\x98\x83| \xf0\x9f\x98\x8e|\xf0\x9f\x98\x9c| \xf0\x9f\x98\x8d\n\xe2\x80\x94\xe2\x80\x94\xe2\x80\x94\xe2\x80\x94\xe2\x80\x94\xe2\x80\x94\xe2\x80\x94\n \xf0\x9f\x98\x87| \xf0\x9f\xa4\x93|\xf0\x9f\x98\x8b|\xf0\x9f\xa5\xb0\n\xe2\x80\x94\xe2\x80\x94\xe2\x80\x94\xe2\x80\x94\xe2\x80\x94\xe2\x80\x94\xe2\x80\x94\n \xf0\x9f\xa4\xa3| \xf0\x9f\x98\x81|\xf0\x9f\xa4\x93|\xf0\x9f\x98\x89\n\xe2\x80\x94\xe2\x80\x94\xe2\x80\x94\xe2\x80\x94\xe2\x80\x94\xe2\x80\x94\xe2\x80\x94\n \xf0\x9f\xa4\xa9| \xf0\x9f\xa4\x97|\xf0\x9f\xa4\xa0|\xf0\x9f\x90\xb6\n\nPost a picture using\xe2\x80\xa6 https://t.co/U8462K5caU'
gsuite,1254793760589963266,2020-04-27 15:25:20,"b""@Dorian_Inman I'd advise you to check this with Weebly since they are the ones that can provide you the status of y\xe2\x80\xa6 https://t.co/44xCy7AyHg"""
gsuite,1254788362969341952,2020-04-27 15:03:53,"b'@Dorian_Inman Hey there, we are here to help. It looks like that it says that you are trying to login using an acco\xe2\x80\xa6 https://t.co/8bcChwCX7d'"
gsuite,1254768726643142663,2020-04-27 13:45:51,"b'@scassiba Hey there, sorry to hear that you have an issue login into your account. Could DM us with more informatio\xe2\x80\xa6 https://t.co/W3s6YhSI1O'"
gsuite,1254757294853799937,2020-04-27 13:00:26,"b'@Glasfeu Thank you for your feedback, we are aware of this and are currently working on a solution via the Accelera\xe2\x80\xa6 https://t.co/G6DbNpYgfE'"
gsuite,1254754920017862660,2020-04-27 12:50:59,"b'@Glasfeu Hey Didier, thank you for wanting to be a part of the Google Chat - Accelerated Transition Program. If you\xe2\x80\xa6 https://t.co/NdnC1I0kIT'"
gsuite,1254614421009293312,2020-04-27 03:32:42,"b""@mselizaday @squarespace Hello Eliza, I'm truly sorry about the issue affecting you. Could you send me the affected domain name via DM? - MG"""
gsuite,1254610198158868480,2020-04-27 03:15:55,"b""@imdilick Hello Ian, thank you for reaching out. I'm truly sorry about the issue you're facing. Could you send me t\xe2\x80\xa6 https://t.co/PaHVAuLfqV"""
gsuite,1254595818570604544,2020-04-27 02:18:47,"b'@PaulPham714 Hello Paul, thank you for reaching out. Could you send us more details about the ssue you faced via DM? - MG'"
gsuite,1254523404964806656,2020-04-26 21:31:02,"b'@Chen_Dogg @thenextweb @napilopez Hello Jamie, thank you for your interesting feedback. Please ask your administrat\xe2\x80\xa6 https://t.co/6sqRKNZXlS'"
gsuite,1254511097081745409,2020-04-26 20:42:07,"b'@LeventKilic Hwllo Levent, thank you for reaching out. You can find the steps here https://t.co/8hXgJp8zAF - MG'"
gsuite,1254357915617591296,2020-04-26 10:33:26,"b'@AlinaPatel18 @Google @GSuiteDevs Hi Alina, thanks for your message. Some features ares still being rolled out, so\xe2\x80\xa6 https://t.co/uypdPH2D63'"
gsuite,1254345291987369984,2020-04-26 09:43:16,"b'@aaashley_gee Hi Ashley, thanks for reaching out. The Team will be glad to hear all your suggestions and ideas for\xe2\x80\xa6 https://t.co/15PqVghi4o'"
gsuite,1254221778970443782,2020-04-26 01:32:29,"b'@sunnymohan @vercel Thanks, unable to find that case number, are you able to send your domain name via DM?\n-JG'"
gsuite,1254218395681243136,2020-04-26 01:19:02,"b'@sunnymohan @vercel Hello Manoj, do you have a case number from support that you can share. I will be happy to check on things.\n-JG'"
gsuite,1254174557419814912,2020-04-25 22:24:50,"b'@andyspinks Hi there Andy, for now you can create labels using Google Keep as shown here https://t.co/k4rSyzu8Kn. C\xe2\x80\xa6 https://t.co/lNqmVyqh4l'"
gsuite,1254169638818263041,2020-04-25 22:05:17,"b'@jencoop4life @Google @googlechrome Hi Jennifer, if you have verified and tried the suggested troubleshooting here\xe2\x80\xa6 https://t.co/Sy1bTbVXwP'"
gsuite,1254157123182907394,2020-04-25 21:15:33,b'@himalayanguyhan So sorry to hear that Sanjay. Could you please provide us with further and more specific details a\xe2\x80\xa6 https://t.co/8KMvzL0WVY'
gsuite,1254137222598721536,2020-04-25 19:56:29,b'@UrvMistry Thank you so much! We are so glad to hear that our team is always there to help and giving their best! W\xe2\x80\xa6 https://t.co/HSDzJpYLml'
gsuite,1253802182136266754,2020-04-24 21:45:09,"b'@mkanfer Hi Mike, you can disable the ability to start a video call to the students following the steps here:\xe2\x80\xa6 https://t.co/1L4q7AhxK6'"
gsuite,1253792521920094209,2020-04-24 21:06:46,b'RT @cldcvr: Wrapping up Friday with a virtual party (or as Google says #TGIF). We were photobombed by some unexpected but really friendly &amp;\xe2\x80\xa6'
gsuite,1253770433524105218,2020-04-24 19:38:59,"b""RT @SADA: Our Marketing team is all smiles for #GoogleMeet's expanded tiled view. We're making #workfromhome work for us! #MeetOurTeam #Goo\xe2\x80\xa6"""
gsuite,1253768154565742594,2020-04-24 19:29:56,"b'@Baggiepr Hi Phil, you can enable the tiled view in Meet following these steps https://t.co/zpdum4ny9U. At the mome\xe2\x80\xa6 https://t.co/0d9ZfphVtk'"
gsuite,1253761790351216640,2020-04-24 19:04:39,b'@Baggiepr Tiled view'
gsuite,1253747077215072257,2020-04-24 18:06:11,b'RT @GoogleCloud_ANZ: How do you #GoogleMeet? Show us how you and your team collaborate by posting a picture using #MeetOurTeam. For the lat\xe2\x80\xa6'
gsuite,1253736771222986756,2020-04-24 17:25:14,"b'RT @AndradaMorar: If you\xe2\x80\x99re looking for creative ways to cure remoteliness, #MeetOurTeam! You might be inspired to host an art party and to\xe2\x80\xa6'"
gsuite,1253734355509313537,2020-04-24 17:15:38,"b""@mrsjworrall Awesome! Our team's working hard to improve our users' experience and catch up with all these requests\xe2\x80\xa6 https://t.co/1zpedZ35FA"""
gsuite,1253729866140221444,2020-04-24 16:57:47,"b'@mrsjworrall Hi Julie, thanks for this improvement suggestion. Our team loves to hear feedback from passionate educ\xe2\x80\xa6 https://t.co/MKpNrRIVHc'"
gsuite,1253727883278852098,2020-04-24 16:49:55,"b'@GodwineShakir Hey Godwine, feel free to post about this situation to the Gmail Community, so other users and Produ\xe2\x80\xa6 https://t.co/CXAkveHv2o'"
gsuite,1253724188810063872,2020-04-24 16:35:14,b'RT @GoogleCloud_SG: How do you #GoogleMeet? Show us how you and your team collaborate by posting a picture using the hashtag #MeetOurTeam.\xe2\x80\xa6'
gsuite,1253708789020229632,2020-04-24 15:34:02,b'@Diooony Sharing the Chrome tab feature is still rolling out and will soon be available to all users. -TP'
gsuite,1253707467877482496,2020-04-24 15:28:47,b'@Diooony Hey Dionisio. Google Meet is available for every G Suite account. https://t.co/8cSmZW10TH -TP'
gsuite,1253703936378314753,2020-04-24 15:14:45,b'RT @IngramCloud: We\xe2\x80\x99re all smiles for #GoogleMeet\xe2\x80\x99s expanded tiled view. Reach out to your Google team at Ingram Micro to learn more. #Meet\xe2\x80\xa6'
gsuite,1253685050471743488,2020-04-24 13:59:43,"b'RT @BasL: #MeetOurTeam @gcompany doing a fun warming up exercise, kicking off our quarterly team meet(ing) /cc @gsuite https://t.co/gtvMi44\xe2\x80\xa6'"
gsuite,1253648594579656704,2020-04-24 11:34:51,"b'@HansDeLeenheer Glad to hear that Hans! Enjoy the ""digital coffee room""! -JR'"
gsuite,1253633933381709826,2020-04-24 10:36:35,"b""@HansDeLeenheer That's right! -JR"""
gsuite,1253632381967388673,2020-04-24 10:30:25,b'@HansDeLeenheer You also have the option to schedule a recurring meeting through Google Calendar. The meeting link\xe2\x80\xa6 https://t.co/cn5g19392H'
