NatGeo,1260588875807850497,2020-05-13 15:13:03,"b'Think snakes are cold, solitary beings? Think again. https://t.co/glFQKItXXU'"
NatGeo,1260571260981055497,2020-05-13 14:03:03,"b'\xe2\x80\x9cI\xe2\x80\x99m missing community more than anything.\xe2\x80\x9d Around the world, 1.8 billion Muslims are coping with a Ramadan like no\xe2\x80\xa6 https://t.co/6TdX3PNtlC'"
NatGeo,1260545844627025921,2020-05-13 12:22:03,b'Take a peek inside the spectacular homes of artists and architects \xf0\x9f\x98\x8dhttps://t.co/uG0lVOd3sY'
NatGeo,1260515139020873728,2020-05-13 10:20:03,b'Life is pretty rosy for this unusual ray https://t.co/e6Zt4J68qx'
NatGeo,1260467071139360777,2020-05-13 07:09:02,"b""Komodo dragons are dominant predators that can grow up to 10 feet long\xe2\x80\x94and their hunting habits aren't for the weak\xe2\x80\xa6 https://t.co/bhOwvSFciG"""
NatGeo,1260420853973606400,2020-05-13 04:05:23,"b'In Yellowstone National Park, photographer Thomas Szajner captured this beautiful scene ""when morning sunlight, fog\xe2\x80\xa6 https://t.co/TkYMFCFaE6'"
NatGeo,1260390065806757890,2020-05-13 02:03:03,"b'Sloth bears feed on ants and termites, but often attack people when startled\xe2\x80\x94and conflict with humans is rising https://t.co/NFajr6hYr5'"
NatGeo,1260382266301329408,2020-05-13 01:32:03,"b'""Colombia cannot afford to relax the lockdown, and it cannot afford to prolong it"" https://t.co/DkNMN5jQJz'"
NatGeo,1260347281603284994,2020-05-12 23:13:02,"b'Commuting by train, bus, or bike in our post-pandemic future may never be the same\xe2\x80\x94but it might be healthier https://t.co/tUALLrwJiZ'"
NatGeo,1260331919943839748,2020-05-12 22:12:00,b'Experience the beauty of Yellowstone\xe2\x80\x94virtually\xe2\x80\x94in this mesmerizing hyperlapse footage https://t.co/EzN6MpCKMG'
NatGeo,1260315659994628101,2020-05-12 21:07:23,b'The worst infestation of desert locusts in decades could push up to 25 million East Africans into hunger https://t.co/BnmsAEVNhp'
NatGeo,1260299299168059395,2020-05-12 20:02:22,b'See the regions where cases and deaths are decreasing and increasing the most week over week https://t.co/BHfOx5UL04'
NatGeo,1260282241500033029,2020-05-12 18:54:35,"b'\xe2\x80\x9cA day cannot begin better than with positive energy and a great natural spectacle,"" writes Your Shot photographer\xe2\x80\xa6 https://t.co/2LQghOt7dB'"
NatGeo,1260257945155252225,2020-05-12 17:18:03,b'The Tanzanian site is the first\xe2\x80\x94and oldest\xe2\x80\x94tsunami deposit bearing human remains found in East Africa https://t.co/lqsV3JGL1W'
NatGeo,1260213152580620289,2020-05-12 14:20:03,b'The spots on these astoundingly diverse flowers may be explained by a model developed by mathematician Alan Turing\xe2\x80\xa6 https://t.co/1zYzmN4DaX'
NatGeo,1260198054684168192,2020-05-12 13:20:04,"b'At age 110, Louisiana native Lawrence Brooks is the oldest known U.S. veteran of World War II https://t.co/ctxpotB5G2'"
NatGeo,1260181777265627136,2020-05-12 12:15:23,"b""Enormous paintings on grain silos form a kind of open-air gallery crawl through some of Australia's most remote tow\xe2\x80\xa6 https://t.co/hu5coO5647"""
NatGeo,1260152247578767360,2020-05-12 10:18:02,"b'\xe2\x80\x9cI\xe2\x80\x99m missing community more than anything.\xe2\x80\x9d Around the world, 1.8 billion Muslims are coping with a Ramadan like no\xe2\x80\xa6 https://t.co/mqC8V2IW2B'"
NatGeo,1260103684068868099,2020-05-12 07:05:04,b'Saharan silver ants can run their body length in less than a hundredth of a second https://t.co/azh8GWwA71'
NatGeo,1260061000092528640,2020-05-12 04:15:27,"b'ICYMI: The closest known black hole to Earth was discovered in the star system HR 6819, about 1,011 light-years fro\xe2\x80\xa6 https://t.co/448a4IsjAW'"
NatGeo,1260028686058704905,2020-05-12 02:07:03,b'Take a peek inside the spectacular homes of artists and architects \xf0\x9f\x98\x8dhttps://t.co/KVXoDUMGM5'
NatGeo,1260000248254148610,2020-05-12 00:14:03,b'What\xe2\x80\x99s the science behind this inherent reaction\xe2\x80\x94and are there consequences? https://t.co/99al2cfVdI'
NatGeo,1259977308330438656,2020-05-11 22:42:54,b'Male tokay geckos are known to be highly territorial\xe2\x80\x94even when they face threatening foes https://t.co/kKaUwieWFT'
NatGeo,1259961267646803968,2020-05-11 21:39:09,"b'RT @Indira_L: Nazis came to her door, shot men in her yard, and took her father. The 8-year-old lost it all in #WWII and only a leap from a\xe2\x80\xa6'"
NatGeo,1259958303934820353,2020-05-11 21:27:23,"b'""Colombia cannot afford to relax the lockdown, and it cannot afford to prolong it"" https://t.co/6fLJL7ayif'"
NatGeo,1259925841095639041,2020-05-11 19:18:23,"b'Commuting by train, bus, or bike in our post-pandemic future may never be the same\xe2\x80\x94but it might be healthier https://t.co/DlTvQu6SCB'"
NatGeo,1259884732516614151,2020-05-11 16:35:02,b'Follow @NGKids and @NatGeoEducation for more daily inspiration and resources! https://t.co/orefdsb7yo'
NatGeo,1259884415775313923,2020-05-11 16:33:46,"b'Learn how to grow a container garden for strawberries, herbs, spinach, and more \xf0\x9f\x8d\x93\xf0\x9f\xa5\xac\xf0\x9f\x8c\xbfhttps://t.co/IwrIBOWyIY'"
NatGeo,1259884414730997760,2020-05-11 16:33:46,b'Download and print these bingo cards to take along when you go out exploring. (Make sure you practice social distan\xe2\x80\xa6 https://t.co/GaQ3fyCUPY'
NatGeo,1259884412730310658,2020-05-11 16:33:46,b'Watch NatGeo photographer @joelsartore LIVE at 2pm ET on Friday to learn about his mission to photograph every spec\xe2\x80\xa6 https://t.co/27MfOL0dz8'
NatGeo,1259884400730419200,2020-05-11 16:33:43,b'...then empower them to help protect animals by exploring this list of actions to take #EndangeredSpeciesDay https://t.co/FhO3Gp0gDL'
NatGeo,1259884399711203332,2020-05-11 16:33:43,"b'Friday is #EndangeredSpeciesDay! Just for fun, have children take a personality quiz to see which threatened animal\xe2\x80\xa6 https://t.co/tYRnRYIxZe'"
NatGeo,1259884398641586180,2020-05-11 16:33:42,"b'Write letters to grandma and grandpa: As more older adults find themselves isolated because of the pandemic, keepin\xe2\x80\xa6 https://t.co/ycgtBJDtqq'"
NatGeo,1259884397605588994,2020-05-11 16:33:42,"b'Make time for music or creativity: If you have a playlist or go-to song that helps you or your family keep calm, le\xe2\x80\xa6 https://t.co/69DEjDb9Uc'"
NatGeo,1259884396779376640,2020-05-11 16:33:42,b'Thread: Get our latest ideas to inspire family exploration this week https://t.co/orefdsb7yo'
NatGeo,1259866618550771713,2020-05-11 15:23:03,"b'Instead of having her baby in the hospital as planned, one New Yorker decided to have her second child at home due\xe2\x80\xa6 https://t.co/tdAI9NMETP'"
NatGeo,1259854033910747136,2020-05-11 14:33:03,"b""The U.S.S. Nevada's remains were recently discovered 65 nautical miles southwest of Pearl Harbor, raising new quest\xe2\x80\xa6 https://t.co/yT6Rtlo5nB"""
NatGeo,1259817879287054336,2020-05-11 12:09:23,"b""Tens of millions of children's lives were brutalized by forces of history beyond their control https://t.co/BAdmkj9nA3"""
NatGeo,1259788851947737088,2020-05-11 10:14:02,"b""Millions of India's street animals are going hungry, but Good Samaritans are venturing outside during the pandemic\xe2\x80\xa6 https://t.co/oasCZ4ocxG"""
NatGeo,1259748843773743105,2020-05-11 07:35:04,"b'Of all the great unknowns in outer space, the dark universe might just be the most mysterious https://t.co/Wnikdoko3u'"
NatGeo,1259702112411410434,2020-05-11 04:29:22,"b'What kinds of forests can absorb planet-warming carbon emissions, but are fireproof? Seaweed. https://t.co/l5BbOqF114'"
NatGeo,1259634925961121792,2020-05-11 00:02:23,b'Experts say that COVID-19 antibody testing has now entered a \xe2\x80\x9cWild West\xe2\x80\x9d phase https://t.co/9r55aUlYy3'
NatGeo,1259606404257677314,2020-05-10 22:09:03,b'Meet the man who inadvertently collected a treasure trove of climate change data from his own backyard https://t.co/QxWD8e3AQy'
NatGeo,1259592799843803136,2020-05-10 21:15:00,b'Make this Mother\xe2\x80\x99s Day magical and join the #DisneyFamilySingalong VOLUME II tonight at 7/6c https://t.co/mP7qAHAN3b'
NatGeo,1259574945253937156,2020-05-10 20:04:03,b'Just about everywhere in the world will experience shifts in seasons\xe2\x80\x94but some more than others https://t.co/ufu5RDyiq8'
NatGeo,1259546002995974144,2020-05-10 18:09:03,b'What\xe2\x80\x99s the science behind this inherent reaction\xe2\x80\x94and are there consequences? https://t.co/kWwJwE6woQ'
NatGeo,1259517330238906372,2020-05-10 16:15:06,"b'In the Maasai Mara, photographer Russ Wiley captured this moment between a mother giraffe and her one-day-old calf\xe2\x80\xa6 https://t.co/jvXgkbzYck'"
NatGeo,1259503055017566213,2020-05-10 15:18:23,"b'Instead of having her baby in the hospital as planned, one New Yorker decided to have her second child at home due\xe2\x80\xa6 https://t.co/9GglyoqkIw'"
NatGeo,1259485575721234437,2020-05-10 14:08:56,"b""Encounters with the big fish are rare, but can be deadly. Here's how to reduce your risk, and what you should keep\xe2\x80\xa6 https://t.co/yz4uuFPJWk"""
NatGeo,1259472021362216960,2020-05-10 13:15:04,"b'Joy, anxiety, panic, gratitude\xe2\x80\x94for #MothersDay, women photographers capture their experiences at home with their ch\xe2\x80\xa6 https://t.co/iMTcaxfH4z'"
NatGeo,1259453381367566341,2020-05-10 12:01:00,b'These animal moms will fight predators and dive into waterfalls for their little ones. Happy #MothersDay! https://t.co/86e47lEjx4'
NatGeo,1259433514753277952,2020-05-10 10:42:03,"b'From emperor scorpions to hippos to wallabies, many wild moms remind us of ourselves. Happy #MothersDay! https://t.co/OKXC4qR5qH'"
NatGeo,1259380413593792512,2020-05-10 07:11:03,"b'Paddle into Papua New Guinea, bike across the Himalaya, and tag along on a trek from Mongolia to Australia in these\xe2\x80\xa6 https://t.co/uR99SdgWr2'"
NatGeo,1259334609902415873,2020-05-10 04:09:02,"b""Millions of India's street animals are going hungry, but Good Samaritans are venturing outside during the pandemic\xe2\x80\xa6 https://t.co/f358Z4NPWO"""
NatGeo,1259307182274875394,2020-05-10 02:20:03,"b'Seventy-five years ago this week, Germany officially surrendered to the Allies...twice #VEDay75 https://t.co/ij3x3UPBOu'"
NatGeo,1259246518021865472,2020-05-09 22:19:00,"b""After birth, a baby wallaby immediately crawls into its mother's pouch and remains there for two months #MothersDay https://t.co/ThpKJyPDMO"""
NatGeo,1259214401376313352,2020-05-09 20:11:23,"b'Tour Helsinki and Seoul by podcast, learn to urban forage, and help rhinos in Uganda https://t.co/nGNuDgtsDZ'"
NatGeo,1259183366508892160,2020-05-09 18:08:03,"b'""Over 7 days between Phoenix and New York, I met people\xe2\x80\x94athletes, business owners, politicians\xe2\x80\x94living lives increas\xe2\x80\xa6 https://t.co/1luSwhjnZR'"
NatGeo,1259154943090610176,2020-05-09 16:15:07,b'A pair of kayakers hold position among swirling eddies in this vibrant long exposure captured by Your Shot photogra\xe2\x80\xa6 https://t.co/o9M7WrdkgY'
NatGeo,1259140835918204928,2020-05-09 15:19:03,b'COVID-19 can slowly starve the body of oxygen without initially causing much shortness of breath https://t.co/XXJCLg9sua'
NatGeo,1259105876683694088,2020-05-09 13:00:08,b'Some migratory bird species make a journey equivalent to two trips around the world. See their mesmerizing flight p\xe2\x80\xa6 https://t.co/Boj7ID9Aei'
NatGeo,1259093357311283200,2020-05-09 12:10:23,"b""This runaway immune response is suspected to play a major role in some of the most critical COVID-19 cases. Here's\xe2\x80\xa6 https://t.co/GSJJy2QYGr"""
NatGeo,1259093274108755970,2020-05-09 12:10:04,b'\xe2\x80\x9cThe absence of any formal entity dedicated to preventing the spread of diseases from the wildlife trade is such a\xe2\x80\xa6 https://t.co/vwdMtuA4ZC'
NatGeo,1259015346889129984,2020-05-09 07:00:24,"b""Where was the most impressive ceiling you've ever seen? https://t.co/4SsqOX6sKG"""
NatGeo,1258972978597056513,2020-05-09 04:12:03,b'Allowing cub petting with large crowds to resume is raising new alarm bells because tigers are also susceptible to\xe2\x80\xa6 https://t.co/pblM2fOTQT'
NatGeo,1258942359343173632,2020-05-09 02:10:23,"b'On Gyaros, a five-mile-long nature reserve with a dark past, the Mediterranean monk seal seems to be mounting a com\xe2\x80\xa6 https://t.co/Tdox6PSbHA'"
NatGeo,1258914092007526405,2020-05-09 00:18:03,"b'Fields that stood empty have rapidly been converted into testing centers, field hospitals, and morgues https://t.co/9DXi9RkBQI'"
NatGeo,1258894797093339141,2020-05-08 23:01:23,"b""Tens of millions of children's lives were brutalized by forces of history beyond their control https://t.co/nVV8n3CGNL"""
NatGeo,1258881627532529667,2020-05-08 22:09:03,"b""Millions of animals that come into the U.S legally each year aren't checked for diseases that have the potential to\xe2\x80\xa6 https://t.co/bFz39rfeFQ"""
NatGeo,1258879920333180928,2020-05-08 22:02:16,"b""RT @dabeard: Need an escape? Here's: \n\xe2\x80\x94The deepest dive under Antarctica\n\xe2\x80\x94What the world looks like from above\n\xe2\x80\x94Clues from Tut's tomb\n\xe2\x80\x94Icel\xe2\x80\xa6"""
NatGeo,1258837840999440385,2020-05-08 19:15:04,"b'Seventy-five years ago this week, Germany officially surrendered to the Allies...twice #VEDay75 https://t.co/p7a78Hzbur'"
NatGeo,1258831366772396032,2020-05-08 18:49:20,b'RT @NatGeo: \xe2\x9a\xa1\xef\xb8\x8f \xe2\x80\x9c#VEDay75 | Hear the Last Voices of World War II\xe2\x80\x9d\n\nhttps://t.co/zNgjCz2IiU'
NatGeo,1258830721185206272,2020-05-08 18:46:46,"b'RT @disneyplus: The ultimate stream team. Discover the world\xe2\x80\x99s best stories across #DisneyPlus, @Hulu, and @ESPN+ with the Disney bundle. #\xe2\x80\xa6'"
NatGeo,1258824502689116163,2020-05-08 18:22:03,b'The Swedish government is doing something few other countries are: It\xe2\x80\x99s relying on individual responsibility to fla\xe2\x80\xa6 https://t.co/tlOkCR3hz9'
NatGeo,1258795782003720192,2020-05-08 16:27:56,"b'RT @NatGeo: ""If you feel nothing, you\xe2\x80\x99re not human. And in the end we\xe2\x80\x99re all human."" #VEDay75 https://t.co/QVI2BylVE4'"
NatGeo,1258777188939202566,2020-05-08 15:14:03,b'COVID-19 can slowly starve the body of oxygen without initially causing much shortness of breath https://t.co/yBKuCWyMAM'
NatGeo,1258762398871310336,2020-05-08 14:15:17,b'\xe2\x9a\xa1\xef\xb8\x8f \xe2\x80\x9c#VEDay75 | Hear the Last Voices of World War II\xe2\x80\x9d\n\nhttps://t.co/zNgjCz2IiU'
NatGeo,1258748116116942852,2020-05-08 13:18:31,"b'As the generation that lived through World War II fades, their memories are more valuable than ever. Share your fam\xe2\x80\xa6 https://t.co/XCqF0U3DHq'"
NatGeo,1258744546919428096,2020-05-08 13:04:20,"b'Just 10 of the famed Tuskegee Airmen\xe2\x80\x94the first African-American military aviators\xe2\x80\x94remain today, and retired Lieuten\xe2\x80\xa6 https://t.co/phWAlBhqyF'"
NatGeo,1258744300600426496,2020-05-08 13:03:22,"b'""If you feel nothing, you\xe2\x80\x99re not human. And in the end we\xe2\x80\x99re all human."" #VEDay75 https://t.co/QVI2BylVE4'"
NatGeo,1258744164122009600,2020-05-08 13:02:49,"b'Today is the 75th anniversary of when the Nazis surrendered in World War II. This is Maria Rokhlina, a Soviet comba\xe2\x80\xa6 https://t.co/ITtVqO1fR7'"
NatGeo,1258728407527022593,2020-05-08 12:00:13,b'Courage in the face of fear. The trauma of war. The high cost of peace. Honor #VEDay75 and experience the impact of\xe2\x80\xa6 https://t.co/GYZ7wNST5T'
NatGeo,1258705465657241600,2020-05-08 10:29:03,"b""This isn't the first time a congressional session has been threatened by a lethal virus  https://t.co/ghS3IyCEAZ"""
NatGeo,1258655121111609345,2020-05-08 07:09:00,"b'The arrowhead crab is a master of disguise, creating its own hat out of halimeda algae https://t.co/cBtPGEm02z'"
NatGeo,1258609163162259457,2020-05-08 04:06:22,"b'Tour Helsinki and Seoul by podcast, learn to urban forage, and help rhinos in Uganda https://t.co/DOEUMInXtx'"
NatGeo,1258573598488514563,2020-05-08 01:45:03,"b""This runaway immune response is suspected to play a major role in some of the most critical COVID-19 cases. Here's\xe2\x80\xa6 https://t.co/dURyoK5Ebf"""
NatGeo,1258555475362222080,2020-05-08 00:33:02,b'Here are five ways to commemorate the end of World War II\xe2\x80\x94while at home and on future travels https://t.co/xFcabsuypk'
NatGeo,1258539142327136256,2020-05-07 23:28:08,b'An expansive expressway illuminates the coast near Mt Fuji in this long-exposure image captured by Your Shot photog\xe2\x80\xa6 https://t.co/rb7KXDMTTz'
NatGeo,1258514712989335552,2020-05-07 21:51:04,"b""RT @MyFrogCroaked: @UNEP @CITES @ivonnehiguero For anyone interested in the #WildlifeTrade and spread of disease, here's an article I wrote\xe2\x80\xa6"""
NatGeo,1258514322528993282,2020-05-07 21:49:31,"b'RT @NatGeoEducation: Our \xe2\x80\x9cLearn at Home\xe2\x80\x9d site has collections for all grades. Browse for curated activities, videos, and more as you finish\xe2\x80\xa6'"
NatGeo,1258475700190928902,2020-05-07 19:16:02,b'Allowing cub petting with large crowds to resume is raising new alarm bells because tigers are also susceptible to\xe2\x80\xa6 https://t.co/TmzR4wE0eT'
NatGeo,1258440050079158274,2020-05-07 16:54:23,"b""Millions of animals that come into the U.S legally each year aren't checked for diseases that have the potential to\xe2\x80\xa6 https://t.co/OgkaX4tACH"""
NatGeo,1258433172716617728,2020-05-07 16:27:03,"b'What dominates the survivors\xe2\x80\x99 stories are the tragedies experienced by so many of them, Allied and Axis alike\xe2\x80\xa6 https://t.co/68ZR8SLJAe'"
NatGeo,1258423944677396481,2020-05-07 15:50:23,"b'""These are the horrors of war, which actually turn humans into monsters"" #VEDay75 https://t.co/xVniUSiXZB'"
NatGeo,1258397525104562183,2020-05-07 14:05:24,b'Experts say that COVID-19 antibody testing has now entered a \xe2\x80\x9cWild West\xe2\x80\x9d phase https://t.co/ziM4PMLwnl'
NatGeo,1258391231702487041,2020-05-07 13:40:24,"b'The newly discovered black hole is an estimated four times the mass of the sun, and lurks in a star system you can\xe2\x80\xa6 https://t.co/uhUKPCizXK'"
NatGeo,1258369586526932993,2020-05-07 12:14:23,"b'On Gyaros, a five-mile-long nature reserve with a dark past, the Mediterranean monk seal seems to be mounting a com\xe2\x80\xa6 https://t.co/fhVh5yZvma'"
NatGeo,1258342574043127808,2020-05-07 10:27:03,"b'For the first time, scientists have sequenced the complete genomes of 20 individual lions\xe2\x80\x94including extinct cave li\xe2\x80\xa6 https://t.co/sD5NKPyMCe'"
NatGeo,1258298036423405571,2020-05-07 07:30:04,b'Smooth and bumpy octopuses deep in the Pacific have long confused scientists: Are they the same species? https://t.co/Gnowa1xfRB'
NatGeo,1258246275516022786,2020-05-07 04:04:23,"b""This isn't the first time a congressional session has been threatened by a lethal virus  https://t.co/KO6wiDoNGh"""
NatGeo,1258218504379142145,2020-05-07 02:14:02,"b'Nearly 20,000 acres of wetland where groundwater was as salty as the ocean once existed https://t.co/BVmw74gjDY'"
NatGeo,1258186548731875329,2020-05-07 00:07:03,b'The hardship brought on by the pandemic has been swift and startling in Monteverde\xe2\x80\x94even though it has no confirmed\xe2\x80\xa6 https://t.co/Fsg0vUEDqF'
NatGeo,1258157592775294977,2020-05-06 22:12:00,b'What does a pom-pom crab do if it loses one of its pom-poms? https://t.co/ljlSo2Ifcw'
NatGeo,1258129672539451399,2020-05-06 20:21:03,b'Losing a landscape comes with daunting practical challenges as well as the complex emotional strain of losing your\xe2\x80\xa6 https://t.co/rpTskOsULT'
NatGeo,1258096955743522817,2020-05-06 18:11:03,"b'The \xe2\x80\x9csequoias of the sea\xe2\x80\x9d suck up carbon and shelter special species\xe2\x80\x94and scientists, surfers, and more are banding\xe2\x80\xa6 https://t.co/mF13Nrq3SW'"
NatGeo,1258094787527356416,2020-05-06 18:02:26,"b""Thanks for your comments, it's been brought to our attention that crossing or walking on the bridge is not allowed,\xe2\x80\xa6 https://t.co/TD5vpRLTYa"""
NatGeo,1258069608742993920,2020-05-06 16:22:23,"b'What dominates the survivors\xe2\x80\x99 stories are the tragedies experienced by so many of them, Allied and Axis alike\xe2\x80\xa6 https://t.co/a16sLpjQ7Z'"
NatGeo,1258027499755311105,2020-05-06 13:35:03,"b'The newly discovered black hole is an estimated four times the mass of the sun, and lurks in a star system you can\xe2\x80\xa6 https://t.co/uhudXsai8t'"
NatGeo,1258005602560880642,2020-05-06 12:08:02,"b""COVID-19 is worsening hardship in Brazil's working-class settlements, so this group is giving out 6,000 free meals\xe2\x80\xa6 https://t.co/9K0aGbRZ5Q"""
NatGeo,1257977752042508290,2020-05-06 10:17:22,b'The Swedish government is doing something few other countries are: It\xe2\x80\x99s relying on individual responsibility to fla\xe2\x80\xa6 https://t.co/sxzLVxVFhH'
NatGeo,1257883300523323393,2020-05-06 04:02:03,"b'For the first time, scientists have sequenced the complete genomes of 20 individual lions\xe2\x80\x94including extinct cave li\xe2\x80\xa6 https://t.co/9uUS3Xui8c'"
NatGeo,1257855949106302979,2020-05-06 02:13:22,"b'\xe2\x80\x9cYou put away money for a rainy day, but nobody predicts the spigot is just going to turn off"" https://t.co/OdPIHa0LBE'"
NatGeo,1257825751753162752,2020-05-06 00:13:23,"b'Fields that stood empty have rapidly been converted into testing centers, field hospitals, and morgues https://t.co/kvOV80dewT'"
NatGeo,1257802766845726721,2020-05-05 22:42:03,b'The hardship brought on by the pandemic has been swift and startling in Monteverde\xe2\x80\x94even though it has no confirmed\xe2\x80\xa6 https://t.co/PhkuteCE4n'
NatGeo,1257778361046306819,2020-05-05 21:05:04,b'These formidable insects would threaten bee colonies if left unabated\xe2\x80\x94but efforts are underway to stop their spread https://t.co/X40JHSD6Rg'
NatGeo,1257763060024049666,2020-05-05 20:04:16,"b'May 8, 2020 will mark 75 years since Victory in Europe Day. As the generation that lived through World War II fades\xe2\x80\xa6 https://t.co/AAfXF1AJgz'"
NatGeo,1257762950074548226,2020-05-05 20:03:50,"b'""Volunteer as you can, whatever that might mean for you,"" says Virginia Hines Basler who left the bomber plant afte\xe2\x80\xa6 https://t.co/mTHcwMf072'"
NatGeo,1257762837587546115,2020-05-05 20:03:23,"b'""Work hard and don\'t believe everything you hear,"" advises Marjorie Sutherland Haskins who got a job working at the\xe2\x80\xa6 https://t.co/vdF94XKeee'"
NatGeo,1257762734780940293,2020-05-05 20:02:58,"b'Most ""Rosie the Riveters""\xe2\x80\x94the term for women who worked in defense plants\xe2\x80\x94never imagined that they would become sym\xe2\x80\xa6 https://t.co/npEYi6TNA5'"
NatGeo,1257762602463174656,2020-05-05 20:02:27,"b'By 1943, more than 310,000 American women worked in aircraft production, many as riveters who helped assemble warpl\xe2\x80\xa6 https://t.co/R38Vo6YZVB'"
NatGeo,1257762434800107520,2020-05-05 20:01:47,"b'During World War II, with the need for equipment surging and more than 16 million Americans in the military, women\xe2\x80\xa6 https://t.co/b3svwltbzw'"
NatGeo,1257742907458695168,2020-05-05 18:44:11,"b'RT @cdellamore: Asian giant hornets, trending lately as ""murder hornets,"" are indeed highly effective predators. But there\'s no reason to p\xe2\x80\xa6'"
NatGeo,1257740759425527809,2020-05-05 18:35:39,b'Read more here: https://t.co/bUyYYpmR3e'
NatGeo,1257739426966487045,2020-05-05 18:30:21,"b'See how the holiday has grown and changed with time, becoming a complex symbol of Mexican culture, resilience, and\xe2\x80\xa6 https://t.co/tTFpNycVSR'"
NatGeo,1257726768095662083,2020-05-05 17:40:03,b'New evidence shows priest-embalmers were savvy entrepreneurs who offered burial packages for every budget https://t.co/XecR6C5Ulj'
NatGeo,1257715629919997959,2020-05-05 16:55:48,b'Dr. Anthony Fauci addresses the misinformation about the origins of #COVID19 and what he hopes will change to preve\xe2\x80\xa6 https://t.co/zBuMyakNBu'
NatGeo,1257705382744674304,2020-05-05 16:15:04,"b'\xe2\x80\x9cNature provides us beautiful surprises. To meet the giant of the oceans is an unforgettable moment,"" writes photog\xe2\x80\xa6 https://t.co/khzQGH4GcC'"
NatGeo,1257668717003059202,2020-05-05 13:49:23,"b'Nearly 20,000 acres of wetland where groundwater was as salty as the ocean once existed https://t.co/lDlBhe03gX'"
NatGeo,1257644980471988225,2020-05-05 12:15:03,b'Losing a landscape comes with daunting practical challenges as well as the complex emotional strain of losing your\xe2\x80\xa6 https://t.co/GzaY5aO1m5'
NatGeo,1257612768171229184,2020-05-05 10:07:03,b'Adults and kids alike will be stunned to discover how many animals we share our homes with https://t.co/5bJlkwyW5Y'
NatGeo,1257567298874982401,2020-05-05 07:06:23,"b'The \xe2\x80\x9csequoias of the sea\xe2\x80\x9d suck up carbon and shelter special species\xe2\x80\x94and scientists, surfers, and more are banding\xe2\x80\xa6 https://t.co/L4aVancDBk'"
NatGeo,1257521246465675266,2020-05-05 04:03:23,"b""COVID-19 is worsening hardship in Brazil's working-class settlements, so this group is giving out 6,000 free meals\xe2\x80\xa6 https://t.co/YDXKB1vTFv"""
NatGeo,1257492221257023488,2020-05-05 02:08:03,"b'\xe2\x80\x9cYou put away money for a rainy day, but nobody predicts the spigot is just going to turn off"" https://t.co/lskna22Rz7'"
NatGeo,1257462525928579073,2020-05-05 00:10:03,"b'In an exclusive interview, Dr. Fauci discusses the rush to reopen, why he does not believe coronavirus escaped a Ch\xe2\x80\xa6 https://t.co/iOaztegNny'"
NatGeo,1257449188620742656,2020-05-04 23:17:03,"b'May is Mental Health Awareness Month, and for parents concerned about the impact of COVID-19 on their kids, the mos\xe2\x80\xa6 https://t.co/hGMffUTiE7'"
