NatGeo,1280543740692779014,2020-07-07 16:46:33,b'RT @CraigAWelch: Last year @natgeo photographer Ian Teh and I joined an expedition to the treacherous spot where the Pacific and Atlantic m\xe2\x80\xa6'
NatGeo,1280534540344348682,2020-07-07 16:10:00,"b'""Ice cores are the most robust tool that we have for looking at past climate. Glaciers don\'t lie.""\xe2\x80\xa6 https://t.co/5k3HSFO4kV'"
NatGeo,1280503857404092416,2020-07-07 14:08:04,b'Join our Explorers as they recall a journey to find the southernmost tree in the world on the latest episode of\xe2\x80\xa6 https://t.co/BHyKyEdmMK'
NatGeo,1280489257224867841,2020-07-07 13:10:03,"b'""Indians are less than one percent of the population. Yet images and names of Indians are everywhere"" https://t.co/M6bQsmHLup'"
NatGeo,1280479196050006017,2020-07-07 12:30:05,"b'Once regarded as ""a thorn in the side of landscape architects, planners, and building owners,"" skateboarders today\xe2\x80\xa6 https://t.co/kRTDgy1tPW'"
NatGeo,1280384901322354689,2020-07-07 06:15:23,"b'Long believed to have been domesticated in Central America some 4,000 years ago, cacao has a more interesting story\xe2\x80\xa6 https://t.co/QNIjbXXnro'"
NatGeo,1280354617595965442,2020-07-07 04:15:03,"b'From a helicopter, this photographer captured the startling stillness of New York City under lockdown https://t.co/NiiUvn7fDe'"
NatGeo,1280324250960871426,2020-07-07 02:14:23,"b'As trade boomed between Europe, Africa, and the Americas, so did piracy https://t.co/E8fx4Z9Oso'"
NatGeo,1280293047872471047,2020-07-07 00:10:23,"b'If you want to interest people in science and shape their views on hot-button science issues, satirical humor can w\xe2\x80\xa6 https://t.co/OfiGDEO6Bl'"
NatGeo,1280261742711300096,2020-07-06 22:06:00,"b'Unlike most frog species, glass frogs are attentive parents\xe2\x80\x94at least the males are https://t.co/jplVfVqSNh'"
NatGeo,1280238685443809281,2020-07-06 20:34:22,"b'Gaps in forest canopies, called crown shyness, could help trees share resources and stay healthy https://t.co/u3kDwOnxWA'"
NatGeo,1280203370427490305,2020-07-06 18:14:03,"b'A rash of fires on landscapes that are typically too cold, wet, and icy to burn is raising alarms for ecologists an\xe2\x80\xa6 https://t.co/DGKkkOqleT'"
NatGeo,1280187268444160003,2020-07-06 17:10:04,"b'Crossing the United States in mid-June, a writer encountered reopening cities, anxious Airbnbs, a desert wildfire\xe2\x80\x94a\xe2\x80\xa6 https://t.co/csPyX5zq6A'"
NatGeo,1280175965902180352,2020-07-06 16:25:09,b'A vibrant aurora dances across the night sky in this otherworldly scene captured by photographer Babak Tafreshi at\xe2\x80\xa6 https://t.co/Pq7BLCbxQx'
NatGeo,1280158408906334208,2020-07-06 15:15:23,b'Conservationists worry our reliance on horseshoe crab blood for COVID-19 vaccines and related therapeutics may impe\xe2\x80\xa6 https://t.co/mK8hQJlMAV'
NatGeo,1280143227660746753,2020-07-06 14:15:04,"b'There are more than seven million school-age migrants around the world, and poverty and organized crime kept most o\xe2\x80\xa6 https://t.co/4uFxyEj2t4'"
NatGeo,1280128377949687808,2020-07-06 13:16:03,"b'The discovery also gives a rare glimpse into the lives of some of the first residents of the Americas, who lived in\xe2\x80\xa6 https://t.co/HWPrwGSgUN'"
NatGeo,1280111096863641601,2020-07-06 12:07:23,"b'Scientists were surprised to discover some of these legless animals, called caecilians, may have venomous saliva\xe2\x80\x94po\xe2\x80\xa6 https://t.co/kT5LPVHffk'"
NatGeo,1280089121449562112,2020-07-06 10:40:04,b'80 percent of the emperor colonies could be gone by 2100 if carbon emissions remain unchecked https://t.co/K1Mv4CY6Od'
NatGeo,1280019493545291776,2020-07-06 06:03:23,"b'You\xe2\x80\x99d think their colors would make them an easy mark for frogs, lizards, and birds. But these weevils want to be s\xe2\x80\xa6 https://t.co/nCvakDenx1'"
NatGeo,1279989715853291520,2020-07-06 04:05:03,"b'As the beloved spacecraft hurtled toward its fiery doom, it beamed home a final collection of eerily beautiful imag\xe2\x80\xa6 https://t.co/afkhE3R04q'"
NatGeo,1279958257214390272,2020-07-06 02:00:03,"b'Long pictured as a lion-like hunter, the prehistoric predator may have had a completely different lifestyle than we\xe2\x80\xa6 https://t.co/H3EblqV5FG'"
NatGeo,1279932588086484992,2020-07-06 00:18:03,"b'Photographers around the globe have captured images of this strange time, when we\xe2\x80\x99re separated from each other by w\xe2\x80\xa6 https://t.co/mDDCSFblRp'"
NatGeo,1279898600005349378,2020-07-05 22:03:00,b'Taiger the great horned owl has recovered from her wing injury and is ready for release back into the wild https://t.co/AplcQRmAdK'
NatGeo,1279886618631888896,2020-07-05 21:15:23,"b'If you want to interest people in science and shape their views on hot-button science issues, satirical humor can w\xe2\x80\xa6 https://t.co/CIhDKI73Cn'"
NatGeo,1279867746575138820,2020-07-05 20:00:24,b'Can you tell a moth from a butterfly? A possum from an opossum? The answer may not be as clear cut as you think https://t.co/4CTG7E1jMy'
NatGeo,1279838465878876161,2020-07-05 18:04:03,"b'Whether photographing loved ones, family pets, or strangers, thinking ahead is key to capturing the personality, em\xe2\x80\xa6 https://t.co/3bBqBJlnc8'"
NatGeo,1279811040935661568,2020-07-05 16:15:04,"b""Framed by lush greenery, Oregon's Multnomah Falls cascades down the cliffside in this picturesque scene captured by\xe2\x80\xa6 https://t.co/nJWuejAIRT"""
NatGeo,1279793507939598336,2020-07-05 15:05:24,"b'Crossing the United States in mid-June, a writer encountered reopening cities, anxious Airbnbs, a desert wildfire\xe2\x80\x94a\xe2\x80\xa6 https://t.co/2cRALKWLwP'"
NatGeo,1279779583383003136,2020-07-05 14:10:04,"b'From a helicopter, this photographer captured the startling stillness of New York City under lockdown https://t.co/TByvaSNUO7'"
NatGeo,1279754498387443713,2020-07-05 12:30:23,"b'There are more than seven million school-age migrants around the world, and poverty and organized crime kept most o\xe2\x80\xa6 https://t.co/94PlP2csLd'"
NatGeo,1279724216229736448,2020-07-05 10:30:03,"b""Scientists are learning how to use volcanic lightning as a tool for monitoring eruptions. Here's how it works https://t.co/SPSLpruafp"""
NatGeo,1279657612519317504,2020-07-05 06:05:24,"b'Even with a brain the size of a sesame seed, the dung beetle can navigate the world guided by the sun, moon, and th\xe2\x80\xa6 https://t.co/zzXKvRbyFy'"
NatGeo,1279626821957562370,2020-07-05 04:03:03,"b'Though they can be fierce and destructive, summer storms can be pretty beautiful, too https://t.co/CFdcGV3G1i'"
NatGeo,1279603419439861762,2020-07-05 02:30:03,"b'Executed 100 years ago, the exotic dancer broke the rules in the early 20th century. But did that cost her her life? https://t.co/vYLRzIvsrX'"
NatGeo,1279539231824556032,2020-07-04 22:15:00,b'These divers were in for a treat when they came across a playful humpback whale and her calf https://t.co/S9LxYbNwc8'
NatGeo,1279521209819049985,2020-07-04 21:03:23,b'This isn\xe2\x80\x99t the first time American protestors have vandalized symbols of oppression https://t.co/LoGrGeTTKH'
NatGeo,1279505524271337474,2020-07-04 20:01:03,b'Make the most out of a contactless road trip with these travel tips https://t.co/Xkoo3TJaSr'
NatGeo,1279478428450934785,2020-07-04 18:13:23,"b'Photographers around the globe have captured images of this strange time, when we\xe2\x80\x99re separated from each other by w\xe2\x80\xa6 https://t.co/tjdFsS7crl'"
NatGeo,1279462070560460800,2020-07-04 17:08:23,"b'The vibrant, aerial displays that impress crowds today were derived in the 1830s, when Italians combined metals wit\xe2\x80\xa6 https://t.co/Dute3dT9xI'"
NatGeo,1279448649563541510,2020-07-04 16:15:03,b'A lioness appears to stare at buzzing flies overhead in this intimate wildlife moment captured by Your Shot photogr\xe2\x80\xa6 https://t.co/t4npYeJ7va'
NatGeo,1279432372358983681,2020-07-04 15:10:22,b'Conservationists worry our reliance on horseshoe crab blood for COVID-19 vaccines and related therapeutics may impe\xe2\x80\xa6 https://t.co/PK3iyFTkSO'
NatGeo,1279419709600006146,2020-07-04 14:20:03,"b'For the COVID-19 vaccine, the ideal candidate would be able to establish immunity in at least 70 percent of the pop\xe2\x80\xa6 https://t.co/WFDbx4xrKE'"
NatGeo,1279386740269203457,2020-07-04 12:09:03,"b'As trade boomed between Europe, Africa, and the Americas, so did piracy https://t.co/8M7XCFnGyi'"
NatGeo,1279386240077496320,2020-07-04 12:07:04,"b'The colonies had already voted for freedom from British rule, but debates over slavery held up the formal adoption\xe2\x80\xa6 https://t.co/Iq8ImqRtrr'"
NatGeo,1279361829198876673,2020-07-04 10:30:04,"b'Asphalt and concrete absorb and radiate heat, while shady parks and gardens \xe2\x80\x9cair-condition\xe2\x80\x9d neighborhoods https://t.co/DZW9twhryf'"
NatGeo,1279297652425928704,2020-07-04 06:15:03,"b'As replete with wildlife as the far north is, it is largely devoid of people\xe2\x80\x94making it tough to steward the immense\xe2\x80\xa6 https://t.co/zDSjyqJmnj'"
NatGeo,1279265441299533834,2020-07-04 04:07:03,"b'If we could see it from outside, our home galaxy would not be a flat disk, but would look more like a record bent i\xe2\x80\xa6 https://t.co/TlAd4sUcyu'"
NatGeo,1279235243636133888,2020-07-04 02:07:03,"b'There are over 500 species of bombardier beetles, all of which have the infamous ability to release rapid bursts of\xe2\x80\xa6 https://t.co/SpUllSKxKh'"
NatGeo,1279207306400534530,2020-07-04 00:16:03,"b'The Saharan dust plume is a supersized version of ones that cross the Atlantic all the time, ferrying particles tha\xe2\x80\xa6 https://t.co/Z3PDNHFvBX'"
NatGeo,1279188170861678594,2020-07-03 23:00:00,"b""His name is... Alexander Hamilton. It's showtime: Hamilton is now streaming globally, exclusively on @DisneyPlus\xe2\x80\xa6 https://t.co/Qc3BnxRbWr"""
NatGeo,1279181999207481346,2020-07-03 22:35:29,b'RT @disneyplus: Just you wait\xe2\x80\x94the Hamilton Watch Party begins in less than 30 minutes!! \xe2\x8f\xb1\xf0\x9f\x93\xba\xe2\xad\x90\xef\xb8\x8f Be sure to hit play on #DisneyPlus at 4:00pm P\xe2\x80\xa6'
NatGeo,1279178857430450177,2020-07-03 22:23:00,"b'Thought of as living fossils, feather stars date back about 200 million years https://t.co/f7D6G0j0Yh'"
NatGeo,1279158080148852738,2020-07-03 21:00:26,"b'""Americans look for heroes, sometimes more than we look for the truth."" https://t.co/jwqWubbNYX'"
NatGeo,1279144898189459456,2020-07-03 20:08:03,b'A viral tweet is sweeping through Canadian sparrow populations\xe2\x80\x94literally\n https://t.co/xPz2Se8Hqs'
NatGeo,1279129544457404416,2020-07-03 19:07:03,"b'Using a more sophisticated calculation called the infection-fatality rate, the latest best estimates show that COVI\xe2\x80\xa6 https://t.co/SaSJOOT18e'"
NatGeo,1279115454288715777,2020-07-03 18:11:03,"b'The discovery also gives a rare glimpse into the lives of some of the first residents of the Americas, who lived in\xe2\x80\xa6 https://t.co/8Ww5iRV4ij'"
NatGeo,1279101362031284224,2020-07-03 17:15:03,"b'After wading through a narrow passageway in waist-high water, photographer Julia Karlsson describes ""the ceiling su\xe2\x80\xa6 https://t.co/BSIqcAVCoS'"
NatGeo,1279082617095237634,2020-07-03 16:00:34,"b'Scientists were surprised to discover some of these legless animals, called caecilians, may have venomous saliva\xe2\x80\x94po\xe2\x80\xa6 https://t.co/pg5SSpIuhZ'"
NatGeo,1279069985835487236,2020-07-03 15:10:23,b'These photos capture the momentous year that 2020 has been thus far https://t.co/u23bsDLE85'
NatGeo,1279053632084889605,2020-07-03 14:05:24,b'80 percent of the emperor colonies could be gone by 2100 if carbon emissions remain unchecked https://t.co/HDGq7tvOJO'
NatGeo,1279024939979485184,2020-07-03 12:11:23,b'Wisconsin\xe2\x80\x99s Ice Age Trail\xe2\x80\x94a nationally designated scenic trail\xe2\x80\x94winds along the remnants of ancient glacial activity\xe2\x80\xa6 https://t.co/9BL76TYu3c'
NatGeo,1279000697963532289,2020-07-03 10:35:03,b'Coronavirus has led to an additional wave of uncertainties for immigrants https://t.co/pOSyQ9BTlV'
NatGeo,1278932839594168321,2020-07-03 06:05:25,b'These tiny fish live fast and get eaten young\xe2\x80\x94and keep the ecosystem humming  https://t.co/VFE86wvSbd'
NatGeo,1278902638386520065,2020-07-03 04:05:24,b'Enjoy these fairytale-worthy views of Ireland https://t.co/UWkC3dsJFo'
NatGeo,1278871098101243904,2020-07-03 02:00:04,b'These secretive predators are built for survival in frozen northern landscapes. Can they adapt to a warming world? https://t.co/GCu7rPTg6E'
NatGeo,1278842401348599809,2020-07-03 00:06:02,"b'Snow leopards are found only in the rugged, cold, and inaccessible mountain terrain of Central Asia, making them di\xe2\x80\xa6 https://t.co/kEvRxsIali'"
NatGeo,1278816721134993411,2020-07-02 22:24:00,"b'In a shimmering \xe2\x80\x9coctopus garden,"" scientists discovered over 1,000 females, many brooding eggs https://t.co/BmMkilryhY'"
NatGeo,1278800207862550528,2020-07-02 21:18:23,b'This isn\xe2\x80\x99t the first time American protestors have vandalized symbols of oppression https://t.co/bFCFwbkiqh'
NatGeo,1278780999057408000,2020-07-02 20:02:03,"b'The colonies had already voted for freedom from British rule, but debates over slavery held up the formal adoption\xe2\x80\xa6 https://t.co/Q8G2gFkmNh'"
NatGeo,1278752310785724418,2020-07-02 18:08:03,"b'Big, dense, and tightly tethered to its home star, the planet is unlike anything astronomers have yet seen\xe2\x80\x94either i\xe2\x80\xa6 https://t.co/3XmUExu7Rj'"
NatGeo,1278738549890846720,2020-07-02 17:13:22,b'A viral tweet is sweeping through Canadian sparrow populations\xe2\x80\x94literally\n https://t.co/uOnPlFmGKS'
NatGeo,1278725032253014022,2020-07-02 16:19:39,"b""A hiker explores the grandeur of Utah's Arches National Park in this captivating image by photographer Ben Horton https://t.co/bdNpjSWGw3"""
NatGeo,1278703991292071938,2020-07-02 14:56:03,b'Make the most out of a contactless road trip with these travel tips https://t.co/zz4h51wBz7'
NatGeo,1278667341983776770,2020-07-02 12:30:25,b'Pop culture can be a great tool to teach kids history while relating to their interests https://t.co/YnyRJn5Kbn'
NatGeo,1278637138679128065,2020-07-02 10:30:24,b'Coronavirus has led to an additional wave of uncertainties for immigrants https://t.co/BmpcbhUJvK'
NatGeo,1278570363430088706,2020-07-02 06:05:03,b'A photographer shines a light on the often misunderstood and controversial pit bull https://t.co/25fjaq9fPh'
NatGeo,1278539911801561088,2020-07-02 04:04:03,"b'Ancient clues buried underwater can save lives, particularly in places without written records https://t.co/FTOB1CVYTG'"
NatGeo,1278527583471243264,2020-07-02 03:15:04,b'These photos capture the momentous year that 2020 has been thus far https://t.co/WR7Dcx0O5s'
NatGeo,1278517603141591041,2020-07-02 02:35:24,b'Meet two foxes living at the Alaska Wildlife Conservation Center and get a behind the scenes look at how the center\xe2\x80\xa6 https://t.co/IHSFZg1UKA'
NatGeo,1278453592341581824,2020-07-01 22:21:03,"b'The Saharan dust plume is a supersized version of ones that cross the Atlantic all the time, ferrying particles tha\xe2\x80\xa6 https://t.co/b5j4u4nnPn'"
NatGeo,1278437159343730688,2020-07-01 21:15:45,"b""July 1st marks Canada Day, a national holiday honoring the country's founding, but for some the day is a reminder o\xe2\x80\xa6 https://t.co/4avz99eVWW"""
NatGeo,1278418574034509826,2020-07-01 20:01:54,b'RT @NGKids: Create an underwater scene using paint bubbles and markers during your second week of Nat Geo Family Camp. Kids blow bubbles wi\xe2\x80\xa6'
NatGeo,1278395477893971968,2020-07-01 18:30:08,b'A praying mantis hangs out upside down in this charming image by Your Shot photographer Leigh Ayres. https://t.co/BhmfQAZYDJ'
NatGeo,1278371130202611713,2020-07-01 16:53:23,"b'Big, dense, and tightly tethered to its home star, the planet is unlike anything astronomers have yet seen\xe2\x80\x94either i\xe2\x80\xa6 https://t.co/qUgZgBb1Cd'"
NatGeo,1278328858740240384,2020-07-01 14:05:24,"b'A major reconsideration of how the history of colonialization, slavery, and white supremacy is taught and viewed is\xe2\x80\xa6 https://t.co/ebY86VIhtn'"
NatGeo,1278301170973446145,2020-07-01 12:15:23,"b'For the COVID-19 vaccine, the ideal candidate would be able to establish immunity in at least 70 percent of the pop\xe2\x80\xa6 https://t.co/KbJj64wdqW'"
NatGeo,1278276005577228288,2020-07-01 10:35:23,"b'Unexpected patterns, shadows, and colors transform these buildings into works of art https://t.co/j8jFyjzcfW'"
NatGeo,1278215270746685442,2020-07-01 06:34:03,"b""Step into a miniature world inhabited by an artist's paper wildlife https://t.co/RL8LpJakDQ"""
NatGeo,1278184570542841856,2020-07-01 04:32:03,"b'There are over 500 species of bombardier beetles, all of which have the infamous ability to release rapid bursts of\xe2\x80\xa6 https://t.co/Oo6rGzCRMz'"
NatGeo,1278153193428582404,2020-07-01 02:27:22,"b'Ancient clues buried underwater can save lives, particularly in places without written records https://t.co/Jq2rqn31Lr'"
NatGeo,1278120478494855170,2020-07-01 00:17:23,b'Volcanic activity could have actually helped life bounce back by warming the planet after years of catastrophic dar\xe2\x80\xa6 https://t.co/Uy0z72zKmw'
NatGeo,1278097071837454344,2020-06-30 22:44:22,"b""Nature's perfect alpinists, these impressive cats have been scraping out a living on the roof of the world for eons https://t.co/wDWlaZg3nH"""
NatGeo,1278070810457104387,2020-06-30 21:00:01,"b""During one of Everest's most embattled climbing seasons, Lost on Everest follows an intrepid expedition to uncover\xe2\x80\xa6 https://t.co/SsoezQt22P"""
NatGeo,1278027112696279040,2020-06-30 18:06:22,b'The water may be cold but the health benefits keep these daring divers coming back https://t.co/4kKerJf0zm'
NatGeo,1278006897115832327,2020-06-30 16:46:03,b'Wisconsin\xe2\x80\x99s Ice Age Trail\xe2\x80\x94a nationally designated scenic trail\xe2\x80\x94winds along the remnants of ancient glacial activity\xe2\x80\xa6 https://t.co/enoTjbQTGj'
NatGeo,1277990289869848579,2020-06-30 15:40:03,"b'Installing a crucial network of weather sensors on Everest demanded months of preparation\xe2\x80\x94but could provide a ""new\xe2\x80\xa6 https://t.co/YdFyDK9KtA'"
NatGeo,1277977791061913601,2020-06-30 14:50:23,"b'Health officials have set targets for how good and how safe a COVID-19 vaccine needs to be, but communicating that\xe2\x80\xa6 https://t.co/dHe2sQejvv'"
NatGeo,1277960664129179648,2020-06-30 13:42:20,b'What led the FBI to arrest a dinosaur eight years ago? Find out in the latest episode of #OverheardNatGeo\xe2\x80\xa6 https://t.co/OLpLqW0mFr'
NatGeo,1277912278797635586,2020-06-30 10:30:04,"b""Scientists have been warning us of this possibility for decades\xe2\x80\x94so why weren't we prepared? https://t.co/U0aH6mIHvC"""
NatGeo,1277845671354269707,2020-06-30 06:05:23,"b'Hurtling over cliffs, forging canyons, and sometimes creating their own clouds, waterfalls relentlessly reshape the\xe2\x80\xa6 https://t.co/yRIZurwuIz'"
NatGeo,1277816393602338816,2020-06-30 04:09:03,"b""Seti I had been buried in one of Egypt's most colorful royal tombs, but his body was gone by the time its richly de\xe2\x80\xa6 https://t.co/eKjRZIiAVj"""
NatGeo,1277784018294104065,2020-06-30 02:00:24,"b'A major reconsideration of how the history of colonialization, slavery, and white supremacy is taught and viewed is\xe2\x80\xa6 https://t.co/6F0Fdgnrzb'"
NatGeo,1277755478215233539,2020-06-30 00:07:00,b'This little fish carries the same gene as four-legged animals https://t.co/708x7EH43F'
NatGeo,1277726636650246146,2020-06-29 22:12:23,b'Volcanic activity could have actually helped life bounce back by warming the planet after years of catastrophic dar\xe2\x80\xa6 https://t.co/QZWFcEjW6H'
NatGeo,1277709694577016832,2020-06-29 21:05:04,"b'From research to conservation, camera traps have revolutionized our knowledge of wildlife. See some of our favorite\xe2\x80\xa6 https://t.co/9KIw8efoPo'"
NatGeo,1277694592306028546,2020-06-29 20:05:03,b'Celebrations for the class of 2020\xe2\x80\x94from preschoolers to medical students\xe2\x80\x94have taken many forms https://t.co/SY5MVHexI1'
NatGeo,1277668168505360384,2020-06-29 18:20:03,"b'On National Camera Day, help us caption this image by Your Shot photographer Marijke V. https://t.co/FWJUroEUO7'"
NatGeo,1277660700400386048,2020-06-29 17:50:23,b'The water may be cold but the health benefits keep these daring divers coming back https://t.co/9cJbGmFfC6'
NatGeo,1277637974394638336,2020-06-29 16:20:05,"b'Despite their major impacts in the lives of Alexander Hamilton and Aaron Burr, certain characters were left off sta\xe2\x80\xa6 https://t.co/l47yDuKgij'"
NatGeo,1277603996383969280,2020-06-29 14:05:04,b'The virus still has abundant room to keep spreading. But harm reduction can help stop that from happening. Here\xe2\x80\x99s h\xe2\x80\xa6 https://t.co/FuqQLnRvjj'
NatGeo,1277591494015225862,2020-06-29 13:15:23,"b""Recent protests in St. Paul evoke the work of Gordon Parks, who became one of the mid-20th century's most influenti\xe2\x80\xa6 https://t.co/tLI4TS7p43"""
NatGeo,1277574383104557056,2020-06-29 12:07:23,"b'Canada has been off limits to foreigners since March, and is not expected to open borders until at least late July https://t.co/meTo5ez2Wa'"
NatGeo,1277549887865925632,2020-06-29 10:30:03,b'Listen to these seniors reflect on their past experiences as they look ahead to the future https://t.co/yPtmdxFovc'
NatGeo,1277483285757726722,2020-06-29 06:05:24,"b'In addition to wildfire season, the pandemic presents additional health risks for first responders and evacuees https://t.co/KhPtri40mj'"
NatGeo,1277452744526348288,2020-06-29 04:04:02,"b'During the peak of the lockdowns, fatal collisions with moose, bears, mountain lions, and other large wild animals\xe2\x80\xa6 https://t.co/cB5as8XA1T'"
NatGeo,1277393190774026240,2020-06-29 00:07:24,"b'\xe2\x80\x9cThis is our history, and none of us are going to let it go easily\xe2\x80\x9d https://t.co/4tDqnvz8be'"
NatGeo,1277364653086179335,2020-06-28 22:14:00,b'Watch Gordon Ramsay learn to make a special chutney using the weaver ant as a key ingredient https://t.co/RsvcbUrvC7'
NatGeo,1277305358172684291,2020-06-28 18:18:23,"b'\xe2\x80\x9cBesides being morally reprehensible, mink farming is now simply untenable because it poses a threat to public heal\xe2\x80\xa6 https://t.co/NmSUEsyWko'"
NatGeo,1277274409145978883,2020-06-28 16:15:24,"b'Despite their major impacts in the lives of Alexander Hamilton and Aaron Burr, certain characters were left off sta\xe2\x80\xa6 https://t.co/dbyDNIN74N'"
NatGeo,1277259221944414208,2020-06-28 15:15:03,b'A free diver spearfishes off the coast of Cat Island in the Bahamas in this scene captured by photographer Andy Mann https://t.co/nmeT1Co2EN'
NatGeo,1277241609810214913,2020-06-28 14:05:04,b'Discover some of history\xe2\x80\x99s most prominent LGBTQ figures and their lasting impacts #PRIDE2020 https://t.co/hfmOmHWdxV'
NatGeo,1277227764161097733,2020-06-28 13:10:03,"b""Recent protests in St. Paul evoke the work of Gordon Parks, who became one of the mid-20th century's most influenti\xe2\x80\xa6 https://t.co/YeU6dSGKSp"""
NatGeo,1277213926103691264,2020-06-28 12:15:04,b'This map shows the regions where cases and deaths are either decreasing or increasing the most https://t.co/j0PUggxOCB'
NatGeo,1277187500000370695,2020-06-28 10:30:03,"b'Decades later, the events at the Stonewall Inn are seen as a revolutionary turning point in the movement to secure\xe2\x80\xa6 https://t.co/mcEVE09i0O'"
NatGeo,1277121059712630784,2020-06-28 06:06:03,"b""Efforts are underway to increase the chances of this subspecies' survival in Arizona https://t.co/wA6vZt0dOI"""
NatGeo,1277093129091461121,2020-06-28 04:15:03,"b'During the peak of the lockdowns, fatal collisions with moose, bears, mountain lions, and other large wild animals\xe2\x80\xa6 https://t.co/RBqW7rWX3b'"
NatGeo,1277062674367602694,2020-06-28 02:14:02,"b'Dolphins are able to transmit knowledge to each other through social learning, which is rarely found in nature https://t.co/XteiCZGlKG'"
NatGeo,1277029050469531648,2020-06-28 00:00:26,"b""Yes, you can get on a plane, but it's important to exercise caution https://t.co/XUIh7p8pFE"""
NatGeo,1277002516715253761,2020-06-27 22:15:00,b'Take a closer look because these little fellas rarely venture to the ground https://t.co/HPVR6v9E9y'
NatGeo,1276969141820325889,2020-06-27 20:02:23,"b'Canada has been off limits to foreigners since March, and is not expected to open borders until at least late July https://t.co/TasvuD3XCu'"
NatGeo,1276942466982260738,2020-06-27 18:16:23,"b'Greenland sled dogs\xe2\x80\x94a fluffy, curly-tailed canine native to the harsh Arctic tundra\xe2\x80\x94could be among the oldest dog b\xe2\x80\xa6 https://t.co/xO60Omc3TX'"
NatGeo,1276920742366625792,2020-06-27 16:50:03,b'Celebrations for the class of 2020\xe2\x80\x94from preschoolers to medical students\xe2\x80\x94have taken many forms https://t.co/yt9QPIW7l6'
NatGeo,1276911940108005376,2020-06-27 16:15:05,b'A man walks toward a distant mountain range in a remote region of Iceland in this inspiring view captured by photog\xe2\x80\xa6 https://t.co/GvYj6uBaz7'
NatGeo,1276895579797434370,2020-06-27 15:10:04,b'Simple\xe2\x80\x94and fun\xe2\x80\x94activities can foster a lifelong commitment to helping others https://t.co/9e4HpSrbrw'
NatGeo,1276865375918010369,2020-06-27 13:10:03,"b""Rats, lion fish, feral hogs, goats: these invasive animals are among the more than 300 species on the parks' most-w\xe2\x80\xa6 https://t.co/BLg6LMUpCm"""
