NatGeo,1231611423517814786,2020-02-23 16:07:00,"b'Eliminating trash may sound far-fetched, but innovators worldwide are pioneering solutions https://t.co/StkcxqVPPF'"
NatGeo,1231597833767149568,2020-02-23 15:13:00,"b""Red-eared sliders are the most popular turtle in the American pet trade, but they're also often abandoned outside\xe2\x80\x94w\xe2\x80\xa6 https://t.co/EnXUgzNwu8"""
NatGeo,1231585754209325056,2020-02-23 14:25:00,b'The inspiring image lifted the spirits of a nation\xe2\x80\x94and raised suspicions that it was too good to be true https://t.co/cQzIqsso5O'
NatGeo,1231566376638304256,2020-02-23 13:08:00,"b'Dine in a candlelit grotto, dive with manta rays, and more in these destinations of a lifetime https://t.co/jMOhEWjQY4'"
NatGeo,1231541965730308096,2020-02-23 11:31:00,b'The surf\xe2\x80\x99s up in North America\xe2\x80\x99s Great Lakes. But environmental threats could change that https://t.co/S7mSI8yASr'
NatGeo,1231446587123077120,2020-02-23 05:12:00,b'The early solar system may have been even more metal than astronomers realized https://t.co/qUc5zbiift'
NatGeo,1231414123352776705,2020-02-23 03:03:00,"b""Efforts to make nature's schedule fit our own have been imperfect from the start https://t.co/bZjyEK16pb"""
NatGeo,1231388705736163328,2020-02-23 01:22:00,b'Celebrate the wonder of plants in these surprising places around the world https://t.co/wK0t4zKD6N'
NatGeo,1231362281692389376,2020-02-22 23:37:00,b'See how rescuers help a giraffe with wire wrapped around its neck https://t.co/lGeGz5sA4b'
NatGeo,1231325539677409280,2020-02-22 21:11:00,"b'We\xe2\x80\x99ve underestimated the methane impacts of fossil fuel extraction by up to 40 percent, new research shows https://t.co/N8pfVY4vQ2'"
NatGeo,1231295843996708865,2020-02-22 19:13:00,"b'Open skies, natural spaces\xe2\x80\x94where do you find quiet? This serene moment was captured by Your Shot photographer Adoni\xe2\x80\xa6 https://t.co/Cb2Z2gb6jK'"
NatGeo,1231267658252857344,2020-02-22 17:21:00,"b'Are travel bans, border screenings, and quarantines effective in thwarting the ongoing outbreak? So far, the verdic\xe2\x80\xa6 https://t.co/7GubfN3oyC'"
NatGeo,1231254823674269698,2020-02-22 16:30:00,"b'Both highly intelligent and a culinary delicacy, the animals are at the center of an ethical controversy https://t.co/wLXiCUD6H9'"
NatGeo,1231244663589425156,2020-02-22 15:49:37,"b'The correct answer is 0.3 miles! When astronomers detected the collision of two neutron stars in 2017, they saw bot\xe2\x80\xa6 https://t.co/t1iNMp3SfC'"
NatGeo,1231229376194199552,2020-02-22 14:48:53,"b'When large stars explode, their cores sometimes collapse and form neutron stars, the universe\xe2\x80\x99s densest objects.\xe2\x80\xa6 https://t.co/TjVaId3TDE'"
NatGeo,1231207512172564481,2020-02-22 13:22:00,"b'Inspired by their powerful ancestors, the Sassanian dynasty restored Persia to imperial glory https://t.co/HSnkP4USZo'"
NatGeo,1231177312999096320,2020-02-22 11:22:00,b'A mass grave discovered on the grounds of a former abbey provides rare and unexpected evidence of how rural populat\xe2\x80\xa6 https://t.co/6UaZYvgygz'
NatGeo,1231086715806285834,2020-02-22 05:22:00,"b'The region has experienced dramatic warming in recent decades, making it easier for heat spells to veer into record\xe2\x80\xa6 https://t.co/wUsWtHnbbP'"
NatGeo,1231052742136778752,2020-02-22 03:07:00,b'In case you were wondering https://t.co/iHq703V5aD'
NatGeo,1231013231856099328,2020-02-22 00:30:00,"b""A lion\xe2\x80\x99s roar can travel 5 miles and reach 114 decibels\xe2\x80\x94that's nearly as loud as thunder! https://t.co/2QsjVt1cbX"""
NatGeo,1230998383935946752,2020-02-21 23:31:00,"b""Efforts to make nature's schedule fit our own have been imperfect from the start https://t.co/bZjyEKiHgJ"""
NatGeo,1230985587345235969,2020-02-21 22:40:09,b'A gray jay poised on a branch seems to make eye contact with photographer Maxime Legare-vezina in this beautiful im\xe2\x80\xa6 https://t.co/y4GYNpE5f7'
NatGeo,1230977749013192711,2020-02-21 22:09:00,"b'RT @Rachael_Bale: Octopuses are a culinary delicacy...and highly intelligent. As overfishing causes their numbers to drop in some places, i\xe2\x80\xa6'"
NatGeo,1230914014198280192,2020-02-21 17:55:44,"b'Are travel bans, border screenings, and quarantines effective in thwarting the ongoing outbreak? So far, the verdic\xe2\x80\xa6 https://t.co/Fj8gIsGudT'"
NatGeo,1230896090544852992,2020-02-21 16:44:31,"b'A quarter century after the invention of recycled fleece, Polartec is still leading the outdoors industry in develo\xe2\x80\xa6 https://t.co/16JApbyckx'"
NatGeo,1230872216797163520,2020-02-21 15:09:39,"b""Red-eared sliders are the most popular turtle in the American pet trade, but they're also often abandoned outside\xe2\x80\x94w\xe2\x80\xa6 https://t.co/GEwODsQsXR"""
NatGeo,1230841852489691136,2020-02-21 13:09:00,b'Celebrate the wonder of plants in these surprising places around the world https://t.co/wK0t4zKD6N'
NatGeo,1230817190015852545,2020-02-21 11:31:00,"b'In the 150 years since his election, he remains one of only 10 black senators ever https://t.co/wflbIzwD7E'"
NatGeo,1230721811387564032,2020-02-21 05:12:00,b'These intricate living structures take 15 to 30 years to complete https://t.co/0YV7z2RDxL'
NatGeo,1230691612642152448,2020-02-21 03:12:00,"b""Capybaras, the world's largest living rodents, have evolved their own form of cancer immunotherapy https://t.co/zdXX0uzxjZ"""
NatGeo,1230670855354691591,2020-02-21 01:49:31,"b'Inspired by their powerful ancestors, the Sassanian dynasty restored Persia to imperial glory https://t.co/HSnkP4USZo'"
NatGeo,1230634234525683715,2020-02-20 23:24:00,"b'Albatrosses can fly millions of miles during a lifetime, but they don\xe2\x80\x99t live a solitary existence https://t.co/tStl7iz9CT'"
NatGeo,1230622658196320257,2020-02-20 22:38:00,"b'ICYMI: Stretching 26 feet in length, the dinosaur is the first new Canadian tyrannosaurid to be found in 50 years https://t.co/Q5xpMUECnq'"
NatGeo,1230609644177018885,2020-02-20 21:46:17,"b'In the 150 years since his election, he remains one of only 10 black senators ever https://t.co/wflbIzwD7E'"
NatGeo,1230592025155768320,2020-02-20 20:36:16,b'Can dogs tell the difference between a happy owner and an angry one? Evidence suggests the animals are better at de\xe2\x80\xa6 https://t.co/4bHBJhUzff'
NatGeo,1230553452553568256,2020-02-20 18:03:00,"b'We\xe2\x80\x99ve underestimated the methane impacts of fossil fuel extraction by up to 40 percent, new research shows https://t.co/N8pfVY4vQ2'"
NatGeo,1230541484178518022,2020-02-20 17:15:26,b'Some vanish into their environments\xe2\x80\x94while others boldly assert their dominance https://t.co/A4R2jSmRzg'
NatGeo,1230504078234484736,2020-02-20 14:46:48,"b""It's #LoveYourPetDay and we couldn't be more excited! \n\nWhat's your favorite thing about your furry (or scaly, feat\xe2\x80\xa6 https://t.co/8WlPcO49j6"""
NatGeo,1230479464624078848,2020-02-20 13:09:00,b'Some vanish into their environments\xe2\x80\x94while others boldly assert their dominance https://t.co/FJSF3ciIaK'
NatGeo,1230360178530193408,2020-02-20 05:15:00,"b'It wouldn\'t be a ""pane"" to view the world this way https://t.co/HSUPJp1UhG'"
NatGeo,1230298537126236162,2020-02-20 01:10:03,b'A mass grave discovered on the grounds of a former abbey provides rare and unexpected evidence of how rural populat\xe2\x80\xa6 https://t.co/ysKW2T7bGT'
NatGeo,1230269581937139712,2020-02-19 23:15:00,"b'Human eyes see only a hovering spot of color, high-speed cameras capture the breathtaking maneuvers of a hummingbir\xe2\x80\xa6 https://t.co/gK46bMkDxS'"
NatGeo,1230256089863729154,2020-02-19 22:21:23,b'The St. Pancras train station in London might not be standing today if a poet with a love of Victorian architecture\xe2\x80\xa6 https://t.co/d3B2KMFlO8'
NatGeo,1230237305799090177,2020-02-19 21:06:45,b'@bittelmethis \xf0\x9f\x91\x80'
NatGeo,1230209206361501697,2020-02-19 19:15:05,"b'Of all the raw materials that we take from the Earth and turn into products, about two-thirds ends up as waste. Our\xe2\x80\xa6 https://t.co/YiuZmMka8K'"
NatGeo,1230191829452283904,2020-02-19 18:06:02,"b'The region has experienced dramatic warming in recent decades, making it easier for heat spells to veer into record\xe2\x80\xa6 https://t.co/Vp45NO3QyO'"
NatGeo,1230176730524082178,2020-02-19 17:06:02,"b'We\xe2\x80\x99ve underestimated the methane impacts of fossil fuel extraction by up to 40 percent, new research shows https://t.co/o4yVv8xbVl'"
NatGeo,1230163392092045312,2020-02-19 16:13:02,"b'Now 95, Marine Corps veteran Bill Montgomery recalls the battle that killed most of the men in his unit. ""I\'ve neve\xe2\x80\xa6 https://t.co/OnVk7iBycN'"
NatGeo,1230150057414070273,2020-02-19 15:20:03,"b""Victoria Falls is one of the world's most impressive natural wonders\xe2\x80\x94but what happens as the region gets drier and\xe2\x80\xa6 https://t.co/n0yAQvZkzO"""
NatGeo,1230133196412596224,2020-02-19 14:13:03,"b'The scale of the locust outbreak is like nothing in recent memory, and threatening the food supply of tens of milli\xe2\x80\xa6 https://t.co/QdAtCMYtwX'"
NatGeo,1230129631841464321,2020-02-19 13:58:53,b'RT @GMA: .@Ginger_Zee is live with @NatGeo from Victoria Falls in Africa as we count down to the 50th anniversary of #EarthDay! As our plan\xe2\x80\xa6'
NatGeo,1230119859020759041,2020-02-19 13:20:03,"b'Diego Calder\xc3\xb3n was researching birds in a remote area of Colombia when he was kidnapped by FARC. Now, he\xe2\x80\x99s returnin\xe2\x80\xa6 https://t.co/81FZtUPVlk'"
NatGeo,1230092261549101056,2020-02-19 11:30:23,b'Don\xe2\x80\x99t expect the typical Caribbean tourist scene in Dominica https://t.co/mi5eeh0xyi'
NatGeo,1230046964361900033,2020-02-19 08:30:24,b'Some vanish into their environments\xe2\x80\x94while others boldly assert their dominance https://t.co/d2F4sdldHM'
NatGeo,1229995289181872128,2020-02-19 05:05:03,"b'For the majority of people infected, this virus begins and ends in the lungs https://t.co/9sAInXyUA9'"
NatGeo,1229966596241809409,2020-02-19 03:11:02,"b'Dine in a candlelit grotto, dive with manta rays, and more in these destinations of a lifetime https://t.co/1UaW7e2lJa'"
NatGeo,1229941430866632707,2020-02-19 01:31:02,"b'Skijoring is a popular not only in the frigid regions north of the Arctic Circle, but also among a growing number o\xe2\x80\xa6 https://t.co/NPmQj7om4o'"
NatGeo,1229906361607245824,2020-02-18 23:11:41,"b""These frogs may be tiny, but they're on a big mission https://t.co/LuMrsOw6S2"""
NatGeo,1229884562609778696,2020-02-18 21:45:04,b'A mass grave discovered on the grounds of a former abbey provides rare and unexpected evidence of how rural populat\xe2\x80\xa6 https://t.co/GiHQ94fq4b'
NatGeo,1229810570460835840,2020-02-18 16:51:03,"b'The region has experienced dramatic warming in recent decades, making it easier for heat spells to veer into record\xe2\x80\xa6 https://t.co/fiy9SgFB0c'"
NatGeo,1229784649846677510,2020-02-18 15:08:03,"b'Now 95, Marine Corps veteran Bill Montgomery recalls the battle that killed most of the men in his unit. ""I\'ve neve\xe2\x80\xa6 https://t.co/uRiNAMJZAy'"
NatGeo,1229769635345715202,2020-02-18 14:08:23,"b'The scale of the locust outbreak is like nothing in recent memory, and threatening the food supply of tens of milli\xe2\x80\xa6 https://t.co/D6Dti19jPG'"
NatGeo,1229729875507982337,2020-02-18 11:30:24,"b'Susan B. Anthony spent most of her life advocating for equal rights for women, but never got to vote\xe2\x80\x94legally at lea\xe2\x80\xa6 https://t.co/DU4DS6t7bo'"
NatGeo,1229727357205991424,2020-02-18 11:20:23,"b""In a bid to attract visitors, a remote village in India's northeastern frontier has declared itself an ecological z\xe2\x80\xa6 https://t.co/n8JAkUifMe"""
NatGeo,1229676949267677184,2020-02-18 08:00:05,b'Did you know matabele ants were the first non-human animals to be observed systematically nursing their wounded bac\xe2\x80\xa6 https://t.co/QlWf1YbDET'
NatGeo,1229632902486511617,2020-02-18 05:05:04,"b""Blink and you'll miss it.\xc2\xa0Flattie spiders ambush their prey with unnerving speed https://t.co/v3LcdaILoR"""
NatGeo,1229603453909028864,2020-02-18 03:08:02,"b'Dance your heart out, enjoy the thrill of the chase, and relish celebrating life Cajun-style, if only for a day https://t.co/twvjDUd8wC'"
NatGeo,1229573591592787968,2020-02-18 01:09:23,"b'These leaping, googly-eyed fish mate in mud burrows where they adjust water levels to help eggs hatch. https://t.co/QrJkWOJmFG'"
NatGeo,1229549490996228096,2020-02-17 23:33:37,b'Arctic foxes are difficult to spot and film\xe2\x80\x94especially when in their springtime camouflage https://t.co/ZMqddHuSuo'
NatGeo,1229513447601209344,2020-02-17 21:10:23,b'Now travelers can help restore reefs by supporting coral replanting programs https://t.co/c3AJ24uccO'
NatGeo,1229486935976108032,2020-02-17 19:25:02,"b'What they lack in tentacles, they make up for in gooey clouds full of autonomous stingers https://t.co/dYoXJT394w'"
NatGeo,1229470665859911681,2020-02-17 18:20:23,"b'With no cars, no banks, and no high-rises, travelers don\xe2\x80\x99t come here to be seen\xe2\x80\x94they come to get lost https://t.co/VaGgU9eHsr'"
NatGeo,1229452964990984192,2020-02-17 17:10:03,"b'The last census of chinstrap penguins on Elephant Island identified 123,000 nests in 1971. A scientific survey this\xe2\x80\xa6 https://t.co/LpOXPSn5ob'"
NatGeo,1229420289127321600,2020-02-17 15:00:13,"b'""If we do this, 10 years from now our schoolchildren will not know or care when George Washington was born. They wi\xe2\x80\xa6 https://t.co/vr2qp9oAjF'"
NatGeo,1229407749492158466,2020-02-17 14:10:23,"b""Photographer Ryota Kajita's compositions of trapped, frozen bubbles may be beautiful, but their existence signifies\xe2\x80\xa6 https://t.co/gtZH06DkkC"""
NatGeo,1229393823861702657,2020-02-17 13:15:03,"b'Perched on a crumbling plateau, the village was at risk of disappearing\xe2\x80\x94until the world\xe2\x80\x99s curiosity caught up to it https://t.co/nG0VFcnNDC'"
NatGeo,1229365973557350401,2020-02-17 11:24:23,"b'From the air, photos expose the economic divide in cities where shacks border pristine new developments https://t.co/8I60lldiXN'"
NatGeo,1229319834971836416,2020-02-17 08:21:02,"b""Bringing plants indoors can provide a number of benefits, but experts say cleaner air isn't one of them https://t.co/wV5cUmnNQq"""
NatGeo,1229272525923856389,2020-02-17 05:13:03,"b'What kinds of forests can absorb planet-warming carbon emissions, but are fireproof? Seaweed. https://t.co/Z4TY0QT3mL'"
NatGeo,1229240398905778178,2020-02-17 03:05:23,"b""Komodo dragons are dominant predators that can grow up to 10 feet long\xe2\x80\x94and their hunting habits aren't for the weak\xe2\x80\xa6 https://t.co/IdBzKL5uoG"""
NatGeo,1229211624558469120,2020-02-17 01:11:03,"b'From blood storms to honeycomb lungs, here\xe2\x80\x99s an organ-by-organ look at how COVID-19 harms humans https://t.co/YKyZgqEdwF'"
NatGeo,1229183676619132930,2020-02-16 23:20:00,"b""This hawksbill sea turtle needs more than just jellyfish to sustain her and the 200 eggs she's about to lay https://t.co/3v47jzmkfl"""
NatGeo,1229161627150364672,2020-02-16 21:52:23,"b'From island monasteries to design-savvy contemporary chapels, here are 20 cathedrals that should top your list of m\xe2\x80\xa6 https://t.co/fahw8VXGNX'"
NatGeo,1229134957123166210,2020-02-16 20:06:24,"b'""Believe me, nothing can beat sleeping in the tent in the snowy mountains,"" writes Your Shot photographer Peter Dvo\xe2\x80\xa6 https://t.co/dNY9wVteDo'"
NatGeo,1229114483915808768,2020-02-16 18:45:03,"b'Nuthatches eavesdrop on chickadee warning signals, but are cautious about vocalizing specific details about a preda\xe2\x80\xa6 https://t.co/0CisoJp7Wm'"
NatGeo,1229102094663155718,2020-02-16 17:55:49,b'Passengers can do their part to minimize the risk of illness https://t.co/vdBFRpoXas'
NatGeo,1229046870099595265,2020-02-16 14:16:23,b'More than a hundred are still missing. Today the survivors are trying to rebuild their lives https://t.co/3nsPTWzUUd'
NatGeo,1229031435740250113,2020-02-16 13:15:03,b'Spice up your next dinner party conversation with these bizarre and amazing discoveries https://t.co/lUcNPUDnRC'
NatGeo,1229001323384885249,2020-02-16 11:15:23,"b""In a bid to attract visitors, a remote village in India's northeastern frontier has declared itself an ecological z\xe2\x80\xa6 https://t.co/a1QlNLwp0T"""
NatGeo,1228957199197712385,2020-02-16 08:20:03,"b'From bold landscapes to intimate wildlife portraits, explore these visions of our world https://t.co/oZPvJZCoXx'"
NatGeo,1228910639575425024,2020-02-16 05:15:03,b'So many North Atlantic right whales have collided with boats or become ensnared in vertical trap lines that only 40\xe2\x80\xa6 https://t.co/GFMlFoje44'
NatGeo,1228847473495506944,2020-02-16 01:04:03,"b'These leaping, googly-eyed fish mate in mud burrows where they adjust water levels to help eggs hatch. https://t.co/pcr6ze1C3x'"
NatGeo,1228817765135372290,2020-02-15 23:06:00,"b""These two Ethiopian wolves are the only survivors of a 23-member pack\xe2\x80\x94but there's still hope https://t.co/TcUnP7ACSO"""
NatGeo,1228797644769824769,2020-02-15 21:46:03,"b'From blood storms to honeycomb lungs, here\xe2\x80\x99s an organ-by-organ look at how COVID-19 harms humans https://t.co/9nr9uUWP2L'"
NatGeo,1228759143097524224,2020-02-15 19:13:03,"b'Dance your heart out, enjoy the thrill of the chase, and relish celebrating life Cajun-style, if only for a day https://t.co/KQW6vkpS5w'"
NatGeo,1228744295777214466,2020-02-15 18:14:03,"b'Nuthatches eavesdrop on chickadee warning signals, but are cautious about vocalizing specific details about a preda\xe2\x80\xa6 https://t.co/ldX0kQKnPA'"
NatGeo,1228729465221603331,2020-02-15 17:15:07,b'Sunset dips behind the Canadian Rockies in this snow-laden scene captured by Your Shot photographer Ying Han at Mor\xe2\x80\xa6 https://t.co/6smNYuFnvl'
NatGeo,1228710907011792896,2020-02-15 16:01:23,"b'On #WorldPangolinDay, we celebrate a charismatic\xe2\x80\x94and threatened\xe2\x80\x94creature that looks a bit like an armadillo, anteat\xe2\x80\xa6 https://t.co/ok4a5KWLiT'"
NatGeo,1228695997834022912,2020-02-15 15:02:08,"b'It is 315 times more massive! R136a1 resides 163,000 light-years away in the Large Magellanic Cloud, one of the Mil\xe2\x80\xa6 https://t.co/wNXXiTMdAM'"
NatGeo,1228680450966786050,2020-02-15 14:00:21,"b'R136a1, the biggest star yet discovered, is about how many times more massive than our sun? #SpaceSaturday'"
NatGeo,1228670390135918592,2020-02-15 13:20:23,"b'What they lack in tentacles, they make up for in gooey clouds full of autonomous stingers https://t.co/sOnf0pUiXA'"
NatGeo,1228638178438995968,2020-02-15 11:12:23,b'This newfound creature is 10 times more massive than any known cave fish\xe2\x80\x94and may still be evolving to lose its eyes https://t.co/885C6fxTDx'
NatGeo,1228591036877955077,2020-02-15 08:05:03,"b'The beautiful stone reliefs adorned a sophisticated canal system, and date to the reign of the mighty King Sargon II https://t.co/T5TnAISZ6O'"
NatGeo,1228548335428128769,2020-02-15 05:15:23,b'The impact of an earthquake reverberates up the food chain\xe2\x80\x94and can disrupt sperm whales\xe2\x80\x99 ability to hunt for up to\xe2\x80\xa6 https://t.co/1y6E1716XL'
NatGeo,1228524749095079936,2020-02-15 03:41:39,"b""Falling into a trench can mean injury or even death for a baby Asian elephant. Here's what can be done to prevent it https://t.co/PC045yhyor"""
NatGeo,1228492886188097536,2020-02-15 01:35:03,"b'Famous for his unparalleled powers of speech,\xc2\xa0Cicero defended the values of the Roman Republic\xe2\x80\x94before he was murder\xe2\x80\xa6 https://t.co/pCbfud3T8C'"
NatGeo,1228465207019700224,2020-02-14 23:45:03,b'Now travelers can help restore reefs by supporting coral replanting programs https://t.co/iFhxcCIsDL'
NatGeo,1228434000169111552,2020-02-14 21:41:03,"b'From blood storms to honeycomb lungs, here\xe2\x80\x99s an organ-by-organ look at how COVID-19 harms humans https://t.co/NubLClHukW'"
NatGeo,1228406300868055042,2020-02-14 19:50:59,b'Feel the love in these destinations\xe2\x80\x94no matter your relationship status https://t.co/5kHFV9qAAy'
NatGeo,1228373147319242753,2020-02-14 17:39:15,b'Love is everywhere you look https://t.co/0ODBmhStGF'
NatGeo,1228340382053928961,2020-02-14 15:29:03,"b'Thirty years ago today, NASA\xe2\x80\x99s Voyager 1 captured an iconic and humbling portrait of our world later described by s\xe2\x80\xa6 https://t.co/Dl8i35y1Sp'"
NatGeo,1228331375520079872,2020-02-14 14:53:15,"b'On February 14, 1990, Voyager 1 saw Earth from a distance of nearly four billion miles, capturing a view of our pla\xe2\x80\xa6 https://t.co/JxFxuS5tKK'"
NatGeo,1228321086955282433,2020-02-14 14:12:22,"b'Whether you celebrate Valentine\xe2\x80\x99s Day or not (by choice, fate, or otherwise), brush up on the history of how it cam\xe2\x80\xa6 https://t.co/iHI9UlaL35'"
NatGeo,1228305892422168577,2020-02-14 13:12:00,b'\xe2\x81\xa3\xf0\x9f\x92\x9b\xf0\x9f\x92\x9b\xf0\x9f\x92\x9b\xf0\x9f\x92\x9b\xf0\x9f\x92\x9b\xf0\x9f\x92\x9b\xf0\x9f\x92\x9b\xf0\x9f\x92\x9b\xf0\x9f\x92\x9b\n\xf0\x9f\x92\x9b\xe2\x98\x81\xef\xb8\x8f\xe2\x98\x81\xef\xb8\x8f\xe2\x98\x81\xef\xb8\x8f\xe2\x98\x81\xef\xb8\x8f\xe2\x98\x81\xef\xb8\x8f\xe2\x98\x81\xef\xb8\x8f\xe2\x98\x81\xef\xb8\x8f\xf0\x9f\x92\x9b\n\xf0\x9f\x92\x9b\xe2\x98\x81\xef\xb8\x8f\xe2\x98\x81\xef\xb8\x8f\xe2\x98\x81\xef\xb8\x8f\xe2\x98\x81\xef\xb8\x8f\xe2\x98\x81\xef\xb8\x8f\xe2\x98\x81\xef\xb8\x8f\xe2\x98\x81\xef\xb8\x8f\xf0\x9f\x92\x9b\n\xf0\x9f\x92\x9b\xe2\x98\x81\xef\xb8\x8f\xf0\x9f\x8c\x8e\xf0\x9f\x8c\x8e\xe2\x98\x81\xef\xb8\x8f\xf0\x9f\x8c\x8e\xf0\x9f\x8c\x8e\xe2\x98\x81\xef\xb8\x8f\xf0\x9f\x92\x9b\n\xf0\x9f\x92\x9b\xf0\x9f\x8c\x8e\xf0\x9f\x8c\x8e\xf0\x9f\x8c\x8e\xf0\x9f\x8c\x8e\xf0\x9f\x8c\x8e\xf0\x9f\x8c\x8e\xf0\x9f\x8c\x8e\xf0\x9f\x92\x9b\n\xf0\x9f\x92\x9b\xf0\x9f\x8c\x8e\xf0\x9f\x8c\x8e\xf0\x9f\x8c\x8e\xf0\x9f\x8c\x8e\xf0\x9f\x8c\x8e\xf0\x9f\x8c\x8e\xf0\x9f\x8c\x8e\xf0\x9f\x92\x9b\n\xf0\x9f\x92\x9b\xf0\x9f\x8c\x8e\xf0\x9f\x8c\x8e\xf0\x9f\x8c\x8e\xf0\x9f\x8c\x8e\xf0\x9f\x8c\x8e\xf0\x9f\x8c\x8e\xf0\x9f\x8c\x8e\xf0\x9f\x92\x9b\n\xf0\x9f\x92\x9b\xe2\x98\x81\xef\xb8\x8f\xf0\x9f\x8c\x8e\xf0\x9f\x8c\x8e\xf0\x9f\x8c\x8e\xf0\x9f\x8c\x8e\xf0\x9f\x8c\x8e\xe2\x98\x81\xef\xb8\x8f\xf0\x9f\x92\x9b\n\xf0\x9f\x92\x9b\xe2\x98\x81\xef\xb8\x8f\xe2\x98\x81\xef\xb8\x8f\xf0\x9f\x8c\x8e\xf0\x9f\x8c\x8e\xf0\x9f\x8c\x8e\xe2\x98\x81\xef\xb8\x8f\xe2\x98\x81\xef\xb8\x8f\xf0\x9f\x92\x9b\n\xf0\x9f\x92\x9b\xe2\x80\xa6 https://t.co/j5oap7zw0E'
NatGeo,1228231246867656705,2020-02-14 08:15:23,"b'From bold landscapes to intimate wildlife portraits, explore these visions of our world https://t.co/KLVnEs012w'"
NatGeo,1228184690768531458,2020-02-14 05:10:23,b'Spice up your next dinner party conversation with these bizarre and amazing discoveries https://t.co/w56oRjclck'
NatGeo,1228182076383358977,2020-02-14 05:00:00,b'Our #ValentinesDay gift to you: A kiss from this hawksbill turtle \xf0\x9f\x92\x8c https://t.co/GCpxMIHrzQ'
NatGeo,1228154744197275648,2020-02-14 03:11:23,b'More than a hundred are still missing. Today the survivors are trying to rebuild their lives https://t.co/wtuqwiTzFg'
NatGeo,1228123956181372934,2020-02-14 01:09:03,"b""The little-seen fish's rosy hue is not due to infection or diet, scientists say https://t.co/bGK76mq9cq"""
NatGeo,1228094499529904129,2020-02-13 23:12:00,b'Some animals make devoted partners https://t.co/vfvmwzxFTS'
NatGeo,1228063141491281921,2020-02-13 21:07:23,b'This newfound creature is 10 times more massive than any known cave fish\xe2\x80\x94and may still be evolving to lose its eyes https://t.co/t0xbeQETiI'
NatGeo,1228051579636457474,2020-02-13 20:21:27,"b'Chytrid fungus has wiped out amphibians around the world. Now a new study shows it can drive their predators, like\xe2\x80\xa6 https://t.co/He3Y7QYtp0'"
NatGeo,1228012308762329094,2020-02-13 17:45:24,"b""Scotland's lesser known attractions take you through an entirely new side of the country's food, culture, and views https://t.co/mRo4aPAzjc"""
NatGeo,1227994605725134853,2020-02-13 16:35:03,"b'What they lack in tentacles, they make up for in gooey clouds full of autonomous stingers https://t.co/Oe2snDQjIF'"
NatGeo,1227973217513562117,2020-02-13 15:10:04,b'Roots dangle from the ceiling of a lava tube on the island of Hawaii in this eerie scene by Your Shot photographer\xe2\x80\xa6 https://t.co/Sl7ipdtLA7'
NatGeo,1227960126725853185,2020-02-13 14:18:03,b'The outbreak and the transportation restrictions over the past three weeks have had a chilling effect on manufactur\xe2\x80\xa6 https://t.co/rUxCPJcuQy'
NatGeo,1227949307090915330,2020-02-13 13:35:03,b'Organized international criminal networks that once focused on elephant ivory are increasingly turning to pangolins https://t.co/675ICPi9X9'
NatGeo,1227917851715080200,2020-02-13 11:30:04,b'These tusked animals use their overgrown teeth as multi-purpose tools https://t.co/8kdM1d2GcG'
NatGeo,1227872551747100673,2020-02-13 08:30:03,"b'Famous for his unparalleled powers of speech,\xc2\xa0Cicero defended the values of the Roman Republic\xe2\x80\x94before he was murder\xe2\x80\xa6 https://t.co/aGTY7lZKYi'"
NatGeo,1227827256447373312,2020-02-13 05:30:04,"b'These destinations will leave you with a deeper understanding of the world above, below, and around us https://t.co/v9V6y3RNev'"
NatGeo,1227791096094347264,2020-02-13 03:06:23,b'More than a hundred are still missing. Today the survivors are trying to rebuild their lives https://t.co/vOY7xcJ0sh'
NatGeo,1227766901926957058,2020-02-13 01:30:14,"b'These tarantulas are ready to mate, but will the male survive? https://t.co/9kNCCiNfgx'"
NatGeo,1227699490993340416,2020-02-12 21:02:22,b'This newfound creature is 10 times more massive than any known cave fish\xe2\x80\x94and may still be evolving to lose its eyes https://t.co/ezXIoOXBsW'
