NatGeo,1247173191342133250,2020-04-06 14:43:54,"b'Follow @NGKids and @NatGeoEducation for more tips, resources, and inspiration  https://t.co/CKeBE8EHHS'"
NatGeo,1247173190247419904,2020-04-06 14:43:54,b'Try one of these creative ways to let kids socialize from afar https://t.co/hBYnV6tPHD'
NatGeo,1247173189140205568,2020-04-06 14:43:54,"b'Draw a simple map of your neighborhood, then have your child navigate from one clue to another as they ride a bike.\xe2\x80\xa6 https://t.co/cu3UIMKmKs'"
NatGeo,1247173188116717572,2020-04-06 14:43:54,b'Make a Birdbath: Attract birds to your yard with this simple craft \xf0\x9f\x90\xa6 https://t.co/0vNAqIcK0N'
NatGeo,1247173186963361792,2020-04-06 14:43:53,"b'Pick a place to ""travel"" through books \xf0\x9f\x93\x9ahttps://t.co/cup8tDqSWB'"
NatGeo,1247173185675628545,2020-04-06 14:43:53,b'Dance together! \xf0\x9f\x95\xbaTurn up the volume and have a Party Animals dance party with this mix featuring songs by Parry Gri\xe2\x80\xa6 https://t.co/yKfdmgTscs'
NatGeo,1247173184585170945,2020-04-06 14:43:53,b'Join explorer Edward Hurme during a live Explorer Classroom session Tuesday April 7 at 2pm ET to learn all about ba\xe2\x80\xa6 https://t.co/abpXifR2JV'
NatGeo,1247173183544987649,2020-04-06 14:43:52,"b'Take a virtual tour of the @NatGeoMuseum\'s ""Becoming Jane"" exhibit to celebrate Jane Goodall\'s recent birthday \xf0\x9f\x8e\x82 https://t.co/1gRU8aFXiJ'"
NatGeo,1247173182462853122,2020-04-06 14:43:52,"b'THREAD: Looking for ways your family can explore, learn, and have fun together? Here are 7 things to do at home thi\xe2\x80\xa6 https://t.co/iDJyb2ptGY'"
NatGeo,1247145779283865602,2020-04-06 12:54:59,"b'A tiger at the Bronx Zoo has tested positive for the virus that causes COVID-19, and six other big cats are exhibit\xe2\x80\xa6 https://t.co/WfYoiZkyBm'"
NatGeo,1247137826010992646,2020-04-06 12:23:23,"b'For many of us, the most important intersection of geography and human culture in our lives is where we go to work.\xe2\x80\xa6 https://t.co/Zveqz7Uw51'"
NatGeo,1247137576676470785,2020-04-06 12:22:23,"b'Some families have found themselves suddenly locked down with little space, while others are forced apart https://t.co/FyIwMQMCuQ'"
NatGeo,1247059980232142850,2020-04-06 07:14:03,b'Researchers broke open ancient rocks extracted from more than 330 feet below the seafloor and discovered a communit\xe2\x80\xa6 https://t.co/2nwHTiMtZ2'
NatGeo,1247015020707315713,2020-04-06 04:15:24,"b'For many of us, the most important intersection of geography and human culture in our lives is where we go to work.\xe2\x80\xa6 https://t.co/1i0Z9iui7i'"
NatGeo,1246984234239250432,2020-04-06 02:13:03,b'These natural giants very quickly show us the scale of our natural world https://t.co/QgcgqHVQCK'
NatGeo,1246944568546910213,2020-04-05 23:35:26,b'RT @natashaldaly: BREAKING: A tiger at the Bronx Zoo has tested positive for Covid-19. 6 other tigers and lions at the zoo are also showing\xe2\x80\xa6'
NatGeo,1246938414173302784,2020-04-05 23:10:59,b'A tiger at the Bronx Zoo tested positive for the novel coronavirus\xe2\x80\x94and six other big cats are exhibiting symptoms c\xe2\x80\xa6 https://t.co/CRYN4yQ7zm'
NatGeo,1246927595536625671,2020-04-05 22:28:00,"b""Follow a pair of orphaned clouded leopards as they learn the skills they'll need to survive in the wild https://t.co/WB6nEsBlmj"""
NatGeo,1246868720766652416,2020-04-05 18:34:03,"b'At times, the overall color of a scene can be so different from the way we normally see it. Learn some tips on how\xe2\x80\xa6 https://t.co/Tp2vF6feTu'"
NatGeo,1246846325620117506,2020-04-05 17:05:03,"b'As self-isolation becomes mandatory in more cities in response to the COVID-19 pandemic, rats are becoming bolder i\xe2\x80\xa6 https://t.co/wyAfIdD53E'"
NatGeo,1246833760164864001,2020-04-05 16:15:08,b'A lioness carries one of her cubs in her mouth while the other swims behind in this moment captured by Your Shot ph\xe2\x80\xa6 https://t.co/RLperRM6WX'
NatGeo,1246818242632519681,2020-04-05 15:13:28,"b'""What really matters is cumulative emissions. If it\xe2\x80\x99s short lived, it\xe2\x80\x99s not really touching the tip of the iceberg.\xe2\x80\x9d https://t.co/lYfBGt0axS'"
NatGeo,1246787013677899776,2020-04-05 13:09:22,b'Feral swine\xe2\x80\x94the offspring of wild boars and domestic pigs\xe2\x80\x94are causing havoc across wide swaths of Canada https://t.co/EpjCPwzRBq'
NatGeo,1246772168828030976,2020-04-05 12:10:23,b'The oldest known Homo erectus and Paranthropus robustus fossils shed light on a critical period of hominin evolution https://t.co/rIo2rUq3qz'
NatGeo,1246747004740526081,2020-04-05 10:30:24,"b'\xe2\x80\x9cWomen often see things\xe2\x80\xa6 a man would not notice,\xe2\x80\x9d said National Geographic\xe2\x80\x99s first editor https://t.co/p7sRJhZfJ2'"
NatGeo,1246697087758106625,2020-04-05 07:12:02,"b'Every place marches to its own beat. For musicians on the move, the mantra is: Stop. Listen. And take note. https://t.co/pquAtysR4j'"
NatGeo,1246651372755353603,2020-04-05 04:10:23,"b'Little data exists to ensure the international trade of ball pythons isn\xe2\x80\x99t a risk to animal welfare, human health,\xe2\x80\xa6 https://t.co/SnRgnV76gF'"
NatGeo,1246619158915284992,2020-04-05 02:02:23,"b'The research shows that \xe2\x80\x9cplague is very much a part of the landscape in the western U.S., and wild animals are freq\xe2\x80\xa6 https://t.co/fBvuqbuIOJ'"
NatGeo,1246592650037334017,2020-04-05 00:17:02,"b'Some families have found themselves suddenly locked down with little space, while others are forced apart https://t.co/QpXENEDpJO'"
NatGeo,1246565710819557376,2020-04-04 22:30:00,b'Life in the Antarctic doesn\xe2\x80\x99t come easy for macaroni penguins https://t.co/jGVkKoPyQo'
NatGeo,1246535499239522307,2020-04-04 20:29:57,b'RT @RobertIger: .@NatGeo just launched a new resource to support teachers and parents during this crisis: NatGeo@Home. It\xe2\x80\x99s a one-stop shop\xe2\x80\xa6'
NatGeo,1246530240014364673,2020-04-04 20:09:03,b'Researchers broke open ancient rocks extracted from more than 330 feet below the seafloor and discovered a communit\xe2\x80\xa6 https://t.co/4yQTUB2CHX'
NatGeo,1246512052375629824,2020-04-04 18:56:47,b'@solomilne @Rachael_Bale Support for the Big Cat Public Safety Act\xe2\x80\x94which would restrict ownership of big cats and p\xe2\x80\xa6 https://t.co/wMNj0i2rOc'
NatGeo,1246511764545683460,2020-04-04 18:55:38,"b'@AndreZollars @Rachael_Bale Yes, @CITES is an international treaty that regulates the wildlife trade between countr\xe2\x80\xa6 https://t.co/blbgXL78JU'"
NatGeo,1246499037664206852,2020-04-04 18:05:04,"b'Faced with shortages, people around the world are looking up DIY mask tutorials. Here\xe2\x80\x99s what scientists say you sho\xe2\x80\xa6 https://t.co/iRlkB1IBXS'"
NatGeo,1246471354066534400,2020-04-04 16:15:03,b'Playful red fox kits chase each other on the prairie at sunset in this moment documented by Your Shot photographer\xe2\x80\xa6 https://t.co/4UYz3VqXc1'
NatGeo,1246457846281240576,2020-04-04 15:21:23,b'The second-largest Ebola outbreak in history finally may be winding to a close https://t.co/NnFoZATvbL'
NatGeo,1246438644484911105,2020-04-04 14:05:05,"b'As self-isolation becomes mandatory in more cities in response to the COVID-19 pandemic, rats are becoming bolder i\xe2\x80\xa6 https://t.co/WqkvM0CMTP'"
NatGeo,1246410704040624128,2020-04-04 12:14:03,b'#WorldRatDay Fact: Domestic rats will avoid harming other rats https://t.co/J6GgdT72z0'
NatGeo,1246389142990270464,2020-04-04 10:48:23,"b'For many of us, the most important intersection of geography and human culture in our lives is where we go to work.\xe2\x80\xa6 https://t.co/MkTnQvrKK1'"
NatGeo,1246339235403182082,2020-04-04 07:30:04,"b'In this high-altitude savanna in Ethiopia, villagers and geladas coexist\xe2\x80\x94for now https://t.co/cmwA7gSQQz'"
NatGeo,1246288481606873090,2020-04-04 04:08:23,b'These natural giants very quickly show us the scale of our natural world https://t.co/6cgVJheseG'
NatGeo,1246273804252385285,2020-04-04 03:10:04,"b'For many of us, the most important intersection of geography and human culture in our lives is where we go to work.\xe2\x80\xa6 https://t.co/lLiunTS5f9'"
NatGeo,1246227078044942342,2020-04-04 00:04:23,b'Feral swine\xe2\x80\x94the offspring of wild boars and domestic pigs\xe2\x80\x94are causing havoc across wide swaths of Canada https://t.co/0nd4ebqQQu'
NatGeo,1246199964390260736,2020-04-03 22:16:39,"b'""When we awoke we found the most magical scene outside!"" writes Your Shot photographer Matthew Loesch-Fries, who ca\xe2\x80\xa6 https://t.co/p5jkhFim8i'"
NatGeo,1246169365042601984,2020-04-03 20:15:03,b'The oldest known Homo erectus and Paranthropus robustus fossils shed light on a critical period of hominin evolution https://t.co/qOzLrkPb0T'
NatGeo,1246139158004994048,2020-04-03 18:15:02,b'Got questions about #TigerKing? Nat Geo photographer Steve Winter @swfoto &amp; journalist Sharon Guynup @sguynup have\xe2\x80\xa6 https://t.co/YzsLyzWvbS'
NatGeo,1246136652470390785,2020-04-03 18:05:04,"b'As spring blooms, some of the most famous landmarks in the City of Lights are off-limits https://t.co/XJZWW3M0wO'"
NatGeo,1246120395696201730,2020-04-03 17:00:28,"b'Faced with shortages, people around the world are looking up DIY mask tutorials. Here\xe2\x80\x99s what scientists say you sho\xe2\x80\xa6 https://t.co/QryFFXWkk0'"
NatGeo,1246109051844538368,2020-04-03 16:15:24,"b'The research shows that \xe2\x80\x9cplague is very much a part of the landscape in the western U.S., and wild animals are freq\xe2\x80\xa6 https://t.co/QDGttj2Nsz'"
NatGeo,1246090199022669825,2020-04-03 15:00:29,"b""Without the discovery of Yellowstone's heat-resistant bacteria more than half a century ago, the technique used in\xe2\x80\xa6 https://t.co/soLOQN45SG"""
NatGeo,1246080273739063298,2020-04-03 14:21:02,b'The second-largest Ebola outbreak in history finally may be winding to a close https://t.co/ms2gDbqAdS'
NatGeo,1246058484069736449,2020-04-03 12:54:27,b'RT @NatGeo: The oldest known Homo erectus and Paranthropus robustus fossils shed light on a critical period of hominin evolution https://t.\xe2\x80\xa6'
NatGeo,1246044779269574656,2020-04-03 12:00:00,"b'On April 3, 1934, a legendary primatologist was born and would change the world forever. Happy Birthday Dr. Jane Go\xe2\x80\xa6 https://t.co/FGKFYOrRQy'"
NatGeo,1246024154656190465,2020-04-03 10:38:03,b'See the latest data and understand where the disease is spreading around the world through maps https://t.co/IkK3i6R1tv'
NatGeo,1245976848280018949,2020-04-03 07:30:04,b'People can perhaps point to the time before and after the pandemic fundamentally changed their lives. Many of our s\xe2\x80\xa6 https://t.co/FG3g9Z1rgm'
NatGeo,1245926010278653954,2020-04-03 04:08:03,"b'These \xe2\x80\x9cunicorns of the sea\xe2\x80\x9d seem to be everywhere: on T-shirts, mugs, and more. But in their native Arctic waters,\xe2\x80\xa6 https://t.co/9qLLjHRex4'"
NatGeo,1245897575003275267,2020-04-03 02:15:04,"b'Little data exists to ensure the international trade of ball pythons isn\xe2\x80\x99t a risk to animal welfare, human health,\xe2\x80\xa6 https://t.co/Ys32RluEcd'"
NatGeo,1245872405555314688,2020-04-03 00:35:03,b'Humans have employed a variety of other methods for bathroom visits over the ages https://t.co/c2HR10eV1K'
NatGeo,1245828370933284866,2020-04-02 21:40:04,"b'At this retreat in Russia, adults with autism get a chance to nurture creativity and independence\xe2\x80\xa6 https://t.co/Qymg9f780O'"
NatGeo,1245815360827338761,2020-04-02 20:48:22,"b'@oulosP Thank you for bringing this to our attention. @natgeo and @insidenatgeo are devoted to science, exploration\xe2\x80\xa6 https://t.co/87CYyBbcz7'"
NatGeo,1245805721620549632,2020-04-02 20:10:04,b'A fossilized jawbone and 16 bone fragments represent the first partial skeleton assembled for a juvenile Homo naledi https://t.co/KHxpyr861v'
NatGeo,1245798251850326021,2020-04-02 19:40:23,b'The oldest known Homo erectus and Paranthropus robustus fossils shed light on a critical period of hominin evolution https://t.co/Z5qIkYBmSd'
NatGeo,1245785890896719877,2020-04-02 18:51:16,"b""Thanks for following along and for reading, I'll be around to answer questions more if anyone has them! \xe2\x80\x93@Rachael_Bale"""
NatGeo,1245782034141806598,2020-04-02 18:35:57,"b""'Tiger King' is mainly about the human story. But the tiger story is perhaps even more chilling. These are some of\xe2\x80\xa6 https://t.co/Qumk5uMsZx"""
NatGeo,1245780626248273921,2020-04-02 18:30:21,"b""@CutaNysa They wouldn't be able to fend for themselves since they've never lived in the wild before. Also: https://t.co/bUMnFpq8w0"""
NatGeo,1245779580771844098,2020-04-02 18:26:12,"b'Tigers are also individual living creatures. As many as 10,000 live in captivity in the U.S., many in inappropriate conditions.'"
NatGeo,1245779579584892936,2020-04-02 18:26:11,"b'Tigers are endangered. There are only ~3,900 left in the wild. https://t.co/0W1vlAYa0G'"
NatGeo,1245779578683101185,2020-04-02 18:26:11,b'Two separate things I always ask people to keep in mind when thinking about wild animals:\n\n1. Conservation  \n2. Welfare'
NatGeo,1245776372343230466,2020-04-02 18:13:27,"b""@miles2025 @Rachael_Bale We've got a really in-depth story on that exact topic. Tigers, elephants, monkeys, bears a\xe2\x80\xa6 https://t.co/yXUnw48fYc"""
NatGeo,1245774346985123840,2020-04-02 18:05:24,"b'There are several tiger subspecies, each adapted to its specific habitat. But because most captive tigers are ""gene\xe2\x80\xa6 https://t.co/ZCND1sYts6'"
NatGeo,1245774346024620032,2020-04-02 18:05:24,"b'All of this captive-breeding of privately owned tigers in the U.S. is not considered useful for conservation, scientists say.'"
NatGeo,1245773349969629184,2020-04-02 18:01:26,b'@BrazenBackpack @Rachael_Bale That way breeding is coordinated to ensure genetic diversity within a population https://t.co/6KiTarSYDQ'
NatGeo,1245773326993276929,2020-04-02 18:01:21,b'@BrazenBackpack @Rachael_Bale The best zoos in the U.S. breed in accordance with the Species Survival Plan of that\xe2\x80\xa6 https://t.co/8gcp11SE4r'
NatGeo,1245773003851513860,2020-04-02 18:00:04,"b'Elsewhere, tigers are bred in captivity to be slaughtered for the illegal trade in their skins, bones, teeth, and c\xe2\x80\xa6 https://t.co/HcNns0AKyk'"
NatGeo,1245769376944533507,2020-04-02 17:45:39,"b""Joe Exotic isn't just in prison for plotting to have someone killed. He was also convicted on charges related to ki\xe2\x80\xa6 https://t.co/umh3mabRuX"""
NatGeo,1245766797728628736,2020-04-02 17:35:24,"b""You may have noticed all the white tigers in the show. DYK the white tiger is not a separate species? It's just a t\xe2\x80\xa6 https://t.co/h42Dd8J9Fo"""
NatGeo,1245765554377560064,2020-04-02 17:30:28,b'@BioTechDirt @Rachael_Bale This provides some tips to help guide you. https://t.co/5afPLgQBn3'
NatGeo,1245765524522483713,2020-04-02 17:30:20,b'@BioTechDirt @Rachael_Bale The most important thing is to do your research before you go spend money to see tigers.\xe2\x80\xa6 https://t.co/4DsU5cNg4S'
NatGeo,1245765308822020097,2020-04-02 17:29:29,"b'@Zarl95 Many captive tigers are also a mix of subspecies, and because each is adapted for a specific environment, i\xe2\x80\xa6 https://t.co/baVhd8tE0X'"
NatGeo,1245765266652479488,2020-04-02 17:29:19,"b""@Zarl95 Unfortunately, no. They wouldn't be able to fend for themselves since they've never lived in the wild before."""
NatGeo,1245764763977691137,2020-04-02 17:27:19,"b""@daisyrothschild We have just what you're looking for! https://t.co/QwoFzOsPO0"""
NatGeo,1245764524562579457,2020-04-02 17:26:22,"b'@shashankkhemani @Rachael_Bale Yes, white tigers have been intensively bred in the U.S. and therefore some have hea\xe2\x80\xa6 https://t.co/tsIloQK0Te'"
NatGeo,1245764212070154247,2020-04-02 17:25:07,"b""There's a wide range of zoos, too, from shabby roadside menageries to state-of-the-art parks like the San Diego Zoo\xe2\x80\xa6 https://t.co/r2GfBA8uow"""
NatGeo,1245764108940644355,2020-04-02 17:24:43,"b""@ParrisBueller @Rachael_Bale It's not just about the price\xe2\x80\x94it's the patchwork of laws in the U.S. too. Some states\xe2\x80\xa6 https://t.co/WwiTyfdtnq"""
NatGeo,1245763547063300096,2020-04-02 17:22:29,"b'@silye0n @Rachael_Bale The recurring cost of food can add up\xe2\x80\x94tigers eat a lot. Plus vitamins/minerals, veterinary c\xe2\x80\xa6 https://t.co/a8826rTRfu'"
NatGeo,1245763249804578829,2020-04-02 17:21:18,b'@silye0n @Rachael_Bale This story is related and may interest you\xe2\x80\x94climate change is pushing more people into the ma\xe2\x80\xa6 https://t.co/JK3MLQXUtG'
NatGeo,1245762700782833664,2020-04-02 17:19:07,"b""@silye0n @Rachael_Bale Climate change is a real threat. In India and Bangladesh, Bengal live in the world's largest\xe2\x80\xa6 https://t.co/oVktHZrnjr"""
NatGeo,1245760504221532161,2020-04-02 17:10:23,"b'Pseudo-sanctuaries abound, as @natashadaly and @kirstenluce found in their investigation of wildlife tourism around\xe2\x80\xa6 https://t.co/iItcYU3Cdq'"
NatGeo,1245760503105937409,2020-04-02 17:10:23,"b""One question I've gotten a lot is: What's the difference between Joe Exotic's zoo and Big Cat Rescue? A real sanctu\xe2\x80\xa6 https://t.co/C6vYOxSzIk"""
NatGeo,1245760298646220803,2020-04-02 17:09:34,"b""Cubs can only interact with visitors from eight weeks old to 12 weeks, the law says. What's next? A life of breedin\xe2\x80\xa6 https://t.co/tA7Q1WelRl"""
NatGeo,1245754419532255235,2020-04-02 16:46:13,"b""Places like Joe Exotic's make their money by offering cub-petting. Who wouldn't want to play with a baby tiger? But\xe2\x80\xa6 https://t.co/d077mZJsxg"""
NatGeo,1245751788394946560,2020-04-02 16:35:45,"b'There are more tigers in captivity in the U.S. than there are left in the wild. Most are privately owned, in roadsi\xe2\x80\xa6 https://t.co/Opoj2nYVrS'"
NatGeo,1245751786465562627,2020-04-02 16:35:45,"b""Hi, I'm @rachael_bale, executive editor of Nat Geo's animals desk. I'm taking over @natgeo to answer your questions\xe2\x80\xa6 https://t.co/rkaoF0uc8H"""
NatGeo,1245747601946873856,2020-04-02 16:19:07,"b'@McSnewsie While we are an organization that is over 130 years old, the media industry is always changing. Your sup\xe2\x80\xa6 https://t.co/RTUFy9vHcV'"
NatGeo,1245745024329035776,2020-04-02 16:08:53,b'Researchers broke open ancient rocks extracted from more than 330 feet below the seafloor and discovered a communit\xe2\x80\xa6 https://t.co/lHqwM6MUXv'
NatGeo,1245707760181837830,2020-04-02 13:40:48,"b'""We hope this coverage helps illuminate a complex issue and the lives of people it affects,"" writes editor\xe2\x80\xa6 https://t.co/u4DREG4pJn'"
NatGeo,1245707524197748736,2020-04-02 13:39:52,"b'Since autism was first identified in the 1940s, researchers have struggled to explain it, but there has been progre\xe2\x80\xa6 https://t.co/xP57KqudMH'"
NatGeo,1245705149038936064,2020-04-02 13:30:26,"b'The range of disability\xe2\x80\x94and ability\xe2\x80\x94of those with autism is huge. But finding work, love, and independence can be e\xe2\x80\xa6 https://t.co/BsqzjZDolM'"
NatGeo,1245704289995063296,2020-04-02 13:27:01,"b'Because the number of people with autism is growing, we asked a writer and photographer to shine a light on this li\xe2\x80\xa6 https://t.co/aLDeSHxoOj'"
NatGeo,1245701362354212864,2020-04-02 13:15:23,"b'If new planned border fences are put up through the region, critical animal migration corridors would be cut off fo\xe2\x80\xa6 https://t.co/eFqi9o1o9b'"
NatGeo,1245684502589915136,2020-04-02 12:08:23,b'Many animals have an ability to process and represent numbers\xe2\x80\x94arguably a form of counting https://t.co/9jsyWYsNom'
NatGeo,1245655478446600193,2020-04-02 10:13:03,b'The ancient ruler of the sea may have gone extinct earlier than we thought\xe2\x80\x94and the rise of its smaller but fierce r\xe2\x80\xa6 https://t.co/BTzvVEk7Of'
NatGeo,1245611942967820289,2020-04-02 07:20:04,b'What happens when you leave a camera running in the forest for a year? https://t.co/a21GGzaAck'
NatGeo,1245565215070138368,2020-04-02 04:14:23,b'A decade-long forensic investigation is illuminating a chapter of World War II in the Channel Islands that many wou\xe2\x80\xa6 https://t.co/tm2viaLadl'
NatGeo,1245531411953655816,2020-04-02 02:00:04,"b""Whether or not you've watched Tiger King, there are important things to know about animal welfare and issues surrou\xe2\x80\xa6 https://t.co/Fo0ub0g4De"""
NatGeo,1245504971581403137,2020-04-02 00:15:00,b'Humans and chimpanzees share 98% of their DNA\xe2\x80\x94see what else we have in common https://t.co/1OKwC2at4c'
NatGeo,1245471763418488833,2020-04-01 22:03:02,"b'These \xe2\x80\x9cunicorns of the sea\xe2\x80\x9d seem to be everywhere: on T-shirts, mugs, and more. But in their native Arctic waters,\xe2\x80\xa6 https://t.co/2N2AVOoECa'"
NatGeo,1245452630949793792,2020-04-01 20:47:01,"b""Last April Fools' photo caption challenge for the day! RT with your best one-liner and we'll share our favorites. T\xe2\x80\xa6 https://t.co/YadxDlT7Mk"""
NatGeo,1245429491725459458,2020-04-01 19:15:04,"b""Without the discovery of Yellowstone's heat-resistant bacteria more than half a century ago, the technique used in\xe2\x80\xa6 https://t.co/um7A25aRUa"""
NatGeo,1245421940665450497,2020-04-01 18:45:04,b'A fossilized jawbone and 16 bone fragments represent the first partial skeleton assembled for a juvenile Homo naledi https://t.co/2aMIA69mfU'
NatGeo,1245404459347456010,2020-04-01 17:35:36,"b""Help us caption this photo in honor of April Fools' day! RT with your best one-liner and we'll share our favorites https://t.co/AGwil54J09"""
NatGeo,1245389469810929664,2020-04-01 16:36:02,"b""RT @notbroadway27: Comin' out of my nest and I've been doin' just fine https://t.co/nyal08PDe7"""
NatGeo,1245375092990922752,2020-04-01 15:38:54,"b""Everyone could still use a laugh, right? This April Fools' Day, RT this with your funniest photo caption and we'll\xe2\x80\xa6 https://t.co/aWyQ11C6kY"""
NatGeo,1245359025946087442,2020-04-01 14:35:04,"b'As spring blooms, some of the most famous landmarks in the City of Lights are off-limits https://t.co/8o1jZk5LFG'"
NatGeo,1245344126960308229,2020-04-01 13:35:51,"b""No April Fools' day jokes this year, but we do want to see your best comedic photo captions! RT with your funniest\xe2\x80\xa6 https://t.co/JjxBtozuBX"""
NatGeo,1245327570524143617,2020-04-01 12:30:04,b'Humans have employed a variety of other methods for bathroom visits over the ages https://t.co/tGuN5otJ0U'
NatGeo,1245297371392737286,2020-04-01 10:30:04,"b'Little data exists to ensure the international trade of ball pythons isn\xe2\x80\x99t a risk to animal welfare, human health,\xe2\x80\xa6 https://t.co/cZ2TBQ4EVy'"
NatGeo,1245246781929271298,2020-04-01 07:09:03,"b'Male bottlenose dolphins call each other by name and touch frequently to reinforce friendships, which can last a li\xe2\x80\xa6 https://t.co/l6AhuiIpYI'"
NatGeo,1245200059622477824,2020-04-01 04:03:23,b'See the latest data and understand where the disease is spreading around the world through maps https://t.co/e4hrrIQN67'
NatGeo,1245172882071785477,2020-04-01 02:15:23,"b'The collective response to the coronavirus pandemic, from panic buying at grocery stores to restaurant closures, is\xe2\x80\xa6 https://t.co/21ausf9YJj'"
NatGeo,1245142080252346369,2020-04-01 00:13:00,"b""Take a virtual trip to Yellowstone and immerse yourself in this park's epic beauty https://t.co/2rvTDHqKNn"""
NatGeo,1245111778356461569,2020-03-31 22:12:35,"b'If new planned border fences are put up through the region, critical animal migration corridors would be cut off fo\xe2\x80\xa6 https://t.co/khFfdcciyT'"
NatGeo,1245102860188205063,2020-03-31 21:37:09,b'Thanks for joining us this #WomensHistoryMonth as we shared stories about female explorers who changed the world. S\xe2\x80\xa6 https://t.co/gKW6WrIuFf'
NatGeo,1245079181337284609,2020-03-31 20:03:03,b'Many animals have an ability to process and represent numbers\xe2\x80\x94arguably a form of counting https://t.co/DOUmjf6u1a'
NatGeo,1245050827930308610,2020-03-31 18:10:23,b'The first Olympic winners became celebrities with social and political heft\xe2\x80\x94and even the power to heal https://t.co/SDefTjTdv2'
NatGeo,1245034969937960960,2020-03-31 17:07:23,"b""Without the discovery of Yellowstone's heat-resistant bacteria more than half a century ago, the technique used in\xe2\x80\xa6 https://t.co/wTPrJxELwZ"""
NatGeo,1245021805603106817,2020-03-31 16:15:04,b'A young burrowing owl prepares to take flight from its perch on a mullein plant in this impeccably timed capture by\xe2\x80\xa6 https://t.co/2uCwS8G4JL'
NatGeo,1245012739816394753,2020-03-31 15:39:03,b'A decade-long forensic investigation is illuminating a chapter of World War II in the Channel Islands that many wou\xe2\x80\xa6 https://t.co/b7ITzA7LLd'
NatGeo,1244990271064100864,2020-03-31 14:09:46,"b'In the face of challenges to the supply chain, what can be done? At home, cooks need to learn how to maintain every\xe2\x80\xa6 https://t.co/h1ZODABJuk'"
NatGeo,1244989606782697474,2020-03-31 14:07:07,b'Thanks for joining us this #WomensHistoryMonth as we shared stories about female explorers\xe2\x80\x94both historic and modern\xe2\x80\xa6 https://t.co/zg7Gw597je'
NatGeo,1244974546102505473,2020-03-31 13:07:16,b'Years of underfunding and a crucial laboratory mistake led to weeks of delay\xe2\x80\x94and the virus\xe2\x80\x99s undetected spread https://t.co/IOaYl5kwkp'
NatGeo,1244957647255855105,2020-03-31 12:00:07,b'Vows of silence and humanist beliefs led European clerics to create new communication methods for the deaf 500 year\xe2\x80\xa6 https://t.co/cEo9SfiZmn'
