NatGeoTravel,1280547238473871360,2020-07-07 17:00:27,b'But don\xe2\x80\x99t pack your bags without considering ethical and safety questions about whether you should go at all. https://t.co/HANkHSfAr6'
NatGeoTravel,1193725061531873280,2019-11-11 03:00:07,"b""Hurtling over cliffs, forging canyons, and sometimes creating their own clouds, waterfalls' relentless course resha\xe2\x80\xa6 https://t.co/xSOecwggyn"""
NatGeoTravel,1193679794828910592,2019-11-11 00:00:15,"b'""Taking this picture was not easy,"" writes #YourShot photographer Mauro Cirigliano, who battled continuous gusts of\xe2\x80\xa6 https://t.co/D6siQuJ0Xj'"
NatGeoTravel,1193634570370981890,2019-11-10 21:00:32,b'Discover boundless Arctic adventures in this set of images of the world\xe2\x80\x99s largest island by photographer Keith Ladz\xe2\x80\xa6 https://t.co/WwRSVaIV1t'
NatGeoTravel,1193589277021687810,2019-11-10 18:00:34,b'Take a trip to one of these destinations offering a bit of an extraterrestrial vibe. https://t.co/QphBNx9Rr3'
NatGeoTravel,1193543837110566912,2019-11-10 15:00:00,"b""If Earth didn't have oxygen, life as we know it would be impossible. But in Dallol, Ethiopia, some organisms have f\xe2\x80\xa6 https://t.co/gZuceR8gBF"""
NatGeoTravel,1193498659117240320,2019-11-10 12:00:29,"b'Some of us just can\xe2\x80\x99t help seeing a peak without wondering what might be visible from its summit, and we\xe2\x80\x99re not sur\xe2\x80\xa6 https://t.co/8WEqXf1CuL'"
NatGeoTravel,1193362753492312065,2019-11-10 03:00:26,b'These awe-inspiring landscapes become all the more impressive alit by the stars above. https://t.co/sDfcLOn0PR'
NatGeoTravel,1193317378429464576,2019-11-10 00:00:08,"b'A pair of surfers enjoy a sunset session off the coast of Santa Barbara, California in this joyful image captured b\xe2\x80\xa6 https://t.co/YoyCygOyOn'"
NatGeoTravel,1193272088221626368,2019-11-09 21:00:10,b'Fall in love with the natural beauty of Scotland with these incredible scenes. https://t.co/2EzmcCzfjI'
NatGeoTravel,1193226815894106115,2019-11-09 18:00:16,"b'For nearly 30 years, Berlin was divided not just by ideology, but by a concrete barrier that snaked through the cit\xe2\x80\xa6 https://t.co/fVqe4cr75J'"
NatGeoTravel,1193181524402823171,2019-11-09 15:00:18,b'There\xe2\x80\x99s a savvy secret for escaping into nature while avoiding the typical national park crowds\xe2\x80\x94visiting former nat\xe2\x80\xa6 https://t.co/i8Fg3aqaFw'
NatGeoTravel,1193136182772846592,2019-11-09 12:00:08,b'Discover what the fascinating German capital offers to today\xe2\x80\x99s travelers\xe2\x80\x94including where to learn the history of Be\xe2\x80\xa6 https://t.co/6YUwgc3BWu'
NatGeoTravel,1193000365035311105,2019-11-09 03:00:26,b'If you love beer as much as you love castles\xe2\x80\x94and we know you love castles\xe2\x80\x94this trip will be a dream come true. https://t.co/sc7SYXF0cd'
NatGeoTravel,1192954994762366978,2019-11-09 00:00:09,"b""Dusk descends on New Zealand's Tasman Lake in this stunning scene captured by #YourShot photographer Geoff Piper. https://t.co/ZL7ILvstdf"""
NatGeoTravel,1192909737001701376,2019-11-08 21:00:19,"b'Since 2003 Rwanda\xe2\x80\x99s Constitution has required women hold 30 percent of elected positions. Today, with 49 women in p\xe2\x80\xa6 https://t.co/MxC9qL1JZO'"
NatGeoTravel,1192873505282560002,2019-11-08 18:36:20,"b""Embark on a 750-mile journey through some of the American West's last untamed wilderness in Into The Grand Canyon,\xe2\x80\xa6 https://t.co/RPC3KwlFXj"""
NatGeoTravel,1192826733357129729,2019-11-08 15:30:29,"b'Known as a transit of Mercury, this is the last time humans will see this daytime sky show until 2032. https://t.co/gp9uBQUiJr'"
NatGeoTravel,1192773896472281088,2019-11-08 12:00:32,"b""From Reykjav\xc3\xadk to the Louvre, some popular travel destinations are becoming a bit too cramped\xe2\x80\x94so what's a travel lo\xe2\x80\xa6 https://t.co/sxuHMEt5bW"""
NatGeoTravel,1192637900405510144,2019-11-08 03:00:08,b'Up your odds of catching this dancing light show with these tips. https://t.co/TNdrvFUXLA'
NatGeoTravel,1192592620670930944,2019-11-08 00:00:12,b'Moonlight illuminates an overhanging waterfall in this dream-like scene captured by #YourShot photographer Helgi Si\xe2\x80\xa6 https://t.co/Dvl98kO15W'
NatGeoTravel,1192547415653572609,2019-11-07 21:00:35,b'Turn your gaze above for these spectacular works of art. https://t.co/dzPbHYnLIq'
NatGeoTravel,1192502147570716674,2019-11-07 18:00:42,"b'Some personal, others public\xe2\x80\x94some sacred, others profane\xe2\x80\x94traditions abound in cultures everywhere you can possibly\xe2\x80\xa6 https://t.co/Yv8Y5pNFqx'"
NatGeoTravel,1192464348700131330,2019-11-07 15:30:30,"b""Step away from the Nordic nation's trendy streets, and you'll find snowy mountains, icy shorelines, and winding roa\xe2\x80\xa6 https://t.co/qtNFjPTS0o"""
NatGeoTravel,1192411415103070208,2019-11-07 12:00:09,"b""Whether you're dropping in before heading out on the Ring Road, or staying awhile to appreciate its own unique cult\xe2\x80\xa6 https://t.co/EdETR6AgT7"""
NatGeoTravel,1192275514003722240,2019-11-07 03:00:08,"b'Despite immense popularity, Iceland retains its mystique as a place where natural wonders inspire photogenic journe\xe2\x80\xa6 https://t.co/iYuZPRgu3D'"
NatGeoTravel,1192230230024499201,2019-11-07 00:00:12,"b'""Last year I saw this beautiful waterfall from the ground and wanted to come back to take some aerials,"" writes\xe2\x80\xa6 https://t.co/r6oi8pCeCM'"
NatGeoTravel,1192215220422352896,2019-11-06 23:00:33,"b'From riding a camel in the Sahara to soaring high in a hot-air balloon, explore are a few of our favorite wheelchai\xe2\x80\xa6 https://t.co/6qr4prB5I9'"
NatGeoTravel,1192144126252322818,2019-11-06 18:18:03,"b'The treatment of women in public has been a frustration for generations, but after a horrifying assault in 2012, wo\xe2\x80\xa6 https://t.co/UJnfca2Dy7'"
NatGeoTravel,1192094490359676933,2019-11-06 15:00:49,b'Rediscover the night sky at these spectacular dark-sky destinations around the globe. https://t.co/6yn2vvEfH2'
NatGeoTravel,1192049038956388352,2019-11-06 12:00:12,"b'Whether it\xe2\x80\x99s lights of a bustling city or stars above a remote landscape, there are always new sights to explore. https://t.co/xW90Ws2T4G'"
NatGeoTravel,1191913133209731074,2019-11-06 03:00:10,"b""For those of us who love camping, and also a good night's rest. https://t.co/5Jcxxrjo1x"""
NatGeoTravel,1191867855970734082,2019-11-06 00:00:15,"b'""The Eisbachwelle is one of Munich\xe2\x80\x99s top attractions &amp; the best place to river surf in the city,"" writes #YourShot\xe2\x80\xa6 https://t.co/2idwnX8xAy'"
NatGeoTravel,1191843131458826240,2019-11-05 22:22:00,b'Attention book worms! \xf0\x9f\x8d\x8e\xf0\x9f\x90\x9b\xf0\x9f\xa4\x93 https://t.co/DVOiZC788K'
NatGeoTravel,1191825535976038400,2019-11-05 21:12:05,"b""The Yucat\xc3\xa1n\xe2\x80\x99s best-kept secret, Mexico's Isla Holbox is lush with wild mangroves and pristine beaches waiting to be\xe2\x80\xa6 https://t.co/wfXuoc9UJp"""
NatGeoTravel,1191779820272857095,2019-11-05 18:10:26,"b""From smoky underground taverns to centuries-old pubs, there's no shortage of good bars in this European city https://t.co/jENpETFYF5"""
NatGeoTravel,1191732310372233226,2019-11-05 15:01:38,b'Enjoy wonder and beauty a bit off the beaten path. https://t.co/FdxmCvetUF'
NatGeoTravel,1191686649866006533,2019-11-05 12:00:12,"b""Outside of this city's bustling markets and ornate mosques, a journey into the wild expanses of turquoise alpine la\xe2\x80\xa6 https://t.co/fPoSP6pAiP"""
NatGeoTravel,1191562632525991936,2019-11-05 03:47:24,"b'From the precipitous peaks of the Karakoram range to the vibrant Indus River plain, Pakistan is home to a diversity\xe2\x80\xa6 https://t.co/BfN9K3Qcxo'"
NatGeoTravel,1191505481493340160,2019-11-05 00:00:18,"b'""Archery is one of the three national sports in Mongolia,"" writes Your Shot photographer Alessandra Manzotti, who c\xe2\x80\xa6 https://t.co/nHOhjEvbvI'"
NatGeoTravel,1191460287351840769,2019-11-04 21:00:43,b'The Czech capital was once a magnet for scientists who studied the stars\xe2\x80\x94and clues to its cosmic side are scattered\xe2\x80\xa6 https://t.co/qXJgANqavz'
NatGeoTravel,1191414927111659520,2019-11-04 18:00:28,"b'Often considered to be Japan\xe2\x80\x99s last frontier, the untouched wilderness of Hokkaido is chock-full of adventures for\xe2\x80\xa6 https://t.co/aZ1nyBdg7M'"
NatGeoTravel,1191373057019056130,2019-11-04 15:14:06,"b""Grab a Rail Pass and avoid the crowds while taking in the can't-miss sights of the Land of the Rising Sun. https://t.co/WnQJzjqDHY"""
NatGeoTravel,1191324357542449156,2019-11-04 12:00:35,"b""Many of these parks aren't as popular, but they're just as beautiful as the most famous ones out there. https://t.co/mvhbYLm4ro"""
NatGeoTravel,1191197228737675264,2019-11-04 03:35:25,"b'Of the many reasons to book a trip to Europe, touring its magnificent cathedrals is near the top of the list. https://t.co/GidQdXXl94'"
NatGeoTravel,1191143078826053634,2019-11-04 00:00:15,"b'""I was captivated by this village church out in the middle of nowhere,"" writes #YourShot photographer Lorio Dove. ""\xe2\x80\xa6 https://t.co/5rVIIelfhV'"
NatGeoTravel,1191099329966223363,2019-11-03 21:06:24,"b""From New Zealand's South Island to tropical rain forests in South America, these destinations will have you feeling\xe2\x80\xa6 https://t.co/Y8QzxEsIVp"""
NatGeoTravel,1191052485810634752,2019-11-03 18:00:15,"b'There are a lot of places to drink in Amsterdam, so it helps to know where to start. https://t.co/F50WsbFQF2'"
NatGeoTravel,1191007215529930752,2019-11-03 15:00:22,b'Settle back in time on a trip to this delightfully serene village. https://t.co/C9OdvT6Zmc'
NatGeoTravel,1190961871123369987,2019-11-03 12:00:11,"b'In the Netherlands\xe2\x80\x99 South Holland province, these quaint, meticulously preserved 18th-century windmills stand guard\xe2\x80\xa6 https://t.co/dROP8lp502'"
NatGeoTravel,1190810865504858114,2019-11-03 02:00:09,"b""Whether you're looking to relax under the sun or explore underwater, find your perfect seaside destination. https://t.co/1LGjKFPHqJ"""
NatGeoTravel,1190765576488181760,2019-11-02 23:00:11,"b'""Two weeks out of every year during the winter solstice the sun sets directly behind this sea stack,"" writes Your S\xe2\x80\xa6 https://t.co/lQEb2XvRLm'"
NatGeoTravel,1190720371294658562,2019-11-02 20:00:33,b'These cozy homes often still serve as guesthouses and farmsteads\xe2\x80\x94perfect to visit on a journey through the gorgeous\xe2\x80\xa6 https://t.co/oRIE0Sa5Zt'
NatGeoTravel,1190675200825864193,2019-11-02 17:01:04,b'Skip the crowds in the City of Canals for the surprises of these destinations.https://t.co/xTQqtC5BwY'
NatGeoTravel,1190629941655851010,2019-11-02 14:01:13,"b'Since attaining national park status, Indiana Dunes has experienced a surge in visitors\xe2\x80\x94with overall visitorship ex\xe2\x80\xa6 https://t.co/O10frPdrkG'"
NatGeoTravel,1190584393754169346,2019-11-02 11:00:14,b'More than 11 million visitors last year experienced the park at the number one spot\xe2\x80\x94is your favorite on the list? https://t.co/LV2iLmZu6n'
NatGeoTravel,1190448482043252737,2019-11-02 02:00:10,b'Why choose one destination when you can see both? https://t.co/zQr8It9UbP'
NatGeoTravel,1190403189218119681,2019-11-01 23:00:11,"b'Mist rises off the water at sunrise on Forked Lake in the Adirondacks, captured here by #YourShot photographer Dani\xe2\x80\xa6 https://t.co/wD5FFYDZVx'"
NatGeoTravel,1190365911578038273,2019-11-01 20:32:03,"b'The Basque community of Idaho is one of exceptional warmth, inclusivity, and cheer\xe2\x80\x94and every October, at the Traili\xe2\x80\xa6 https://t.co/i8KSmQKkpz'"
NatGeoTravel,1190318181828775936,2019-11-01 17:22:24,"b""Blissfully short on people, Sun Valley's wild expanses are a mecca for mountain bikers. https://t.co/nukRwCNgC1"""
NatGeoTravel,1190267364451012609,2019-11-01 14:00:28,b'Take a journey through stunning Iceland and the quirky characters\xe2\x80\x94from trolls to fairies\xe2\x80\x94that color its landscapes. https://t.co/GyGHI4p8r8'
NatGeoTravel,1190222006907740160,2019-11-01 11:00:14,"b'Whether or not you believe in Scotland\xe2\x80\x99s fabled animal, these historic sites might just get you feeling the magic. https://t.co/6xRusWGJ8a'"
NatGeoTravel,1190086164939726848,2019-11-01 02:00:27,"b'As long as humans keep nudging the edge of the known world, we will be haunted by the monsters we create. https://t.co/wHL7damDBy'"
NatGeoTravel,1190040810441650178,2019-10-31 23:00:13,b'A reputation for the supernatural or uncanny can often attract a devoted following of curious adventure-seekers. https://t.co/ZAniClxro9'
NatGeoTravel,1189995457616891904,2019-10-31 20:00:00,"b'During Day of the Dead, the people of Santiago Sacatep\xc3\xa9quez and Sumpango, Guatemala celebrate life through the trad\xe2\x80\xa6 https://t.co/WPYeobBLsE'"
NatGeoTravel,1189950291401162753,2019-10-31 17:00:32,"b""Wherever it's celebrated, D\xc3\xada de los Muertos reminds the living that our ties to the dead are ever-present. https://t.co/4lRoS097zV"""
NatGeoTravel,1189859614587785216,2019-10-31 11:00:13,"b""Everest claims much of the world's attention\xe2\x80\x94and controversy\xe2\x80\x94but these epic climbs around the world are equally cha\xe2\x80\xa6 https://t.co/DdU3obBdfu"""
NatGeoTravel,1189734335009755136,2019-10-31 02:42:24,"b'New Zealand is sometimes called the ""adventure capital of the world""\xe2\x80\x94and for good reason. https://t.co/HB8mmafHpY'"
NatGeoTravel,1189678429576290304,2019-10-30 23:00:15,"b'""The first thing I did when I arrived was backpack the stunning Milford Track,"" writes #YourShot photographer Mikae\xe2\x80\xa6 https://t.co/RSkguo9qEu'"
NatGeoTravel,1189642419870031877,2019-10-30 20:37:10,"b""Despite being accessible only on foot, this fairytale Austrian village saw over a million visitors last year. Here'\xe2\x80\xa6 https://t.co/Psvnza7Bai"""
NatGeoTravel,1189587892324225030,2019-10-30 17:00:29,"b'All Diwali festivals are linked in a common symbolism: the victory of light over darkness, knowledge over ignorance\xe2\x80\xa6 https://t.co/7uimIhEVzv'"
NatGeoTravel,1189545084225761281,2019-10-30 14:10:23,"b'From its bustling capital in Tbilisi to the quiet wilderness of the mountains, there is much to uncover in this div\xe2\x80\xa6 https://t.co/OH8mVmt3bb'"
NatGeoTravel,1189361301769871361,2019-10-30 02:00:06,"b""Canada's first national park boasts some of the world's finest unspoiled wilderness. https://t.co/wQnSy6K3Yo"""
NatGeoTravel,1189316021129273344,2019-10-29 23:00:10,"b""A moose pauses at a riverbank as evening descends on Canada's Banff National Park in this inspiring scene captured\xe2\x80\xa6 https://t.co/seuWQ4pOjn"""
NatGeoTravel,1189270742170509312,2019-10-29 20:00:15,b'Rediscover the night sky at these spectacular dark-sky destinations around the globe. https://t.co/KTiFDj4zAp'
NatGeoTravel,1189248145420705794,2019-10-29 18:30:27,"b'In India\'s \xe2\x80\x9cabode of the clouds,"" the interwoven roots of living rubber trees have offered safe-passage to traveler\xe2\x80\xa6 https://t.co/HWXQMKXz0e'"
NatGeoTravel,1189225556971327490,2019-10-29 17:00:42,"b'Travelers have journeyed to Slovenia for generations to drink, bathe, and swim in its rejuvenating waters.\xe2\x80\xa6 https://t.co/IShTDj7Fmz'"
NatGeoTravel,1189188989699231746,2019-10-29 14:35:23,"b""Fireworks in London, manta rays in Mozambique, or ghosts in Mexico City\xe2\x80\x94here's where to travel and what to experien\xe2\x80\xa6 https://t.co/IKmcGJKyXC"""
NatGeoTravel,1189134818702966789,2019-10-29 11:00:08,b'What better way is there to channel the royal existence than by spending a night in a castle? https://t.co/QPdKSkzHsx'
NatGeoTravel,1189000750611025921,2019-10-29 02:07:24,b'Though only 10 miles off the west coast of Scotland\xe2\x80\x94a five-hour drive from Glasgow\xe2\x80\x94Eigg seems a world away. https://t.co/SkLIW9WFil'
NatGeoTravel,1188953631405592576,2019-10-28 23:00:10,b'A surfer walks along an idyllic stretch of beach as the sun dips below the horizon in this island scene captured by\xe2\x80\xa6 https://t.co/vUNUZPCdKs'
NatGeoTravel,1188908439885488136,2019-10-28 20:00:35,b'Dive into this ultimate guide to exploring your sweet tooth\xe2\x80\x94from the charming villages of Switzerland to the cacao\xe2\x80\xa6 https://t.co/jN9nB7o4WO'
NatGeoTravel,1188884038804746241,2019-10-28 18:23:37,b'With #Halloween19 on the way and #NationalChocolateDay  today in the U.S. we need to know\xe2\x80\x94where have you had the be\xe2\x80\xa6 https://t.co/LqApcijKFL'
NatGeoTravel,1188822070899150848,2019-10-28 14:17:23,"b'Winding roads lined with wildflowers, charming little towns, and blue sky views make the Tyrrhenian coastline of Ca\xe2\x80\xa6 https://t.co/TJbkcoY6kR'"
NatGeoTravel,1188772434176040960,2019-10-28 11:00:09,b'These little walks come with big rewards.https://t.co/JzFE3xexaP'
NatGeoTravel,1188636608645550083,2019-10-28 02:00:25,"b'Remnants of World War I\xe2\x80\x94including intact machine gun posts, rusted piles of barbed wire, and bullet casings\xe2\x80\x94can sti\xe2\x80\xa6 https://t.co/4UBWiQFjJw'"
NatGeoTravel,1188591241937772545,2019-10-27 23:00:09,b'A warm sunset bathes the Italian dolomites in orange light in this breathtaking scene captured by #YourShot photogr\xe2\x80\xa6 https://t.co/mBsuoENaK9'
NatGeoTravel,1188545936299122690,2019-10-27 20:00:07,"b'Explore the continent\xe2\x80\x99s lesser-traveled areas, where trails weave through idyllic coastal towns, mountain-top monas\xe2\x80\xa6 https://t.co/45AllIsHIf'"
NatGeoTravel,1188516472991244299,2019-10-27 18:03:03,"b""If you're visiting Paris, a side trip to this splendid and iconic palace should certainly be on your agenda. https://t.co/NBG1YaIXj6"""
NatGeoTravel,1188455459696599043,2019-10-27 14:00:36,"b'The next time you plan a trip to France, spread the love and check out some of these treasured, less-visited cities. https://t.co/e0qzp6OTRM'"
NatGeoTravel,1188410036902662145,2019-10-27 11:00:07,"b'Humans are, quite literally, trashing the planet. These cities are taking a stand. https://t.co/HO0QHmjxSH'"
NatGeoTravel,1188228842126823424,2019-10-26 23:00:06,"b'""This sauna in the Dolomites is located at an altitude of 2,752 meters,"" writes #YourShot photographer Robert Bilos\xe2\x80\xa6 https://t.co/PmcrcZBmhK'"
NatGeoTravel,1188183634433454080,2019-10-26 20:00:28,"b""It's a quick an easy switch-up, with big rewards for the planet. https://t.co/yGVSrVZRaW"""
NatGeoTravel,1188138290521739269,2019-10-26 17:00:17,b'Explore the world in all its beauty\xe2\x80\x94while leaving behind a lighter footprint. https://t.co/EIWtAVvdy3'
NatGeoTravel,1188093088830500864,2019-10-26 14:00:40,b'Some museums captivate visitors even before they enter.https://t.co/qm51ZojhyX'
NatGeoTravel,1188047753504612354,2019-10-26 11:00:31,b'Get inspired in these creative and engaging museums from South Africa to San Francisco.https://t.co/AGhmYhEO7s'
NatGeoTravel,1187911831505031169,2019-10-26 02:00:25,b'For the nerd in all of us. https://t.co/bCveD7v14D'
NatGeoTravel,1187866473110392833,2019-10-25 23:00:11,"b'""Big Bend is an International Dark Sky Park,"" writes #YourShot photographer Cat O. ""During our two week stay we enc\xe2\x80\xa6 https://t.co/qAf5NFa7V6'"
NatGeoTravel,1187821188292235265,2019-10-25 20:00:14,"b'See the mesmerizing process one artist uses to re-construct a tiny replica of his hometown, Bilbao\xe2\x80\x94and hear the del\xe2\x80\xa6 https://t.co/mEZS3pKqYn'"
NatGeoTravel,1187780454478438400,2019-10-25 17:18:22,"b'Travel through Basque country in northern Spain, and you\xe2\x80\x99ll encounter breathtaking coastal vistas and tranquil farm\xe2\x80\xa6 https://t.co/nzDpR12Ixm'"
NatGeoTravel,1187735580869906434,2019-10-25 14:20:04,"b'For the rock\xe2\x80\x99s Aboriginal owners, this is a momentous decision\xe2\x80\x94one they have dreamed of and worked toward for decad\xe2\x80\xa6 https://t.co/SuqTb5yAtk'"
NatGeoTravel,1187685275985743872,2019-10-25 11:00:10,"b'From the open skies of the Outback to the blue waters of the ocean, soak up these gorgeous sights from Oz. https://t.co/4TtJuEaq1S'"
NatGeoTravel,1187568561675493377,2019-10-25 03:16:23,"b'Immerse yourself in gorgeous landscapes, challenge your abilities, and see a new part of the world\xe2\x80\x94all in just a da\xe2\x80\xa6 https://t.co/OKFEke2059'"
NatGeoTravel,1187504077422432264,2019-10-24 23:00:09,"b'A pair of climbers cross a ridge above the Col des Grandes Jorasses in the alps, captured here by #YourShot photogr\xe2\x80\xa6 https://t.co/k1TUkhzRBh'"
NatGeoTravel,1187462275608829952,2019-10-24 20:14:03,"b'""Treat cemeteries as they are: spaces for the living."" https://t.co/qTs2xh2oCN'"
NatGeoTravel,1187428613764931584,2019-10-24 18:00:17,"b'Tens of thousands of caves sprawl beneath Tennessee\xe2\x80\x99s hills and farmlands, making for the perfect spelunking road t\xe2\x80\xa6 https://t.co/1E5O2kqQHl'"
NatGeoTravel,1187322887365124096,2019-10-24 11:00:10,"b""The Hallgr\xc3\xadmskirkja can be seen from almost anywhere in Iceland's capital. https://t.co/XlJec6aBH8"""
NatGeoTravel,1187187054465208320,2019-10-24 02:00:25,"b'With lush national parks, vast lava fields, and snow-covered glaciers, Iceland is the ultimate outdoor adventure sp\xe2\x80\xa6 https://t.co/nKoDZmYayl'"
NatGeoTravel,1187141683978407937,2019-10-23 23:00:08,"b'""We had really heavy rain when we where here, which made it tricky to get the shots I wanted,"" writes #YourShot pho\xe2\x80\xa6 https://t.co/kmzmraT9qL'"
NatGeoTravel,1187096493901123588,2019-10-23 20:00:33,"b'This glittering glass metropolis\xe2\x80\x94set against temperate rainforest, ocean inlets, and the Coast Mountains of British\xe2\x80\xa6 https://t.co/GmItOOplzk'"
NatGeoTravel,1187006276737339393,2019-10-23 14:02:04,"b'From treehouse temples in the Ozarks to the buttresses and gargoyles of Washington\xe2\x80\x99s National Cathedral, marvel at\xe2\x80\xa6 https://t.co/GZcI0qqpb9'"
NatGeoTravel,1186960579312934915,2019-10-23 11:00:29,"b'With facades dressed in mosaics, glowing marble, crowning domes, and spiraling towers, these mosques are awe-striki\xe2\x80\xa6 https://t.co/HPohDQ5z0c'"
NatGeoTravel,1186824669862780928,2019-10-23 02:00:26,b'Escape the crowds\xe2\x80\x94but not the natural wonders\xe2\x80\x94in these gorgeous national parks. https://t.co/pJdiEz3sLm'
NatGeoTravel,1186779305168248837,2019-10-22 23:00:10,"b'""Before I took this shot, there were strong winds over night that washed out footprints and created fantastic patte\xe2\x80\xa6 https://t.co/zMfMU4jRe4'"
NatGeoTravel,1186766445809721345,2019-10-22 22:09:04,"b""Offering untouched wilderness and astounding silence, Greenland is home to some of the world's largest fjords\xe2\x80\x94inclu\xe2\x80\xa6 https://t.co/2rdPQrkWKS"""
NatGeoTravel,1186734036091314178,2019-10-22 20:00:17,"b""One look at these stunning ancient sites and you'll understand why Explorer @indyfromspace finds them out of this w\xe2\x80\xa6 https://t.co/e56xf8JmSx"""
NatGeoTravel,1186701849887432711,2019-10-22 17:52:23,b'Gaze off into space at these marvelous sites. https://t.co/ohcU9ycVcG'
NatGeoTravel,1186653787936772096,2019-10-22 14:41:24,"b'Home to soaring mountain peaks, ancient wine country, and festive traditions, ""there is no place on earth like Geor\xe2\x80\xa6 https://t.co/vR8sOeN7qu'"
NatGeoTravel,1186598131032612869,2019-10-22 11:00:15,"b'From the iconic to the less-traveled, these parks will fuel your love of the outdoors with their abundant natural b\xe2\x80\xa6 https://t.co/47k1PKSAO4'"
NatGeoTravel,1186487688733642753,2019-10-22 03:41:23,"b'From the secluded coves of Oregon to the serene ponds of Maine, these stand-out natural gems deserve to be on your\xe2\x80\xa6 https://t.co/uYlGAmS0EW'"
NatGeoTravel,1186416912986714114,2019-10-21 23:00:09,b'Fog rolls across the hillsides in this peaceful sunrise moment captured by #YourShot photographer Billy Hammon in N\xe2\x80\xa6 https://t.co/BO1jM7F8ts'
NatGeoTravel,1186371719646371840,2019-10-21 20:00:34,"b'While these places may have troubled histories, their untouched landscapes make them worth the risk for some advent\xe2\x80\xa6 https://t.co/efieRTrDVc'"
NatGeoTravel,1186349060426555393,2019-10-21 18:30:31,"b'Explore the silent streets and derelict buildings of these abandoned towns, reclaimed by nature. https://t.co/V1JpA3HA4N'"
NatGeoTravel,1186285780311957504,2019-10-21 14:19:04,"b'Atmospheric landscapes, otherworldly topography, and ever-changing weather makes for some stunning photos in South\xe2\x80\xa6 https://t.co/g1WpDY3Hbr'"
NatGeoTravel,1186235724246474753,2019-10-21 11:00:10,b'Head to this secluded South American region for fewer crowds and greater thrills. https://t.co/90xk0aMBsm'
NatGeoTravel,1186120687586598913,2019-10-21 03:23:03,"b'A trip to Bryce Canyon showcases the stunning geology of southern Utah, a red-rock wonderland created by wind, wate\xe2\x80\xa6 https://t.co/vLKt4q9nso'"
NatGeoTravel,1186054522684215297,2019-10-20 23:00:08,"b""A layer of clouds roll over the striking cliffsides of Utah's Bryce Canyon National Park in this captivating image\xe2\x80\xa6 https://t.co/bcHutmeBV9"""
NatGeoTravel,1186009302886170628,2019-10-20 20:00:27,"b'For these travelers, one visit was all it took to fall in love with their new forever-home. https://t.co/luH7Sl4Tgf'"
NatGeoTravel,1185963938527268869,2019-10-20 17:00:11,"b'Ever take a vacation and think, \xe2\x80\x9cI could live here?\xe2\x80\x9d For English photojournalist Charlie Hamilton James, that\xe2\x80\x99s exa\xe2\x80\xa6 https://t.co/8LLo5aahWs'"
NatGeoTravel,1185918778468720641,2019-10-20 14:00:44,b'This quintessential destination packs all the perks of ordinary mountain towns into an intimate locale visitors can\xe2\x80\xa6 https://t.co/qYsRV9U3Vt'
