politico,1272838859425005575,2020-06-16 10:30:06,b'At least four members of Congress have reaped benefits in some way from the half-trillion-dollar small-business loa\xe2\x80\xa6 https://t.co/0YkjVV7h3G'
politico,1272816700736634880,2020-06-16 09:02:03,"b'Seven years ago, just nine Senate Republicans supported a bill codifying workplace protections for sexual orientati\xe2\x80\xa6 https://t.co/CdKWBuQzJb'"
politico,1272786317945036801,2020-06-16 07:01:20,"b'Joe Biden\xe2\x80\x99s campaign announced it raised $81 million last month, fueled by his rise in the polls against President\xe2\x80\xa6 https://t.co/pN185I5HaW'"
politico,1272771064884535297,2020-06-16 06:00:43,"b'Analysis: What\xe2\x80\x99s happening in Seattle\xe2\x80\x99s Protest Zone that shook the world is indeed an occupation, but it looks not\xe2\x80\xa6 https://t.co/hZDOsZspAt'"
politico,1272755882674266114,2020-06-16 05:00:23,"b'By most conventional indicators, Donald Trump is in danger of becoming a one-term president. But state and local GO\xe2\x80\xa6 https://t.co/zrLr5cbxen'"
politico,1272740710375141376,2020-06-16 04:00:06,"b'Analysis: Trump has a native instinct for knowing what matters\xe2\x80\x94not what the pundits say, or what civics classes tel\xe2\x80\xa6 https://t.co/tSSUorY6gm'"
politico,1272737563523059712,2020-06-16 03:47:36,"b'""No words can describe what he meant to me and all who knew him.""\n\nIlhan Omar\'s father died from complications due\xe2\x80\xa6 https://t.co/7RF0ZBrmLL'"
politico,1272725614257201152,2020-06-16 03:00:07,b'Thousands of nursing homes across the U.S. have not been checked to see if staff are following proper procedures to\xe2\x80\xa6 https://t.co/PuEw4zJd4J'
politico,1272710573306925056,2020-06-16 02:00:21,b'Conservatives are seething over Justice Neil Gorsuch\xe2\x80\x99s opinion that cemented new protections for LGBTQ people. \n\nTh\xe2\x80\xa6 https://t.co/DPyXkLiNSu'
politico,1272701691612344325,2020-06-16 01:25:03,b'Gain unique insight from global experts on the decisions made in Washington and Beijing that will shape the world f\xe2\x80\xa6 https://t.co/cT2FhC7IsU'
politico,1272695608105713665,2020-06-16 01:00:53,"b'With an executive order set to be unveiled tomorrow, Trump is expected to lay out the case for the creation of a na\xe2\x80\xa6 https://t.co/TzUf34UOvo'"
politico,1272695131465027584,2020-06-16 00:58:59,b'There are still far more questions than answers when it comes to managing Covid patients. But doctors have made som\xe2\x80\xa6 https://t.co/tcL7pk0Wab'
politico,1272687857099030534,2020-06-16 00:30:05,b'Federal watchdogs complained in a letter that the Trump administration is limiting their ability to monitor more th\xe2\x80\xa6 https://t.co/8SrFSYKwZ8'
politico,1272680547110838274,2020-06-16 00:01:02,b'Gov. Gavin Newsom offered his most vigorous defense yet Monday for reopening California\xe2\x80\x99s economy even as thousands\xe2\x80\xa6 https://t.co/N7GZwqYeKC'
politico,1272676128684154884,2020-06-15 23:43:28,b'A group of GOP senators is expected to file legislation this week that would address policing practices.\n\nBut GOP l\xe2\x80\xa6 https://t.co/OQHFpfa4UE'
politico,1272672759756263424,2020-06-15 23:30:05,b'The Senate is unlikely to take up a police reform bill until after the July 4 recess. That means it could be a mont\xe2\x80\xa6 https://t.co/WoTua4Wcvg'
politico,1272665532794355729,2020-06-15 23:01:22,b'President Trump said today he will live with the Supreme Court decision that a landmark civil rights law protects L\xe2\x80\xa6 https://t.co/irW9GAdHH4'
politico,1272657657741049856,2020-06-15 22:30:05,b'The White House will host leaders from Serbia and Kosovo later this month in an effort to kickstart stalled efforts\xe2\x80\xa6 https://t.co/oR6Z8ZNaEs'
politico,1272654992202248197,2020-06-15 22:19:29,b'The potential legal threat comes just a week before Bolton\xe2\x80\x99s tell-all is set to be released. \n\nThe former national\xe2\x80\xa6 https://t.co/ERuuUciEAu'
politico,1272653914693947396,2020-06-15 22:15:12,b'President Trump and AG William Barr did not deny today that the administration would sue to block the impending rel\xe2\x80\xa6 https://t.co/b0vyG5hH35'
politico,1272650478992711682,2020-06-15 22:01:33,b'A Chinese company once found guilty of stealing information from a U.S. company that manufactures airplane boarding\xe2\x80\xa6 https://t.co/Dz2Q72kTma'
politico,1272646326757527555,2020-06-15 21:45:03,b'President Trump today said he wants to pull thousands of U.S. troops from Germany in response to what he characteri\xe2\x80\xa6 https://t.co/1HRKNqeKvO'
politico,1272638779522768896,2020-06-15 21:15:04,"b""Transatlantic relations are seemingly so bad, even speaking English didn't help EU foreign ministers get their mess\xe2\x80\xa6 https://t.co/BklvnYtRYZ"""
politico,1272630336594366465,2020-06-15 20:41:31,b'Mike Bloomberg is asking a court to throw out a lawsuit brought by former aides to his failed presidential campaign\xe2\x80\xa6 https://t.co/0UIU5TfkwI'
politico,1272623678149271552,2020-06-15 20:15:03,b'The House Homeland Security Chairman is asking the Bureau of Prisons whether corrections officials asked to staff t\xe2\x80\xa6 https://t.co/pDVU4koqyq'
politico,1272621180000841729,2020-06-15 20:05:08,"b""Sick of the news clutter? We've got you covered. For the most critical Covid-19 facts and insights from issue exper\xe2\x80\xa6 https://t.co/81GlviLvte"""
politico,1272614870123458561,2020-06-15 19:40:03,b'The Supreme Court passed up at least seven cases Monday that would have allowed it to reconsider aspects of a legal\xe2\x80\xa6 https://t.co/UJiN6dme53'
politico,1272613999964717056,2020-06-15 19:36:36,b'Our CA reporters @cmarinucci and @JeremyBWhite will ask about how L.A. is containing Covid as businesses begin to r\xe2\x80\xa6 https://t.co/684o4VmnFU'
politico,1272613615531692034,2020-06-15 19:35:04,b'Los Angeles is grappling with a rising number of Covid-19 cases just as a wave of protests over the killing of Geor\xe2\x80\xa6 https://t.co/n8amV1OYn3'
politico,1272608582249459713,2020-06-15 19:15:04,"b'The harsh sentence against Paul Whelan highlights the plight of Trevor Reed, a second ex-marine facing questionable\xe2\x80\xa6 https://t.co/7OgM145hNO'"
politico,1272601682527039491,2020-06-15 18:47:39,b'Ben Carson suggested Monday he was working to tamp down President Trump\xe2\x80\x99s public displays of hostility toward athle\xe2\x80\xa6 https://t.co/hGQ8Q3M11S'
politico,1272593488027226112,2020-06-15 18:15:05,"b'Joe Biden\xe2\x80\x99s presidential campaign announced it raised $81 million last month, fueled by his rise in the polls again\xe2\x80\xa6 https://t.co/DDMdjDmBbl'"
politico,1272592542983507968,2020-06-15 18:11:20,b'Voice of America director Amanda Bennett and deputy director Sandy Sugawara announced their resignations Monday as\xe2\x80\xa6 https://t.co/yNWkBkEOL8'
politico,1272587187297583106,2020-06-15 17:50:03,"b'California\xe2\x80\x99s \xe2\x80\x9csanctuary\xe2\x80\x9d immigration enforcement law will not go before the U.S. Supreme Court, handing California\xe2\x80\xa6 https://t.co/AoUfMI0bI9'"
politico,1272583411828428802,2020-06-15 17:35:03,"b""Treasury Secretary Steven Mnuchin said he's planning talks with lawmakers seeking details of $512 billion in emerge\xe2\x80\xa6 https://t.co/XZkr59RV7N"""
politico,1272578398674657281,2020-06-15 17:15:08,"b'Former Sen. Trent Lott, who was abruptly ousted from Squire Patton Boggs last week, has landed at another lobbying\xe2\x80\xa6 https://t.co/geDsylfQT1'"
politico,1272575864551677952,2020-06-15 17:05:04,b'President Trump claimed to be a victim of double standards when it comes to perception of his decision to resume ca\xe2\x80\xa6 https://t.co/19U2fnla46'
politico,1272575456080998400,2020-06-15 17:03:26,"b'As states reopen, some are reporting record numbers of coronavirus cases and hospitalizations. @POLITICOPro\xe2\x80\x99s team\xe2\x80\xa6 https://t.co/n8XuZFYJfu'"
politico,1272572096032407556,2020-06-15 16:50:05,b'The pandemic gave small meat processors a new window of business as big meatpackers had to shut down or scale back\xe2\x80\xa6 https://t.co/DEVm6CqQ3S'
politico,1272567169486852096,2020-06-15 16:30:31,"b'Our interviews with more than 50 state, district and county Republican Party chairs depict a version of the elector\xe2\x80\xa6 https://t.co/wq7zOMIDMA'"
politico,1272560251720654855,2020-06-15 16:03:01,"b'After the threat of a high-stakes legal bout, Amazon CEO Jeff Bezos says he is willing to testify before the House\xe2\x80\xa6 https://t.co/Yg4VeUsarU'"
politico,1272555737949093888,2020-06-15 15:45:05,b'House Dems are asking the Bureau of Prisons if corrections officials who staffed protests have been quarantined or\xe2\x80\xa6 https://t.co/CdQ7ONeek5'
politico,1272552129895563264,2020-06-15 15:30:45,b'The coronavirus disproportionately infects and kills minority communities and there remains little federal guidance\xe2\x80\xa6 https://t.co/ShtWbjmcq2'
politico,1272549639070326789,2020-06-15 15:20:51,"b'The drugs, hydroxychloroquine and chloroquine, have failed in several recent clinical trials and doctors say they c\xe2\x80\xa6 https://t.co/T6kuWKYyd9'"
politico,1272549638164361217,2020-06-15 15:20:51,b'The Food and Drug Administration has withdrawn emergency use authorizations for two controversial coronavirus treat\xe2\x80\xa6 https://t.co/FemQddNnae'
politico,1272548187732086784,2020-06-15 15:15:05,b'A bipartisan group of 30 senators is urging leadership to cement temporary virtual care policies in a letter out to\xe2\x80\xa6 https://t.co/T58r90ra9Z'
politico,1272545182169403392,2020-06-15 15:03:08,b'Smartphone apps could be key to ramping up coronavirus contact-tracing.\n\nBut a lack of coordination between states\xe2\x80\xa6 https://t.co/xjgwndbBuK'
politico,1272544772016701443,2020-06-15 15:01:31,b'The data isn\xe2\x80\x99t perfect. Since the CDC hasn\xe2\x80\x99t yet begun publicly releasing the number of people who have been tested\xe2\x80\xa6 https://t.co/xDBiIwQkfB'
politico,1272544770381041667,2020-06-15 15:01:30,"b""Using data from the COVID Tracking Project, we\xe2\x80\x99re following how each state is responding to Covid-19. Here's where\xe2\x80\xa6 https://t.co/D2nIUeHDyw"""
politico,1272544333359722496,2020-06-15 14:59:46,b'Gorsuch accepted arguments that the Civil Rights Act of 1964\xe2\x80\x99s prohibition on sex discrimination also effectively b\xe2\x80\xa6 https://t.co/g4j0YTqJxd'
politico,1272540631366340609,2020-06-15 14:45:03,"b'Pollsters\xe2\x80\x99 annual meeting was moved online as a result of the coronavirus pandemic, but there was no shortage of il\xe2\x80\xa6 https://t.co/7TDFx1Hzc0'"
politico,1272536987434733569,2020-06-15 14:30:35,"b""Lisa Murkowski isn't worried about retribution from President Trump after she made waves this month by concurring w\xe2\x80\xa6 https://t.co/HTkZG901WA"""
politico,1272536208657149953,2020-06-15 14:27:29,b'Live interview: Colorado Gov. Jared Polis talks water security https://t.co/NPXCXsQNip'
politico,1272535529964408832,2020-06-15 14:24:47,"b'Justices Clarence Thomas, Samuel Alito and Brett Kavanaugh dissented from the ruling  https://t.co/VYAPCtveS4'"
politico,1272535185796599809,2020-06-15 14:23:25,"b'Two of the court\xe2\x80\x99s Republican appointees, Neil Gorsuch and John Roberts, joined the court\xe2\x80\x99s Democratic appointees t\xe2\x80\xa6 https://t.co/2BA27Cg8HG'"
politico,1272534957865533442,2020-06-15 14:22:31,"b'BREAKING: The Supreme Court rules that federal law prohibiting discrimination in the workplace protects gay, lesbia\xe2\x80\xa6 https://t.co/qPmHn1cFEl'"
politico,1272534757994377217,2020-06-15 14:21:43,"b'Health advocates and industry reps panned the Trump administration\xe2\x80\x99s rollback of patient protections, including the\xe2\x80\xa6 https://t.co/50MR8N9plu'"
politico,1272530120117534722,2020-06-15 14:03:17,b'Essential workers are increasingly trying to organize to demand better working conditions as the pandemic has prove\xe2\x80\xa6 https://t.co/vAHgNpfPW9'
politico,1272525541279752198,2020-06-15 13:45:06,b'A Trump 2020 senior legal adviser repeatedly characterized a CNN presidential poll as \xe2\x80\x9cjunk\xe2\x80\x9d in an interview on the\xe2\x80\xa6 https://t.co/C3jdJIWhxN'
politico,1272524662149459968,2020-06-15 13:41:36,b'Trump\xe2\x80\x99s musings about a trade deal with China will be under a legal microscope today as lawyers for Huawei executiv\xe2\x80\xa6 https://t.co/fL9sOWkjbu'
politico,1272521916537069569,2020-06-15 13:30:41,"b'National Economic Council Director Larry Kudlow said that ""almost all businesses"" understand the $600 additional un\xe2\x80\xa6 https://t.co/GsKn3ed2mS'"
politico,1272517988260904961,2020-06-15 13:15:05,"b'Rep. Denver Riggleman (R-Va.), who became a target of conservatives after officiating a same-sex wedding last year,\xe2\x80\xa6 https://t.co/BKpz81BQOJ'"
politico,1272515079800598528,2020-06-15 13:03:31,"b'RT @POLITICOLive: LIVE NOW: Playbook Interview @apalmerdc &amp; @JakeSherman are sitting down (virtually) with @mj_sommers, President and CEO,\xe2\x80\xa6'"
politico,1272514954390908928,2020-06-15 13:03:01,b'The coronavirus and police brutality crises have pressured the GOP into action on two fronts they would normally ne\xe2\x80\xa6 https://t.co/yFmIw8JBPj'
politico,1272513472123809796,2020-06-15 12:57:08,"b'RT @POLITICOPress: Join @apalmerdc and @JakeSherman in 30 minutes for a virtual Playbook Interview with @mj_sommers, President and CEO, @AP\xe2\x80\xa6'"
politico,1272513328666075136,2020-06-15 12:56:34,b'RT @playbookplus: Health experts are growing increasingly worried that the White House will pressure regulators to approve the first vaccin\xe2\x80\xa6'
politico,1272512376475209728,2020-06-15 12:52:47,"b'RT @AndrewDesiderio: Meanwhile, Sen. Romney told me it\xe2\x80\x99s \xe2\x80\x9capparent on its face\xe2\x80\x9d that the Hunter Biden probe is politically motivated, and w\xe2\x80\xa6'"
politico,1272511903164764160,2020-06-15 12:50:54,b'Voice of America reported Sunday that a top communications official at the Centers for Disease Control and Preventi\xe2\x80\xa6 https://t.co/94oGC4l7MO'
politico,1272510436118798338,2020-06-15 12:45:04,"b'President Trump is supposed to hold a rally in Tulsa on Saturday night, but the top public health official is askin\xe2\x80\xa6 https://t.co/O9o5eLk6WE'"
politico,1272506727079055360,2020-06-15 12:30:20,b'A growing number of lawmakers are blasting Treasury Secretary Steven Mnuchin\xe2\x80\x99s surprising decision to withhold the\xe2\x80\xa6 https://t.co/YPGQZ5iU7M'
politico,1272502883691507714,2020-06-15 12:15:04,b'Jon Burge tortured black men for years and his fellow officers covered for him. The coverups continued long after h\xe2\x80\xa6 https://t.co/cNPEryWtde'
politico,1272499799170920448,2020-06-15 12:02:48,b'Sen. Josh Hawley is preparing legislation that could require major online platforms like Google and Facebook to sto\xe2\x80\xa6 https://t.co/17E3xbD4GK'
politico,1272494072729669633,2020-06-15 11:40:03,"b'Former Sens. Trent Lott and John Breaux are joining the Washington lobbying firm Crossroads Strategies, a week afte\xe2\x80\xa6 https://t.co/TRo2qUiDjY'"
politico,1272489039870988291,2020-06-15 11:20:03,"b'Across corners of the labor market traditionally without unions, the coronavirus is spurring new interest in organi\xe2\x80\xa6 https://t.co/xRbovE44uA'"
politico,1272484471506419714,2020-06-15 11:01:54,"b'By most conventional indicators, Donald Trump is in danger of becoming a one-term president. But state and local GO\xe2\x80\xa6 https://t.co/HEFjyVcQLf'"
politico,1272482759739654144,2020-06-15 10:55:06,"b'Stay up to date on the latest sustainability news, trends, and solutions. Learn more about efforts focused on build\xe2\x80\xa6 https://t.co/oI1DN94ZDy'"
politico,1272478973226868736,2020-06-15 10:40:03,b'Public health experts are growing increasingly worried that the White House will pressure regulators to approve the\xe2\x80\xa6 https://t.co/GqrtXsuh29'
politico,1272473939458101253,2020-06-15 10:20:03,"b""Sen. Ron Johnson is playing a major role in pushing Trump's sought after probes https://t.co/5Z0EPNT478"""
politico,1272461397939666946,2020-06-15 09:30:13,"b'Social distancing, travel trouble and health concerns still limit work of the European Parliament, Commission and C\xe2\x80\xa6 https://t.co/NCiLvNE109'"
politico,1272431175819280384,2020-06-15 07:30:07,b'Why Trump Is Right To Worry About That Glass of Water\n\nhttps://t.co/SMbfYNzw5K'
politico,1272400968437694466,2020-06-15 05:30:05,b'Opinion: What Today\xe2\x80\x99s Progressives Can Learn From 1948\n\nhttps://t.co/RjErRXLB4Q'
politico,1272385862949580802,2020-06-15 04:30:04,b'Analysis: The New York Times Used to Be a Model of Diverse Opinion. What Happened?\n\nhttps://t.co/x2C0JBgo6s'
politico,1272370764759646208,2020-06-15 03:30:04,"b'Lawmakers, facing a growing list of crises, may not have the bandwidth to help DACA recipients \xe2\x80\x94 especially in an e\xe2\x80\xa6 https://t.co/zN09dYiZ6s'"
politico,1272355660806737920,2020-06-15 02:30:03,"b'Despite rising pressure on the Trump administration to fix the data deficits, 52 percent of reported coronavirus ca\xe2\x80\xa6 https://t.co/0h4Z7nWuqf'"
politico,1272340563472384000,2020-06-15 01:30:03,b'President Donald Trump has long had NASCAR and the NFL standing beside him as he railed against athletes taking a k\xe2\x80\xa6 https://t.co/rQXJzLosLS'
politico,1272325464607076353,2020-06-15 00:30:04,"b'Rep. Bobby Rush likened Chicago\xe2\x80\x99s largest police union to the Ku Klux Klan, saying the two organizations \xe2\x80\x9care like\xe2\x80\xa6 https://t.co/p98NbwDkGH'"
politico,1272318028097748997,2020-06-15 00:00:31,"b'The State Department has drawn criticism for being dominated by white men, especially in senior jobs. \n\nThe new sta\xe2\x80\xa6 https://t.co/hXZyLWtkvh'"
politico,1272312879300120580,2020-06-14 23:40:03,"b""Join the sharpest minds in conversation around our world's biggest challenges. From pandemics to plastics, climate\xe2\x80\xa6 https://t.co/zNV6uwV37m"""
politico,1272307844092755968,2020-06-14 23:20:03,b'Democratic heavyweights House Majority Whip Jim Clyburn and Rep. Adam Schiff are endorsing Rep. Eliot Engel for ree\xe2\x80\xa6 https://t.co/RMEhTqxdKJ'
politico,1272302972031115266,2020-06-14 23:00:41,"b'Analysis: Even if it\xe2\x80\x99s baseless and unfair, few things stick to a modern president like images of physical frailty\n\nhttps://t.co/SMbfYNzw5K'"
politico,1272295267669291008,2020-06-14 22:30:04,b'Russian President Vladimir Putin said anti-racism protests in the United States are a \xe2\x80\x9csign of some deep-seated int\xe2\x80\xa6 https://t.co/Gxd1Al9Fpc'
politico,1272282915175649282,2020-06-14 21:40:59,"b""We'll discuss the policies and legislation needed at the state, regional and federal levels to meet the water needs\xe2\x80\xa6 https://t.co/LwwK3oHPge"""
politico,1272282682714701825,2020-06-14 21:40:04,b'Water is becoming increasingly scarce around the U.S. How can we secure long-term solutions amid the Covid-19 pande\xe2\x80\xa6 https://t.co/5mnuivSxoc'
politico,1272277645540102144,2020-06-14 21:20:03,b'French President Emmanuel Macron said the country will not be tearing down statues or rewriting its history in resp\xe2\x80\xa6 https://t.co/FVo4yxmB3p'
politico,1272272769804374018,2020-06-14 21:00:40,"b'Criticism of the World Trade Organization by Donald Trump has been ""damaging"", said the body\'s chief, Roberto Azev\xc3\xaa\xe2\x80\xa6 https://t.co/cHXCMAlaxy'"
politico,1272267582091952129,2020-06-14 20:40:03,b'U.K. Prime Minister Boris Johnson condemned \xe2\x80\x9cracist thuggery\xe2\x80\x9d after right-wing protesters clashed with anti-racist\xe2\x80\xa6 https://t.co/lqSLxZEWo6'
politico,1272262546804936704,2020-06-14 20:20:03,"b'Opinion: It\xe2\x80\x99s possible to drag a centrist nominee to the left, if you know the right way to do it\n\nhttps://t.co/RjErRXLB4Q'"
politico,1272257801977507841,2020-06-14 20:01:12,b'.@POLITICOPro\xe2\x80\x99s team of policy experts constantly release in-depth analyses on topics like economic relief oversigh\xe2\x80\xa6 https://t.co/7mtMO9E8o8'
politico,1272252479485415426,2020-06-14 19:40:03,"b'The U.K.\'s two-meter social distancing rule will be reviewed ""very soon"" because of the impact it has on businesses\xe2\x80\xa6 https://t.co/6x4XKxr6TR'"
politico,1272247446345781249,2020-06-14 19:20:03,b'National Economic Council Director Larry Kudlow reiterated the $600 additional weekly unemployment benefit will end\xe2\x80\xa6 https://t.co/zA7gF9T0Sg'
politico,1272242401134800896,2020-06-14 19:00:00,"b""As states reopen, there's a debate brewing about the safety of protests and Trump rallies.\xc2\xa0\n\nAnd it\xe2\x80\x99s happening wit\xe2\x80\xa6 https://t.co/4j9jCkTel5"""
politico,1272237379856797696,2020-06-14 18:40:03,b'The senior legal adviser to President Donald Trump\xe2\x80\x99s 2020 campaign condemned CNN\xe2\x80\x99s recent poll as \xe2\x80\x9cmisleading junk\xe2\x80\xa6 https://t.co/BVbcP9Ynoz'
politico,1272232348399140866,2020-06-14 18:20:03,"b'House Majority Whip Jim Clyburn said no one is going to defund the police, and instead called for a ""re-imagining""\xe2\x80\xa6 https://t.co/jv2oW9sLKI'"
politico,1272231396422156289,2020-06-14 18:16:16,"b""We'll also discuss the role the American Petroleum Institute intends to play in the upcoming 2020 election and what\xe2\x80\xa6 https://t.co/Zs9B2O7eiJ"""
politico,1272227714712436736,2020-06-14 18:01:38,b'Global oil markets have plunged due to the economic slowdown. Expect a long recovery as fuel demand remains weak an\xe2\x80\xa6 https://t.co/dTjrvKey2W'
politico,1272222748400660480,2020-06-14 17:41:54,"b'Analysis: Fifty years ago, like today, newsrooms were divided about what ""objectivity"" means. Here\xe2\x80\x99s how a d\xc3\xa9tente\xe2\x80\xa6 https://t.co/nEWqVDlglV'"
politico,1272217252293742592,2020-06-14 17:20:04,b'Oklahoma Sen. James Lankford said the president did not initially see it as disrespectful to hold his planned comeb\xe2\x80\xa6 https://t.co/GSY7IzW2ca'
politico,1272212764124200963,2020-06-14 17:02:14,"b'Keep up with essential news and updates on Covid-19, the nationwide unrest, 2020 election and more with our daily p\xe2\x80\xa6 https://t.co/v6qXFGlZtR'"
politico,1272204675387928576,2020-06-14 16:30:05,"b'Congress could soon be staring down another crisis: the possible deportation of 700,000 Dreamers\n\nhttps://t.co/eDTxYoAKsu'"
politico,1272198610306949120,2020-06-14 16:05:59,b'RT @playbookplus: The latest in Playbook --&gt; A bunch of police reform news\n\nhttps://t.co/u0YPLXBqW1 https://t.co/qI3bbxDWmN'
politico,1272197654110507008,2020-06-14 16:02:11,"b'Amid ongoing demonstrations against racism, Housing and Urban Development Secretary Ben Carson said America needs t\xe2\x80\xa6 https://t.co/LFLAJmxlIo'"
politico,1272189575788728320,2020-06-14 15:30:05,b'Data shared exclusively with POLITICO suggest an Ivy degree is still a career booster for Foreign Service employees\n\nhttps://t.co/jcxSVcT5uC'
politico,1272182485976338433,2020-06-14 15:01:55,b'Housing and Urban Development Secretary Ben Carson said the circumstances in the police killing of a black man in A\xe2\x80\xa6 https://t.co/Jt5ZENltpn'
politico,1272174484057972737,2020-06-14 14:30:07,b'NASCAR and the NFL are vowing to stand up for racial justice in a way that could challenge the president\xe2\x80\x99s relation\xe2\x80\xa6 https://t.co/qSn8z7jK4k'
politico,1272159382231490563,2020-06-14 13:30:06,b'The coronavirus\xe2\x80\x99 brutal impact on African Americans and other minorities may never be fully known because of consis\xe2\x80\xa6 https://t.co/YU8POe8WPs'
politico,1272144277196464128,2020-06-14 12:30:05,"b'Rep. Denver Riggleman (R-Va.), who became a target of conservatives after officiating a same-sex wedding last year,\xe2\x80\xa6 https://t.co/k8v8ILdBOy'"
politico,1272091652274913281,2020-06-14 09:00:58,"b'British Airways, easyJet and Ryanair have asked for a judicial review of the British government\xe2\x80\x99s decision to impos\xe2\x80\xa6 https://t.co/FLmKs6DXCw'"
politico,1272076521889554432,2020-06-14 08:00:51,b'Big tech companies are dialing up the pressure on Congress to limit police use of facial recognition software https://t.co/sAvGAXlwba'
politico,1272061371463720962,2020-06-14 07:00:39,"b""When the history of Boris Johnson's premiership is written, keep an eye out for the second week of June 2020 https://t.co/Sc3AKgrU5K"""
politico,1272046187638652929,2020-06-14 06:00:19,b'A feud between two Russian diplomats was behind a hoax that prompted police to guard Prague\xe2\x80\x99s mayor and two other p\xe2\x80\xa6 https://t.co/jiEanXMwVM'
politico,1272041219766603776,2020-06-14 05:40:34,"b'BREAKING: Rep. Denver Riggleman, who became a target of conservatives after officiating a same-sex wedding last yea\xe2\x80\xa6 https://t.co/R1HjPgdgGG'"
politico,1272031033240752128,2020-06-14 05:00:06,b'The U.K. formally confirmed on Friday that it will not seek an extension of the Brexit transition period beyond Dec\xe2\x80\xa6 https://t.co/TXEgIzkpcs'
politico,1272015937957437440,2020-06-14 04:00:07,"b'Portugal was hailed as a rare Western European coronavirus success story.\n\nHowever, in recent weeks it\xe2\x80\x99s failed to\xe2\x80\xa6 https://t.co/WXy27qctiy'"
politico,1272000835149598720,2020-06-14 03:00:06,"b'France will open its borders to travelers from most European countries beginning Monday, ending months of restricti\xe2\x80\xa6 https://t.co/jsWtTOSVu4'"
politico,1271985737844621313,2020-06-14 02:00:06,"b""Canada's ethics watchdog is investigating Ottawa\xe2\x80\x99s former envoy to Washington to determine if he broke conflict-of-\xe2\x80\xa6 https://t.co/sHMvf77FbC"""
