ScienceChannel,1204460907943931904,2019-12-10 18:00:32,"b'A crystal or crystalline solid is a solid material containing components such as atoms, molecules, or ions that are\xe2\x80\xa6 https://t.co/zvqLXhZoHE'"
ScienceChannel,1204430575672512513,2019-12-10 16:00:01,"b""The home to Nefertiti and Tutankhamun has been buried for 3 millennia. Now, it's being #Unearthed.\n\nWatch full epis\xe2\x80\xa6 https://t.co/f03B7Ywrkc"""
ScienceChannel,1204158781153824768,2019-12-09 22:00:00,"b'Titan has all the ingredients for life, but not as we know it. \xf0\x9f\x8c\x91 \n\nWatch full episodes of #NASASUnexplained on SCI\xe2\x80\xa6 https://t.co/nVGwSLO8V6'"
ScienceChannel,1204128581980319747,2019-12-09 20:00:00,"b'""It\'s not about where you\'re going, it\'s about what you\'re finding on your way there.""\xf0\x9f\x97\xba\n\nMissed an episode of UNEXP\xe2\x80\xa6 https://t.co/TJFaQBDCN9'"
ScienceChannel,1204098562121973760,2019-12-09 18:00:42,b'You think your world is chaotic? Take a look at what is going on inside a drop of water! \xf0\x9f\x98\xb3 \n\n#MicroscopicMonday \xf0\x9f\xa7\xab \xf0\x9f\x94\xac\xe2\x80\xa6 https://t.co/dAF4Go9UxS'
ScienceChannel,1204056094982713348,2019-12-09 15:11:57,"b""Was the legend of Troy's demise real? Skeletal remains and charred ruins are linking mythology to history. \xf0\x9f\x92\x80\xf0\x9f\x94\xa5\n\nWatc\xe2\x80\xa6 https://t.co/DQzqNMorpb"""
ScienceChannel,1203871387212869633,2019-12-09 02:58:00,b'@Justin_Fornal and @EmilianoRuprah are on a quest to find one of the holiest artifacts ever created \xe2\x80\x94 the Ark of th\xe2\x80\xa6 https://t.co/dFJqDudwed'
ScienceChannel,1203766195587039233,2019-12-08 20:00:00,"b'An ancient map, a sacred lake, an island temple... @Justin_Fornal and @EmilianoRuprah are hot on the trail of the A\xe2\x80\xa6 https://t.co/7cOS8fc6Zh'"
ScienceChannel,1203720897107918848,2019-12-08 17:00:00,"b'Experts believe to have found the location of the fabled Tower of Babel. An ancient building so tall, it touched th\xe2\x80\xa6 https://t.co/HOIwHR1P0H'"
ScienceChannel,1203705947962650624,2019-12-08 16:00:36,b'Light waves will change speed and direction when they pass through multiple substances. This effect is called refra\xe2\x80\xa6 https://t.co/XxnpVXOJwM'
ScienceChannel,1203434067322195975,2019-12-07 22:00:15,"b""Discover how the world's most remarkable superstructures are built. \xf0\x9f\x8f\x97\xf0\x9f\x8f\x9f\n\nWatch full episodes of #BuildingGiants NOW\xe2\x80\xa6 https://t.co/VxfQoTXpJE"""
ScienceChannel,1203403809235619840,2019-12-07 20:00:00,"b""Who doesn't love a good holiday ham?\n\nWatch full episodes of #HowitsMade NOW on SCI Go. --&gt; https://t.co/rrGbKpTRDp https://t.co/mObhtwyzW4"""
ScienceChannel,1203373817344745473,2019-12-07 18:00:50,b'An icebreaker is a special-purpose ship designed to move and navigate through ice-covered waters and provide safe w\xe2\x80\xa6 https://t.co/4TqVjkM1WI'
ScienceChannel,1203328308781305857,2019-12-07 15:00:00,b'Ancient Indian Sanskrit describes a land bridge that was built by the gods to connect India and Sri Lanka.\xf0\x9f\x93\x9c Scienti\xe2\x80\xa6 https://t.co/RNiVBqlsGz'
ScienceChannel,1203060974590316553,2019-12-06 21:17:42,b'@netflix Let\xe2\x80\x99s experiment'
ScienceChannel,1203041419612418049,2019-12-06 20:00:00,b'These atomic bunkers could house several thousand people in the event of a nuclear attack.\xe2\x98\xa2\xef\xb8\x8f\n\nWatch full episodes o\xe2\x80\xa6 https://t.co/yIk01aTxhn'
ScienceChannel,1203019194650038272,2019-12-06 18:31:41,"b'Oyster mushrooms are commonly used in mycoremediation, a process that utilizes fungi-based technology to decontaminate the environment.'"
ScienceChannel,1203011434227126272,2019-12-06 18:00:51,"b'Happy #FungusFriday \xf0\x9f\x8d\x84! These are Oyster Mushrooms (Pleurotus Ostreatus). No, they\'re not ""magic,"" but they are one\xe2\x80\xa6 https://t.co/1u9MfuOXSJ'"
ScienceChannel,1202996122605817856,2019-12-06 17:00:00,b'The ancient Egyptian capital was erased from history and buried for 3 millennia. \xf0\x9f\x8c\x9e\n\nWatch full episodes of\xe2\x80\xa6 https://t.co/0iZMdpVTp9'
ScienceChannel,1202971585268895746,2019-12-06 15:22:30,b'Did the Knights Templar arrive in North America a century before Columbus? Archeological evidence suggests they did\xe2\x80\xa6 https://t.co/J2Y1l6Cmza'
ScienceChannel,1202679034200518656,2019-12-05 20:00:01,b'The nuclear disaster that changed the course of human history. \xe2\x98\xa2\xef\xb8\x8f\n\nClick below to watch full episodes of #DeadlyEngineering NOW on SCIgo.'
ScienceChannel,1202649242415828993,2019-12-05 18:01:38,b'Harvesting is the process of gathering ripe crops from the field. Here we have a sophisticated combine harvester re\xe2\x80\xa6 https://t.co/Xm7QdnqE4k'
ScienceChannel,1202640657749336064,2019-12-05 17:27:31,b'The people of Constantinople perfected the design and construction of cisterns. \xf0\x9f\x8f\x9b\xf0\x9f\x92\xa7\n\nWatch a new episode of\xe2\x80\xa6 https://t.co/RtQB9vMZdL'
ScienceChannel,1202608064089726976,2019-12-05 15:18:00,b'The impact of this factory cannot be understated. \xf0\x9f\x8f\xad\n\nWatch full episodes of #MysteriesoftheAbandoned on Science Cha\xe2\x80\xa6 https://t.co/zpcPxDWfMT'
ScienceChannel,1202377041426837504,2019-12-05 00:00:00,"b'This lost city was the home to Nefertiti and Tutankhamun. So, why was it destroyed? \xf0\x9f\x8f\x9c\n\nClick below to watch full ep\xe2\x80\xa6 https://t.co/QmNXcZZ2x0'"
ScienceChannel,1202353329201991683,2019-12-04 22:25:46,"b'Dogs\xe2\x80\x99 lineages are thought to have split from their wolf progenitors some 20,000 \xe2\x80\x93 40,000 years ago, putting Dogor\xe2\x80\xa6 https://t.co/ER1MQApEW9'"
ScienceChannel,1202316644996878338,2019-12-04 20:00:00,b'What caused this massive bridge to collapse? \xf0\x9f\x8c\x89\n\nWatch a new episode of #EngineeringCatastrophes tonight at 9p ET on\xe2\x80\xa6 https://t.co/oFtDu0g4T9'
ScienceChannel,1202313956209102848,2019-12-04 19:49:19,"b'Frogfish gather during mating season, but they will not tolerate each other for long. Once the act of fertilization\xe2\x80\xa6 https://t.co/j9e7LeDzCk'"
ScienceChannel,1202286590871179266,2019-12-04 18:00:35,b'Residing in the benthic zone of the Red Sea is an OG crew of Painted Frogfish. The waddling hunter they will use th\xe2\x80\xa6 https://t.co/wxEmjptuq3'
ScienceChannel,1202274735352098816,2019-12-04 17:13:28,b'This system failure caused a catastrophic collision.\xf0\x9f\x9a\xa6\xf0\x9f\x9a\x82\n\nWatch a new episode of #DeadlyEngineering tonight at 10p ET\xe2\x80\xa6 https://t.co/u9Wmrf73dy'
ScienceChannel,1201999594793648128,2019-12-03 23:00:10,"b'Dogs\xe2\x80\x99 lineages are thought to have split from their wolf progenitors some 20,000 \xe2\x80\x93 40,000 years ago, putting Dogor\xe2\x80\xa6 https://t.co/Ml4otJUoMq'"
ScienceChannel,1201954258079244288,2019-12-03 20:00:01,b'Nobody expected the levies to fail. \xe2\x9b\x88\xf0\x9f\x8c\x8a#HurricaneKatrina\n\nWatch full episodes of #DeadlyEngineering on Science Chann\xe2\x80\xa6 https://t.co/NI079RTffZ'
ScienceChannel,1201939690494005256,2019-12-03 19:02:07,"b'This mountain range is the home of Lake Tahoe, the largest alpine lake in North America, and Mount Whiney, the high\xe2\x80\xa6 https://t.co/So5v0Z43F0'"
ScienceChannel,1201939521207754753,2019-12-03 19:01:27,"b""Dreaming of a snowy holiday season? Look no further than California's Sierra Nevada. \n\n#TimelapseTuesday \xe2\x8f\xb3\n#Science https://t.co/RaMIGUrn7L"""
ScienceChannel,1201902078370746368,2019-12-03 16:32:40,b'The original layout for Mt. Rushmore was drastically different. \xe2\x9b\xb0\n\nWatch full episodes of #Unearthed on\xe2\x80\xa6 https://t.co/k11L5Gw57U'
ScienceChannel,1201591867525099520,2019-12-02 20:00:00,b'Cosmic rays are the bullets of the Universe.\n\nWatch full episodes of #HowTheUniverseWorks only on @ScienceChannel a\xe2\x80\xa6 https://t.co/CZi8Dk8TTY'
ScienceChannel,1201566023067086848,2019-12-02 18:17:18,"b'This may resemble an #alien #facehugger, but it\'s actually your friendly neighborhood ""Daddy Long-Leg,"" or Pholcida\xe2\x80\xa6 https://t.co/LHehV6DuyU'"
ScienceChannel,1201546573043372033,2019-12-02 17:00:01,b'Did the Knights Templar arrive in North America a century before Columbus? Archeological evidence suggests they did\xe2\x80\xa6 https://t.co/Z8JD3dfv2E'
ScienceChannel,1201523423098396672,2019-12-02 15:28:01,b'The eruption of Mt. Vesuvius carbonized Herculaneum \xe2\x80\x94 leaving the town almost perfectly preserved.\xf0\x9f\x8f\x9b\n\nClick below an\xe2\x80\xa6 https://t.co/3Hmb6zyFf2'
ScienceChannel,1201230678639226880,2019-12-01 20:04:46,b'Have you ever spent a night in a museum? \xf0\x9f\x93\x96\n\nWatch an all new episode of UNEXPLAINED AND UNEXPLORED tonight at 10p E\xe2\x80\xa6 https://t.co/GSv4biIe8j'
ScienceChannel,1201214382161776641,2019-12-01 19:00:00,b'Decrypting the Dead Sea Scrolls. \xf0\x9f\x93\x9c \n\nWatch full episodes of #Unearthed NOW on SCIgo. --&gt; https://t.co/QUtqfEaMjb https://t.co/A3W2rWz7d3'
ScienceChannel,1201169191191171072,2019-12-01 16:00:26,"b'This is the Kingdom of the Kushite \xe2\x80\x94 The Lost Kingdom of the Black Pharaohs. \xf0\x9f\x8f\x9c\xc2\xa0\n\nWatch the @ScienceChannel special,\xe2\x80\xa6 https://t.co/EhsuRoXxWV'"
ScienceChannel,1200927489159245825,2019-12-01 00:00:00,b'The civilization of the Kush \xe2\x80\x94 rulers of the largest empire the Nile Valley has ever seen.\xf0\x9f\x8f\x9c\n\nWatch the\xe2\x80\xa6 https://t.co/c9FkD46L6L'
ScienceChannel,1200897356675325953,2019-11-30 22:00:16,"b""Discover how the world's most remarkable superstructures are built. \xf0\x9f\x8f\x97\xf0\x9f\x8f\x9f\n\nWatch full episodes of #BuildingGiants NOW\xe2\x80\xa6 https://t.co/FeXGSh2CIn"""
ScienceChannel,1200867091127029760,2019-11-30 20:00:00,b'This is the largest acid lake on Earth and it can reduce flesh to bone in just hours. \xe2\x98\xa0\xef\xb8\x8f\xf0\x9f\x98\xb2\n\nWant more? Watch\xe2\x80\xa6 https://t.co/8mlL61QZNR'
ScienceChannel,1200821945773838339,2019-11-30 17:00:36,b'Down the volcano we go to the acidic crater lake below. \xf0\x9f\x8c\x8b\n\n#DiscoverGlobe \xf0\x9f\x8c\x8f \xf0\x9f\x8e\xa5 by Andr\xc3\xa9s Aguilera (@AndriuFPV) https://t.co/aK3ufwRGOA'
ScienceChannel,1200821795860795392,2019-11-30 17:00:00,"b'A top-secret mission, an unbreakable code, and a murder\xe2\x80\xa6 Here\xe2\x80\x99s what you didn\xe2\x80\x99t know about the historic Lewis and C\xe2\x80\xa6 https://t.co/9Tjo81lQkb'"
ScienceChannel,1200791593667706880,2019-11-30 15:00:00,"b'Fish, sea jellies, divers... The submerged intake pipes to this nuclear power plant can be deadly.\xe2\x98\xa2\xef\xb8\x8f\n\nWatch\xe2\x80\xa6 https://t.co/8uv74bR2ed'"
ScienceChannel,1200534902380335105,2019-11-29 22:00:00,"b'Uncover the secrets of the Kingdom of Kush. \xf0\x9f\x8f\x9c\n\nWatch the Science Channel special, Lost Kingdom of the Black Pharaoh\xe2\x80\xa6 https://t.co/lYq2BzcT05'"
ScienceChannel,1200504707619274752,2019-11-29 20:00:01,b'Can you imagine being trusted with the power to unleash Armageddon on the world?\xf0\x9f\x9a\x80\xf0\x9f\x8c\x8e\n\nWant more? Watch full episodes\xe2\x80\xa6 https://t.co/tPPjGe4b5o'
ScienceChannel,1200474660753887234,2019-11-29 18:00:37,b'We met this slug in the woods while foraging for mushrooms this #FungusFriday \xf0\x9f\x8d\x84. His name is Fred. Fred isn\xe2\x80\x99t much\xe2\x80\xa6 https://t.co/rAHk9q0cYc'
ScienceChannel,1200459407961677824,2019-11-29 17:00:00,b'The Department of Justice dubbed this prison as one of the most violent in the U.S.\xf0\x9f\x98\xb1\xf0\x9f\x87\xba\xf0\x9f\x87\xb8\n\nWant more? Watch\xe2\x80\xa6 https://t.co/wkQuskpKW5'
ScienceChannel,1200429210613014528,2019-11-29 15:00:01,b'A revolutionary dream turned nightmare. \xf0\x9f\x8f\x9a\n\nWatch #MysteriesoftheAbandoned NOW on SCI Go. --&gt; https://t.co/dJxEj5SlO5 https://t.co/lKYasVzZFR'
ScienceChannel,1200187635861458946,2019-11-28 23:00:05,b'A simple miscalculation may have caused a catastrophic flood. \xf0\x9f\x8c\x8a\n\nWatch full episodes of #EngineeringCatastrophes on\xe2\x80\xa6 https://t.co/dKUk3NPsku'
ScienceChannel,1200157466505428994,2019-11-28 21:00:12,"b'Chernobyl, Deep Water Horizon, the space shuttle Challenger... These disasters changed the course of history. \n\nWat\xe2\x80\xa6 https://t.co/IDvlYp2iig'"
ScienceChannel,1200097023036289024,2019-11-28 17:00:01,b'Welcome to the only extreme subterranean bike route in the world. \xf0\x9f\x9a\xb5\xe2\x80\x8d\xe2\x99\x82\xef\xb8\x8f\n\nWatch #UndergroundMarvels NOW on\xe2\x80\xa6 https://t.co/EfRSLQU7tB'
ScienceChannel,1200067002632683527,2019-11-28 15:00:44,b'Are the rumors that Turkey meat makes you sleepy true? #Science says no. Your carb-heavy side dishes and alcohol co\xe2\x80\xa6 https://t.co/ooZVW3tfhc'
ScienceChannel,1199840566558769152,2019-11-28 00:00:57,"b'Mt. Rushmore\xe2\x80\x99s Grand Hall was to be a magnificent symbol of the United States, but it remains unfinished. \xe2\x9b\xb0\n\nWatch\xe2\x80\xa6 https://t.co/KcHOHw1o83'"
ScienceChannel,1199810126439280640,2019-11-27 22:00:00,b'The civilization of the Kush \xe2\x80\x94 rulers of the largest empire the Nile Valley has ever seen.\xf0\x9f\x8f\x9c\n\nWatch the\xe2\x80\xa6 https://t.co/IWcEeN7ofE'
ScienceChannel,1199795172718059521,2019-11-27 21:00:34,b'.@MarkRober and @MrBeastYT host a global event for change! \xf0\x9f\x8c\xb3\n\nDon\xe2\x80\x99t miss the #TeamTrees watch-and-plant event Tuesd\xe2\x80\xa6 https://t.co/3uLfGKJI79'
ScienceChannel,1199779931468771328,2019-11-27 20:00:01,b'Could a simple miscalculation be to blame? \xf0\x9f\x8c\x89\n\nWatch #EngineeringCatastrophes NOW on SCI Go--&gt;\xe2\x80\xa6 https://t.co/NuAwfbjZWb'
ScienceChannel,1199764888454873092,2019-11-27 19:00:14,"b""The turkey isn't the reason your Thanksgiving celebration turns into a mellow snooze-fest. \xf0\x9f\xa6\x83 https://t.co/ZcsL4vVrPR"""
ScienceChannel,1199750438662348802,2019-11-27 18:02:49,b'Eat enough for Thanksgiving and you can regurgitate-feed your fledgling too. #HappyThanksgiving\n\n#WildlifeWednesday\xe2\x80\xa6 https://t.co/3uNX6zCFVr'
ScienceChannel,1199734630464794625,2019-11-27 17:00:00,"b'April 20, 2010 \xe2\x80\x94 The largest environmental disaster in U.S. history, Deep Water Horizon.\xf0\x9f\x94\xa5\xf0\x9f\x9b\xa2\n\nWatch\xe2\x80\xa6 https://t.co/8FPTKCxMvJ'"
ScienceChannel,1199447740125765632,2019-11-26 22:00:00,b'The civilization of the Kush \xe2\x80\x94 rulers of the largest empire the Nile Valley has ever seen.\xf0\x9f\x8f\x9c\n\nWatch the\xe2\x80\xa6 https://t.co/UEgnvzFS0j'
ScienceChannel,1199387696881446917,2019-11-26 18:01:25,"b""Wouldn't you rather be here? \xf0\x9f\x8c\x8a The week of #Thanksgiving is one of busiest holidays of the year when it comes to tr\xe2\x80\xa6 https://t.co/EcqR736Gte"""
ScienceChannel,1199191047189889024,2019-11-26 05:00:00,"b""Was the legend of Troy's demise real? Skeletal remains and charred ruins are linking mythology to history. \xf0\x9f\x92\x80\xf0\x9f\x94\xa5\n\nWatc\xe2\x80\xa6 https://t.co/Jz9IWFlpde"""
ScienceChannel,1199055154009522177,2019-11-25 20:00:00,b'Did the Knights Templar arrive in North America 100 years before Columbus? Archeological evidence suggests they did\xe2\x80\xa6 https://t.co/tj2bSItKys'
ScienceChannel,1199055153451679744,2019-11-25 20:00:00,b'To survive in this Universe we need an insurance policy. \xf0\x9f\x8c\x8e\xf0\x9f\x8c\x8f\n\nWatch full episodes of #HowtheUniverseWorks only on\xe2\x80\xa6 https://t.co/1iLeqv2xOj'
ScienceChannel,1199026549594435584,2019-11-25 18:06:20,b'It\xe2\x80\x99s a water bear #Thanksgiving! Aunt Susie is talking about how she was in a cryptobiotic state for decades and Gr\xe2\x80\xa6 https://t.co/IG967SCrEs'
ScienceChannel,1199009858386714629,2019-11-25 17:00:01,b'Did the Knights Templar arrive in North America a century before Columbus? Archeological evidence suggests they did\xe2\x80\xa6 https://t.co/KF838cb7pt'
ScienceChannel,1198977422701551616,2019-11-25 14:51:08,b'The eruption of Mt. Vesuvius carbonized Herculaneum \xe2\x80\x94 leaving the town almost perfectly preserved.\xf0\x9f\x8f\x9b\n\nClick below to\xe2\x80\xa6 https://t.co/nadxt13gjy'
ScienceChannel,1198692764201799681,2019-11-24 20:00:00,"b'For @Justin_Fornal and @EmilianoRuprah when it comes to traveling, field samples always trump memories.\xf0\x9f\x97\xba\n\nWatch an\xe2\x80\xa6 https://t.co/rpbHpMQ7cO'"
ScienceChannel,1198662567536799745,2019-11-24 18:00:00,b'The original layout for Mt. Rushmore was drastically different. \xe2\x9b\xb0\n\nWatch a new episode of #Unearthed tonight at 9p\xe2\x80\xa6 https://t.co/7dFzKJlUR6'
ScienceChannel,1198636407926988801,2019-11-24 16:16:03,"b'The sidewinder possesses a weaker venom than many other rattlesnakes, but a bite from any rattlesnake can be fatal\xe2\x80\xa6 https://t.co/vFhmDYpvpj'"
ScienceChannel,1198635155683983361,2019-11-24 16:11:05,b'Slithering across the desert region of the southwestern United States is a venomous pit viper species belonging to\xe2\x80\xa6 https://t.co/TK5VHctVlG'
ScienceChannel,1198375713054834688,2019-11-23 23:00:09,b'How does an island the size of Manhattan vanish without trace?\n\nWatch full episodes of #WhatonEarth NOW on SCIgo. https://t.co/ljRzr2xDcv'
ScienceChannel,1198345478544543746,2019-11-23 21:00:00,b'A revolutionary dream turned nightmare. \xf0\x9f\x8f\x9a\n\nWatch full episodes of #MysteriesoftheAbandoned NOW on SCIgo.\xe2\x80\xa6 https://t.co/j61AP9zHHw'
ScienceChannel,1198307727266574336,2019-11-23 18:30:00,b'Did the Knights Templar arrive in North American 100 years before Columbus? Archeological evidence suggests they di\xe2\x80\xa6 https://t.co/4hf3h8wSNS'
ScienceChannel,1198300316837597185,2019-11-23 18:00:33,"b'Welcome to the Fly Geyser in Washoe County, #Nevada. The geyser draws heat from a very deep pool of hot rock where\xe2\x80\xa6 https://t.co/4F08kEjcmo'"
ScienceChannel,1198277226900406272,2019-11-23 16:28:48,b'In geologic terms \xe2\x80\x94 Mexico City is in free fall.\xf0\x9f\x98\xb0\n\nWatch full episodes of #WhatonEarth NOW on SCIgo.\xe2\x80\xa6 https://t.co/xZfWvXTrv6'
ScienceChannel,1198005993495552009,2019-11-22 22:31:01,b'Scientists finally have the opportunity to probe deep beneath the surface of Mars! https://t.co/3HcRQc5IhU'
ScienceChannel,1197986966987563008,2019-11-22 21:15:25,b'Imagine spending a night at the Trans-Allegheny Lunatic Asylum? \xf0\x9f\x8f\xa5\n\nWatch a new episode of #MysteriesoftheAbandoned\xe2\x80\xa6 https://t.co/fWE7Iq0zGc'
ScienceChannel,1197941857998823426,2019-11-22 18:16:10,"b""You can have your fungus and draw on it too. This Artist's Conk is the perfect medium for sketching.\xe2\x80\xa6 https://t.co/XEpKuqBh8v"""
ScienceChannel,1197909233959931904,2019-11-22 16:06:32,b'This village launched one of the deadliest campaigns of guerilla warfare in all of World War II.\n\nWatch a new episo\xe2\x80\xa6 https://t.co/sDH3aUjrl0'
ScienceChannel,1197900094898655233,2019-11-22 15:30:13,b'Extreme sports have found a subterranean home. \xf0\x9f\x9a\xb5\xe2\x80\x8d\xe2\x99\x82\xef\xb8\x8f \xf0\x9f\x9b\xb6\n\nClick below to watch full episodes of #UndergroundMarvels on\xe2\x80\xa6 https://t.co/0T4caff9Nl'
ScienceChannel,1197635853113319425,2019-11-21 22:00:13,b'A simple miscalculation may have caused a catastrophic flood. \xf0\x9f\x8c\x8a\n\nWatch full episodes of #EngineeringCatastrophes on\xe2\x80\xa6 https://t.co/wwWIfK4MoH'
ScienceChannel,1197605601616023553,2019-11-21 20:00:00,b'The Space Shuttle Challenger disaster changed the course of space exploration forever. \n\nClick below to watch full\xe2\x80\xa6 https://t.co/WZAsZusLrw'
ScienceChannel,1197585401235554304,2019-11-21 18:39:44,"b'Blue Angels is a flight demonstration squadron for the United States Navy originally formed in 1946. Currently, the\xe2\x80\xa6 https://t.co/2AT5rCWFGb'"
ScienceChannel,1197522805216235520,2019-11-21 14:31:00,b'These atomic bunkers could house several thousand people in the event of a nuclear attack.\xe2\x98\xa2\xef\xb8\x8f\n\nWatch a new episode o\xe2\x80\xa6 https://t.co/NOUzBF5o3C'
ScienceChannel,1197273413468819457,2019-11-20 22:00:00,"b""Was the legend Troy's demise real? Skeletal remains and charred ruins are linking mythology to history. \xf0\x9f\x92\x80\xf0\x9f\x94\xa5\n\nWatch f\xe2\x80\xa6 https://t.co/BYTTsU5xWW"""
ScienceChannel,1197253277882163201,2019-11-20 20:39:59,"b'Boston\xe2\x80\x99s Big Dig was an engineering catastrophe even before this deadly event, said every New York Yankees fan ever\xe2\x80\xa6 https://t.co/Xc2WPqosqP'"
ScienceChannel,1197219084087283712,2019-11-20 18:24:07,"b""What happens #underthesea stays under the sea.\xf0\x9f\x8c\x8a First, we have a male cuttlefish flushing another male's sperm out\xe2\x80\xa6 https://t.co/rOLhyKEBbd"""
ScienceChannel,1197182820281511936,2019-11-20 16:00:01,b'Nobody expected the levies to fail. \xe2\x9b\x88\xf0\x9f\x8c\x8a #HurricaneKatrina\n\nWatch a new episode of #DeadlyEngineering tonight at 10p\xe2\x80\xa6 https://t.co/hNgKuOKp6l'
ScienceChannel,1196919538085957632,2019-11-19 22:33:50,b'More than 15 million trees have been planted.\xf0\x9f\x8c\xb2 Are you going to get in on the action?\xf0\x9f\x98\xae\xf0\x9f\x8c\xb3\n\nWatch #TeamTrees now on Di\xe2\x80\xa6 https://t.co/iJjhwIYxGX'
ScienceChannel,1196913892385013765,2019-11-19 22:11:24,b'BOOM. \xf0\x9f\x92\xa5  https://t.co/nE5Y6U7wYy'
ScienceChannel,1196893797810163714,2019-11-19 20:51:33,"b""Who wouldn't want to discover the Lost Dutchman's treasure rumored to be worth $200-million? \xf0\x9f\x92\xb0\n\nWatch full episodes\xe2\x80\xa6 https://t.co/KSgDeKgqKW"""
ScienceChannel,1196856046607843328,2019-11-19 18:21:32,"b'Here we have a couple Sunflower Sea Stars using their 15,000 tube feet to move at a blazing speed speed of 3.3ft/mi\xe2\x80\xa6 https://t.co/12qRhqKr9w'"
ScienceChannel,1196838149617541121,2019-11-19 17:10:25,b'110 miles from London stands a massive structure with a veiled history and surreptitious purpose. \xf0\x9f\x8f\x9b\n\nWatch full epi\xe2\x80\xa6 https://t.co/7DRGOdOl6w'
ScienceChannel,1196806163591024648,2019-11-19 15:03:19,b'Why is this town lying at the bottom of the sea?\xf0\x9f\x8f\x9b\n\nWatch full episodes of #Unearthed only on Science Channel and SC\xe2\x80\xa6 https://t.co/kDRV9LJ8pw'
ScienceChannel,1196548637909753858,2019-11-18 22:00:00,b'This ancient city was erased from history.\xf0\x9f\x92\x80 \n\nWatch full episodes of #Unearthed NOW on SCI Go.'
ScienceChannel,1196518439143297024,2019-11-18 20:00:00,b'A supernova \xe2\x81\xa0\xe2\x80\x94 the greatest show in the known universe.\xf0\x9f\x92\xa5\xf0\x9f\x91\x80\n\nWatch full episodes of #HowTheUniverseWorks NOW on SCIgo\xe2\x80\xa6 https://t.co/7z7wiy0UfM'
ScienceChannel,1196495788978974721,2019-11-18 18:30:00,b'Would you look at this \xf0\x9f\x92\xa9! Gastrotrichs are worm-like animals abundant in freshwater and marine habitats. With \xf0\x9f\x92\xa9 lik\xe2\x80\xa6 https://t.co/iTUJMqs8dk'
ScienceChannel,1196473255047118848,2019-11-18 17:00:28,"b""The hunt is on for the Lost Dutchman's treasure.\xf0\x9f\x92\xb0\xf0\x9f\x97\xba\n\nWatch an all new episode of UNEXPLAINED AND UNEXPLORED now on S\xe2\x80\xa6 https://t.co/fZZ5hfGBbK"""
ScienceChannel,1196450549996171264,2019-11-18 15:30:14,b'Has the legendary lost city of Troy been rediscovered?\xf0\x9f\x90\xb4\xf0\x9f\x97\xba\n\nFind out on an all new episode of UNEARTHED available NOW\xe2\x80\xa6 https://t.co/PBFBa1CiJq'
ScienceChannel,1196261746991943680,2019-11-18 03:00:00,"b""@Justin_Fornal and @EmilianoRuprah are on a mission to find the Lost Dutchman's Mine \xe2\x80\x94 from the air.\xf0\x9f\x9a\x81\n\nWatch an all\xe2\x80\xa6 https://t.co/9fIjCPGvqQ"""
ScienceChannel,1196156049256001536,2019-11-17 20:00:00,"b""If you happen to die in the desert, you'll be preserved for years to come.\xf0\x9f\x92\x80\xf0\x9f\x8c\xb5\n\nWatch an all new episode of UNEXPLAIN\xe2\x80\xa6 https://t.co/XickAFhZo9"""
ScienceChannel,1196125852775452675,2019-11-17 18:00:00,b'Have experts discovered the infamous city of Troy? \xf0\x9f\x90\xb4\n\nWatch a new episode of #Unearthed tonight at 9p ET only on\xe2\x80\xa6 https://t.co/OASBPHeiUt'
ScienceChannel,1196096019311857664,2019-11-17 16:01:28,b'Having trouble getting out of your egg today? So is this Nile #Crocodile. The only difference is this Crocodylus Ni\xe2\x80\xa6 https://t.co/m48aaDn1ft'
ScienceChannel,1195763710075248640,2019-11-16 18:00:59,"b'Ah, the Flamingo, such social creatures. This group is in the middle of a courtship display that includes some pret\xe2\x80\xa6 https://t.co/CYc0mGc7nv'"
ScienceChannel,1195748366476398592,2019-11-16 17:00:01,"b'A lost mine \xe2\x9b\x8f,  a hidden treasure\xf0\x9f\x92\xb0, and a stunning view\xf0\x9f\x8f\x9c...\n\nWatch new episodes of UNEXPLAINED AND UNEXPLORED Sunda\xe2\x80\xa6 https://t.co/ZOxZUx4sut'"
ScienceChannel,1195539092269928449,2019-11-16 03:08:26,"b'RT @curiositydotcom: On today\'s podcast, explorers @Justin_Fornal and @EmilianoRuprah from @ScienceChannel\'s brand-new series ""Unexplained\xe2\x80\xa6'"
ScienceChannel,1195461474761633792,2019-11-15 22:00:00,b'Even this innovative engineering solution couldn\xe2\x80\x99t save these miners. \xf0\x9f\x8f\x94\n\nWatch full episodes of\xe2\x80\xa6 https://t.co/yo5AbtMVKe'
ScienceChannel,1195433371343687680,2019-11-15 20:08:20,b'The West Virginia Penitentiary was one of the most violent prisons in the US. \n\nWant more? Watch\xe2\x80\xa6 https://t.co/X1iE5dyKuK'
ScienceChannel,1195403614677807105,2019-11-15 18:10:05,"b""We're shaking things up this #FungusFriday \xf0\x9f\x8d\x84 with some Leafy Brain Fungus, a.k.a. Tremella foliacea. This is a spec\xe2\x80\xa6 https://t.co/zqMwsFTMUF"""
ScienceChannel,1195346003173527554,2019-11-15 14:21:10,b'RT @Discovery: More than 15 million trees have been planted.\xf0\x9f\x8c\xb2 Are you going to get in on the action?\xf0\x9f\x98\xae\xf0\x9f\x8c\xb3\n\nWatch #TeamTrees now on Discovery G\xe2\x80\xa6'
