ScienceChannel,1152322300580175875,2019-07-19 21:00:20,"b""The world's most dangerous threats are in top-secret locations all over the planet. \xf0\x9f\x8c\x8e\n\nWatch full episodes of\xe2\x80\xa6 https://t.co/2GWOyRSepx"""
ScienceChannel,1152262071490424832,2019-07-19 17:01:00,"b""Happy #FungusFriday! Unlike plants, molds don't grow from seeds, they grow from tiny spores that float around in th\xe2\x80\xa6 https://t.co/pqaO292DYj"""
ScienceChannel,1152217879548518402,2019-07-19 14:05:24,b'Leaving Tranquility Bay \xf0\x9f\x8c\x95 \xf0\x9f\x9a\x80 #NASA #Apollo50th #Apollo #Science \n\nWatch Apollo: The Forgotten Films Sunday at 8p ET\xe2\x80\xa6 https://t.co/KuR5uzXp2x'
ScienceChannel,1151955396816441344,2019-07-18 20:42:23,b'RT @ForrestGalante: @EPWGOP &amp; @EPWDems will hold a hearing to establish a new grant for reducing human-predator conflict. I will be represe\xe2\x80\xa6'
ScienceChannel,1151899580763705345,2019-07-18 17:00:35,"b""According to NASA's astronauts, the most beautiful thing in the world is \xe2\x80\x94 the Earth. \xf0\x9f\x8c\x8e\xf0\x9f\x9b\xb0 #NASA #Apollo50th https://t.co/KnxPrTVdob"""
ScienceChannel,1151884337769537536,2019-07-18 16:00:01,b'Did an earthquake unleash a never before seen prehistoric Japanese sea monster? \xf0\x9f\x8c\x8a\xf0\x9f\x90\x8a\n\nWatch new episodes of\xe2\x80\xa6 https://t.co/0uxCHAP7Vn'
ScienceChannel,1151854134976503809,2019-07-18 14:00:00,b'Welcome to the end of the Earth. \xf0\x9f\x97\xba \xf0\x9f\x92\xa8\xe2\x9d\x84\xef\xb8\x8f\n \nWatch new episodes of #WhatonEarth Thursdays at 10p ET on @ScienceChannel\xe2\x80\xa6 https://t.co/iY6gMWSKd8'
ScienceChannel,1151597510940663808,2019-07-17 21:00:16,b'MORE POWER! Watch #SavageBuilds on @ScienceChannel and on SCIgo. https://t.co/ONnqyohB7e'
ScienceChannel,1151573229271703552,2019-07-17 19:23:47,b'To the Moon and back. \xf0\x9f\x8c\x8e The countdown begins. \xe2\x8f\xb3\xf0\x9f\x8c\x95 #science #Apollo50th #Apollo #NASA https://t.co/GYzfE3lHIr'
ScienceChannel,1151537377300688897,2019-07-17 17:01:19,b'Walk into Wednesday with the Velvet Worm. \xf0\x9f\x90\x9b The Onychophora shoots a white glue-like slime to ensnare its prey and\xe2\x80\xa6 https://t.co/T3yPsTinjJ'
ScienceChannel,1151526535989530630,2019-07-17 16:18:15,b'RT @donttrythis: Still ornery. #faceapp #faceappchallenge https://t.co/TNM4AdFFj1'
ScienceChannel,1151506846026539010,2019-07-17 15:00:00,"b'Here\'s how @donttrythis crafted ""space-caliber"" out of a meteorite? \xf0\x9f\x94\xa5\xf0\x9f\x97\xa1 \n\nWatch new episodes of #SavageBuilds Wednes\xe2\x80\xa6 https://t.co/w8AYCje2P7'"
ScienceChannel,1151476648954355712,2019-07-17 13:00:01,b'Do robots burn? \xf0\x9f\x94\xa5\xf0\x9f\xa4\x96\n\nMore bots. More battles. Watch #BattleBots TONIGHT at 9p ET on @sciencechannel and on SCIgo. https://t.co/I0w8ddXTF0'
ScienceChannel,1151235187516280832,2019-07-16 21:00:32,"b'The Apollo 13 oxygen systems failed 200,000 miles away from the Earth. The lives of 3 astronauts hung in the balanc\xe2\x80\xa6 https://t.co/elWcZ08ECl'"
ScienceChannel,1151204859086921729,2019-07-16 19:00:01,b'Destination: The Moon \xf0\x9f\x9a\x80\xf0\x9f\x8c\x95 #Apollo50th #Apollo #NASA https://t.co/5oyo4D3FPr'
ScienceChannel,1151178990977245185,2019-07-16 17:17:13,"b'3. 2. 1. We have lift-off. 50 years ago today, Buzz Aldrin, Neil Armstrong, and Michael Collins began their histori\xe2\x80\xa6 https://t.co/NGHzIuQ8b9'"
ScienceChannel,1151133158789849088,2019-07-16 14:15:06,"b""Cranes, helicopters, excavators... What would it take to build Egypt's Great Pyramid today? \xf0\x9f\x8f\x97\n \nWatch the series pr\xe2\x80\xa6 https://t.co/YK5OkRtBfQ"""
ScienceChannel,1150903028779819009,2019-07-15 23:00:39,"b""Discover planets with problems you couldn't imagine. \xf0\x9f\x8c\x91\xf0\x9f\x9b\xb0 \n\nWatch new episodes of #HowtheUniverseWorks on SCIgo.\n\nhttps://t.co/tRHQg7AM36"""
ScienceChannel,1150887766080794632,2019-07-15 22:00:00,b'Get ready to take flight! \xf0\x9f\x9a\x80\xf0\x9f\x8c\x95\n\nWatch a new episode of Mysteries of Apollo TONIGHT at 10p ET on @ScienceChannel and o\xe2\x80\xa6 https://t.co/YHRimOYlgQ'
ScienceChannel,1150852045416648705,2019-07-15 19:38:04,"b""@donttrythis don't blow up the birthday cake! \xf0\x9f\x92\xa5\xf0\x9f\xa4\xaf \n\nHAPPY BIRTHDAY!! \xf0\x9f\x8e\x82 https://t.co/1TrNpidTrZ"""
ScienceChannel,1150812418802671616,2019-07-15 17:00:36,"b'Struggling to get out of your egg today? The South Korean water bug lays 30 to 40 eggs every summer. However, these\xe2\x80\xa6 https://t.co/qLyYPbPId2'"
ScienceChannel,1150790895786180609,2019-07-15 15:35:04,b'50 years ago we made history landing on the Moon. \xf0\x9f\x9a\x80\xf0\x9f\x8c\x95 Today people question if it happened. \xf0\x9f\x8e\xa5\xf0\x9f\x8c\x91 Here is what we know.\xe2\x80\xa6 https://t.co/Ul4HeXIXon'
ScienceChannel,1150450009894268928,2019-07-14 17:00:31,"b'Comment if you yawned. \xe2\x9c\x8b Yawning is a natural response to fatigue, but contagious yawning may be explained by empat\xe2\x80\xa6 https://t.co/fkmiQ8N98c'"
ScienceChannel,1150404582792683522,2019-07-14 14:00:00,b'An architectural wonder. A lost pyramid. The secrets of an ancient civilization unearthed. \n\nCatch the season premi\xe2\x80\xa6 https://t.co/Xtx5wdACiZ'
ScienceChannel,1150223387165364226,2019-07-14 02:00:00,b'Beautiful. Peaceful. Deadly. The largest acid lake on Earth can reduce flesh to bare bones in just hours. \xe2\x98\xa0\xef\xb8\x8f\xf0\x9f\x98\xb2 Watch\xe2\x80\xa6 https://t.co/JToWahoqwK'
ScienceChannel,1150117693321818115,2019-07-13 19:00:00,b'Drugs. Money. Secrecy. Welcome to the arcane ruins of Hacienda La Manuelf. An inside look at the life and legacy of\xe2\x80\xa6 https://t.co/XUzaN6CgU1'
ScienceChannel,1150087610183954432,2019-07-13 17:00:28,b'Ready for another #WeekendGetaway? The Sanctuary of Madonna della Corona was built in 1625 into a vertical cliff fa\xe2\x80\xa6 https://t.co/VUG9ECjgN4'
ScienceChannel,1149785578092814337,2019-07-12 21:00:18,b'Sinister Things are happening on #StrangeEvidence watch NOW on SCIgo. https://t.co/pyNxbhBisM'
ScienceChannel,1149755366961491969,2019-07-12 19:00:15,"b""What are the Russians hiding? This Russian ship's disappearing act raises serious questions. Watch new episodes of\xe2\x80\xa6 https://t.co/HgCpM8QfMD"""
ScienceChannel,1149725254597730305,2019-07-12 17:00:36,b'Slide into the weekend with #FungusFriday! Dog vomit slime mold (Fuligo septica) is a member of the Myxomycetes cla\xe2\x80\xa6 https://t.co/uiSk2JsiGw'
ScienceChannel,1149714642006134785,2019-07-12 16:18:25,b'We have taken another giant leap into the Universe. The Hayabusa2 spacecraft performed the 2nd touchdown on the sur\xe2\x80\xa6 https://t.co/btL6hMurId'
ScienceChannel,1149679807938138116,2019-07-12 14:00:00,"b'Have we discovered the ""screaming mummy\'s"" true identity? \n\nFind out this and more by watching #EgyptsUnexplained S\xe2\x80\xa6 https://t.co/RdByExNMRb'"
ScienceChannel,1149471668449894402,2019-07-12 00:12:56,b'RT @MythBusters: Inspiration. \xf0\x9f\x92\xa1 Imagination. \xf0\x9f\x92\xad Explosions. \xf0\x9f\xa4\xaf @donttrythis discusses it all with @wyattcenac at @92Y. https://t.co/HBjYB0papF'
ScienceChannel,1149423182627164160,2019-07-11 21:00:16,b'MORE POWER! Watch #SavageBuilds on @ScienceChannel and on SCIgo. https://t.co/M0dPXhg8yX'
ScienceChannel,1149413603512127490,2019-07-11 20:22:12,b'\xf0\x9f\x8e\x99ARE YOU READY! \xf0\x9f\x9a\xa6\xf0\x9f\xa4\x96 Watch #BattleBots online now. https://t.co/37vSYwFdz0'
ScienceChannel,1149370393519697925,2019-07-11 17:30:30,b'Processing leather generates an enormous amount of waste: 250-300kg of leather leaves 600kg of waste. Researchers a\xe2\x80\xa6 https://t.co/DH6ENoC3Vh'
ScienceChannel,1149347621921808389,2019-07-11 16:00:01,b'A prehistoric discovery unlike anything you have ever seen.  \xf0\x9f\xa6\x96 #jurassicworld\n\nFind out more on an all new episode\xe2\x80\xa6 https://t.co/3oLlMOHLpa'
ScienceChannel,1149316931473874945,2019-07-11 13:58:04,b'Have we unearthed the answer to establishing colonies across the solar system? \xf0\x9f\x8c\x95Watch new episodes of #WhatonEarth\xe2\x80\xa6 https://t.co/0LkT8kUxPo'
ScienceChannel,1149060827191881728,2019-07-10 21:00:24,"b""Witness a mystery millions of years in the making. A comet's odyssey through the Universe. \xe2\x98\x84 Watch new episodes of\xe2\x80\xa6 https://t.co/AkZ0tVkiBl"""
ScienceChannel,1149038765710675970,2019-07-10 19:32:44,b'Get ready for lift-off. \xf0\x9f\x9a\x80\n\nWatch new episodes of #MysteriesofApollo on SCIgo. https://t.co/MVu3kwro8F'
ScienceChannel,1149000485384413184,2019-07-10 17:00:37,"b'Lithobius forficatus, aka the brown centipede, grows between 18 and 30 mm long. The 100 legged myriapod lives in to\xe2\x80\xa6 https://t.co/KAr6p4bYPa'"
ScienceChannel,1148985232588267521,2019-07-10 16:00:01,"b'In a #MadMax melee, what would be your weapon of choice?\xf0\x9f\x92\xa5\xe2\x98\xa0\xef\xb8\x8f\n\n@donttrythis goes head-to-head with builders\xe2\x80\xa6 https://t.co/h9f3pd8qkZ'"
ScienceChannel,1148956288459690002,2019-07-10 14:05:00,b'The carnage continues -- courtesy of Tombstone. \xf0\x9f\x92\x80\n\nWatch new episodes of #BattleBots Wednesday at 9p on\xe2\x80\xa6 https://t.co/onuakJYzb4'
ScienceChannel,1148698432867094532,2019-07-09 21:00:22,"b""Is there anything Adam Savage cant build?\xf0\x9f\x9b\xa0\n\nMissed an episode of #SavageBuilds? We've got you covered. Watch full e\xe2\x80\xa6 https://t.co/Y6DChzvkOO"""
ScienceChannel,1148677020932612098,2019-07-09 19:35:17,"b'Devastating mega-earthquakes, massive tsunamis\xe2\x80\xa6 Tectonic stress is building. #WhatOnEarth https://t.co/bF0xBTmgSu https://t.co/Pr2Q0eXDIr'"
ScienceChannel,1148638085753769984,2019-07-09 17:00:34,"b'Is California on the verge of a massive #earthquake? Though the threat of the ""Big One"" is always looming,\xe2\x80\xa6 https://t.co/8zAHgSLtM0'"
ScienceChannel,1148622943422963712,2019-07-09 16:00:24,"b'Haunting mansions, forgotten industrial relics, ruins on verge of collapse... These abandoned locales are as beauti\xe2\x80\xa6 https://t.co/FSXH0Bqgmt'"
ScienceChannel,1148335951363489792,2019-07-08 21:00:00,"b'16 astronauts, 10 manned-missions, one goal: To put a man on the moon. #ProjectGemini\n\nWatch #MysteriesofApollo Mon\xe2\x80\xa6 https://t.co/xZDCdXLWuk'"
ScienceChannel,1148305825846444032,2019-07-08 19:00:18,"b'They threaten our survival, but they could be the source of life on Earth.\xe2\x98\x84\xef\xb8\x8f#Comets\n\nWatch #HowtheUniverseWorks Mon\xe2\x80\xa6 https://t.co/Ofwf4y2lHD'"
ScienceChannel,1148275707983859712,2019-07-08 17:00:37,"b'The medical term for ""goosebumps"" is piloerection. These tiny elevations of the skin are caused by a contraction of\xe2\x80\xa6 https://t.co/Q8jJfMjr0K'"
ScienceChannel,1148249148086509568,2019-07-08 15:15:04,"b'A faulty lunar module, a near death experience, a government conspiracy... Did we actually land on the moon?\xe2\x80\xa6 https://t.co/3c3A1Ij8ER'"
ScienceChannel,1147917025488048129,2019-07-07 17:15:20,"b""This view of Sri Lanka's Nine Arch Bridge can cure any weary travelers'  blues. This colonial-era relic was constru\xe2\x80\xa6 https://t.co/7nafTXrHpP"""
ScienceChannel,1147611175347245056,2019-07-06 21:00:00,b'Strongly considering becoming a vegetarian.\xf0\x9f\xa5\x97\n\nWatch new episodes #StrangeEvidence now on SCIgo. --&gt;\xe2\x80\xa6 https://t.co/AAkxYXbIHF'
ScienceChannel,1147580977406980097,2019-07-06 19:00:00,b'Its the largest acid lake on Earth and it can reduce flesh to bare bones in just hours. \xe2\x98\xa0\xef\xb8\x8f\xf0\x9f\x98\xb2#WhatOnEarth https://t.co/ftmj2fH2RC'
ScienceChannel,1147505511694290946,2019-07-06 14:00:08,"b'Alien communications, a hidden mountain structure, a strange desert compound... Watch full episodes #WhatonEarth on\xe2\x80\xa6 https://t.co/rbQDMKwKOl'"
ScienceChannel,1147248838849134594,2019-07-05 21:00:12,"b""Watch an episode of #StrangeEvidence and tell us you're not at least a little bit freaked out. https://t.co/uCmGXkLr1R"""
ScienceChannel,1147218713483055106,2019-07-05 19:00:30,"b""Missed the season finale of #LegendsoftheDeep? We've got you covered. Watch full episodes online now. https://t.co/GGM0480OHu"""
ScienceChannel,1147143135832813570,2019-07-05 14:00:11,b'No robot is safe. Watch #BattleBots online now.\xf0\x9f\x94\xa5\xf0\x9f\xa4\x96https://t.co/18ToDgfKoH'
ScienceChannel,1146856202850189314,2019-07-04 19:00:00,"b'The Paris Catacombs hold the remains of approx. 2 million people, and you can tour them for just $40.\xf0\x9f\x92\x80\xf0\x9f\x92\x80\n\nWatch epis\xe2\x80\xa6 https://t.co/XM8UQ7Nz3L'"
ScienceChannel,1146826132865671168,2019-07-04 17:00:31,"b'If you swapped your eyes for an eagle\xe2\x80\x99s, you could see an ant crawling on the ground from the top of a 10-story bui\xe2\x80\xa6 https://t.co/ivLl86dfVT'"
ScienceChannel,1146780708943388674,2019-07-04 14:00:01,"b""This is where Eastern Europe's locomotives go to die.\xf0\x9f\x9a\x82\n\nWatch full episodes of #MysteriesoftheAbandoned now on SCIg\xe2\x80\xa6 https://t.co/xQAahUiKVi"""
ScienceChannel,1146493897847300097,2019-07-03 19:00:20,b'Is there anything Adam Savage cant build? \xf0\x9f\x9b\xa0\n\nWatch full episodes of #SavageBuilds? Watch the episode online now. https://t.co/F8ee4JAyzd'
ScienceChannel,1146463742105989122,2019-07-03 17:00:31,"b'Shed your mid-week blues! Cicadas, best known for their loud buzzing sound, can live  4-17 years. Unlike annual cic\xe2\x80\xa6 https://t.co/NS1eRoWjVi'"
ScienceChannel,1146448634415857666,2019-07-03 16:00:29,"b""Don't miss a moment of #BattleBots action! Watch full episodes online now (free).  https://t.co/0FsRRkYk0S"""
ScienceChannel,1146433420098228224,2019-07-03 15:00:01,"b""The training for NASA's space program was grueling. Given the opportunity, could you have made the cut?\xf0\x9f\x9a\x80\xf0\x9f\xa4\x94\n\nWatch ne\xe2\x80\xa6 https://t.co/GTL5ml0DyY"""
ScienceChannel,1146418554264334338,2019-07-03 14:00:57,"b'They threaten our survival, but they could be the source of life on Earth.\xe2\x98\x84\xef\xb8\x8f#Comets\n\nWatch #HowtheUniverseWorks Mon\xe2\x80\xa6 https://t.co/9DdZtAeOT4'"
ScienceChannel,1146212900056399872,2019-07-03 00:23:45,b'RT @Discovery: The Diamond Ring effect. \xf0\x9f\x92\x8e Did you get to watch the #eclipse as it happened? \n\n\xf0\x9f\x93\xb8 by Stan Honda https://t.co/OcDnTsay3O'
ScienceChannel,1146116327091793921,2019-07-02 18:00:00,"b'Behold, the kraken!\xf0\x9f\xa6\x91 #MythicalBeasts https://t.co/vXgLOOstw8'"
ScienceChannel,1146101411970727937,2019-07-02 17:00:44,"b'The term UFO, coined by the United States Air Force in 1953, is an acronym for Unidentified Flying Objects. So, whi\xe2\x80\xa6 https://t.co/EqoNqIuR00'"
ScienceChannel,1146071120547762180,2019-07-02 15:00:22,"b'Haunting mansions, forgotten industrial relics, ruins on verge of collapse... These abandoned locales are as beauti\xe2\x80\xa6 https://t.co/q3keIMlFXu'"
ScienceChannel,1146040831020638209,2019-07-02 13:00:01,b'Woolly Mammoth bones are literally falling out of this Siberian cliffside. \xf0\x9f\x98\xae https://t.co/cQ8FWCVnaB'
ScienceChannel,1145799300598943749,2019-07-01 21:00:15,"b'A faulty lunar module, a near death experience, a government conspiracy... Did we actually land on the moon?\xe2\x80\xa6 https://t.co/kDAT64uBt4'"
ScienceChannel,1145769112947367936,2019-07-01 19:00:18,"b'They threaten our survival, but they could be the source of life on Earth.\xe2\x98\x84\xef\xb8\x8f#Comets\n\nWatch #HowtheUniverseWorks Mon\xe2\x80\xa6 https://t.co/QWc8LcGVUm'"
ScienceChannel,1145750924440342530,2019-07-01 17:48:02,b'An estimated 8 million metric tons of plastic enter the ocean each year and entrepreneur Marshall Medoff may have a\xe2\x80\xa6 https://t.co/yaPINiWFmQ'
ScienceChannel,1145720439647416320,2019-07-01 15:46:53,b'Celine Cousteau and Fabien Cousteau are pushing beyond the barriers of the known.\xf0\x9f\x8c\x8a\n\nMissed the Season Finale of\xe2\x80\xa6 https://t.co/ipwQBPdilu'
ScienceChannel,1145376633714556928,2019-06-30 17:00:44,b'Rainbows are found when light from the Sun passes through raindrops. This causes the light to refract into seven di\xe2\x80\xa6 https://t.co/R8G3okAkox'
ScienceChannel,1145014250231992320,2019-06-29 17:00:45,"b'These lovely tulips were raised in well-drained, moist soil, an ideal condition for tulip-growing. With 150 species\xe2\x80\xa6 https://t.co/9q9VaTzo3P'"
ScienceChannel,1144712174700564480,2019-06-28 21:00:24,"b""Watch an episode of #StrangeEvidence and tell us you're not at least a little bit freaked out. https://t.co/3swoWFShVu"""
ScienceChannel,1144681873882304512,2019-06-28 19:00:00,b'Will @CelineCousteau and @FCousteau make it out of the haunted ship?\xf0\x9f\x91\xbb\xf0\x9f\x9a\xa2\n\nWatch the Season Finale of\xe2\x80\xa6 https://t.co/ooO08yg4Wt'
ScienceChannel,1144651809769873411,2019-06-28 17:00:32,"b'Pink oyster mushrooms are fast colonizers that grow in large bouquets. They are vibrantly pink, but whiten as they\xe2\x80\xa6 https://t.co/SjJsVXHW5d'"
ScienceChannel,1144637417762242564,2019-06-28 16:03:21,"b'Alien communications, a hidden mountain structure, a strange desert compound... Watch full episodes #WhatonEarth on\xe2\x80\xa6 https://t.co/WixvuF6N6c'"
ScienceChannel,1144428723917217793,2019-06-28 02:14:04,b'RT @Discovery: A rare giant squid has been found in US waters \xf0\x9f\x98\xa7\xf0\x9f\xa6\x91 https://t.co/SABYTitNSJ'
ScienceChannel,1144349685802422272,2019-06-27 21:00:00,b'This forgotten mine might be the home to more than just gold. \xf0\x9f\x91\xbb\n\nWatch an all new episode of #StrangeEvidence TONIG\xe2\x80\xa6 https://t.co/RZtaUuRAYp'
ScienceChannel,1144319541910155266,2019-06-27 19:00:13,"b""Don't miss a moment of #BattleBots action! Watch full episodes online now (free).  https://t.co/FuQwMK1PpN"""
ScienceChannel,1144289434805948418,2019-06-27 17:00:35,"b""Hot air balloons work because hot air rises - it's lighter than the cooler air outside - causing the balloon to flo\xe2\x80\xa6 https://t.co/RqAD3AJ7Jw"""
ScienceChannel,1144248486847832064,2019-06-27 14:17:53,b'Does silicone-based life really exist?\xf0\x9f\x91\xbd\n\nWatch new episodes of #WhatonEarth Thursdays at 10p ET on @ScienceChannel\xe2\x80\xa6 https://t.co/ecjc7WpWhR'
ScienceChannel,1143927092670861312,2019-06-26 17:00:46,b'Feeling scrambled today? We understand. The modern-day blender would not have come to life without the invention of\xe2\x80\xa6 https://t.co/EvWASe8W7m'
ScienceChannel,1143919349733851136,2019-06-26 16:30:00,"b'Two Adams are better than 1, right?\xf0\x9f\xa4\x94\n\nWatch new episodes of #SavageBuilds Wednesdays at 10p ET on @ScienceChannel a\xe2\x80\xa6 https://t.co/gFu4VeVx1H'"
ScienceChannel,1143893268947701760,2019-06-26 14:46:22,b'Take a walk through the robot garden of punishment with Bite Force + Yeti. \xf0\x9f\xa5\x80\xf0\x9f\xa4\x96\n\nWatch new episodes of #BattleBots We\xe2\x80\xa6 https://t.co/o22aR9nXA4'
ScienceChannel,1143598934302089216,2019-06-25 19:16:47,"b""The ruins of Pablo Escobar's infamous vacation house are still standing and YOU can tour them...\n\nWant more? Watch\xe2\x80\xa6 https://t.co/rXlQIJkHAx"""
ScienceChannel,1143564839002017792,2019-06-25 17:01:18,"b""Common in urban and suburban America, these Cabbageworms are extremely docile - they'll barely move to reach the ne\xe2\x80\xa6 https://t.co/xISTO9rEjR"""
ScienceChannel,1143528562496065536,2019-06-25 14:37:09,b'The #Apollo17 mission was the first time #NASA launched a spacecraft at night. How fitting for its final venture to\xe2\x80\xa6 https://t.co/mGL0BPBPEW'
ScienceChannel,1143247491984441344,2019-06-24 20:00:17,"b'A faulty lunar module, a near death experience, a government conspiracy... Did we actually land on the moon?\xe2\x80\xa6 https://t.co/mxezxB4djY'"
ScienceChannel,1143217266290507783,2019-06-24 18:00:10,"b'They threaten our survival, but they could be the source of life on Earth.\xe2\x98\x84\xef\xb8\x8f#Comets\n\nWatch #HowtheUniverseWorks Mon\xe2\x80\xa6 https://t.co/Lgb5Rn2C8c'"
ScienceChannel,1143202698575196160,2019-06-24 17:02:17,"b'While holding the record of the world\xe2\x80\x99s most visited waterfall, Niagara Falls is not the tallest or largest. Angel\xe2\x80\xa6 https://t.co/xMGNZEXpMJ'"
ScienceChannel,1143156824805445634,2019-06-24 14:00:00,b'A family that dives together thrives together.\xf0\x9f\x8c\x8a\n\nWatch full episodes of #LegendsoftheDeep online now. --&gt;\xe2\x80\xa6 https://t.co/9rep7AopJM'
ScienceChannel,1142957771219963904,2019-06-24 00:49:02,"b""Meet #SpongeBob's real-life best friend Patrick! Though starfish have no blood, they use filtered sea water to pump\xe2\x80\xa6 https://t.co/Wu1pIxI15f"""
ScienceChannel,1142869935372324864,2019-06-23 19:00:00,b'What if Apollo 11 never made it to the moon? \xf0\x9f\x9a\x80\xf0\x9f\x8c\x95\n\nWatch #TruthBehindtheMoon TONIGHT at 10p ET on @ScienceChannel and\xe2\x80\xa6 https://t.co/p7xCLEEYOo'
ScienceChannel,1142794436503429122,2019-06-23 14:00:00,b'@FCousteau and @RichardBranson descend into the abyss.\xf0\x9f\x8c\x8a\n\nWatch an all new episode of #LegendsoftheDeep TONIGHT at 9\xe2\x80\xa6 https://t.co/9HYsp2Rn2H'
ScienceChannel,1142537745262239744,2019-06-22 21:00:00,"b'So, the Ratan-600 telescope may have discovered signs of extraterrestrial life.\xf0\x9f\x91\xbe\n\nWatch all new episodes of\xe2\x80\xa6 https://t.co/en5XZKFv8w'"
ScienceChannel,1142432053549400064,2019-06-22 14:00:01,b'This now decommissioned drydock once produced a battleship in just 17 days.\n\nWatch #MysteriesoftheAbandoned now. --\xe2\x80\xa6 https://t.co/PAFXATAq4V'
ScienceChannel,1142245131426418688,2019-06-22 01:37:15,"b""If things go wrong, the dive team may end-up lost at sea.\xf0\x9f\x98\xaf\xf0\x9f\x8c\x8a\n\nMissed an episode of #LegendsoftheDeep? We've got you\xe2\x80\xa6 https://t.co/Q8mOGM3Op3"""
ScienceChannel,1142145204155244546,2019-06-21 19:00:11,"b""Watch an episode of #StrangeEvidence and tell us you're not at least a little bit freaked out. https://t.co/WX3gvOT6P2"""
ScienceChannel,1142115266354143237,2019-06-21 17:01:13,"b""Mushrooms don\xe2\x80\x99t just give #Mario power-ups, they'll give you one too. Studies suggest mushrooms can be useful as an\xe2\x80\xa6 https://t.co/y0qySu1RNs"""
ScienceChannel,1142069711485788170,2019-06-21 14:00:12,"b""The world's most dangerous threats are in top-secret locations all over the planet. \xf0\x9f\x8c\x8e\n\nWatch full episodes of\xe2\x80\xa6 https://t.co/NtLiJNhrSI"""
ScienceChannel,1141812969354883072,2019-06-20 21:00:00,"b'Wormholes: Just a theory, or a much scarier reality?\xf0\x9f\x98\xb1Find out TONIGHT at 9p ET on an all new episode of\xe2\x80\xa6 https://t.co/5g1RqKufN3'"
ScienceChannel,1141782830198001668,2019-06-20 19:00:14,"b""Don't miss a moment of #BattleBots action! Watch full episodes online now (free).  https://t.co/OitO89PTJO"""
ScienceChannel,1141755665171529728,2019-06-20 17:12:18,b'Missed the @ScienceChannel premiere of #SavageBuilds? Watch the episode online now. https://t.co/OxrwgBMPwF'
ScienceChannel,1141707275771494400,2019-06-20 14:00:01,"b'Avengers may have ended, but the legend of #Thor lives on. \xf0\x9f\x94\xa8\xe2\x9a\xa1\xef\xb8\x8f#AvengersEndgame\n\nWatch a new episode of #WhatonEarth\xe2\x80\xa6 https://t.co/OHJcjHP9BG'"
ScienceChannel,1141533628003864576,2019-06-20 02:30:00,"b""Can't get enough of @Donttrythis? Go inside #SavageBuilds with the #MythBusters vet himself.\n\nWatch now on DGO. --&gt;\xe2\x80\xa6 https://t.co/BkXgeOXlNO"""
ScienceChannel,1141420449584308226,2019-06-19 19:00:16,"b'Supermassive black holes, interstellar comets, binary suns... Watch full episodes of #SpacesDeepestSecrets online n\xe2\x80\xa6 https://t.co/pLWZClg0ej'"
ScienceChannel,1141390467071971328,2019-06-19 17:01:08,"b'Wishing you could hide away like a flounder? The Flounder is a master of camouflage and, like chameleons, they can\xe2\x80\xa6 https://t.co/G3T88CLn3F'"
ScienceChannel,1141375084814204930,2019-06-19 16:00:00,"b""Just how strong is @Donttrythis's titanium #IronMan armor?\xf0\x9f\x92\xa5#Bulletproof\n\nWatch the Season Premiere of #SavageBuilds\xe2\x80\xa6 https://t.co/2CtlL6HJCl"""
ScienceChannel,1141344884348948481,2019-06-19 14:00:00,b'It looks like Whiplash just lost its lifter...\xf0\x9f\x91\x80\n\nNo robot is safe on #BattleBots Wednesdays at 8p ET on\xe2\x80\xa6 https://t.co/5NGXUijuIW'
ScienceChannel,1141057995167739909,2019-06-18 19:00:00,b'Every solar system has an origin story.\xe2\x98\x80\xef\xb8\x8f\xf0\x9f\x8c\x8c\n\nWatch #SpacesDeepestSecrets online now. --&gt;  https://t.co/JCswt3gXDV https://t.co/mFP710LGJB'
ScienceChannel,1140982582684921862,2019-06-18 14:00:20,"b'From ""man-in-a-tin-can"" to man on the moon, the #MercurySeven paved the way for the #American space program.\xf0\x9f\x87\xba\xf0\x9f\x87\xb8\xe2\x80\xa6 https://t.co/x4HKQ4tnoo'"
ScienceChannel,1140756073533624320,2019-06-17 23:00:16,"b'A faulty lunar module, a near death experience, a government conspiracy... Did we actually land on the moon?\xe2\x80\xa6 https://t.co/jeRVTlFrP3'"
ScienceChannel,1140695663870664704,2019-06-17 19:00:14,"b'They threaten our survival, but they could be the source of life on Earth.\xe2\x98\x84\xef\xb8\x8f#Comets\n\nWatch #HowtheUniverseWorks Mon\xe2\x80\xa6 https://t.co/UFNbHkx1Md'"
ScienceChannel,1140680783277039616,2019-06-17 18:01:06,b'Time to burst your weekend bubble. Here\xe2\x80\x99s some hydrogen to get you started. It has the greatest heat conductivity o\xe2\x80\xa6 https://t.co/xmT7X6guYg'
ScienceChannel,1140627659556151297,2019-06-17 14:30:00,b'How would you like to dive with a submersible drone?\n\nMissed an episode of #LegendsoftheDeep? Catch-up now. --&gt;\xe2\x80\xa6 https://t.co/RPFof2U8lX'
ScienceChannel,1140423816742502400,2019-06-17 01:00:00,"b'60 witness, a government investigation, an underwater mystery... Watch the Series Premiere of #LegendsoftheDeep NOW\xe2\x80\xa6 https://t.co/ukoxNMLv0x'"
