ScienceChannel,1280193131338772480,2020-07-06 17:33:22,b'Leishmania major is a species of parasites associated with the disease zoonotic cutaneous leishmaniasis.\xe2\x80\xa6 https://t.co/UEOEfQWNPK'
ScienceChannel,1279792149043666944,2020-07-05 15:00:00,b'This green sea turtle is munching on algae and blowing sand out of its nostrils. \xf0\x9f\x98\xa4\xf0\x9f\xa5\xac \n\n\xf0\x9f\x90\xa2\xf0\x9f\x8e\xa5 by @jacintashackleton/IG https://t.co/u9y5iCSAqV'
ScienceChannel,1279429764491743239,2020-07-04 15:00:01,"b'An enduring symbol of freedom made from 62,000 lbs of copper. \xf0\x9f\x97\xbd\n\nWatch the series premiere of #Unearthed Seven Wond\xe2\x80\xa6 https://t.co/H9xqKbP3jh'"
ScienceChannel,1278842061865787392,2020-07-03 00:04:41,"b'Watch the series premiere of #Unearthed 7 Wonders Sunday, July 5 at 8p on Science Channel. https://t.co/IGJWFt7cNI'"
ScienceChannel,1278784526605484039,2020-07-02 20:16:04,b'The zebra shark (Stegostoma fasciatum) is a nocturnal species of carpet shark. These sharks spend most of the day r\xe2\x80\xa6 https://t.co/9Twk29u0G3'
ScienceChannel,1278755940746092544,2020-07-02 18:22:29,b'These sharks give birth to as many as 37 pups after a gestation period of 10\xe2\x80\x9312 months.'
ScienceChannel,1278628421967450112,2020-07-02 09:55:46,"b""@SharkWeek @Discovery Just when you think you've seen it all...."""
ScienceChannel,1278622882948669441,2020-07-02 09:33:45,b'RT @SharkWeek: There\xe2\x80\x99s still a lot you don\xe2\x80\x99t know. #SharkWeek starts August 9 on @Discovery. \n\nLearn more at https://t.co/zZYc08M4rN. https\xe2\x80\xa6'
ScienceChannel,1278364497577730048,2020-07-01 16:27:01,"b'The star-nosed mole may be blind, but it\xe2\x80\x99s unique tentacled snout can see the world through an extraordinary sense\xe2\x80\xa6 https://t.co/oVnVskcXMX'"
ScienceChannel,1278034619263340550,2020-06-30 18:36:12,b'Could lava and ground water be the cause of an Earth shattering explosion?\n\nWatch a new episode of #StrangeEvidence\xe2\x80\xa6 https://t.co/4ukj7serGS'
ScienceChannel,1277676772562292737,2020-06-29 18:54:15,"b'This is a Physalia physalis \xe2\x80\x9cPortuguese man o\xe2\x80\x99 war\xe2\x80\x9d.\n\nDr. Hines added some acetic acid to the slide, causing the te\xe2\x80\xa6 https://t.co/S1xPrk3f3Z'"
ScienceChannel,1277407722854637569,2020-06-29 01:05:08,"b'Join experts and archeologists as we unearth Aztec relics on #LostPyramids of the Aztecs, airing right now on Scien\xe2\x80\xa6 https://t.co/siXgMQlxBK'"
ScienceChannel,1276981967062515713,2020-06-27 20:53:20,"b'While it only lasted around 200 years, the Aztec civilization brought forth innovation that can be seen around Mexi\xe2\x80\xa6 https://t.co/xUGDPD8HlA'"
ScienceChannel,1276929070115233794,2020-06-27 17:23:09,b'What? You\xe2\x80\x99ve never seen a red lipped bat fish before?\n\nOgcocephalus darwini is a fish of unusual morphology found a\xe2\x80\xa6 https://t.co/jUu8Y435nN'
ScienceChannel,1276631407872356353,2020-06-26 21:40:20,"b""RT @TVInsider: Archaeologists Unearth Astonishing Secrets in 'Lost Pyramids of the Aztecs' https://t.co/cK2usa1kKc"""
ScienceChannel,1276578464733134849,2020-06-26 18:09:58,"b'Despite not having a brain, or even a single neuron, this organism is able to make clever decisions in search of fo\xe2\x80\xa6 https://t.co/HBcUfvFt9Y'"
ScienceChannel,1276547734426865664,2020-06-26 16:07:51,"b'RT @Discovery: .@AstroBehnken and @Astro_SEAL have been on a spacewalk since around 7:30am ET this morning, conducting maintenance on the @\xe2\x80\xa6'"
ScienceChannel,1276547716076748801,2020-06-26 16:07:47,b'RT @Discovery: One of the first rules of a spacewalk - keep yourself tethered at all times! \n\n@AstroBehnken and @Astro_SEAL will spend arou\xe2\x80\xa6'
ScienceChannel,1276198562947366914,2020-06-25 17:00:22,"b'Small human-like creatures called homo-floresiensis (hobbits) were thought to have gone extinct over 100,000 years\xe2\x80\xa6 https://t.co/fia6JS7909'"
ScienceChannel,1276152428799438852,2020-06-25 13:57:03,"b""Mary W. Jackson made history as @NASA's first black, female engineer. Today, she is the namesake of its Washington,\xe2\x80\xa6 https://t.co/OvvJQtwCJz"""
ScienceChannel,1275865790114336768,2020-06-24 18:58:03,"b'Here we have a male peacock jumping spider (Maratus volans) doing his best to win the heart of another. But, if his\xe2\x80\xa6 https://t.co/zwhR1Fd9g1'"
ScienceChannel,1275764358463668224,2020-06-24 12:15:00,"b""New York's Central Park Tower is the second tallest building in the United States, towering over 1,550-feet-tall! \xf0\x9f\x8f\x97\xe2\x80\xa6 https://t.co/H6TyyTjvhJ"""
ScienceChannel,1275194178079784962,2020-06-22 22:29:18,"b'RT @Discovery: If the current rate of deforestation continues, there may not be any rainforests left in 100 years. Learn more about how the\xe2\x80\xa6'"
ScienceChannel,1275107527538212868,2020-06-22 16:44:59,"b'Unicellular ciliate protists of the Blepharisma genus may be as small as 50 micrometers in length, or as large as 1\xe2\x80\xa6 https://t.co/a5xgIp1tl1'"
ScienceChannel,1275107295949729796,2020-06-22 16:44:04,"b'This pink single cell ciliate is a Blepharisma. As you can see, it is being slapped by a smaller multicellular worm\xe2\x80\xa6 https://t.co/jtV5elQJQz'"
ScienceChannel,1274403260363931657,2020-06-20 18:06:29,b'Blue Glaucus Nudibranches or \xe2\x80\x9cdragon slugs\xe2\x80\x9d are ocean current drifters that float upside down by using the surface\xe2\x80\xa6 https://t.co/POCCScWymb'
ScienceChannel,1274006315669610496,2020-06-19 15:49:10,"b'""It emitted by night a phosphorescent light.""\xf0\x9f\x94\x85\xf0\x9f\x8d\x84 \xe2\x80\x94 Scottish naturalist, James Drummond describing the Ghost fungus i\xe2\x80\xa6 https://t.co/GfgTZYJ3fl'"
ScienceChannel,1273665780199100418,2020-06-18 17:16:00,"b'This vase is made using PLA (Polylactide Acid), a biodegradable and bioactive thermoplastic aliphatic polyester der\xe2\x80\xa6 https://t.co/8W40GpgC22'"
ScienceChannel,1273665682002018305,2020-06-18 17:15:36,"b'Constructing a three-dimensional object from a computer-aided design  was once the stuff of science fiction, now we\xe2\x80\xa6 https://t.co/3rDGtRtRHw'"
ScienceChannel,1273574932417400832,2020-06-18 11:15:00,"b""It's the plant that's making all that noise -- but how is it doing it? \xf0\x9f\x8c\xbf\n\nWatch a new episode of #StrangeEvidence T\xe2\x80\xa6 https://t.co/k8sD3ye0uz"""
ScienceChannel,1273314470559985665,2020-06-17 18:00:01,"b""Navigating through these tough waters is not an easy task! That's where harbor pilots come in! \xf0\x9f\x9a\xa4\n\nWatch a NEW episo\xe2\x80\xa6 https://t.co/NR19X428ox"""
ScienceChannel,1273307508627685381,2020-06-17 17:32:21,b'Heat from the reaction brings the mixture to near the boiling point of water and produces gas that drives the eject\xe2\x80\xa6 https://t.co/oha4YhiboY'
ScienceChannel,1273306644919836672,2020-06-17 17:28:55,b'The bombardier beetle exterminates attackers by ejecting a hot noxious chemical spray from the tip of its abdomen.\xe2\x80\xa6 https://t.co/5u7e2qC5Wc'
ScienceChannel,1273299367299072000,2020-06-17 17:00:00,b'This innovative building seems to defy physics and float mid-air! See how in an all-new episode of #BuildingGiants\xe2\x80\xa6 https://t.co/vVMsHbRIHb'
ScienceChannel,1272960505884348416,2020-06-16 18:33:29,b'The Venus flytrap (Dionaea muscipula) is a carnivorous plant that primarily feeds on insects and arachnids. However\xe2\x80\xa6 https://t.co/QIU1znghYZ'
ScienceChannel,1272585061892796426,2020-06-15 17:41:36,b'Underneath our skin is miles and miles of blood vessels filled with around 1.3 gallons of #blood. These cells are o\xe2\x80\xa6 https://t.co/VT9marzp1s'
ScienceChannel,1272276528697671681,2020-06-14 21:15:36,b'Talk about a team effort! The adonis blue caterpillar partakes in an exceptional symbiotic relationship with ants.\xe2\x80\xa6 https://t.co/v7R1GaVOMo'
ScienceChannel,1272182006638612480,2020-06-14 15:00:01,b'The infamous Salem witch trials were a series of prosecutions for witchcraft starting in 1692. More than 200 people\xe2\x80\xa6 https://t.co/nqH22nQXuZ'
ScienceChannel,1272155579222376448,2020-06-14 13:15:00,b'Archaeologists have now discovered a vast harbor complex \xe2\x80\x94 the oldest harbor ever found. \xe2\x9a\x93\xef\xb8\x8f\n\nCatch this in the SEAS\xe2\x80\xa6 https://t.co/VRiqEgi6uz'
ScienceChannel,1271849815186509826,2020-06-13 17:00:00,"b'The cuttlefish is a master of disguise.\xf0\x9f\xa6\x91 To evade predators, these cephalopods change their skin color rapidly usin\xe2\x80\xa6 https://t.co/PIH3FipoJy'"
ScienceChannel,1271485995637264386,2020-06-12 16:54:19,b'There are distinct differences \xe2\x80\x94 the Magpie Fungus has a black cap with white scales while the shaggy ink cap has w\xe2\x80\xa6 https://t.co/mj5LjH3rGp'
ScienceChannel,1271485866444275712,2020-06-12 16:53:48,"b'The magpie mushroom (Coprinopsis picacea) is a poisonous species of fungus in the family Psathyrellaceae, but it is\xe2\x80\xa6 https://t.co/yZTsxwBko6'"
ScienceChannel,1271181728946835456,2020-06-11 20:45:16,b'A Eulers Disk is used to illustrate and study the dynamic system of a spinning disk on a flat or curved surface. As\xe2\x80\xa6 https://t.co/5cEp0wRw54'
ScienceChannel,1270828357853249536,2020-06-10 21:21:06,"b""RT @AprilMac: #Cleopatra Sex, Lies And Secrets' reveals new tomb findings. Tune in details for @ScienceChannel Archaeological Adventure htt\xe2\x80\xa6"""
ScienceChannel,1270828319693516806,2020-06-10 21:20:56,"b""RT @TVInsider: 'Strange Evidence' Returns to Investigate Footage From Around the World https://t.co/TCHqMcW7iQ"""
ScienceChannel,1270763358011219968,2020-06-10 17:02:48,"b""I'm looking through you, where did you go? \xf0\x9f\x90\xb8\n\nGlass Frogs are transparent, leaving their internal organs visible. T\xe2\x80\xa6 https://t.co/ABJW71tTNx"""
ScienceChannel,1270702253486280705,2020-06-10 13:00:00,b'Engineers are building the world\xe2\x80\x99s fastest train but it comes with its complexations. How do you accelerate a 500-t\xe2\x80\xa6 https://t.co/EwjvqVMQiN'
ScienceChannel,1270439853172445190,2020-06-09 19:37:19,"b'This is a Drosera binata, commonly known as the forked sundew. Like all sundews, it is a carnivorous plant. However\xe2\x80\xa6 https://t.co/SFYzCeEhH2'"
ScienceChannel,1270412813236912131,2020-06-09 17:49:52,b'RT @Discovery: Join the Discovery family of networks for a powerful conversation tonight at 9p ET. #OWNSpotlight https://t.co/x7aIEsCUPI'
ScienceChannel,1270097249884868608,2020-06-08 20:55:56,"b""RT @Discovery: Dive in! We're taking you on a tour of all the Earth's incredible oceans on #WorldOceansDay. \xf0\x9f\x8c\x8a https://t.co/t0USoSlja8"""
ScienceChannel,1270050699674517505,2020-06-08 17:50:57,b'Giants clams reproduce sexually and are hermaphrodites (producing both eggs and sperm). While self-fertilization is\xe2\x80\xa6 https://t.co/lXqKUZnzZI'
ScienceChannel,1270050632846671881,2020-06-08 17:50:41,"b'Ahhh yes, the Giant clam (Tridacna gigas), so majestic, so beautiful. This clam is spawning, releasing sperm and eg\xe2\x80\xa6 https://t.co/UTxq94UMxX'"
ScienceChannel,1270004071764811776,2020-06-08 14:45:40,"b'RT @Discovery: Where do we go from here? On Tuesday and Wednesday, join the Discovery family of networks for an important conversation led\xe2\x80\xa6'"
ScienceChannel,1269744885017567240,2020-06-07 21:35:45,"b'We hear tourists love the tentacle drones. \xf0\x9f\x90\x99\n\nVisual effects artist, @rek0de/IG, creates animations using 3D softwa\xe2\x80\xa6 https://t.co/NLgr5FY73n'"
ScienceChannel,1269645292036427776,2020-06-07 15:00:01,b'Moses saw a burning bush which he interpreted as a sign to lead Israelites from oppression in Egypt to safety. This\xe2\x80\xa6 https://t.co/IqNnsGrztk'
ScienceChannel,1269622639225700367,2020-06-07 13:30:00,b'Jericho is one of the earliest settlements dating back to 9000 BCE! Catch this historic city in an all NEW episode\xe2\x80\xa6 https://t.co/hebOmwufwM'
ScienceChannel,1269452004868403200,2020-06-07 02:11:57,b'RT @Discovery: Looking forward to this important conversation airing across the Discovery family of networks. #OWNSpotlight'
ScienceChannel,1269316742947495941,2020-06-06 17:14:28,"b'Approximately 3,000 feet below sea level is a detritus feeding sea-creature known as the Vampire squid (Vampyroteut\xe2\x80\xa6 https://t.co/l8EkamiZYr'"
ScienceChannel,1269245152763228160,2020-06-06 12:30:00,"b'""We all have the capacity to see the humanity in someone else.""\n\nWatch a special presentation of #WhyWeHate startin\xe2\x80\xa6 https://t.co/YOHzSO5HXx'"
ScienceChannel,1268958299237556231,2020-06-05 17:30:09,"b'Conversation sparks change. Search for the origins of hate in #WhyWeHate premiering tomorrow, June 6th at 10a on\xe2\x80\xa6 https://t.co/0TfxCHfTdp'"
ScienceChannel,1268956337653927936,2020-06-05 17:22:21,"b'The hedgehog mushroom (Hydnum repandum) is a basidiomycete fungus of the family Hydnaceae. Its soft, toothy undersi\xe2\x80\xa6 https://t.co/I2TqmoatcO'"
ScienceChannel,1268657918272049154,2020-06-04 21:36:32,b'RT @Discovery: Thank you to everyone who watched #SpaceLaunchLIVE on Discovery and @ScienceChannel! We loved bringing this amazing achievem\xe2\x80\xa6'
ScienceChannel,1268606245327589379,2020-06-04 18:11:13,b'Heliamphora pilosa is a species of marsh pitcher plant endemic to the Chimanta Massif and surrounding table-top mou\xe2\x80\xa6 https://t.co/xeEWOfK8JE'
ScienceChannel,1268241910499606530,2020-06-03 18:03:28,"b'Have you ever seen an Okapi before? Although the okapi has striped markings reminiscent of zebras, it is most close\xe2\x80\xa6 https://t.co/WPnHhQaZz3'"
ScienceChannel,1267659557842694144,2020-06-02 03:29:25,b'RT @DiscoveryIncTV: This PSA is airing across all Discovery networks. We\xe2\x80\x99re donating to social justice orgs and developing a programming pl\xe2\x80\xa6'
ScienceChannel,1267157092609282054,2020-05-31 18:12:48,"b'""The last blueprint"" \n\n\xf0\x9f\x8e\xa5 + caption by @rek0de/IG\n\n#SatisfyingSunday \xf0\x9f\x96\x8c https://t.co/5oPydjVGir'"
ScienceChannel,1267155526523260928,2020-05-31 18:06:34,b'RT @Discovery: Amazing moment! \xf0\x9f\x91\x8f\xf0\x9f\x91\x8f\xf0\x9f\x91\x8f\xf0\x9f\x91\x8f'
ScienceChannel,1267155493396647937,2020-05-31 18:06:26,"b""RT @Discovery: Success! An exciting culmination to so much hard work! Congrats to @NASA's @AstroBehnken, @Astro_Doug, @elonmusk, @SpaceX, a\xe2\x80\xa6"""
ScienceChannel,1266866982307205127,2020-05-30 23:00:00,"b""We have liftoff! Here's to @NASA, @SpaceX, @AstroBehnken, @Astro_Doug, and everyone involved in today's launch! Che\xe2\x80\xa6 https://t.co/2MFj9itTRL"""
ScienceChannel,1266844373263822851,2020-05-30 21:30:10,"b""RT @Discovery: .@SpaceX's Falcon 9 lifts off at exactly 3:22PM EDT local time on Saturday May 30, 2020. #SpaceLaunchLIVE https://t.co/SDMkM\xe2\x80\xa6"""
ScienceChannel,1266825580101722112,2020-05-30 20:15:29,"b""RT @Discovery: And we have liftoff! Get the play-by-play of today's historic @NASA/@SpaceX launch! #SpaceLaunchLIVE https://t.co/ynK5yqKIpF"""
ScienceChannel,1266823137074823168,2020-05-30 20:05:46,"b'RT @SpaceX: Once their stay is complete, @AstroBehnken and @Astro_Doug will depart the @space_station on Crew Dragon, which will autonomous\xe2\x80\xa6'"
ScienceChannel,1266810402672910338,2020-05-30 19:15:10,b'RT @Discovery: Everything continues to be GO for an on time launch. \n\nRocket being loaded with liquid oxygen. Liftoff at 3:22pm ET. #SpaceL\xe2\x80\xa6'
ScienceChannel,1266807688215826432,2020-05-30 19:04:23,b'RT @Discovery: Propellant loading on Falcon 9. #SpaceLaunchLIVE https://t.co/QPWgqaviac'
ScienceChannel,1266805828247486467,2020-05-30 18:57:00,"b""It's almost time for lift off!\xf0\x9f\x9a\x80 #SpaceLaunchLIVE https://t.co/JtvLc96dhu"""
ScienceChannel,1266805504979984384,2020-05-30 18:55:43,b'RT @Discovery: The weather is currently GO for launch. #SpaceLaunchLIVE https://t.co/ksi6Zl5vEc'
ScienceChannel,1266791485170692097,2020-05-30 18:00:00,b'History is ready to be made. #SpaceLaunchLIVE coverage begins NOW on Discovery and Science Channel. https://t.co/SUUOqYQ8Sc'
ScienceChannel,1266786616133238784,2020-05-30 17:40:39,b'#SpaceLaunchLIVE coverage begins at 2p ET/11a PT! https://t.co/aV6O01bten'
ScienceChannel,1266776636017373184,2020-05-30 17:01:00,"b""When it comes to space travel, it's all in the family for astronauts @AstroBehnken and @Astro_Doug. Meet their wive\xe2\x80\xa6 https://t.co/2IM8m0bcX7"""
ScienceChannel,1266760781351264256,2020-05-30 15:58:00,b'American astronauts have not launched from US soil in nearly 10 years. That is about to change...\n\nLive coverage of\xe2\x80\xa6 https://t.co/KjQ1g7nX04'
ScienceChannel,1266759526742724609,2020-05-30 15:53:01,b'RT @Discovery: Suiting up for Round 2. #SpaceLaunchLIVE https://t.co/XGSgmzf2WI'
ScienceChannel,1266759140589928448,2020-05-30 15:51:29,"b'RT @MBCompanyMan: Remember when we use to slap duct tape on rocket ships &amp; fly to the moon? Well, after a decade long hiatus, weather permi\xe2\x80\xa6'"
ScienceChannel,1266753736346484738,2020-05-30 15:30:00,"b'The Bermuda Triangle has the most heavily travelled shipping lanes in the world. Cruise ships, pleasure crafts, com\xe2\x80\xa6 https://t.co/8iIvFUaiua'"
ScienceChannel,1266745216511496192,2020-05-30 14:56:09,b'What will @donttrythis wear today for #SpaceLaunchLIVE? \xf0\x9f\x91\xa8\xe2\x80\x8d\xf0\x9f\x9a\x80\n\nLive coverage of the second @NASA/@SpaceX launch attem\xe2\x80\xa6 https://t.co/9ixCMxRFUY'
ScienceChannel,1266739927879991297,2020-05-30 14:35:08,b'RT @Discovery: Would you want to live in the first colony on Mars? #SpaceLaunchLIVE'
ScienceChannel,1266507356885725184,2020-05-29 23:10:59,b'RT @AnimalPlanet: It has been reported that a gang of rhesus macaques ambushed a lab assistant and escaped with test samples of #coronaviru\xe2\x80\xa6'
ScienceChannel,1266463824510693377,2020-05-29 20:18:00,b'RT @Discovery: Try on an astronaut\xe2\x80\x99s helmet and take a trip to space to celebrate the next #SpaceLaunchLIVE this Saturday beginning at 2pm\xe2\x80\xa6'
ScienceChannel,1266443057307824129,2020-05-29 18:55:28,"b""Launch Pad 39A is where one era ended and another will begin. \n\nDon't forget to catch live coverage of the @NASA/\xe2\x80\xa6 https://t.co/Zj9KeyBYgO"""
ScienceChannel,1266415744482508801,2020-05-29 17:06:57,"b""Happy #FungusFriday! Unlike plants, molds don't grow from seeds, they grow from tiny spores that float around in th\xe2\x80\xa6 https://t.co/WRsLgM9EJY"""
ScienceChannel,1266179954527490050,2020-05-29 01:30:00,"b'Weapons developed here were deployed for use both as coastal defenses elsewhere in the United States, and by the Un\xe2\x80\xa6 https://t.co/jHPaGRiW4C'"
ScienceChannel,1266176179200909312,2020-05-29 01:15:00,b'Sandy Hook Proving Ground was founded in 1874 for the testing and development of artillery. It served in this role\xe2\x80\xa6 https://t.co/ZRaGkRr3Lk'
ScienceChannel,1266153219153108993,2020-05-28 23:43:46,"b'RT @Discovery: The instantaneous launch window meant that even if weather conditions had improved ten minutes later, the @SpaceX launch STI\xe2\x80\xa6'"
ScienceChannel,1266088280862478337,2020-05-28 19:25:43,b'The galaxy is waiting for us. #SpaceLaunchLIVE returns with live coverage of the second @NASA/@SpaceX launch attemp\xe2\x80\xa6 https://t.co/r3Mg26wtJb'
ScienceChannel,1265815049928609793,2020-05-28 01:20:00,b'This crane is used to load and unload supplies so the crew can operate independently for up to 90 days.\xe2\x80\xa6 https://t.co/x2e8MbS15q'
ScienceChannel,1265746774758690816,2020-05-27 20:48:42,"b""RT @Discovery: Unfortunately today's launch has been scrubbed due to weather conditions.\n\nLearn more about why launches may be delayed. #Sp\xe2\x80\xa6"""
ScienceChannel,1265734519987957760,2020-05-27 20:00:00,"b""This military facility serve as the United States Army's first proving ground for the testing of new military weapo\xe2\x80\xa6 https://t.co/wkO0RZbCf4"""
ScienceChannel,1265687417589313536,2020-05-27 16:52:50,"b""Stream today's #SpaceLaunchLIVE for FREE on the #SciGO app! https://t.co/7izxAv4BUe"""
ScienceChannel,1265617498700996610,2020-05-27 12:15:00,b'This team is putting their offshore powerboat to the test in the most dangerous race on the water! But who will tak\xe2\x80\xa6 https://t.co/J8voGSc0vS'
ScienceChannel,1265613724422823936,2020-05-27 12:00:00,"b'This is no ordinary crane! \xe2\x9b\xb4 When at seas, this vessel\xe2\x80\x99s crane counteract the motion of the waves, keeping the cran\xe2\x80\xa6 https://t.co/wIMCRlOhDL'"
ScienceChannel,1265456526094974981,2020-05-27 01:35:21,"b'Fathers. Husbands. Astronauts. Get to know @AstroBehnken and @Astro_Doug, the @nasa astronauts traveling to the\xe2\x80\xa6 https://t.co/fMXBZ1XYs1'"
ScienceChannel,1265421036461395976,2020-05-26 23:14:20,"b""Blast off with @Discovery's Space Launch filter! View it on Instagram: https://t.co/3ntH5WhEtj\n\nYou can catch\xe2\x80\xa6 https://t.co/hKshGTxGW9"""
ScienceChannel,1265404745902108675,2020-05-26 22:09:36,b'RT @Discovery: Blast off with our Instagram and Facebook Space Launch filter in celebration of #SpaceLaunchLive!\n\nWatch live coverage of th\xe2\x80\xa6'
ScienceChannel,1265388307594297348,2020-05-26 21:04:16,"b""RT @Discovery: During Wednesday's #SpaceLaunchLive event on Discovery, use this companion discussion guide to spark meaningful conversation\xe2\x80\xa6"""
ScienceChannel,1265060900387553280,2020-05-25 23:23:17,b'Strap yourself into the @SpaceX Dragon capsule that will take @NASA  astronauts to the @Space_Station Wednesday.\xe2\x80\xa6 https://t.co/AQCggVImJh'
ScienceChannel,1265008587623084040,2020-05-25 19:55:24,"b'RT @Discovery: \xe2\x9a\xa0\xef\xb8\x8f @SpaceX CEO, @ElonMusk, is mere days away from the most important launch in the history of the company.\n\nSee the moment o\xe2\x80\xa6'"
ScienceChannel,1264940730616885250,2020-05-25 15:25:46,"b'Just one of the many cutting-edge technologies helping service members around the world. Today and every day, we ho\xe2\x80\xa6 https://t.co/ltQCOOgQNW'"
ScienceChannel,1264674754964983809,2020-05-24 21:48:52,b'#SpaceLaunchLIVE begins Wednesday at 2p ET/11a PT on @ScienceChannel and @Discovery. https://t.co/56JQONoz0v'
ScienceChannel,1264673987323453441,2020-05-24 21:45:49,b'RT @Discovery: Did you hear that the rocket is going land back on Earth and be reused? \xf0\x9f\x9a\x80\n\nLive coverage for #SpaceLaunchLIVE  begins at 2p\xe2\x80\xa6'
ScienceChannel,1264619051348832258,2020-05-24 18:07:31,"b'American astronauts have not launched from US soil in almost 10 years. All that will change Wednesday, May 27. \n\nDo\xe2\x80\xa6 https://t.co/GGR1nANwNo'"
ScienceChannel,1264577877812678659,2020-05-24 15:23:55,"b""Go inside the journey @NASA and @SpaceX have traveled on to make the Demo-2 mission possible. \n\nDon't miss the laun\xe2\x80\xa6 https://t.co/ujKYcfOPrh"""
ScienceChannel,1264524043006308352,2020-05-24 11:50:00,"b""For many it's a secret world of libraries, priceless Holy relics, and artwork but how deep do these secrets go? Fin\xe2\x80\xa6 https://t.co/B0VBcIiYFk"""
ScienceChannel,1264325397388439559,2020-05-23 22:40:39,b'The Dragon parachute is ready for human spaceflight. \n\nLive coverage of #SpaceLaunchLIVE begins Wednesday at 2p ET/\xe2\x80\xa6 https://t.co/WXv5mnVLm4'
ScienceChannel,1264284970643861511,2020-05-23 20:00:00,"b""Under the cover of murky water \xe2\x80\x94 this Alligator Snapping Turtle's tongue masquerades as a worm, luring its prey int\xe2\x80\xa6 https://t.co/U27upOH8kz"""
ScienceChannel,1264251067157614597,2020-05-23 17:45:17,"b'Here a female has come ashore to lay her eggs.\xf0\x9f\xa5\x9a Once her 80-150 eggs are buried, she will crawl back to sea where s\xe2\x80\xa6 https://t.co/dU5aHTkbgo'"
ScienceChannel,1264220791371153414,2020-05-23 15:44:59,b'Sea turtles are expert navigators and often migrate thousands of miles between feeding grounds and nesting beaches.\xe2\x80\xa6 https://t.co/aHLxfk8jwe'
ScienceChannel,1264218124238413825,2020-05-23 15:34:23,"b""Do you have the right stuff? Take our space quiz! https://t.co/uxLNSr8SS9  \n\nDon't miss the Demo-2 launch when live\xe2\x80\xa6 https://t.co/K3kIzetCVI"""
ScienceChannel,1264059110594621440,2020-05-23 05:02:31,b'Space exploration is about to enter a new frontier. Witness history unfold and watch NASA &amp; SpaceX: Journey to the\xe2\x80\xa6 https://t.co/zdJl2u5tJY'
ScienceChannel,1264058174744735745,2020-05-23 04:58:48,"b""RT @PopCulture: EXCLUSIVE: @Discovery Previews NASA and SpaceX Documentary 'Journey to the Future' Narrated by Walton Goggins Before Histor\xe2\x80\xa6"""
ScienceChannel,1263926354652741632,2020-05-22 20:15:00,"b'Before it was known as the site of horrific tragedy, the Twin Towers were a modern engineering marvel. Watch expert\xe2\x80\xa6 https://t.co/Kzb62w36cX'"
ScienceChannel,1263888363951538178,2020-05-22 17:44:02,b'Happy #FungusFriday \xf0\x9f\x8d\x84 everybody! The Red Pinwheel (Marasmius plicatulus) can be characterized by its mahogany to re\xe2\x80\xa6 https://t.co/25zlvfYf0Z'
ScienceChannel,1263643240370065408,2020-05-22 01:30:00,b'Ie Shima lies about three and one-half miles off the western tip of Motobu Peninsula and twenty miles north of the\xe2\x80\xa6 https://t.co/5PC2IJ3ne5'
ScienceChannel,1263639464217174016,2020-05-22 01:15:00,b'There was heavy fighting from April 16 until the island was secured on April 21. #MysteriesOfTheAbandoned https://t.co/3kksi5qjoC'
ScienceChannel,1263277076418752519,2020-05-21 01:15:00,"b'The procedure \xe2\x80\x94 of drilling, injecting grout, blasting, clearing, and advancing\xe2\x80\x94will eventually result in some 20 m\xe2\x80\xa6 https://t.co/79uFlMXTxh'"
ScienceChannel,1263169299105157121,2020-05-20 18:06:44,b'Witness history in the making! Coverage of the @NASA &amp; @SpaceX capsule launch starts May 27th at 2pm ET on\xe2\x80\xa6 https://t.co/HrIp8Y4xds'
