SunSport,1276019832702619648,2020-06-25 05:10:10,b'Every Burnley star wanted to condemn banner before Mee addressed pres https://t.co/xyWNhunjGZ'
SunSport,1276015758489853952,2020-06-25 04:53:58,b'Keegan stars in promo tape to launch Stockport kit and donates wages to NHS https://t.co/HLO2uP6zUp'
SunSport,1276012367613169670,2020-06-25 04:40:30,"b""Snooker legend Willie Thorne's family and 100 pals pay tribute at funeral service in Spain after his death age 66 https://t.co/1PctByPf3H"""
SunSport,1276008788240338946,2020-06-25 04:26:16,b'Boxer Moloney in hospital with BOTH eardrums burst and vomiting after defeat https://t.co/bKfi57CFNr'
SunSport,1276004275743842304,2020-06-25 04:08:21,"b""Watch Gagliardini's 'miss of season' in Inter 3-3 draw as Young has horror cameo https://t.co/jKQgFZfmGj"""
SunSport,1276000273593491456,2020-06-25 03:52:26,b'Golf crisis as PGA Tour confirm three more positive coronavirus tests https://t.co/NrtjdpFWbg'
SunSport,1275995892068294656,2020-06-25 03:35:02,"b""Nick Kyrgios takes swipe at Novak Djokovic 'stupidity' after testing positive for coronavirus following Adria Tour https://t.co/44zVLYi25e"""
SunSport,1275989698805202944,2020-06-25 03:10:25,"b""McGregor claims Khabib's dad's virus scare is 'cover-up' for rival 'running away' https://t.co/PAIMn4DjXY"""
SunSport,1275963735446880259,2020-06-25 01:27:15,"b""Fury claims AJ rejected \xc2\xa364m to fight Wilder and would be 'put unconscious in round one' https://t.co/HUh3l8pN4y"""
SunSport,1275960029301088266,2020-06-25 01:12:31,b'Watch shock moment NFL star Clinton-Dix flees from two bears in his house https://t.co/2C3OoeCijj'
SunSport,1275955223639592961,2020-06-25 00:53:26,b'Tyson Fury splits from cartel boss who brokered AJ fight after global backlash https://t.co/c3IGmkdJWK'
SunSport,1275920963897606146,2020-06-24 22:37:17,b'Georgina Rodriguez relaxes on yacht in leather hotpants and \xc2\xa3140 socks https://t.co/WwdvpEWkPB'
SunSport,1275916895363960834,2020-06-24 22:21:07,"b""Mason Greenwood is 'one of the best Butt has ever worked with', reveals Redknapp https://t.co/JGCwWKrCB4"""
SunSport,1275913058179862540,2020-06-24 22:05:53,"b""Souness admits he gets 'hammered' for Pogba criticism but claims 'I'm a fan' https://t.co/GSF51RDYWM"""
SunSport,1275909465024475136,2020-06-24 21:51:36,b'Stephen Ireland admits shock that new neighbour Bruno Fernandes used to have POSTER of him https://t.co/Mhi1IwMw9X'
SunSport,1275905925254176777,2020-06-24 21:37:32,"b'How Arsenal could look next season...with David Luiz, Cedric Soares and Pablo Mari https://t.co/LbUcScZAju'"
SunSport,1275902336171376641,2020-06-24 21:23:16,"b""Cardboard cut out of Osama Bin Laden spotted at Leeds' behind-closed-doors game https://t.co/IpAr6Q4nsu"""
SunSport,1275898765535305734,2020-06-24 21:09:05,b'RT @TheSunFootball: Liverpool can be crowned Premier League champions tomorrow https://t.co/xuPM0uLDD2 https://t.co/egphxqS4k3'
SunSport,1275895874913136641,2020-06-24 20:57:36,"b""Arsenal's 2020-21 home kit spotted for first time in official store BEFORE big reveal https://t.co/LH4X2VfrKy"""
SunSport,1275892161054216192,2020-06-24 20:42:50,"b""Man Utd team 'leaked' for Blades clash with Pogba in and De Gea keeping place https://t.co/YvZTpF5wSo"""
SunSport,1275888386503475203,2020-06-24 20:27:50,"b'Jose Mourinho has a history of falling out with players, just ask Ronaldo &amp; Kaka https://t.co/zjRqbozw1t'"
SunSport,1275884806350483456,2020-06-24 20:13:37,b'WWE in coronavirus scare as multiple people test positive after being at Performance Center https://t.co/ycMJyq0ypO'
SunSport,1275883454329171976,2020-06-24 20:08:14,b'Chelsea join Arsenal in Dayot Upamecano transfer race with Lampard looking to grab RB Leipzig star for \xc2\xa350m https://t.co/IRvCRsjO5D'
SunSport,1275879974650679298,2020-06-24 19:54:25,b'How Arsenal will line-up at Southampton with Arteta set to ring changes after Brighton horror show and Ozil returns https://t.co/iLJuFeMRYx'
SunSport,1275875606773760000,2020-06-24 19:37:03,b'Aguero pictured in hospital after emergency knee surgery as he thanks fans for support https://t.co/uDnjitfr1Y'
SunSport,1275872042588557312,2020-06-24 19:22:54,"b""Chelsea 'make \xc2\xa380m transfer bid for Kai Havertz' and offer Bayer Leverkusen \xc2\xa38m MORE than Real Madrid https://t.co/bCEAgcb9g8"""
SunSport,1275868248198844418,2020-06-24 19:07:49,"b""Most popular Wags on Instagram, including Georgina Rodriguez and Little Mix's Perrie Edwards and Leigh-Anne Pinnock https://t.co/QE5XFgbYkO"""
SunSport,1275864196480208901,2020-06-24 18:51:43,b'WWE star Alexa Bliss sends fans wild with revealing bikini selfie https://t.co/OQHNlaEj0P'
SunSport,1275859647610617856,2020-06-24 18:33:38,"b""Tanguy Ndombele 'tells Jose Mourinho he will never play for him again at Tottenham after another bust-up' https://t.co/BNown8q8dC"""
SunSport,1275856716853161984,2020-06-24 18:22:00,b'Boxing is back! https://t.co/fqj6Vc3s8W'
SunSport,1275855996229955586,2020-06-24 18:19:08,b'How Chelsea will line up vs City with Abraham &amp; Pulisic after rotation hints https://t.co/RwuCHc7zFE'
SunSport,1275850897957048322,2020-06-24 17:58:52,b'Mike Tyson took cocaine and cannabis moments before ring walk vs Lou Savarese https://t.co/B9dtOfj3U7'
SunSport,1275846929499467777,2020-06-24 17:43:06,"b""Roma ace Antonucci axed by Vitoria for 'TikTok antics with influencer partner' https://t.co/r2u8aYtukg"""
SunSport,1275841617539354624,2020-06-24 17:22:00,b'This dog just wants to surf \xf0\x9f\x90\x95 https://t.co/QyBAJ8m2Zt'
SunSport,1275838831657234432,2020-06-24 17:10:56,b'Conor McGregor risks police rap by filming himself driving Bentley on busy road https://t.co/L2ZmPmF7UM https://t.co/URnbQyQmQG'
SunSport,1275826518233677827,2020-06-24 16:22:00,b'This Mo Salah lookalike is spot on! https://t.co/Zm4gzkNUiC'
SunSport,1275815465827405826,2020-06-24 15:38:05,"b""RT @TheSunFootball: Burnley fan behind the 'White Lives Matter' banner has been sacked from his job\nhttps://t.co/dzEkNBK9Nd https://t.co/ra\xe2\x80\xa6"""
SunSport,1275785686453571590,2020-06-24 13:39:45,b'Man Utd starlet Dion McGhee wanted by Rangers and West Ham on free transfer https://t.co/gtT4Q8qFbB'
SunSport,1275780795806908417,2020-06-24 13:20:19,b'Ex-Hull ace Thomas Beattie comes out gay and becomes first top English player to do so since Justin Fashanu 30 year\xe2\x80\xa6 https://t.co/DGt5OYVgG4'
SunSport,1275776715575394305,2020-06-24 13:04:06,b'Aubameyang tipped to quit Arsenal for Man Utd in shock transfer as Louis Saha urges Solskjaer to snap-up Thomas Par\xe2\x80\xa6 https://t.co/jMOHMkBRN5'
SunSport,1275773043814604801,2020-06-24 12:49:31,b'UFC stunner Brittney Palmer stuns in tiny bikini as Octagon girl keeps fans entertained with during lockdown https://t.co/RCo9f5nK6T'
SunSport,1275769440718766080,2020-06-24 12:35:11,b'WWE star Edge reveals gruesome torn triceps injury photos as he undergoes surgery https://t.co/LRaZkaL6IO'
SunSport,1275766119861751808,2020-06-24 12:22:00,b'You shall not pass! https://t.co/7kMuAL8OMF'
SunSport,1275761673182285824,2020-06-24 12:04:20,b'White Lives Matter banner: Burnley\xe2\x80\x99s statement in full https://t.co/98YoQMx8wG'
SunSport,1275755875886600192,2020-06-24 11:41:17,b'Dumbarton boss Jim Duffy recovering in hospital after suffering a heart attack https://t.co/qOJOakTvUj'
SunSport,1275751020505763841,2020-06-24 11:22:00,b'These wrestlers are worth some serious \xf0\x9f\x92\xb5 https://t.co/X1Skk3gswP'
SunSport,1275750960825085952,2020-06-24 11:21:46,"b'Wanheng Menayothin, who beat Mayweather\xe2\x80\x99s 50-0 record, makes shock retirement U-turn https://t.co/F8iCGINuhT'"
SunSport,1275745041848446976,2020-06-24 10:58:14,b'Tyson Fury vs Anthony Joshua blow as WBC insist Dillian Whyte MUST face Gypsy King after Wilder trilogy fight https://t.co/Q2fWHKwEGb'
SunSport,1275740142221889542,2020-06-24 10:38:46,b'Man City lead transfer race for Kalidou Koulibaly with Liverpool prioritising other areas https://t.co/LYC9kG50Kw'
SunSport,1275736288457560068,2020-06-24 10:23:27,b'F1 news LIVE https://t.co/uuECZwRSCe'
SunSport,1275730360429694976,2020-06-24 09:59:54,b'Kane scores first goal in six months as Spurs edge closer to top four https://t.co/kuKWHo0Fxm'
SunSport,1275719164985032705,2020-06-24 09:15:25,"b""Mikel Arteta 'ready to sell Matteo Guendouzi' after Arsenal star taunted Brighton players over wages https://t.co/AMsdkmqNdY"""
SunSport,1275713422739542016,2020-06-24 08:52:36,b'Messi fails to hit 700 goals but makes 250th assist to regain top spot https://t.co/ZuqRebeHGA'
SunSport,1275707700027052032,2020-06-24 08:29:51,b'Messi escapes red card for 2nd game in row after studs-up tackle in Barca win https://t.co/Ma7L2jglp1'
SunSport,1275705721900937216,2020-06-24 08:22:00,b'Boxing is back! https://t.co/NJTApY4ats'
SunSport,1275698933419970561,2020-06-24 07:55:01,b'RT @TheSunFootball: Arsenal confirm four new contracts including David Luiz https://t.co/DWpAXHqfxL https://t.co/mDzC8pb4N5'
SunSport,1275692667582717963,2020-06-24 07:30:07,"b""Man 'arrested for trespassing Performance Center' after RAW gatecrash attempt https://t.co/CNLktrzbSF"""
SunSport,1275690622431694849,2020-06-24 07:22:00,b'This dog just wants to surf \xf0\x9f\x90\x95 https://t.co/wegJFNf2DJ'
SunSport,1275681469076320258,2020-06-24 06:45:37,b'Warnock wants to make free signing of Gunter his first move as Boro boss https://t.co/4DFd1NzU7g'
SunSport,1275677640050049025,2020-06-24 06:30:24,"b""Man Utd to be cheered on by 40,000 digital fans in 'spectacular mosaic' at Old Trafford https://t.co/h0aAuxU47Q"""
SunSport,1275672984129323009,2020-06-24 06:11:54,b'The 5 times De Gea was let off for horror blunders proving Man Utd should drop him https://t.co/hSwa1nvfYl'
SunSport,1275669422150160385,2020-06-24 05:57:45,"b""Juventus 'agree \xc2\xa372.5m fee for Barca midfielder Arthur' ending chase of Jorginho https://t.co/NGn7gwhPWF"""
SunSport,1275665557161984001,2020-06-24 05:42:24,"b'Wahlberg, Stallone, Serena and other famous superstars own shares in UFC https://t.co/Q3oMf0SEC1'"
SunSport,1275661213884710919,2020-06-24 05:25:08,b'Man Utd offered chance to sign Willian on free transfer from Chelsea at end of season when contract expires https://t.co/WgjsRKB2sU'
SunSport,1275655139634876420,2020-06-24 05:01:00,"b""Charlotte Flair 'to be out of WWE for EIGHT months for surgery and to take personal break and be back for Royal Rum\xe2\x80\xa6 https://t.co/EK8xLyu41o"""
SunSport,1275651405920055301,2020-06-24 04:46:10,b'No Maupay heroics as penalty miss spares Foxes in stalemate https://t.co/yWnnoh1I0I'
SunSport,1275625176131133440,2020-06-24 03:01:56,b'Has Mike Tyson leaked comeback date in title tour T-shirt in his latest Instagram training video? https://t.co/b1BrKCWFPe'
SunSport,1275599521377144833,2020-06-24 01:20:00,"b""UFC chief Dana White refuses to 'chase' Conor McGregor following retirement after offering him three fights a year https://t.co/S34kyCGNJC"""
SunSport,1275565020869525507,2020-06-23 23:02:54,"b""Man Utd coach Fortune asked Mason Greenwood 'what's wrong with you?' after 'ridiculous' training session https://t.co/NUCmugPGO0"""
SunSport,1275564714190270466,2020-06-23 23:01:41,b'The Undertaker thanks fans in farewell tweet after WWE legend announces retirement aged 55 https://t.co/VBn6Jt8BWB'
SunSport,1275564706384744448,2020-06-23 23:01:39,"b""Dele Alli shows off 'loser/lover' tattoo before helping Spurs win vs West Ham https://t.co/bYVCLbxe21"""
SunSport,1275562662391406592,2020-06-23 22:53:32,b'Burnley back Ben Mee for slamming White Lives Matter banner flown over Etihad and vow to ban fans responsible for l\xe2\x80\xa6 https://t.co/xRPv31fGWj'
SunSport,1275558949056634886,2020-06-23 22:38:46,"b""Partey's Arsenal move is 'open secret' with Gunners to pay \xc2\xa345m release clause https://t.co/roSz8JirdP"""
SunSport,1275555222266556418,2020-06-23 22:23:58,"b""Liverpool owners have 'exit strategy' to sell out and make giant profit, says ex-chairman https://t.co/mByyblLs5Y"""
SunSport,1275550766388973568,2020-06-23 22:06:15,"b""Crystal Palace troll Sky Sports over 'one-sided' advert for Liverpool clash https://t.co/gn8cn4fKxL"""
SunSport,1275546287224561666,2020-06-23 21:48:28,"b""Guendouzi 'brags about \xc2\xa340k-a-week wages' but FIVE Brighton stars earn more https://t.co/LBCwdbLCAu"""
SunSport,1275542566541438976,2020-06-23 21:33:40,b'Fury and wife Paris meet up with James Argent at hangout Sheesh in Essex https://t.co/tpxbxWlrNl'
SunSport,1275537850759548929,2020-06-23 21:14:56,"b""Newcastle's potential Saudi owners 'supremely unconcerned' by Henry Mauriss bid https://t.co/Dig8ZvZFJH"""
SunSport,1275532740646092800,2020-06-23 20:54:38,b'Joe Cole quits Chelsea coaching role to travel world for a year building up management portfolio https://t.co/PIzGnVPHKH'
SunSport,1275528420609400832,2020-06-23 20:37:28,b'Three reasons Dean Henderson should NOT replace De Gea as Man Utd No1 as Spaniard comes under fire for Tottenham ga\xe2\x80\xa6 https://t.co/2wY1F8YIzq'
SunSport,1275524955342540803,2020-06-23 20:23:42,"b""Aguero to see 'Messi of medicine' in Barcelona amid fears he's out for season https://t.co/9f5ue0x0hu"""
SunSport,1275521398136586246,2020-06-23 20:09:34,b'Watch Diego Maradona flash bum at camera as he drops his trousers while dancing with former girlfriend https://t.co/HohmTZQkw6'
SunSport,1275517871620227073,2020-06-23 19:55:33,"b""RT @TheSunFootball: Cops say 'no criminal offences' committed after 'White Lives Matter' banner flown over Etihad https://t.co/WkFKMFnpum h\xe2\x80\xa6"""
SunSport,1275514713800085506,2020-06-23 19:43:00,"b""Brock Lesnar accused of sexual harassment by Terri Runnels after 'exposing his manly bits' https://t.co/JfOk4SfACJ"""
SunSport,1275510967749795843,2020-06-23 19:28:07,"b""Inside UFC legend Joe Rogan's luxury \xc2\xa34m mansion including wine cellar and pool with picturesque views over hills https://t.co/JQtSziWWFU"""
SunSport,1275507471663214594,2020-06-23 19:14:13,"b'Conor McGregor should be removed from UFC rankings after retirement, blasts rival Gilbert Burns ahead of title fight https://t.co/Ji73cvrXDt'"
SunSport,1275503028733464577,2020-06-23 18:56:34,b'Novak Djokovic issues grovelling apology after positive coronavirus test https://t.co/iqMXjRFv9i https://t.co/xIpkkqk4pi'
SunSport,1275501878651031552,2020-06-23 18:52:00,b'These wrestlers are worth some serious \xf0\x9f\x92\xb5 https://t.co/B1bME7yYQA'
SunSport,1275501138041765888,2020-06-23 18:49:03,b'Chelsea given go ahead of \xc2\xa31bn stadium redevelopment with extension on planning https://t.co/4jVGiITrmy'
SunSport,1275497455526776832,2020-06-23 18:34:25,b'Six-point plan to get Arsenal back on top: Stick with Arteta &amp; recruit experience leaders https://t.co/ucFYLoCyLn'
SunSport,1275493852573503490,2020-06-23 18:20:06,"b""Man Utd refuse extending Sanchez's Inter Milan loan to weaken Europa League rivals https://t.co/uCudXm2bZD"""
SunSport,1275490116404940805,2020-06-23 18:05:15,b'Arsenal interested in Tyrone Mings but Aston Villa transfer demands could end to deal as Arteta searches for defend\xe2\x80\xa6 https://t.co/2uhKgTWzkd'
SunSport,1275488837020651520,2020-06-23 18:00:10,b'RT @TheSunFootball: Arsenal confirm Bernd Leno injury much less serious than expected https://t.co/Frvy0LCaLz https://t.co/RN1SQETtBp'
SunSport,1275486779261378560,2020-06-23 17:52:00,b'This dog just wants to surf \xf0\x9f\x90\x95 https://t.co/wilsDUjmwQ'
SunSport,1275483838261714944,2020-06-23 17:40:19,b'How Man Utd will line up vs Sheff Utd with Bruno &amp; Pogba together for first time https://t.co/YsuBCfwmxX'
SunSport,1275478851758559234,2020-06-23 17:20:30,b'Richarlison confirms Man Utd transfer offer and Barcelona interest but decided to stay with Everton earlier in seas\xe2\x80\xa6 https://t.co/RZ8ZK0u9iT'
SunSport,1275475059663085568,2020-06-23 17:05:26,"b""WWE's Sonya Deville will 'be as big if not bigger than Charlotte Flair' if given same title shots\xe2\x80\xa6 https://t.co/9hDrAYyUUm"""
SunSport,1275471679972495360,2020-06-23 16:52:00,b'Mike Tyson is 53 and still dangerous as ever \xf0\x9f\x94\xa5 https://t.co/qfqo3LXsJR'
SunSport,1275470333651439621,2020-06-23 16:46:39,"b""Novak Djokovic slammed as 'boneheaded' for letting Adria Tour go ahead as Borna Coric is latest star to get coronav\xe2\x80\xa6 https://t.co/xMqcbU5T95"""
SunSport,1275466003581931524,2020-06-23 16:29:26,b'Tim Witherspoon says prime Mike Tyson would easily KO Deontay Wilder https://t.co/GLxZzzdNRM https://t.co/3oppOm6CII'
SunSport,1275461780261740546,2020-06-23 16:12:40,b'Premier League returns sees fans flock to watch TV matches with 53 per cent catching game over weekend https://t.co/bW0xWiYkbS'
SunSport,1275457557184667648,2020-06-23 15:55:53,"b""Mari's permanent Arsenal transfer confirmed by Flamengo for \xc2\xa314m despite long-term injury https://t.co/LaBsmiJMcC"""
SunSport,1275453864028721161,2020-06-23 15:41:12,b'Five goalkeepers Arsenal could sign with Leno \xe2\x80\x98out for a year\xe2\x80\x99 - including Hart and Forster https://t.co/wHRA6xawHs'
SunSport,1275448756540862464,2020-06-23 15:20:54,"b""Arsenal 'eye Claudio Bravo transfer with Man City star seen as Bernd Leno replacement' https://t.co/2V3LkMxk9v"""
SunSport,1275444195478564865,2020-06-23 15:02:47,b'Man Utd and Everton in Mohammed Salisu transfer battle and can steal 21-year-old Valladolid defender for just \xc2\xa310.8m https://t.co/wzCZWMf4qk'
SunSport,1275439956253478913,2020-06-23 14:45:56,b'RT @TheSunFootball: Willian and Pedro agree Chelsea contract extensions https://t.co/zHI2DE3KsE https://t.co/1jtjvySNFL'
SunSport,1275436072235753472,2020-06-23 14:30:30,b'Arsenal in talks with Roma over Kluivert and Mkhitaryan swap with wingers both keen https://t.co/Ch7Z3CVU2d'
SunSport,1275430842882568194,2020-06-23 14:09:43,b'Countdown on with just HOURS to sign up Willian &amp; Co or lose them on FREES https://t.co/CQZAEFP0mN'
SunSport,1275426871350566912,2020-06-23 13:53:57,b'10 Pakistan players have coronavirus ahead of England tour https://t.co/CG6CDOasfF https://t.co/kYYYlrn9F3'
SunSport,1275424992050765825,2020-06-23 13:46:29,b'Meet WWE SmackDown host Kayla Braxton who stuns with Instagram modelling shots https://t.co/vMOoQAa1T0'
SunSport,1275418998235107328,2020-06-23 13:22:39,"b""Arsenal bad boy Matteo Guendouzi 'taunted Brighton players over money and his \xc2\xa340k-a-week wages and said they were\xe2\x80\xa6 https://t.co/DwFMYU8wvR"""
SunSport,1275413004369133568,2020-06-23 12:58:50,"b""De Jong 'angry with Barca medical team' over how injury was misdiagnosed https://t.co/k05v4MNTeM"""
SunSport,1275403903304155139,2020-06-23 12:22:41,b'Grand National-winning jockey Liam Treadwell dead at 34 https://t.co/InExzVaIMo https://t.co/Y5g4PODfz8'
SunSport,1275403440349417472,2020-06-23 12:20:50,b'Novak Djokovic tests positive for coronavirus https://t.co/a3NN81dAwu https://t.co/AfGFFJXtQA'
SunSport,1275396566958948354,2020-06-23 11:53:31,"b""Gareth Bale 'doesn't care' about not playing at Real Madrid, says former Los Blancos boss with summer transfer like\xe2\x80\xa6 https://t.co/8sDdjSZTUs"""
SunSport,1275392691027746816,2020-06-23 11:38:07,b'Shredded Great Khali reveals dramatic body transformation since WWE days https://t.co/dJeuc3EJCC'
SunSport,1275389329943207936,2020-06-23 11:24:46,b'Tyson Fury vs Dillian Whyte: How fighters compare with WBC set to order Gypsy King to hold mandatory defence https://t.co/bKRzDdFvgi'
SunSport,1275385728600551424,2020-06-23 11:10:27,b'Hearn predicts AJ vs Pulev will take place in front of fans in November https://t.co/XZKJ58iutD'
SunSport,1275381407372673027,2020-06-23 10:53:17,"b""Arsenal and Spurs miss out on Meunier as he 'signs four-year Dortmund deal' https://t.co/KnSBWmRpsz"""
SunSport,1275375733515354113,2020-06-23 10:30:44,"b'The Undertaker left heartbroken after brother Timothy, 63, died of heart attack during WrestleMania 36 match filming https://t.co/gdbC0GRizP'"
SunSport,1275371340573356032,2020-06-23 10:13:17,b'West Ham star Darren Randolph reveals he was regularly racially abused and spat on as child in Ireland https://t.co/rdOkajgqpB'
SunSport,1275366108816650246,2020-06-23 09:52:30,b'Pedro hoping to sign short-term Chelsea contract TODAY as he waits on Roma to offload players before free transfer https://t.co/3jKUWXdRMR'
SunSport,1275361825773752321,2020-06-23 09:35:28,"b""Guardiola fears Aguero could miss rest of season with 'painful' knee injury ending Man City striker's Golden Boot d\xe2\x80\xa6 https://t.co/WIKdbUXUGo"""
SunSport,1275358241120235520,2020-06-23 09:21:14,b'FA Cup replays could be axed completely next season in bid to ease fixture chaos https://t.co/EgX5p7i8QM'
SunSport,1275356830487777281,2020-06-23 09:15:38,b'RT @TheSunFootball: Middlesbrough sack Jonathan Woodgate and appoint Neil Warnock https://t.co/VQVvjArnlD https://t.co/DJjjJIq0Wj'
SunSport,1275355564881711104,2020-06-23 09:10:36,b'RT @TheSunFootball: FA considering allowing fans into Community Shield later this year https://t.co/x8shoa5XvE https://t.co/NR8sdxxe0a'
SunSport,1275352340325969922,2020-06-23 08:57:47,b'RT @TheSunFootball: Scott McTominay signs new Man United deal https://t.co/mlj4T6BCvC https://t.co/pEt7zoB2XU'
SunSport,1275346588634943489,2020-06-23 08:34:56,"b""Arsenal's arrogance so famous one ex-player was told 'leave that attitude behind' https://t.co/8A6PNvCBJh"""
SunSport,1275343333976489984,2020-06-23 08:22:00,b'Mike Tyson looks lethal \xf0\x9f\x94\xa5 https://t.co/M2FwzHavCg'
SunSport,1275340663094214656,2020-06-23 08:11:23,"b""Burnley's airborne boneheads prove Black Lives Matter is totally relevant in Prem https://t.co/uFN16nXbkm"""
SunSport,1275334421177143296,2020-06-23 07:46:35,"b""Brit legend Prince Naseem Hamed's son Aadam, 20, shows blistering hand speed https://t.co/hOGfZ1KNI0"""
SunSport,1275324162257694720,2020-06-23 07:05:49,b'Bologna vs Juventus LIVE: Follow all the latest updates from Serie A as they happen https://t.co/jL0qltncC0'
SunSport,1275320417423626240,2020-06-23 06:50:56,b'Watch Mike Tyson spar in training video as he shows off ferocious power and speed https://t.co/hkSG39WXhI'
SunSport,1275316920032657409,2020-06-23 06:37:02,b'Three Pakistan stars test positive for coronavirus ahead of England tour https://t.co/FwGAkmSCKB'
SunSport,1275310900786978818,2020-06-23 06:13:07,b'Celtic confirm appointment of Gavin Strachan as new first-team coach https://t.co/VcUH8y8SJJ'
SunSport,1275300428834582528,2020-06-23 05:31:30,"b""White blasts Rohskopf critics after UFC newbie quit fight and insists 'no shame' https://t.co/beeR0nBGzK"""
SunSport,1275272880985706497,2020-06-23 03:42:02,"b""Mourinho hits back at Merson's Kane rant with striker stats but gets Drogba wrong https://t.co/KeptA2jEQx"""
SunSport,1275244828536832006,2020-06-23 01:50:34,"b""The Undertaker reveals his four fighters for WWE 'Mount Rushmore' including Stone Cold Steve Austin but no Rock https://t.co/ZYFGxwvaLc"""
SunSport,1275202075803160577,2020-06-22 23:00:41,b'Robshaw to join US rugby side San Diego Legion... but insists he is no Beckham https://t.co/0xLZH3yHTn'
SunSport,1275200755742453762,2020-06-22 22:55:26,b'Bayern make \xc2\xa336m bid for Sane and will sign him on free next summer if bid is rejected https://t.co/pjrMPNpJws'
SunSport,1275199522206035981,2020-06-22 22:50:32,b'Brit boxer Andrew Selby retires aged 31 after turbulent career from Olympic hero and only 13 professional fights https://t.co/Q3rvjPfy6m'
SunSport,1275188601186398211,2020-06-22 22:07:09,"b""Mike Tyson warns Jamie Foxx 'it won't be pretty' playing him in biopic https://t.co/myZQ8GDv5E"""
SunSport,1275184065713442820,2020-06-22 21:49:07,"b""Chelsea star Rudiger insists 'humble' Timo Werner is like Jamie Vardy and reveals chat that convinced him to join B\xe2\x80\xa6 https://t.co/qHY3TLU1UT"""
SunSport,1275179928267472896,2020-06-22 21:32:41,b'How hard does Messi train? Star is naturally talented but fitness regime is key https://t.co/q22ZjdpLRV'
SunSport,1275175505302638593,2020-06-22 21:15:06,"b""WWE legend Jake 'The Snake' Roberts shows off gruesome hand injuries after surgery leaving fans wincing https://t.co/FJiBkJljpz"""
SunSport,1275172036554493959,2020-06-22 21:01:19,"b'Wladimir Klitschko, 44, leaves fans stunned with ripped body as boxing legend strips to just his pants for cryother\xe2\x80\xa6 https://t.co/tu78gUYa99'"
SunSport,1275168021447946245,2020-06-22 20:45:22,"b""Inside Luiz's home with huge garden and sleek kitchen as he gives MTV tour https://t.co/meT5RdX6ue"""
SunSport,1275164515387215883,2020-06-22 20:31:26,"b""Guevara says he wanted to 'f***ing rape' WWE star Sasha Banks https://t.co/u3aLg59CoF"""
SunSport,1275161040624459777,2020-06-22 20:17:38,"b""David De Gea looks glum on way into Man Utd training after another blunder as Dean Henderson 'demands No1 spot' https://t.co/kgbQQyxelw"""
SunSport,1275157490271911939,2020-06-22 20:03:31,b'Morgan Schneiderlin to quit Everton after passing medical at Ligue 1 side Nice with just year left on deal https://t.co/C880s5ic1m'
SunSport,1275153960224133120,2020-06-22 19:49:29,b'Man Utd and Chelsea miss out on Jude Bellingham transfer to Dortmund despite 16-year-old already visiting Carrington https://t.co/3K0enlD8gw'
SunSport,1275150406461595649,2020-06-22 19:35:22,"b'PSG star Paredes rolls up in Ferrari as Neymar, Mbappe and Co return to training ahead of Champions League restart https://t.co/ntE90cmlez'"
SunSport,1275148282092826624,2020-06-22 19:26:56,b'RT @TheSunFootball: \xe2\x80\x98White Lives Matter Burnley\xe2\x80\x99 sign flown over Etihad https://t.co/gWU2Q9Fzw8 https://t.co/ul2Ix7WOxf'
SunSport,1275146904083587081,2020-06-22 19:21:27,b'De Gea has until end of season to save Utd career with Henderson lined up as No1 https://t.co/b3k2f8g37J'
