SunSport,1280205371467083776,2020-07-06 18:22:00,b'Mike Tyson has told Deontay Wilder how to beat Tyson Fury in their trilogy bout https://t.co/aro8IwdDdL'
SunSport,1280202695853424642,2020-07-06 18:11:22,"b""Mourinho rips into Arsenal after Spurs taunts and warns 'we'll be waiting' https://t.co/8eoEEcSflU"""
SunSport,1280199097237020672,2020-07-06 17:57:04,"b'Tyson, 54, reveals he shed almost 5 STONE to weigh less than AJ before comeback https://t.co/tHuU6GGRGV'"
SunSport,1280197821535313922,2020-07-06 17:52:00,b'From sausage maker to WWF sales manager\n\nThese footballers had some weird jobs before becoming pro footballers https://t.co/xY95yzFqA0'
SunSport,1280194941642256389,2020-07-06 17:40:33,"b""PL's biggest bottlers revealed with West Ham leading way &amp; Chelsea not far off https://t.co/5pBptVBtlR"""
SunSport,1280190271758598149,2020-07-06 17:22:00,b'The huge fight between Jorge Masvidal and Kamaru Usman is ON! \xf0\x9f\x94\xa5 https://t.co/99f050zFxQ'
SunSport,1280182722036510720,2020-07-06 16:52:00,b'What have we just seen \xf0\x9f\x98\xb2 https://t.co/pb93kKGPKo'
SunSport,1280172502644293632,2020-07-06 16:11:23,b'Grealish trolls Souness after slamming Villa star and stats prove pundit WRONG https://t.co/c81KnWXQLx'
SunSport,1280168703150247937,2020-07-06 15:56:17,"b""Man Utd star Juan Mata 'eyeing transfer to Turkish side Fenerbahce' as Solskjaer plans huge clear-out https://t.co/c9IAcXSvjv"""
SunSport,1280163332167806980,2020-07-06 15:34:57,b'RB Leipzig hint Upamecano could follow Werner by leaving for Arsenal or Chelsea https://t.co/YJpKT07y4A'
SunSport,1280158488954626050,2020-07-06 15:15:42,"b""Greenwood's talent shown as he boasts better stats than Ronaldo and Rooney https://t.co/CKAQddtIMf"""
SunSport,1280154772637650945,2020-07-06 15:00:56,b'Arsenal and PSG in shock transfer race for Newcastle star Allan Saint-Maximin https://t.co/WN25ivRGTV'
SunSport,1280150906017845255,2020-07-06 14:45:34,b'Pulisic vs Hazard: Chelsea\xe2\x80\x99s new star has more goals than legend at same stage https://t.co/DU5kHJD9WP'
SunSport,1280145240020725760,2020-07-06 14:23:03,b'Man Utd legend Yorke tells \xe2\x80\x98offensive\xe2\x80\x99 Roy Keane to quit ranting https://t.co/rznSYeXXar'
SunSport,1280140769685372928,2020-07-06 14:05:18,b'Pique makes controversial VAR gesture after Messi goal disallowed as fuming Barcelona hint at Real Madrid favouriti\xe2\x80\xa6 https://t.co/FYWwIcOsVE'
SunSport,1280137423595302917,2020-07-06 13:52:00,b'This kid is a boxing champ in the making https://t.co/tfLqAztPUQ'
SunSport,1280133003809828864,2020-07-06 13:34:26,b'Nemanja Matic signs new Man Utd contract until 2023 after recent resurgence https://t.co/ZccjX6JLbO'
SunSport,1280126882789367808,2020-07-06 13:10:07,"b""Thomas Partey 'wants Arsenal transfer completed as quickly as possible' https://t.co/hJGTikGa90"""
SunSport,1280122323975036929,2020-07-06 12:52:00,b'These are the best P4P boxers in the world \xf0\x9f\xa5\x8a https://t.co/cSxleSafuO'
SunSport,1280122323958403075,2020-07-06 12:52:00,b'This kid is a boxing champ in the making https://t.co/w9vDbod2aw'
SunSport,1280114774316023808,2020-07-06 12:22:00,b'Mike Tyson has told Deontay Wilder how to beat Tyson Fury in their trilogy bout https://t.co/W9HT97O6ky'
SunSport,1280109272253243395,2020-07-06 12:00:08,b'Fernando Alonso could be set for sensational F1 return two years after quitting McLaren\nhttps://t.co/8BTyPySMER'
SunSport,1280107224627662848,2020-07-06 11:52:00,b'Andy Murray at Wimbledon in 2050 https://t.co/t5qtDp7hga'
SunSport,1280103051102244864,2020-07-06 11:35:25,b'Chelsea to offload six stars to fund move to sign \xc2\xa390m Kai Havertz this summer https://t.co/vX2lw4uc6b'
SunSport,1280099674750431232,2020-07-06 11:22:00,b'The huge fight between Jorge Masvidal and Kamaru Usman is ON! \xf0\x9f\x94\xa5 https://t.co/FaqtsZLNrY'
SunSport,1280099063875227650,2020-07-06 11:19:34,b'Man Utd on transfer red alert after James Rodriguez REFUSES to travel with Real Madrid squad for Athletic Bilbao cl\xe2\x80\xa6 https://t.co/FWyJxZhWZI'
SunSport,1280095455708356619,2020-07-06 11:05:14,"b""Chris Hemsworth to undergo dramatic body transformation to play WWE's Hulk Hogan https://t.co/XvLNTaGu9d"""
SunSport,1280089745289367552,2020-07-06 10:42:32,b'Klopp promises Prem medal to every player... even if he has to give HIS away https://t.co/ajWHVxAYJI'
SunSport,1280079275400536070,2020-07-06 10:00:56,"b""Arsenal fans go wild as Aubameyang 'blinks' to signal new contract signing https://t.co/B3XER3sKMi"""
SunSport,1280072774132936704,2020-07-06 09:35:06,b'Players deeply unhappy over proposed Super League pay cuts in Covid-19 fallout https://t.co/KW8onLYFXU'
SunSport,1280068361158823937,2020-07-06 09:17:34,b'UFC 251: Jorge Masvidal vs Usman ON as both fighters pass coronavirus tests https://t.co/OPlMdG1XnQ'
SunSport,1280061926039412737,2020-07-06 08:52:00,b'The beautiful game \xf0\x9f\x98\x82 https://t.co/vzlSmP29ko'
SunSport,1280061011039596544,2020-07-06 08:48:22,b'Chelsea news LIVE: Follow all the latest updates from Stamford Bridge https://t.co/oBV9c5UUYk'
SunSport,1280049376958787584,2020-07-06 08:02:08,b'Arteta wants Lacazette to agree new Arsenal deal but will wait to open talks https://t.co/keQKQaQlk8'
SunSport,1280046826507300869,2020-07-06 07:52:00,b'From sausage maker to WWF sales manager\n\nThese footballers had some weird jobs before becoming pro footballers https://t.co/1vM720urTI'
SunSport,1280043096240259072,2020-07-06 07:37:10,"b""Chelsea transfer target Havertz keen to \xe2\x80\x98sit down with Leverkusen chiefs about future\xe2\x80\x99 as 'agent Rudiger' gets to w\xe2\x80\xa6 https://t.co/g4gjlj3agW"""
SunSport,1280036291669905410,2020-07-06 07:10:08,b'Jose Mourinho vows to break social distancing rules again - to hug Carlo Ancelotti when Tottenham face Everton https://t.co/8wTSKVPCnw'
SunSport,1280031727164035072,2020-07-06 06:52:00,b'What have we just seen \xf0\x9f\x98\xb2 https://t.co/uwVSTA3jJH'
SunSport,1280026984555466753,2020-07-06 06:33:09,"b""Watch baseball star Tanaka take sickening blow to head after Stanton's big hit https://t.co/MrwOBLHrVu"""
SunSport,1280021626965372928,2020-07-06 06:11:52,b'Shearer: Greenwood reminds me of myself and England will be keeping tabs on him https://t.co/m6VpbN4Xdu'
SunSport,1280016388749484032,2020-07-06 05:51:03,b'Kairi Sane set to quit WWE to be with her husband in Japan https://t.co/dC0vq8dWt8'
SunSport,1280011214454697984,2020-07-06 05:30:29,b'Arteta hails Mustafi for reviving Arsenal career with ace in line for new deal https://t.co/cCU0SZ1V9l'
SunSport,1280006957554905089,2020-07-06 05:13:34,"b""Suarez becomes Barca's third-highest scorer of all time with amazing finish https://t.co/1VZDpBwidF"""
SunSport,1279997040479608832,2020-07-06 04:34:10,b'Hamilton vows to continue anti-racism fight as six F1 drivers fail to take a knee https://t.co/pbe9LcgQTv'
SunSport,1279965985487937538,2020-07-06 02:30:46,"b""Jorge Masvidal 'absolutely willing' to step in and face Usman at UFC 251 after Burns pulled out due to coronavirus https://t.co/de6WzJP9fF"""
SunSport,1279946026154110976,2020-07-06 01:11:27,"b'Messi will be tempted by Man City to be reunited with Guardiola, claims Rivaldo https://t.co/QPcHGJ90nK'"
SunSport,1279914262966697984,2020-07-05 23:05:14,b'WWE legend Randy Orton shares topless selfie of wife as part of romantic post https://t.co/u6CfplZLET'
SunSport,1279898950166884354,2020-07-05 22:04:23,b'Fury releases vid of Team Wilder watching hands wrapped to end tampering call https://t.co/hguyVabRQe'
SunSport,1279895193647484929,2020-07-05 21:49:28,b'Souness gives brutal Grealish verdict and would love to play against Villa ace https://t.co/HoTMLN8fGY'
SunSport,1279891234232971267,2020-07-05 21:33:44,b'Hearn still owed money by Miller for up-front payment ahead of Joshua fight https://t.co/gzQFKMv3a4'
SunSport,1279887497653256192,2020-07-05 21:18:53,b'Jorge Masvidal vs Kamaru Usman at UFC 251 is done deal for Fight Island https://t.co/BgGhpeUvod'
SunSport,1279880731964080128,2020-07-05 20:52:00,b'This kid is a boxing champ in the making https://t.co/SNGdiIJuF3'
SunSport,1279871201037430787,2020-07-05 20:14:07,b'Twitter goes into meltdown after Jack Rodwell comes off the bench for Sheff Utd https://t.co/7rYibonBwt'
SunSport,1279867688999964674,2020-07-05 20:00:10,b'Man Utd could turn to Traore as Sancho alternative - but Wolves want \xc2\xa390m https://t.co/eZmkRalx3O'
SunSport,1279865632511721474,2020-07-05 19:52:00,b'These are the best P4P boxers in the world \xf0\x9f\xa5\x8a https://t.co/4KPliy8YuG'
SunSport,1279863670596603906,2020-07-05 19:44:12,b'Real Madrid won\xe2\x80\x99t sign anyone this summer as they aim to make \xc2\xa3190m in sales https://t.co/agwBSLMJKv'
SunSport,1279859942627979264,2020-07-05 19:29:23,"b""Arsenal transfer target Wout Weghorst says move to Emirates would be \xe2\x80\x98perfect' https://t.co/kegv7ZYGuT"""
SunSport,1279856478778806274,2020-07-05 19:15:37,"b""The Undertaker hits out at WWE for getting rid of character - as CM Punk claims there's 'no way' he's really retired https://t.co/UPfiJJKLDO"""
SunSport,1279850533038231553,2020-07-05 18:52:00,b'The beautiful game \xf0\x9f\x98\x82 https://t.co/cmSC24wgdh'
SunSport,1279849970884018176,2020-07-05 18:49:46,b'RT @TheSunFootball: HALF TIME: Southampton 1-0 Man City\n\n#SOUMCI \n\nhttps://t.co/zpNDknmL33'
SunSport,1279847850151677957,2020-07-05 18:41:20,b'Jorge Masvidal vs Kamaru Usman confirmed for UFC 251 in most anticipated clash of 2020 at Fight Island\xe2\x80\xa6 https://t.co/rzroat7GLf'
SunSport,1279841742339149825,2020-07-05 18:17:04,b'RT @TheSunFootball: GOAL! Southampton 1-0 Man City (Adams)\n\nWHAT A FINISH!\n\n#SOUMCI \n\nhttps://t.co/zpNDknmL33'
SunSport,1279841302755119104,2020-07-05 18:15:19,b'Barcelona blow as Xavi signs contract extension to stay as manager at Qatar club Al-Sadd until 2021 https://t.co/Goixgylt8k'
SunSport,1279837641513582593,2020-07-05 18:00:46,"b""Scholes slams \xe2\x80\x98slow\xe2\x80\x99 Maguire - urging Solskjaer to sign a \xe2\x80\x98new Rio Ferdinand' https://t.co/ToyO8IFLhj"""
SunSport,1279835433610821632,2020-07-05 17:52:00,b'From sausage maker to WWF sales manager\n\nThese footballers had some weird jobs before becoming pro footballers https://t.co/exzekeyV0O'
SunSport,1279835120317468673,2020-07-05 17:50:45,"b""RT @TheSunFootball: Southampton vs Man City starting XI's:\n\nMcCarthy, Walker-Peters, Stephens, Bednarek, Bertrand, Romeu, Ward-Prowse, Arms\xe2\x80\xa6"""
SunSport,1279833812902522882,2020-07-05 17:45:33,b'Man Utd \xe2\x80\x98told Sancho will leave Dortmund for \xc2\xa3108m\xe2\x80\x99 after personal terms agreed https://t.co/dMwROHcYqi'
SunSport,1279830210544893952,2020-07-05 17:31:14,b'Watch Greenwood goal spark desperate shouts from Bournemouth then X-rated rant https://t.co/i7VEU35a2J'
SunSport,1279820334137372672,2020-07-05 16:52:00,b'What have we just seen \xf0\x9f\x98\xb2 https://t.co/TsxjvHQ05z'
SunSport,1279813207495004161,2020-07-05 16:23:41,"b'What is the F1 Styrian Grand Prix, which country is it in and which track is holding it? https://t.co/x5RDnoOb4x'"
SunSport,1279809581795901441,2020-07-05 16:09:16,"b'Arsenal could sell Lacazette, Guendouzi or Torreira to fund Partey transfer https://t.co/XzbojHFGGD'"
SunSport,1279802299607588865,2020-07-05 15:40:20,b'Van Dijk reveals he snubbed Chelsea transfer for Liverpool thanks to Klopp https://t.co/W7t70dMuWX'
SunSport,1279795037308583936,2020-07-05 15:11:28,"b""RT @TheSunFootball: Liverpool vs Aston Villa XI's:\n\nAlisson, Alexander-Arnold, Gomez, Van Dijk, Robertson, Fabinho, Keita, Oxlade-Chamberla\xe2\x80\xa6"""
SunSport,1279791496976314369,2020-07-05 14:57:24,b'Valtteri Bottas wins Austria GP with Lewis Hamilton slipping to fourth after five-second penalty\xe2\x80\xa6 https://t.co/3fCZgbxX5g'
SunSport,1279790657503141888,2020-07-05 14:54:04,b'RT @TheSunFootball: Sergio Ramos puts Real Madrid on verge of LaLiga title https://t.co/P3688uIRIP https://t.co/wXj3FtbYnc'
SunSport,1279790135337517057,2020-07-05 14:52:00,b'John Cena - limo driver \nBecky Lynch - flight attendant \n\nWrestlers had some bizarre jobs before WWE https://t.co/5h3iAY5Usr'
SunSport,1279787981474279426,2020-07-05 14:43:26,b'RT @TheSunFootball: GOAL! Newcastle 2-2 West Ham (Shelvey)\n\nInstant equaliser at St James Park!\n\n#NEWWHU \n\nhttps://t.co/AkvBUTQr8H'
SunSport,1279787601260621825,2020-07-05 14:41:56,b'RT @TheSunFootball: GOAL! Newcastle 1-2 West Ham (Soucek)\n\n#NEWWHU \n\nhttps://t.co/AkvBUTQr8H'
SunSport,1279787051953594376,2020-07-05 14:39:45,b'Man Utd star Wan-Bissaka goes viral for \xe2\x80\x98worst skill ever\xe2\x80\x99 in win vs Bournemouth https://t.co/7xySrcKKcj'
SunSport,1279783505929666564,2020-07-05 14:25:39,b'Arsenal transfer swoop for Thomas Partey given the green light by technical director Edu https://t.co/3ecZKWqiLt'
SunSport,1279778431258025984,2020-07-05 14:05:29,"b""Greenwood vs Rooney: As Solskjaer compares duo, how does 'specialist finisher' compare to legend in breakout season? https://t.co/PIWYBPtyR1"""
SunSport,1279775035712888832,2020-07-05 13:52:00,b'Still a better diver than any Premier League star \xf0\x9f\x98\x82 https://t.co/6qT0B37U5j'
SunSport,1279772263068336129,2020-07-05 13:40:59,b'Keeper Ivan Zaborovskiy fighting for life after being struck by lightning https://t.co/EwZNgcsZ7W'
SunSport,1279765109922041861,2020-07-05 13:12:33,b'Here we go! F1 Austrian GP is underway! https://t.co/yqKtW6gTkQ'
SunSport,1279764494873513984,2020-07-05 13:10:07,b'Six F1 drivers chose not to take the knee for Black Lives Matter https://t.co/yqKtW6gTkQ'
SunSport,1279759936264626176,2020-07-05 12:52:00,b'We all know a tackler this bad \xf0\x9f\xa4\xa3 https://t.co/YlxCQQkHWc'
SunSport,1279756765350027264,2020-07-05 12:39:24,"b""F1 duo Charles Leclerc and Max Verstappen won't take knee for Black Lives Matter https://t.co/ndtjsdc8nF https://t.co/C0EZaKEElv"""
SunSport,1279755874072965123,2020-07-05 12:35:51,"b""UFC star Jon Jones 'saves man's life' on July 4 along with group of 'heroes' https://t.co/tl0BEpw3Hc"""
SunSport,1279752386463088640,2020-07-05 12:22:00,b'F1 returns this weekend and these racers make some serious money! \xf0\x9f\x92\xb0 https://t.co/n3StgmBJbk'
SunSport,1279752130493063168,2020-07-05 12:20:59,b'Mourinho \xe2\x80\x98disturbed and destroyed\xe2\x80\x99 by Spurs\xe2\x80\x99 lack of effort in loss to Sheff Utd https://t.co/y4uTvDgjDY'
SunSport,1279745854837010433,2020-07-05 11:56:02,"b'Tyson Fury\xe2\x80\x99s cousin Sissy, 17, reaches semis of Miss England beauty pageant https://t.co/swjcWqIkNn'"
SunSport,1279744836636045312,2020-07-05 11:52:00,b'Jose Mourinho loves resigning players \xe2\x9d\xa4\xef\xb8\x8f https://t.co/Ayjzna0O5g'
SunSport,1279729737095614464,2020-07-05 10:52:00,b'The Undertaker leaves an amazing legacy in WWE https://t.co/NiySCzacdu'
SunSport,1279728336361701376,2020-07-05 10:46:26,b'RT @TheSunFootball: Footballer Derrick Otim dies aged 24 https://t.co/gu7egd2Kap https://t.co/TOpS0xkhkO'
SunSport,1279728108959080448,2020-07-05 10:45:32,b'Ashley Cole shows where his loyalties lie as he says he hopes Chelsea get Champions League over Arsenal https://t.co/yR2Z5gWQ0n'
SunSport,1279722955841380352,2020-07-05 10:25:03,b'Man Utd and Arsenal join race for James Rodriguez as Real Madrid want \xc2\xa322.5m https://t.co/N1910MngOj'
SunSport,1279718133914308613,2020-07-05 10:05:53,"b""Pulisic not quite Hazard - but he's getting there, says Chelsea boss Lampard https://t.co/F8hKTGp19s"""
SunSport,1279714637622239232,2020-07-05 09:52:00,"b""There's no way he meant to score this way!\n\n\xf0\x9f\x93\xb9 @yourinstreplay https://t.co/tC3v8EWdIL"""
SunSport,1279699538060562433,2020-07-05 08:52:00,b'He left him for a \xf0\x9f\x8c\xad https://t.co/4iiye8TTNo'
SunSport,1279695283681714176,2020-07-05 08:35:05,b'Footie ace Kenny Sansom walking and talking after beating nearly killed him https://t.co/AemZdFy2T5'
SunSport,1279691637527056384,2020-07-05 08:20:36,b'Norwich defender Godfrey wanted by Dortmund and Leipzig in shock \xc2\xa325m swoop https://t.co/BSOdJ4XBkE'
SunSport,1279688176739762184,2020-07-05 08:06:51,b'Billy Joe Saunders hits back at Chris Eubank Jr with X-rated tweet https://t.co/DBSTEQpoQB'
SunSport,1279684438662807553,2020-07-05 07:52:00,"b""Formula One returns this weekend: here's what to expect from the Austrian Grand Prix https://t.co/Mith6zbyus"""
SunSport,1279680666645467136,2020-07-05 07:37:00,b'McCarthy interested in Bristol City job after Robins sack Johnson https://t.co/jvgX0xIWEp'
SunSport,1279672948928983040,2020-07-05 07:06:20,"b""Everton's Mina wanted by Valencia for \xc2\xa315m as Toffees eye John Stones return https://t.co/wXX3u2m3kS"""
SunSport,1279665348585951232,2020-07-05 06:36:08,b'Pulisic and Mount star to prove they can form prolific partnership going forward https://t.co/2WLBccm7M2'
SunSport,1279649005656514560,2020-07-05 05:31:12,b'UFC ring girl Arianny Celeste announces pregnancy with topless photo https://t.co/sBUwOkH53c'
SunSport,1279610488222081025,2020-07-05 02:58:09,b'Future is bright for Reece James but Chelsea need a solution at the back https://t.co/g2rhN9lafR'
SunSport,1279590550111490049,2020-07-05 01:38:55,b'Spurs out to exploit Wigan\xe2\x80\x99s financial woe with double raid for Gelhardt and Weird https://t.co/d7mAIWTN8w'
SunSport,1279587090003636224,2020-07-05 01:25:10,b'Chelsea starlet Gallagher wanted by Palace in \xc2\xa310m swoop after shining on loan https://t.co/SRfOj7fXHH'
SunSport,1279583589513023490,2020-07-05 01:11:15,"b""I want to be a dad again at 90 &amp; I don't need Viagra, says Bernie Ecclestone https://t.co/mOeYj2fAdy"""
SunSport,1279580103647932418,2020-07-05 00:57:24,b'Masvidal ready to step in and face Usman at UFC 251 after Burns pulls out https://t.co/TgGYKeCwTf'
SunSport,1279534359251386374,2020-07-04 21:55:38,"b'Man Utd eye swoop for Uruguayan starlet Pellistri, coached by ex-star Forlan https://t.co/mjMpjermcX'"
SunSport,1279530901408448517,2020-07-04 21:41:54,b'Arsenal player ratings: Martinez excels between the sticks and Mustafi solid throughout but Xhaka struggles early on https://t.co/9Gj2by52rO'
SunSport,1279518427821027328,2020-07-04 20:52:20,"b""Instagram celeb 'Ray Hushpuppi\xe2\x80\x99 arrested and charged with attempting to steal \xc2\xa3100million from Premier League club https://t.co/h9wVF198nl"""
SunSport,1279514449162964993,2020-07-04 20:36:31,b'WWE stars Bobby Lashley and MVP involved in \xe2\x80\x98physical altercation\xe2\x80\x99 at restaurant https://t.co/mmQwcIPt2K'
SunSport,1279510738353164289,2020-07-04 20:21:46,"b'Man Utd must act in \xe2\x80\x98important summer\xe2\x80\x99, says Solskjaer in hint to Woodward https://t.co/Dusm7gxW1n'"
SunSport,1279507101686038532,2020-07-04 20:07:19,b'Ronaldo scores first free-kick as Juventus cruise against rivals Torino https://t.co/gxOQNsVxzI'
SunSport,1279501181472169986,2020-07-04 19:43:48,b'RT @TheSunFootball: SCORES!\n\nChelsea 2-0 Watford\n\n#CHEWAT \n\nhttps://t.co/sgbkMjiu7k'
SunSport,1279501065373827072,2020-07-04 19:43:20,b'RT @TheSunFootball: PENALTY CHELSEA\n\n#CHEWAT \n\nhttps://t.co/sgbkMjiu7k'
SunSport,1279497404220309507,2020-07-04 19:28:47,b'RT @TheSunFootball: GOAL! Chelsea 1-0 Watford (Giroud)\n\n#CHEWAT \n\nhttps://t.co/sgbkMjiu7k'
SunSport,1279495695171383296,2020-07-04 19:22:00,b'John Cena - limo driver \nBecky Lynch - flight attendant \n\nWrestlers had some bizarre jobs before WWE https://t.co/yKJF5ctDC2'
SunSport,1279493074184474624,2020-07-04 19:11:35,b'Arsenal boss Mikel Arteta urges board to invest in squad this summer https://t.co/n7npQ5FmjB'
SunSport,1279490243696242688,2020-07-04 19:00:20,"b'RT @TheSunFootball: Kick off at Stamford Bridge, our final Premier League clash of the day is underway!\n\nFollow #CHEWAT live here!\n\nhttps:/\xe2\x80\xa6'"
SunSport,1279488788285337604,2020-07-04 18:54:33,"b""Greenwood stars for rampant United but it's a game to forget for Maguire https://t.co/vf0Xa3COCD"""
SunSport,1279484576495210496,2020-07-04 18:37:49,b'Man Utd boast champagne frontline but flat lager defence a concern https://t.co/9BTupUCtR4'
SunSport,1279480595576471556,2020-07-04 18:22:00,b'Still a better diver than any Premier League star \xf0\x9f\x98\x82 https://t.co/cOoOBS9FTR'
SunSport,1279478502924914689,2020-07-04 18:13:41,b'RT @TheSunFootball: GOAL! Wolves 0-2 Arsenal (Lacazette)\n\nThe Gunners have sealed a vital three points!\n\n#WOLARS \n\nhttps://t.co/fScTjfnc5X'
SunSport,1279478093565100038,2020-07-04 18:12:03,"b""RT @TheSunFootball: Chelsea vs Watford starting XI's:\n\nKepa, James, Zouma, Christensen, Azpilicueta, Kante, Barkley, Mount, Willian, Giroud\xe2\x80\xa6"""
SunSport,1279472856951402496,2020-07-04 17:51:15,b'RT @TheSunFootball: Lee Johnson sacked by Bristol City https://t.co/5ZV5LyRAfi https://t.co/78lECjegQz'
SunSport,1279467547079909381,2020-07-04 17:30:09,"b""Man Utd star Maguire 'has his career ended' after filthy Junior Stanislas nutmeg https://t.co/aLKT1MhHND"""
SunSport,1279465496124043264,2020-07-04 17:22:00,b'Jose Mourinho loves resigning players \xe2\x9d\xa4\xef\xb8\x8f https://t.co/ZUwAP4WHzP'
SunSport,1279464516905046016,2020-07-04 17:18:06,b'RT @TheSunFootball: HALF TIME: Wolves 0-1 Arsenal \n\n#WOLARS \n\nhttps://t.co/fScTjfnc5X'
SunSport,1279463400087699459,2020-07-04 17:13:40,b'RT @TheSunFootball: GOAL! Wolves 0-1 Arsenal (Saka)\n\nSublime volley by the youngster!\n\n#WOLARS \n\nhttps://t.co/fScTjfnc5X'
SunSport,1279459956299902976,2020-07-04 16:59:59,"b""Sky Sports pundits ditch BLM badges for Kick It Out pins after 'hijack' claims https://t.co/wILXqqwk3P"""
SunSport,1279455960193368065,2020-07-04 16:44:06,b'Chelsea vow to swat Hornets with cheeky matchday Instagram post as the race for a top-four spot heats up https://t.co/C01BSexrEe'
SunSport,1279452160854421505,2020-07-04 16:29:00,"b""Hamilton slams 's***' contract rumours amid claims Mercedes offer \xc2\xa320m-a-year https://t.co/i7ozRDk9Bc"""
SunSport,1279450396574887938,2020-07-04 16:22:00,b'He left him for a \xf0\x9f\x8c\xad https://t.co/iBKgdpFrtR'
SunSport,1279448338807640065,2020-07-04 16:13:49,b'RT @TheSunFootball: Jamie Vardy ends goal drought with brace to join Premier League 100 club as Leicester thrash Crystal Palace 3-0\nhttps:/\xe2\x80\xa6'
SunSport,1279443879780134912,2020-07-04 15:56:06,b'Kevin Pietersen\xe2\x80\x99s Twitter is locked after cricket legend threatens to slap Piers Morgan in row over pubs re-opening https://t.co/b0hDmg95jH'
SunSport,1279440077773590528,2020-07-04 15:41:00,b'Barcelona eyeing transfer for Man City teenager Garcia amid Etihad big wage rise https://t.co/KEtOizxVbb'
SunSport,1279435297135214597,2020-07-04 15:22:00,b'F1 returns this weekend and these racers make some serious money! \xf0\x9f\x92\xb0 https://t.co/QEvZHKol2N'
SunSport,1279435011565944832,2020-07-04 15:20:52,b'RT @TheSunFootball: GOAL! Man Utd 5-2 Bournemouth (Fernandes)\n\nWOW! WHAT A FREE KICK!\n\n#MUNBOU \n\nhttps://t.co/lxCXL0xJTF'
SunSport,1279433480624132096,2020-07-04 15:14:47,b'RT @TheSunFootball: GOAL! Man Utd 4-2 Bournemouth (Greenwood)\n\nWhat a goal that is! \n\n#MUNBOU \n\nhttps://t.co/lxCXL0xJTF'
SunSport,1279432114325381120,2020-07-04 15:09:21,b'RT @TheSunFootball: PENALTY BOURNEMOUTH! Handball by Bailly just seconds after coming on!\n\n#MUNBOU \n\nhttps://t.co/lxCXL0xJTF'
SunSport,1279429976576724992,2020-07-04 15:00:51,b'Agents \xe2\x80\x98dreaming of Messi and Ronaldo partnership\xe2\x80\x99 after Barca star\xe2\x80\x99s quit hint https://t.co/bnI5Asdyy8'
SunSport,1279427192133496834,2020-07-04 14:49:47,b'RT @TheSunFootball: HALF TIME: Man Utd 3-1 Bournemouth\n\n#MUNBOU \n\nhttps://t.co/lxCXL0xJTF'
SunSport,1279426799513075713,2020-07-04 14:48:14,"b""RT @TheSunFootball: Man Utd concede to Bournemouth after Harry Maguire 'has his career ended' by Junior Stanislas #MUNBOU https://t.co/DIBD\xe2\x80\xa6"""
SunSport,1279425047824916481,2020-07-04 14:41:16,b'Arsenal fined by Fifa over illegal secret sell-on clauses on player transfers https://t.co/jzDiJA7LE8'
SunSport,1279423678640422912,2020-07-04 14:35:50,b'RT @TheSunFootball: SCORES! (just) Turnaround complete!\n\nMan Utd 2-1 Bournemouth\n\n#MUNBOU \n\nhttps://t.co/lxCXL0xJTF'
SunSport,1279423400298020865,2020-07-04 14:34:43,b'RT @TheSunFootball: PENALTY MAN UTD!\n\n#MUNBOU \n\nhttps://t.co/lxCXL0xJTF'
SunSport,1279422176484036610,2020-07-04 14:29:52,b'RT @TheSunFootball: GOAL! Man Utd 1-1 Bournemouth (Greenwood)\n\n#MUNBOU \n\nhttps://t.co/lxCXL0xJTF'
SunSport,1279420197758095361,2020-07-04 14:22:00,"b""There's no way he meant to score this way!\n\n\xf0\x9f\x93\xb9 @yourinstreplay https://t.co/T8Spv3fi9o"""
SunSport,1279418920399667201,2020-07-04 14:16:55,b'RT @TheSunFootball: GOAL! Man Utd 0-1 Bournemouth (Stanislas)\n\nA huge shock on the cards at Old Trafford!\n\n#MUNBOU \n\nhttps://t.co/lxCXL0xJTF'
SunSport,1279417251926605828,2020-07-04 14:10:17,b'Rugby league star Sia Soliola shares horrific X-ray of skull fracture after sickening clash of heads https://t.co/2n0nLJSMRE'
SunSport,1279413510158585857,2020-07-04 13:55:25,b'Keeper has leg amputated as freak accident left Colombia star in intensive care https://t.co/Ffkq3ddsUi'
SunSport,1279408967333097476,2020-07-04 13:37:22,"b""Man Utd 'agree personal terms with Sancho' on five-year \xc2\xa3140k-a-week deal but must argue transfer fee with Dortmund https://t.co/DyTQy5GBh9"""
SunSport,1279405098129600514,2020-07-04 13:22:00,b'The Undertaker leaves an amazing legacy in WWE https://t.co/Agcb9Jh1xM'
SunSport,1279402346125103106,2020-07-04 13:11:04,"b""RT @TheSunFootball: Bayern Munich's Thiago 'agrees personal terms' with Liverpool https://t.co/eXqSXJFZbp https://t.co/YMz1PDd4Ro"""
